,PuzzleId,FEN,Moves,Rating,RatingDeviation,Popularity,NbPlays,Themes,GameUrl,OpeningTags,ID
0,msBB0,1r6/3k4/1P3p1p/1BK2p1P/4pP2/6P1/8/8 b - - 3 45,d7c8 c5c6 c8d8 b6b7,2100,76,99,250,advancedPawn crushing endgame master short,https://lichess.org/jpCmgcpY/black#90,,4274229
1,Bjt4T,2B5/7p/4nkp1/3p4/2p4P/1P1p1PP1/P4K2/8 w - - 0 38,c8e6 c4c3 e6d5 c3c2 f2e3 c2c1q,2100,75,100,116,advancedPawn bishopEndgame crushing endgame long promotion,https://lichess.org/pbYRR4vt#75,,1027355
2,oAAXK,1B6/6p1/7p/7P/6kP/3p1p2/3K4/8 w - - 4 45,d2d3 g4h3 b8a7 h3g2 a7d4 f3f2,2100,76,99,166,advancedPawn bishopEndgame crushing endgame long,https://lichess.org/O6BxPras#89,,4387226
3,3Jcrq,r1bk2r1/pp3p2/8/2bpQ3/8/2NB1qP1/PPP2P1P/R3R1K1 w - - 5 20,d3e2 c5f2 g1f1 c8h3,2100,75,98,977,fork mate mateIn2 middlegame short,https://lichess.org/JxWA4h3d#39,,290095
4,rFY12,2r1r1k1/1b1q1pp1/p4n1p/1p3N2/1QpN4/P3P3/1P3PPP/2R2RK1 w - - 0 23,f5d6 f6d5 d6e8 d5b4 e8f6 g7f6,2100,75,100,153,advantage long middlegame trappedPiece,https://lichess.org/dJVdIHSM#45,,4657218
5,yfHLB,8/5R2/6p1/7p/r4PkP/8/5K2/8 w - - 9 50,f7g7 a4f4 f2g2 f4f6 g7b7 g4h4 b7b4 h4g5,2100,75,99,269,crushing endgame quietMove rookEndgame veryLong,https://lichess.org/WtdZBv6H#99,,5306821
6,6ENfD,r5rk/pp1b1p1p/4qp2/3p4/7Q/5N2/P4PPP/3R1BK1 b - - 12 27,e6f5 f1d3 g8g2 g1g2 a8g8 g2f1,2100,75,100,168,advantage defensiveMove long middlegame,https://lichess.org/5h9LeU7t/black#54,,545668
7,qrMDX,8/8/1p2ppp1/1Pk5/2P2P2/3K2Pp/7P/8 w - - 0 52,d3c3 e6e5 f4e5 f6e5 c3d3 e5e4,2100,76,98,90,crushing endgame long pawnEndgame,https://lichess.org/ZWke7XRS#103,,4622830
8,Amhsn,8/6R1/p1p1k3/1p6/4P3/4K2P/8/3r4 b - - 0 36,d1d7 g7d7 e6d7 h3h4 b5b4 h4h5,2100,75,100,297,crushing defensiveMove endgame long quietMove rookEndgame,https://lichess.org/wVpGeb5w/black#72,,943772
9,Ojv9W,7k/R7/1p5p/p1n2Bb1/P1P4P/1P6/3p4/4r1RK w - - 1 43,f5g4 g5e3 a7a8 h8g7,2100,76,99,159,crushing endgame short,https://lichess.org/3gPWOMQz#85,,2163622
10,naelj,7k/5p1p/p2P1prq/7r/1P1QP3/P1N3P1/2P2RKP/8 w - - 5 34,d4b6 h5h2 g2f3 h6h5 f3e3 g6g3,2100,76,99,970,crushing deflection endgame long,https://lichess.org/KPiQt56E#67,,4337083
11,tKmhv,2n3k1/5q1p/p1p3p1/Pp1pBpQn/1P1P3P/2PB1P2/6PK/8 b - - 8 38,f7e7 d3f5 e7g5 f5e6 g8f8 h4g5,2100,76,99,200,crushing endgame fork intermezzo long pin sacrifice,https://lichess.org/F0Vwu4At/black#76,,4840317
12,nnkyq,5r1k/pR4p1/4p1p1/4p3/2P1N1Q1/7P/P2r1qPK/8 b - - 4 28,f2e2 g4g6 e2g2 g6g2 d2g2 h2g2,2100,75,99,271,crushing endgame long,https://lichess.org/jEB5Uf2M/black#56,,4355663
13,ikDsB,8/2p3rp/2p5/1k4P1/1PR2K1P/8/2R5/5r2 w - - 1 41,f4e5 g7e7 e5d4 f1f4 d4d3 e7d7 d3e3 f4c4,2100,76,99,311,crushing deflection endgame rookEndgame veryLong,https://lichess.org/kDAdjH3f#81,,3912205
14,9II0f,8/8/5k2/5p2/7K/7P/8/8 w - - 1 59,h4h5 f6e5 h5g5 f5f4 g5g4 e5e4 h3h4 f4f3 g4g3 e4e3,2100,75,99,414,crushing defensiveMove endgame pawnEndgame quietMove veryLong,https://lichess.org/QiYW8b8U#117,,813585
15,Sts97,rnbq1rk1/ppppb1pp/8/3Pp2Q/2P1N3/3B4/PP3PPP/R3K1NR b KQ - 4 10,d8e8 e4f6 f8f6 h5e8,2100,76,99,280,crushing deflection kingsideAttack opening short,https://lichess.org/YYRywrAk/black#20,Dutch_Defense Dutch_Defense_Queens_Knight_Variation,2527811
16,o07dS,r6r/pp1k1p2/2pqbQpp/8/2p5/1B4P1/PP3P1P/3RR1K1 b - - 1 22,e6d5 d1d5 c6d5 b3a4 b7b5 a4b5,2100,75,98,302,crushing long middlegame pin sacrifice,https://lichess.org/aTuFEYLh/black#44,,4373022
17,oh98f,r1b4r/ppk2p1p/2pR1qp1/4nN2/2P1PQ2/5B2/P4PPP/R5K1 b - - 1 25,e5f3 g2f3 f6a1 d6d1,2100,76,100,126,crushing discoveredAttack middlegame sacrifice short,https://lichess.org/t8EtFk8j/black#50,,4433489
18,utrzT,3r4/1p2R2p/5pp1/1P1p1k2/R4n2/5PQ1/2r2K1P/5N2 w - - 11 39,f2e3 d5d4 a4d4 c2e2,2100,75,98,236,mate mateIn2 middlegame short,https://lichess.org/tS1AI513#77,,4977255
19,LYdYe,5r2/p3kp1Q/1pb3pN/2p4n/2P1P3/1P1q2PP/P4PB1/4R1K1 w - - 1 31,h6g4 d3c3 e1d1 f8h8 h7h8 c3h8,2100,75,100,72,advantage long middlegame trappedPiece,https://lichess.org/4W7Z1oY8#61,,1884981
20,8kgzt,5r1k/1b2q1p1/2p1p2p/p1p1P3/3Q4/BP1P3R/P1P3PP/5K2 w - - 1 25,f1g1 e7f7 h3f3 c5d4 f3f7 f8f7,2100,74,98,278,advantage endgame long quietMove,https://lichess.org/vBPiNK58#49,,765758
21,S4Ori,8/pp5p/6p1/n1k5/2P1pPP1/2K1N3/P1P5/8 b - - 0 31,h7h5 f4f5 g6f5 g4h5,2100,76,100,118,advantage deflection endgame knightEndgame master short,https://lichess.org/nPq34Fpc/black#62,,2454899
22,7Sj5K,8/6pk/2Q4p/5p2/3PpKPq/R3P2P/P7/7r w - - 0 41,f4f5 h1f1 f5e4 h4e7 e4d5 e7a3,2100,75,100,115,crushing endgame fork long,https://lichess.org/VOxQEegf#81,,653217
23,bOOeY,8/8/8/4k2p/4p2P/4K1P1/8/8 w - - 2 81,g3g4 h5g4 h4h5 g4g3 h5h6 e5f6 h6h7 f6g7 h7h8q g7h8,2100,75,99,382,crushing endgame pawnEndgame veryLong,https://lichess.org/ytXXI8Oi#161,,3268933
24,0uY2Z,8/8/8/p3BK2/6p1/5k2/8/8 w - - 0 56,f5e6 a5a4 e5d6 g4g3 e6e5 g3g2,2100,75,98,366,advancedPawn bishopEndgame crushing endgame long quietMove,https://lichess.org/vwZhkeEe#111,,79414
25,yIrDk,3r2k1/pb3p1p/1p4p1/2pPr3/P1B1q3/1Q2P2P/5PP1/2RR2K1 b - - 0 22,b7d5 f2f3 e4e3 b3e3,2100,75,98,280,advantage middlegame short,https://lichess.org/e707sIzb/black#44,,5275119
26,umP9H,3r2k1/1R3pn1/2p2Q1p/1pPq2p1/1P3p2/5P1P/5BP1/6K1 b - - 5 39,d8d7 b7d7 d5d7 f2d4 d7d4 f6d4,2101,75,98,214,crushing endgame long quietMove,https://lichess.org/9iEsv37u/black#78,,4966888
27,Th3HE,2k5/ppp5/5P2/8/P1Bnq3/2Q2pP1/1P6/4RRKr w - - 2 28,g1f2 h1h2 f2g1 h2g2 g1h1 e4h7,2101,76,99,492,long mate mateIn3 middlegame,https://lichess.org/Pw3MpEYv#55,,2597146
28,i7ezC,8/8/4RP2/6p1/4bkP1/5r2/4K3/8 b - - 0 62,f4g4 e6e4 g4g3 e4e3 g5g4 e3f3 g4f3 e2f1,2101,76,99,392,crushing defensiveMove endgame hangingPiece pin veryLong,https://lichess.org/5VMkSQMQ/black#124,,3857883
29,vDPUR,8/7q/2p2k2/pp3pR1/3PrP2/P1P2Q2/1P4P1/1K6 w - - 3 33,g2g4 f5g4 f3g4 e4f4,2101,75,99,290,advantage discoveredAttack endgame master short,https://lichess.org/glRRgT7y#65,,5004915
30,su3EH,2rk4/3P3n/3NP1p1/4K3/7P/P4p2/8/8 b - - 2 49,c8c5 e5d4 c5f5 d6b7 d8c7 d7d8q,2101,74,98,278,advancedPawn crushing defensiveMove endgame exposedKing long promotion,https://lichess.org/4SWTG8AB/black#98,,4802252
31,1jU4E,8/8/8/1P3Pbp/k1K5/8/7P/8 b - - 0 47,g5d8 c4c5 a4a5 c5c6 d8f6 b5b6,2101,76,99,233,bishopEndgame crushing endgame long zugzwang,https://lichess.org/ta4a4z5O/black#94,,151582
32,ssJ5v,1k6/2p5/p2p2p1/1p1P1b2/3N1Pq1/P7/KPPQ4/8 b - - 9 36,f5e4 d4c6 b8c8 d2d4 e4d5 d4d5,2101,75,100,77,advantage clearance endgame long,https://lichess.org/YTFwDoXL/black#72,,4799775
33,svTQ4,2b3k1/8/8/P2pP3/5P1p/2pB1P2/8/3K4 w - - 0 39,d3f1 h4h3 f1h3 c8h3 d1c2 d5d4,2101,75,100,473,bishopEndgame crushing defensiveMove endgame long,https://lichess.org/xYGRqXqb#77,,4804209
34,hZdSx,5r2/3b2k1/2pp4/p3p3/4P1pN/1P1BR1P1/1rPK2P1/8 b - - 5 41,f8f2 d2c1 b2a2 c1b1 a2c2 d3c2,2101,75,98,737,advantage defensiveMove endgame long,https://lichess.org/6ED3WoRm/black#82,,3809212
35,Grdb7,8/8/1b1p4/3P2k1/1PKpPppp/N4P2/6PP/8 w - - 2 47,a3c2 h4h3 g2h3 g4f3 c2e1 f3f2,2101,76,98,622,advancedPawn advantage deflection endgame long,https://lichess.org/Um71Kfd5#93,,1475266
36,oZAiq,1k6/1pb2p2/p7/3qPB2/P6P/1KQ2P2/1P1r4/2R5 w - - 1 37,b3a3 c7e5 c3c8 b8a7 c8c5 d5c5 c1c5 e5d6,2101,76,98,380,advantage endgame pin veryLong,https://lichess.org/qNiVMuqO#73,,4422402
37,9dBoX,1R6/1Q3pkp/2p1rbp1/3p4/3P4/3BPP2/3q1PKP/8 w - - 2 26,b7c8 f6h4 c8f8 g7f6 g2h3 d2f2,2101,76,98,654,crushing endgame long master,https://lichess.org/a4BppDJt#51,,843090
38,FQZro,1r1r1k2/2q1b3/p1b1pnQ1/n1p5/2P4P/P3PN2/1B1NBP2/2K3R1 b - - 0 24,b8b2 f3g5 b2c2 c1c2 d8d2 c2d2,2101,75,99,149,crushing long middlegame,https://lichess.org/gQ2s3mFK/black#48,,1349280
39,YBJoC,5rk1/2r2p2/3p2pb/3Pp1Np/1Nq1P1bP/P7/1P1Q1RP1/1K3R2 w - - 6 26,f1c1 c4c1 d2c1 c7c1 b1c1 f7f6,2101,76,98,132,advantage long middlegame queensideAttack,https://lichess.org/byL98tjt#51,,2988249
40,mBn4X,6k1/5p2/6p1/pQp4p/1qP4P/1P2P1P1/5PK1/8 w - - 3 38,b5b4 c5b4 c4c5 g8f8,2101,76,98,850,crushing defensiveMove endgame short,https://lichess.org/d9e3UFoH#75,,4214737
41,xoA4m,r1b1k1r1/pp3pq1/2B5/3Q4/7b/5N2/PPP2PP1/2KR4 b q - 0 17,e8f8 d5c5 h4e7 d1d8,2101,76,98,317,clearance mate mateIn2 middlegame pin short,https://lichess.org/xJVcRmIp/black#34,French_Defense French_Defense_McCutcheon_Variation,5231691
42,YCDxQ,3r2k1/ppb3pp/5n2/1QP2bp1/1P1n4/P2p2P1/5P1P/3RR1K1 w - - 2 25,b5b7 d4e2 g1g2 f5e4 b7e4 f6e4,2101,74,99,520,advantage fork long middlegame,https://lichess.org/UA3NE3Rn#49,,2989498
43,scg6E,r1q1r1k1/pp1n1p2/6p1/7p/3p3P/6P1/PP1QPP1N/RN2K2R w KQ - 0 19,d2d4 c8c1 d4d1 e8e2 e1e2 a8e8 e2f1 c1d1,2101,76,98,501,attraction crushing deflection interference middlegame pin sacrifice veryLong,https://lichess.org/UGbsVXTj#37,,4777426
44,nP0CG,6k1/3p2p1/3Nr1q1/2P1rp1p/1P1QP2P/p4PP1/P5K1/4R3 w - - 0 35,e4f5 e5e1 f5g6 e6e2,2101,76,100,201,advantage endgame master sacrifice short,https://lichess.org/u4F75wxR#69,,4320629
45,O1yQi,r2q1r1k/4b1Rp/3pQ3/p3p3/1p2P3/4pP2/PPP4P/1K4R1 b - - 1 23,e7f6 g7h7 h8h7 e6f5 h7h8 f5h5,2101,75,98,823,attraction kingsideAttack long mate mateIn3 middlegame sacrifice,https://lichess.org/9taZlklw/black#46,,2101362
46,JdtRf,5rk1/pp2n1pp/3b1q2/3p4/2pPn3/2P1BP1Q/PPB3PP/R5K1 b - - 0 22,e4g5 e3g5 f6g5 h3e6 g8h8 e6d6,2101,75,99,130,advantage fork long middlegame,https://lichess.org/qZjPzJI3/black#44,,1718125
47,VaOhv,8/8/8/5p2/4p1k1/4K1p1/8/R7 w - - 0 61,a1f1 g3g2 f1a1 g4g3,2101,75,98,493,advancedPawn crushing defensiveMove endgame master rookEndgame short,https://lichess.org/SVBAJWfK#121,,2761798
48,6PTzo,7k/1p1r2p1/p3q2p/5B2/5Qn1/P4N2/1PP2bPP/5RK1 w - - 0 25,f1f2 d7d1 f2f1 e6b6 f3d4 d1d4 f4b8 d4d8,2101,76,100,284,crushing discoveredAttack middlegame veryLong,https://lichess.org/W5FtSUuC#49,,561235
49,cAMBT,5r1r/ppp1k3/4p3/3pn3/6Pn/1PN1P1QP/P1qPB2K/R6R w - - 0 24,g3e5 f8f2 h2g1 f2g2 g1f1 h8f8 f1e1 h4f3,2101,76,100,87,crushing middlegame veryLong,https://lichess.org/1vfhCwNh#47,,3336761
50,2QYvh,2r2bk1/2q4p/4p1p1/1p1p1pQ1/3B1P2/1P1PP2P/6P1/R5K1 b - - 1 26,f8c5 a1c1 c5e7 c1c7,2102,76,99,213,crushing endgame short,https://lichess.org/iuzulx7M/black#52,,212443
51,gUv3m,2r1k3/2qb1p2/4p3/8/2n1P2Q/1N6/P1P4R/1K1R4 w - - 11 35,h2g2 c4a3 b1b2 c7c3 b2c1 c3c2 g2c2 c8c2,2102,76,98,1298,master mate mateIn4 middlegame sacrifice veryLong,https://lichess.org/2sOpH8K4#69,,3715399
52,DG2W3,2k4r/ppp2pp1/2nrpn2/7p/7q/2NP1B2/PPP2P1N/R2Q1RK1 w - - 0 15,c3e4 f6g4 h2g4 h5g4,2102,76,99,106,advantage middlegame short,https://lichess.org/E9J0TXKM#29,Scandinavian_Defense Scandinavian_Defense_Modern_Variation,1159873
53,S5ILW,8/8/5np1/b2k2P1/1p1B1K2/1P6/8/8 w - - 0 45,g5f6 d5d4 f6f7 a5c7,2102,76,99,152,bishopEndgame crushing endgame hangingPiece master short,https://lichess.org/lCtwop1d#89,,2456206
54,x3396,5rk1/p2pQ2p/P1q3p1/1p2Pr2/2pPN3/2P2P2/P6P/5RK1 b - - 2 26,f5f3 f1f3 f8f3 e4f6 c6f6 e5f6,2102,76,100,90,crushing endgame long,https://lichess.org/ycy3EUCM/black#52,,5165081
55,D6kik,8/1p6/3N4/1PPbk3/6pp/8/5K1P/8 w - - 0 45,f2g1 b7b6 d6e8 b6c5,2102,76,98,97,crushing endgame short,https://lichess.org/sLFb8MDf#89,,1146844
56,st942,r7/8/P3R3/8/1pP2k2/1Kb2p2/R7/8 w - - 2 50,b3c2 f3f2 e6e7 a8f8,2102,75,99,342,advancedPawn crushing defensiveMove endgame short,https://lichess.org/0wp12O8N#99,,4800977
57,nJ7fU,1r3k2/p2q2p1/P4p1p/1Pp1p2P/2QpP1P1/3P4/2K1P3/1R6 w - - 11 46,c2b3 d7b5 c4b5 b8b5,2102,74,100,122,crushing endgame master short,https://lichess.org/DDt9Kh8E#91,,4312336
58,j77qi,8/pp2bk2/4N1p1/2pQp1Pp/2P1P1qP/8/P7/5K2 b - - 12 42,g4h4 e6f4 f7e8 d5g8 e8d7 g8e6,2102,75,100,100,crushing discoveredAttack endgame long,https://lichess.org/llibMu37/black#84,,3944679
59,rNyIf,8/4r3/8/4k3/6PK/2p4p/8/4R3 b - - 1 53,e5d4 e1e7 c3c2 e7e1,2102,75,99,691,crushing defensiveMove endgame hangingPiece master rookEndgame short,https://lichess.org/zTwff2DD/black#106,,4669342
60,KnPuN,8/4K1R1/4P3/5k2/8/8/4r1p1/8 w - - 1 68,e7d7 f5f6 g7g8 e2d2 d7c6 f6e6,2102,75,100,61,crushing deflection endgame long rookEndgame,https://lichess.org/xJIeCifj#135,,1818608
61,5xVan,8/2r2kp1/8/p7/P3q3/8/3QpK2/6R1 b - - 4 58,e4a4 d2d5 f7f8 d5d8 a4e8 d8c7,2102,76,99,251,crushing endgame fork long,https://lichess.org/IHiU2cMO/black#116,,521615
62,Uk2vP,8/5pk1/8/5pPp/7P/8/5P1K/8 b - - 0 59,g7g6 h2g3 f7f6 g5f6,2102,75,98,67,crushing endgame master pawnEndgame short,https://lichess.org/eT8twMcc/black#118,,2688052
63,ZVCeq,2r3k1/pp4pq/5p1p/3b4/4N1PQ/P4NBP/1b3P2/4R1K1 w - - 3 28,f3d2 g7g5 h4h5 d5f7,2102,75,99,207,advantage master middlegame short,https://lichess.org/mnJYnlY5#55,,3103564
64,q4tLR,5rk1/ppQ2pp1/7p/8/1P3n1q/P3RP2/2P2P1P/3R2K1 w - - 1 24,e3e4 f4h3 g1g2 h4f2 g2h3 f2f3,2102,76,99,396,advantage deflection endgame long,https://lichess.org/FVJ1k4rq#47,,4554550
65,m8ljD,8/8/pp1k4/2p1p1p1/P1P3P1/1P1K1P1p/7P/8 b - - 1 44,a6a5 d3e3 d6d7 e3f2 d7c6 f2g3,2102,75,100,112,crushing endgame long pawnEndgame zugzwang,https://lichess.org/WSqlhQtv/black#88,,4210544
66,WyF3b,4r3/pp6/6nR/2R2k2/4b2P/8/P4P2/6K1 b - - 2 37,e8e5 h6g6 e5c5 g6g5 f5e6 g5c5,2102,76,99,261,advantage endgame long sacrifice skewer,https://lichess.org/kxOfH6Fc/black#74,,2882305
67,7YYNl,1r4k1/pb3ppp/8/4r3/1P6/P3PP2/2Q2P1P/R5K1 w - - 0 24,a1d1 e5g5 g1f1 b7a6 f1e1 g5g1 e1d2 b8d8,2102,75,99,376,advantage endgame veryLong,https://lichess.org/eJKtOdbH#47,,661359
68,mAgbL,4r1k1/1p1b1p2/p1p3pQ/4PP2/P3B3/3P2b1/1q6/5R1K b - - 2 35,g3e5 f5g6 b2h2 h6h2 e5h2 g6f7,2102,74,98,499,advancedPawn crushing long middlegame,https://lichess.org/cQlpaQnX/black#70,,4213225
69,p2l23,5rk1/4qr2/p1Pp1ppp/3Q1b2/8/4R2P/PR3PP1/6K1 b - - 4 26,e7c7 b2b7 c7d8 e3e7 d8e7 b7e7,2102,76,98,138,advantage long middlegame pin,https://lichess.org/FWOwVIul/black#52,,4464142
70,vvsy1,4r2k/p5pb/2p4p/2Pp1p1P/3q1P2/4R3/P4KB1/1R5Q w - - 0 33,b1e1 d4f4 g2f3 f4d4 f2g2 e8e3 e1e3 d4e3,2102,76,100,94,advantage middlegame pin veryLong,https://lichess.org/3ZsKTtcv#65,,5067583
71,1iBDL,1r1qnk1r/2p3p1/2Qbpp1p/3p4/1P1P1B2/2PbPN1P/P2N1PP1/R4RK1 w - - 2 16,f1e1 d3b5 f4d6 c7d6 c6b5 b8b5,2102,76,100,101,advantage long middlegame trappedPiece,https://lichess.org/ycSt1Vtg#31,Queens_Pawn_Game Queens_Pawn_Game_Accelerated_London_System,149714
72,befA5,Q1b4r/p1pk2pp/5p2/7q/3P1b2/1P2P1P1/P1P4P/R1B1K2R w KQ - 0 23,e3f4 c8a6 a8g2 h8e8 c1e3 e8e3 e1d2 e3e2,2102,76,100,212,advantage exposedKing middlegame quietMove veryLong,https://lichess.org/hvVBmW92#45,,3291944
73,PjFRW,8/8/P7/4kb2/6p1/3pK3/8/3B4 b - - 0 42,g4g3 d1f3 f5h3 a6a7 g3g2 e3f2,2102,75,98,107,advancedPawn bishopEndgame crushing endgame long quietMove,https://lichess.org/z7knnwvF/black#84,,2250004
74,e8Cut,2r5/2PQ4/1p2Pkpq/4bp2/6n1/4P1P1/4NPBr/2R1R1K1 w - - 5 32,e2f4 h2h1 g2h1 h6h2 g1f1 h2f2,2102,76,98,556,clearance kingsideAttack long mate mateIn3 middlegame sacrifice,https://lichess.org/p7yR09gU#63,,3508761
75,O8Of6,6k1/1b2b1p1/6qp/p7/3PpB2/7P/PP1Q1P2/4RK2 w - - 0 28,f1e2 g6h5 e2f1 h5h3,2102,75,98,210,crushing endgame short,https://lichess.org/jbdWxeeH#55,,2110336
76,yMHfm,r4r1k/p1p4p/bp2Q1pR/n7/3P1P2/2P1P1q1/PP4P1/2KR4 b - - 2 20,f8e8 h6h7 h8h7 e6f7 h7h6 d1h1 g3h2 h1h2,2102,75,99,193,attraction kingsideAttack mate mateIn4 middlegame sacrifice veryLong,https://lichess.org/hbMQOPsM/black#40,,5279891
77,y96Sy,3r3k/pp4pp/2p3b1/3nNpP1/1Q1Pq3/PB5P/1P3P2/2R3K1 w - - 5 27,b4b7 d5f4 b7c6 f4e2 g1f1 e2c1,2102,76,98,159,advantage fork long middlegame,https://lichess.org/iKg5V14I#53,,5261184
78,uZeIi,3Q4/p5q1/1p1nr2k/2p3p1/P1P2p1p/5P1P/5BPK/3R4 b - - 8 47,d6c4 d1d7 g7f6 d8g8 e6e7 d7e7 f6e7 g8c4,2103,76,100,98,advantage endgame veryLong,https://lichess.org/ttD1Exob/black#94,,4948986
79,QOwzF,8/2p2pp1/4p3/1p2PPP1/4P3/pk1bN3/8/K7 b - - 3 43,d3e4 g5g6 f7g6 f5f6 g7f6 e5f6 g6g5 f6f7,2103,76,98,280,advancedPawn advantage endgame veryLong,https://lichess.org/EMBnI69Z/black#86,,2308674
80,Yqrao,3r2k1/2p3p1/ppn2pN1/3q2pQ/7P/2P3P1/1P2R2K/8 b - - 2 43,g5h4 e2e8 d8e8 h5d5,2103,76,99,126,crushing deflection endgame master short,https://lichess.org/4vY9ZvQg/black#86,,3046784
81,UOKCR,1Q4r1/pp2k3/1p5n/4N2q/4P1b1/2P4P/PP3P2/R4RK1 w - - 2 29,b8c7 g4d7 e5g4 h6g4,2103,76,98,158,crushing discoveredAttack middlegame short,https://lichess.org/1zeNedJr#57,,2657871
82,X2DiE,8/8/4P1kp/8/p2K1P2/8/8/8 w - - 0 45,f4f5 g6f6 d4d5 a4a3 d5d6 a3a2 e6e7 a2a1q e7e8q a1d4,2103,75,98,318,advancedPawn crushing defensiveMove endgame pawnEndgame promotion veryLong,https://lichess.org/oVuTIzlC#89,,2887918
83,wRp5z,r3r1k1/2p2pp1/p2P3p/1p5n/8/2P3B1/P4P1P/3RR1K1 b - - 0 29,h5g3 e1e8 a8e8 d6c7 g8h7 d1d8,2103,76,98,87,advancedPawn advantage endgame long,https://lichess.org/MccWEvbD/black#58,,5112609
84,mXWlG,1r1r4/p1p1kp2/2b3p1/2p3N1/2P3pP/1P2P1P1/P2R1K2/3R4 w - - 0 25,e3e4 d8d2 d1d2 f7f6 g5f3 g4f3,2103,75,100,100,advantage endgame long,https://lichess.org/gMOE0bB8#49,,4245219
85,3gfDZ,r2q1rk1/pbpn1p1p/1p1p1bpQ/8/1PPN4/2BB4/P4PPP/R4RK1 b - - 1 14,f6g7 h6g7 g8g7 d4f5 g7g8 f5h6,2103,76,98,978,attraction doubleCheck kingsideAttack long mate mateIn3 middlegame sacrifice,https://lichess.org/PGod6JL9/black#28,Philidor_Defense Philidor_Defense_Exchange_Variation,322784
86,4Iy10,7k/1p4p1/p6p/6b1/2BP2P1/2P1p2P/PP1q4/KQ6 w - - 5 37,b1g6 d2d1 g6b1 e3e2 c4e2 d1e2,2103,75,100,110,advancedPawn advantage endgame long,https://lichess.org/cHQwtg9R#73,,377219
87,zNRJa,8/8/8/3P1p2/1p3K2/1kr1R3/5P2/8 b - - 0 49,c3e3 f4e3 b3a2 d5d6 b4b3 d6d7,2103,75,100,89,advancedPawn crushing endgame long,https://lichess.org/4PdGYUmh/black#98,,5369390
88,3gozZ,8/8/4k3/2p4K/8/1P6/8/8 w - - 0 48,h5g4 e6e5 g4g5 e5d4 g5f4 d4c3,2103,76,98,238,crushing endgame long pawnEndgame,https://lichess.org/Fzrmq0qp#95,,323002
89,mejPz,2k5/pp6/8/2P1p2r/2P1P3/3K4/8/5R2 w - - 0 43,f1f5 h5f5 e4f5 a7a5,2103,75,99,216,crushing defensiveMove endgame rookEndgame short,https://lichess.org/ERaBmGeW#85,,4255428
90,sbSiq,5rk1/p5bp/2p3p1/7q/2PpQ3/8/P1PB2PP/4R2K w - - 4 28,e4c6 h5e2 h2h3 e2d2,2103,75,98,371,advantage endgame short,https://lichess.org/HlmvgORB#55,,4775722
91,xfLPA,6k1/2R3pp/4P3/2pr4/1P6/4b1P1/6KP/8 b - - 0 30,g7g6 c7c8 g8g7 e6e7,2103,76,100,55,advancedPawn crushing endgame short,https://lichess.org/e6ffr6z6/black#60,,5219104
92,QWLJz,5rk1/6r1/ppq1p2p/2b1P3/2Q2P2/2N1BR2/PP4KP/5R2 w - - 3 27,g2h3 f8f5 c4e6 c6e6,2103,75,98,280,crushing middlegame short,https://lichess.org/obNpGN7U#53,,2319119
93,htSpl,4r3/1pp1r1k1/1p1p1q1p/3P1PP1/6Q1/2PB4/PP3RP1/6K1 b - - 0 29,f6g5 g4g5 h6g5 f5f6 g7g8 f6e7,2103,76,100,102,advancedPawn advantage endgame fork long,https://lichess.org/46nJBYTP/black#58,,3837658
94,3yMog,8/6k1/5pp1/6P1/4KP2/8/8/8 b - - 1 61,f6g5 f4g5 g7f8 e4d5 f8e7 d5e5,2103,75,100,105,crushing defensiveMove endgame long master pawnEndgame zugzwang,https://lichess.org/WWashu6u/black#122,,347738
95,kNFEY,1rqr4/4ppkp/2N1p1p1/1PPn4/8/PQ3PP1/3R2KP/R7 b - - 2 33,c8c6 b3b2 e6e5 b5c6 b8b2 d2b2,2104,76,100,482,advantage intermezzo long middlegame pin,https://lichess.org/CMF1QaLN/black#66,,4055303
96,uK7fF,8/5pp1/4p1p1/1k1pPP2/1p4P1/1Pr5/r1P3RP/2KR4 b - - 0 51,c3b3 c2c4 d5c4 g2a2,2104,75,99,244,advantage discoveredAttack endgame rookEndgame short,https://lichess.org/QM3T7sqb/black#102,,4927227
97,EfcuS,8/8/8/p1pk2p1/1p4P1/PP1K4/2P5/8 w - - 0 40,a3a4 c5c4 b3c4 d5c5 d3e4 c5c4 e4f5 c4c3 f5g5 c3c2 g5f6 b4b3 g4g5 b3b2,2104,75,98,387,advancedPawn crushing endgame pawnEndgame veryLong zugzwang,https://lichess.org/95ki25qm#79,,1283228
98,zeev7,r5k1/ppp2pp1/2p4p/4Pq2/5P2/1Q5P/P1Pr2P1/R4RK1 w - - 2 25,b3b7 f5c2 b7a8 g8h7 a8c6 c2c6,2104,75,98,464,crushing endgame long sacrifice,https://lichess.org/Dbx7xFjU#49,,5393531
99,E68GX,8/2q1k3/5p2/1P1bpPpp/1QN5/7P/6PK/8 b - - 2 47,e7f7 b5b6 c7c4 b4c4 d5c4 b6b7,2104,75,100,130,advancedPawn crushing endgame long sacrifice,https://lichess.org/5hKyGTsW/black#94,,1233216
100,6syCY,4rrk1/1p4b1/p2n2Q1/P1pP4/5pPq/2N5/1P4PB/R4RK1 w - - 1 23,g6d6 g7d4 g1h1 f8f6,2104,76,98,150,advantage master masterVsMaster middlegame short,https://lichess.org/8d1h6uxs#45,,603125
101,he0nq,8/2pb1r1k/3pN2p/3PrP2/1p2p3/1P4R1/PK4RP/8 b - - 2 34,d7e6 d5e6 f7e7 f5f6 e5e6 f6e7,2104,75,98,493,advancedPawn advantage endgame long,https://lichess.org/e6OfrXcN/black#68,,3815414
102,wi0Fj,8/8/4p3/8/3PPk2/8/5p2/5K2 w - - 1 53,f1f2 f4e4 d4d5 e4d5 f2e3 d5e5,2104,76,100,129,crushing defensiveMove endgame long pawnEndgame zugzwang,https://lichess.org/20kj1nhO#105,,5135445
103,diZPK,7k/5QR1/4p2B/3p4/2pP4/3q4/5P2/r5K1 w - - 1 38,g1g2 d3e4 f7f3 a1g1 g2g1 e4f3,2104,76,98,1214,advantage deflection endgame long,https://lichess.org/PXZyttTG#75,,3472444
104,aOu15,2rq1r1k/6bp/p2pQ1p1/1p6/5B2/2P2P2/PP3P1P/4RRK1 w - - 1 22,f4d6 f8f6 d6e7 f6e6 e7d8 e6e1,2104,75,98,461,advantage long middlegame,https://lichess.org/k0TS6zYs#43,,3182393
105,XVKIs,6r1/ppkqbR1Q/2p1p3/3nP3/3PB3/2P3rP/PP4P1/R5K1 w - - 2 21,e4d5 d7d5 f7e7 c7d8 e7d7 d5d7,2104,75,98,161,advantage long middlegame,https://lichess.org/qrJ4jxAr#41,,2928968
106,GERKe,rn2kb1r/ppp2ppp/2b1B3/3P4/6PN/5P1P/P1P2K2/q1BQR3 b kq - 0 15,c6d7 e6f5 e8d8 c1g5 f7f6 d1a1,2104,75,99,474,advantage discoveredAttack long middlegame,https://lichess.org/I7t5GCIe/black#30,Scandinavian_Defense Scandinavian_Defense_Lasker_Variation,1419827
107,G8gHi,r1bqk2r/1p1pnppp/8/1p1NP3/1R6/4P3/2P2PPP/3QKB1R w Kkq - 1 16,f1b5 e7d5 d1d5 a8a1 e1e2 a1h1,2104,75,100,113,advantage long middlegame skewer,https://lichess.org/7cLUml1g#31,Englund_Gambit Englund_Gambit_Main_Line,1411615
108,GClzS,r1b1k2r/ppp2pp1/2p5/8/4P1P1/3P1Pq1/PPP3P1/RN1Q1RK1 w kq - 1 14,b1d2 h8h2 f1f2 g3h4 g1f1 h2h1 f1e2 h1d1,2104,74,98,370,advantage middlegame skewer veryLong,https://lichess.org/lJ1mhZgN#27,Petrovs_Defense Petrovs_Defense_Stafford_Gambit,1417564
109,zsJ1X,R7/P4k2/6p1/6Kp/r6P/8/8/8 w - - 0 45,a8h8 f7g7 h8g8 g7g8 a7a8q a4a8,2104,75,98,109,crushing endgame long rookEndgame,https://lichess.org/bGtQMrl4#89,,5412721
110,COC1h,7r/8/2kbpr2/1p1p1pq1/pPpP1N1p/P1P1PQ1P/4B1PK/6R1 b - - 2 41,e6e5 f3d5 c6c7 d4e5 g5g3 h2h1 g3e3 e5d6,2104,75,100,64,advantage fork middlegame veryLong,https://lichess.org/xpca5bkl/black#82,,1084096
111,wk3Pm,r3k3/ppB1np1p/2b1p3/8/3Q4/4P3/PP2qP1P/2KR4 b q - 0 17,e7f5 d4h8 e8e7 c7d8 a8d8 h8d8,2105,76,100,62,long mate mateIn3 middlegame,https://lichess.org/P360xKOv/black#34,Queens_Gambit_Declined Queens_Gambit_Declined_Other_variations,5138336
112,ptZc4,r2q1rk1/pp1bn2R/4p1p1/1N1pb1B1/3p4/3B4/PPP2PP1/R2QK3 b Q - 0 14,g8h7 d1h5 h7g8 d3g6 e7g6 h5g6 e5g7 g5d8,2105,75,98,405,advantage deflection middlegame pin veryLong,https://lichess.org/alsDODa2/black#28,Modern_Defense Modern_Defense_Other_variations,4538837
113,jKXip,6nr/pB3ppp/4pkq1/4Q3/1b4b1/3P1N2/PP3PPP/n2K3R b - - 9 19,f6e7 e5c7 e7f6 c7d8 g8e7 d8d4 e6e5 d4e5,2105,76,100,132,fork mate mateIn4 middlegame veryLong,https://lichess.org/QSJ6heWa/black#38,,3963810
114,liryx,6k1/pp1b2pp/q1r1p3/1N1p4/3P1Q1P/2P3P1/8/1R4K1 b - - 8 23,c6c8 b1f1 h7h6 f4f7 g8h7 f7d7,2105,76,99,197,advantage endgame fork long quietMove,https://lichess.org/QvWYy993/black#46,,4173638
115,gaopy,4r3/5pbk/PQ4p1/3P3p/2n2P2/5B1P/6P1/5K2 w - - 7 37,b6c6 c4d2 f1g1 g7d4 g1h2 d2f1,2105,76,100,62,crushing endgame long,https://lichess.org/Xxam6Mxs#73,,3723654
116,QdhCJ,5k2/p7/1p2p3/3p2P1/1P1P3P/P3K3/r3n2R/8 b - - 3 35,e2c3 h2a2 c3a2 e3d2 e6e5 d4e5,2105,75,98,401,advantage endgame long,https://lichess.org/uF1byrGn/black#70,,2329482
117,Fxpi1,8/3k4/2p3p1/2Pp1p1p/1P1K1P1P/8/6P1/8 b - - 0 37,d7c7 b4b5 c6b5 d4d5 b5b4 d5c4 b4b3 c4b3,2105,74,98,462,crushing deflection endgame pawnEndgame veryLong zugzwang,https://lichess.org/oRuwm7CA/black#74,,1396327
118,dMuOu,r4kr1/1pN1bp1p/4p1b1/3p4/4qB2/4P3/PP3PPP/R2Q1RK1 w - - 4 20,c7a8 e4g2 g1g2 g6e4 g2h3 e4g2,2105,75,98,425,attraction doubleCheck kingsideAttack long mate mateIn3 middlegame sacrifice,https://lichess.org/m07iEdrd#39,,3442100
119,E5dMN,3k4/1p1n3p/4Bpp1/1P2p3/2P5/4KPP1/7P/8 w - - 0 40,e6d7 d8d7 c4c5 d7e6,2105,75,100,110,advantage defensiveMove endgame short,https://lichess.org/NK9xcLj1#79,,1232514
120,1Zka3,6k1/7p/4pq2/2ppRp2/5P1P/2PPQ1P1/1r4K1/8 w - - 2 31,g2h3 f6g6 e3f3 h7h5,2105,75,98,136,crushing defensiveMove endgame master short,https://lichess.org/u9sort4N#61,,137873
121,l9kw9,r7/1p2kp2/1q1Np2p/4P2Q/p7/P1n5/1P3PP1/1K1R4 w - - 6 28,b1c2 b6b3 c2d2 b3d1 h5d1 c3d1,2105,76,98,121,advantage endgame long skewer,https://lichess.org/yfDUvlNk#55,,4123734
122,xXKFt,8/8/2pb4/2Np1k2/3P3p/4K2P/6P1/8 w - - 3 48,e3f3 d6c5 d4c5 d5d4 g2g4 h4g3 f3g3 f5e4 g3f2 e4d3,2105,75,99,379,crushing defensiveMove enPassant endgame quietMove veryLong,https://lichess.org/mNr41Q38#95,,5207965
123,YZ64x,8/5p1p/2p3p1/p7/P1K1kP2/4P2r/1P2R2P/8 b - - 0 36,h3e3 e2e3 e4e3 b2b4 a5b4 a4a5,2105,76,99,233,crushing defensiveMove endgame long rookEndgame,https://lichess.org/jrwsoNCy/black#72,,3022056
124,8Dc8N,r3r3/1b2n1R1/p3p3/1p1p1k2/5P1n/1BP3R1/PP2N3/2K5 b - - 0 29,h4g6 g7f7 f5e4 b3c2,2105,76,99,182,mate mateIn2 middlegame short,https://lichess.org/SyPfxfAk/black#58,,719237
125,EvUDj,5k2/5p2/p3b3/4Q3/P2pPR1P/3P2K1/6P1/1r5q b - - 2 43,h1d1 e5e6 d1e1 g3g4 e1e2 g4g5,2105,75,100,140,advantage defensiveMove endgame long pin,https://lichess.org/viya94Bs/black#86,,1305529
126,B4rZU,7r/3b1pk1/r1p2p2/p1p4q/2NpN1p1/1P1P1P2/P1P3P1/R2QR1K1 w - - 1 25,e4g3 h5h2 g1f2 h8h3 g3h5 h3h5,2105,76,98,196,advantage clearance fork long middlegame pin,https://lichess.org/qvpMvE2z#49,,969425
127,f8O8u,8/1r6/p5p1/P1KPk3/8/1pP3P1/1B6/8 b - - 2 52,b7b5 c5c6 b5a5 c3c4 e5e4 d5d6 a5a2 d6d7 a2b2 d7d8q,2105,76,98,1583,advancedPawn advantage discoveredAttack endgame promotion veryLong,https://lichess.org/EMuJfUap/black#104,,3596115
128,ujQhM,r5k1/5ppp/2p1q3/1pPp4/rP3P1P/P1QR2P1/K1P5/7R w - - 7 33,h1e1 d5d4 e1e6 d4c3 d3c3 f7e6,2105,76,99,417,advantage discoveredAttack endgame long,https://lichess.org/Tk4HlcZI#65,,4962661
129,km64Y,8/4n3/2P3kP/3K1p2/8/1p6/8/2B5 w - - 2 63,d5d6 e7c6 d6c6 f5f4,2105,74,98,1366,crushing defensiveMove endgame sacrifice short,https://lichess.org/SPc7mlaQ#125,,4090716
130,qNbjF,r5k1/2Q2ppp/p1N5/8/8/K1NbP3/PP5P/7q b - - 1 24,d3g6 c7b7 h1c6 b7c6,2105,75,98,645,crushing endgame short,https://lichess.org/AHtLJGUW/black#48,,4580928
131,0fcZS,r5k1/pp4pp/2b1p3/q1bpN3/8/1R6/P1PQNrPP/3R3K b - - 1 20,a8f8 d2a5 f2f1 e2g1 f1d1 a5c5,2105,76,99,242,advantage hangingPiece long middlegame,https://lichess.org/aRYc2RLp/black#40,,58326
