,PuzzleId,FEN,Moves,Rating,RatingDeviation,Popularity,NbPlays,Themes,GameUrl,OpeningTags,ID
2493,p8wZL,1k1r1n1r/8/1p1qp3/pPpP1p1p/2P1Q3/5B2/P4PPP/3RR1K1 w - - 0 26,d5e6 f5e4 d1d6 d8d6,1969,75,100,237,advantage middlegame short,https://lichess.org/fgL7wEjE#51,,4472921
2494,0seCU,2k5/ppp4p/2nb2r1/2P1p1r1/4p3/1P2P2q/PB2BRP1/3R1QK1 b - - 0 21,g6h6 f2f8 c6d8 f8d8 c8d8 f1f8,1969,75,100,252,attraction crushing long middlegame pin queensideAttack sacrifice,https://lichess.org/HXuxZIg7/black#42,,76729
2495,pzbP2,r1bq2k1/pp3r1p/1bp2p1B/3p1pN1/1PnP4/P1N5/2P2PPP/R1Q1R1K1 b - - 3 18,f6g5 c1g5 g8h8 g5d8 b6d8 e1e8 f7f8 e8f8,1969,75,100,139,fork mate mateIn4 middlegame veryLong,https://lichess.org/KbJq4CHo/black#36,Caro-Kann_Defense Caro-Kann_Defense_Advance_Variation,4547209
2496,PUSSJ,2r3k1/pp2p2p/3p2pb/8/1qPP1N2/2RQP3/8/2K5 b - - 2 34,a7a5 f4d5 b4a4 d5e7 g8f7 e7c8,1969,75,100,82,advantage endgame fork long,https://lichess.org/B0wqQnfH/black#68,,2229258
2497,0DFxM,8/7p/8/3k1pp1/8/5K2/5PPP/8 b - - 1 41,h7h5 h2h4 g5g4 f3f4 d5e6 f4g5,1969,75,100,197,crushing defensiveMove endgame long pawnEndgame,https://lichess.org/xGeaihSF/black#82,,18745
2498,3lNdB,4r1k1/RR3pp1/3Qb2p/1p1p4/2qP4/2P3P1/1P3P1P/6K1 w - - 1 31,d6f4 c4f1 g1f1 e6h3 f1g1 e8e1,1970,75,100,215,attraction endgame long master mate mateIn3 sacrifice,https://lichess.org/mMTseeB0#61,,329489
2499,9EtYD,8/ppp5/3p3p/5Pk1/2P1K1P1/8/1P6/8 b - - 2 43,c7c6 c4c5 d6d5 e4e5,1970,74,100,102,crushing defensiveMove endgame pawnEndgame short,https://lichess.org/xW4SH8N3/black#86,,808611
2500,C4z97,4Q3/1p4p1/6Pk/3p1r2/PP6/5qPp/5P2/5RK1 w - - 1 34,e8e3 f3e3 f2e3 h3h2 g1h2 f5f1,1970,75,100,428,advancedPawn crushing deflection endgame long,https://lichess.org/eAlpRQpR#67,,1056956
2501,HeOxt,2r5/5k2/pp6/3r4/2qP2Q1/2P2RP1/P4P1K/8 b - - 4 41,f7e7 g4g7 e7d6 f3f6,1970,75,100,541,endgame mate mateIn2 short,https://lichess.org/uqJ533t8/black#82,,1543640
2502,ZLkwX,rn3r1k/pp4pp/3p2q1/3Bp3/5p2/3P3b/PPP2PPP/R1BQ1RK1 w - - 0 15,d5b7 h3g2 b7g2 f4f3 d1f3 f8f3,1970,75,100,130,advantage long middlegame pin sacrifice,https://lichess.org/BzbSLXfp#29,Scandinavian_Defense Scandinavian_Defense_Mieses-Kotroc_Variation,3090231
2503,I5oih,5r1k/p5pp/2p1R3/2p3q1/4Q1P1/PPBP1p2/5P1b/6K1 w - - 0 28,g1h2 g5h4 h2g1 h4h3 c3g7 h8g8,1970,75,100,158,crushing endgame long,https://lichess.org/yE4qKSen#55,,1582325
2504,wmQeq,5r1k/R6p/2q1brp1/2p5/p5P1/2Q4P/PP1R1P2/6K1 b - - 0 36,g6g5 d2d8 c6f3 d8f8,1970,74,100,159,crushing master middlegame pin short,https://lichess.org/UjGSylrw/black#72,,5141737
2505,rowsG,rnb2r1k/pp1n2pp/4Qb2/q1p1N3/3p1P2/2NP4/PPP2BPP/2KR1B1R b - - 1 13,d4c3 e5f7 f8f7 e6f7 a5d8 d1e1,1970,75,100,268,advantage defensiveMove long middlegame,https://lichess.org/0EEWxXFI/black#26,French_Defense French_Defense_Kings_Indian_Attack,4707391
2506,4AtQR,Q7/2p3kp/p2b4/1p2q3/8/3P1P2/2P4P/5R1K w - - 1 27,f1f2 e5e1 h1g2 d6c5 d3d4 c5d4 f2d2 e1d2,1971,75,100,284,crushing endgame fork veryLong,https://lichess.org/UQtqZ7cd#53,,365691
2507,3Nl3F,8/5R2/6k1/8/1p4p1/1P1N1p2/4r3/3K4 w - - 4 64,d3f4 g6f7 f4e2 f3e2,1971,75,100,179,advancedPawn crushing endgame master short,https://lichess.org/eU0WXvY2#127,,295973
2508,oSa7y,2kr4/1p3p2/1Q6/2p1p2P/2PqPp2/P2r3P/6P1/3R1R1K w - - 0 28,d1b1 d3h3 g2h3 d4e4 h1g1 d8g8,1971,75,100,156,crushing endgame long sacrifice,https://lichess.org/9RLO91Wg#55,,4413070
2509,UjCTX,2r3k1/q4p2/p2bpnN1/1p6/3P1PQ1/8/PP1B1R1P/6K1 w - - 1 26,g4g2 f7g6 g2g6 a7g7,1971,75,100,168,advantage middlegame short,https://lichess.org/v1g83mWZ#51,,2686907
2510,EncT1,8/4R3/r4Kp1/7k/7P/8/8/8 w - - 21 71,f6e5 h5h4 e7h7 h4g5,1971,75,100,216,crushing defensiveMove endgame rookEndgame short,https://lichess.org/t70ZURsZ#141,,1294381
2511,9x2gq,2k3nr/ppp2ppp/2n5/8/Q2N1bq1/8/PP3PPP/RN3RK1 w - - 0 14,g2g3 f4e5 d4c6 g4a4,1971,75,100,139,advantage discoveredAttack middlegame short,https://lichess.org/LX1WmCkM#27,Nimzowitsch_Defense Nimzowitsch_Defense_Scandinavian_Variation,871083
2512,MbVOm,8/8/2k1P3/p1P5/4K1pp/1P3p1P/6P1/8 w - - 0 41,g2f3 g4h3 e6e7 c6d7 c5c6 d7e7,1971,75,100,114,crushing endgame long pawnEndgame,https://lichess.org/sb3qJ9Hq#81,,1976883
2513,PIAMk,rn1q1rk1/p3bpB1/1p2pn2/7P/2pP4/2NB1b2/PP1Q1PP1/R3K2R b KQ - 0 13,g8g7 d2g5 g7h8 g5h6,1972,75,100,96,crushing middlegame short,https://lichess.org/BTqFi2PD/black#26,Caro-Kann_Defense Caro-Kann_Defense_Panov_Attack,2211829
2514,DbftD,6k1/3R4/1P6/7p/3pbp1P/6p1/3K4/8 w - - 0 48,d2e2 f4f3 e2f1 e4d3,1972,75,100,265,crushing endgame short,https://lichess.org/jAv61RUR#95,,1190164
2515,rMAk9,4r3/Qpqk1np1/1np1p1N1/6P1/4PPBP/2N5/PPP5/2K5 w - - 3 27,f4f5 e8a8 f5e6 d7e8 e6f7 e8f7 a7a8 b6a8,1972,75,100,858,advantage defensiveMove middlegame sacrifice trappedPiece veryLong,https://lichess.org/GcuTWOEd#53,,4666741
2516,dgH30,r6r/1p1k1ppp/p3p3/3pPnQ1/3q4/P1N5/1P3PPP/R4RK1 b - - 1 16,h7h5 c3d5 e6d5 g5f5,1972,74,100,200,advantage deflection middlegame short,https://lichess.org/vdpSE5mX/black#32,French_Defense French_Defense_Franco-Sicilian_Defense,3469220
2517,R5YVm,4r1k1/1p3ppp/p2R1n2/5r2/4pQ2/1P2PP1q/PB2KP2/1BR5 w - - 1 26,d6f6 e4f3 e2d3 f5f4,1972,75,100,120,advantage middlegame short,https://lichess.org/mYgjlO5W#51,,2368940
2518,bNjwR,2k4r/1p6/4N1p1/1r1p1pP1/pnqP1B2/5N2/PPPQ1P1P/2KR4 w - - 6 24,f3e5 b4a2 c1b1 a2c3,1972,75,100,688,crushing middlegame pin queensideAttack short,https://lichess.org/05nXgP7W#47,,3268060
2519,tj3Bk,6k1/prp3p1/8/n2PRp2/5B2/P1P2qPp/2Q2P1P/5K2 w - - 4 30,c2f5 b7b1 f5b1 f3h1 f1e2 h1b1,1973,75,100,69,crushing endgame long sacrifice skewer,https://lichess.org/HNcoN4FR#59,,4874743
2520,XSGxC,2kr2r1/pb6/1q2p2p/1pp5/3P1Q2/2P5/P3BPPP/2R2RK1 w - - 2 28,e2f3 d8f8 f3b7 b6b7 f4f8 g8f8,1973,75,100,111,advantage long middlegame,https://lichess.org/LTWm4pVZ#55,,2924610
2521,UCjxw,5b2/8/4N1p1/7p/2P2p1k/2K1pP1P/P5P1/8 w - - 4 41,e6f8 h4g3 c3d3 g3f2 f8g6 e3e2,1973,75,100,108,advancedPawn crushing endgame knightEndgame long,https://lichess.org/ICy32NeO#81,,2641782
2522,bj9ID,5rk1/1p4pp/p5r1/3p4/4q3/2QRP3/PP2R1PP/6K1 w - - 9 29,d3d4 g6g2 e2g2 e4b1 d4d1 b1d1 c3e1 d1e1,1974,75,100,103,endgame mate mateIn4 sacrifice veryLong,https://lichess.org/0t4KapAj#57,,3298415
2523,tOFpC,r5k1/1p1b2bp/p3p1p1/3q1n2/P3N3/5Q2/1P4PP/3R1R1K b - - 15 33,f5d4 f3f7 g8h8 e4f6,1974,75,100,149,advantage middlegame short,https://lichess.org/duwKlYrh/black#66,,4845226
2524,NBn6t,5rk1/4n1b1/p3N2q/3pp2P/P5Q1/2PPp3/6P1/1R4K1 b - - 1 37,f8f7 b1b8 g8h7 e6g5 h6g5 g4g5 e3e2 b8b1,1974,75,100,153,advantage defensiveMove exposedKing fork middlegame veryLong,https://lichess.org/zspKKm3z/black#74,,2028000
2525,IafLc,6rk/4b1pp/4Pp2/3p3N/1p1Bb3/1P3RRP/P5PK/2r5 w - - 4 33,f3f6 g7f6 d4f6 e7f6,1974,75,100,113,advantage master middlegame short,https://lichess.org/nhaCq3XQ#65,,1626106
2526,oUz2B,1Q6/2R2qk1/4r2p/6p1/8/5p1P/6PK/8 b - - 1 39,f3f2 c7f7 g7f7 b8a7 f7g6 a7f2,1974,74,100,79,attraction crushing endgame long,https://lichess.org/VKIM2Sry/black#78,,4416487
2527,3GBTR,rn2kb1r/pp3ppp/1q2pn2/1b6/2BP1B2/5N1P/PP3PP1/RNQ1K2R b KQkq - 0 10,b6a5 f4d2 f8b4 c4b5 a5b5 c1c8 e8e7 c8h8,1974,74,100,117,advantage clearance defensiveMove opening skewer veryLong,https://lichess.org/rRzpFOPY/black#20,Caro-Kann_Defense Caro-Kann_Defense_Exchange_Variation,285368
2528,yPhHn,r1br2k1/ppq1bpp1/2n1p3/4N1p1/4B3/2P5/PP1NQPP1/3RK2R b K - 1 18,c7e5 h1h8 g8h8 e2h5 h8g8 h5h7 g8f8 h7h8,1974,75,100,265,attraction kingsideAttack mate mateIn4 middlegame sacrifice veryLong,https://lichess.org/8M6eY65A/black#36,Indian_Defense Indian_Defense_London_System,5284722
2529,WoTro,8/2p5/p2k4/3P4/2K5/1P3R2/5P2/3r4 b - - 10 39,d1d5 f3f6 d6e5 f6f5 e5f5 c4d5,1974,74,100,460,crushing deflection endgame exposedKing long rookEndgame,https://lichess.org/uvk395Wh/black#78,,2868804
2530,aAvxf,r1b2rk1/ppp1R1p1/1b1p3p/3PN2q/2B2p1B/2PQ4/P4PPP/4R1K1 b - - 0 18,h5h4 e7g7 g8g7 d3g6 g7h8 e5f7 f8f7 e1e8 f7f8 e8f8,1975,74,100,334,attraction clearance kingsideAttack mate mateIn5 middlegame sacrifice veryLong,https://lichess.org/SvXB5h4U/black#36,Bishops_Opening Bishops_Opening_Boi_Variation,3162516
2531,fM40g,2R5/7p/1P1k2p1/5p2/2pr3P/8/5PP1/6K1 b - - 2 36,c4c3 b6b7 d4d1 g1h2 d1b1 b7b8q b1b8 c8b8,1975,75,100,185,advancedPawn crushing endgame exposedKing promotion rookEndgame veryLong,https://lichess.org/M0119P4E/black#72,,3615247
2532,gQihr,r2q2k1/pp6/3p2np/2pP4/3b1r2/2NQ3P/PP2B3/2R2R1K b - - 1 23,g6e5 d3g3 d8g5 g3f4 g5f4 f1f4,1975,74,100,148,advantage fork long middlegame,https://lichess.org/HhaeNXN4/black#46,,3709545
2533,djwrL,r5k1/pp3qpp/1p1Pbr2/2b5/2B5/1Q6/PP4PP/2R2R1K w - - 3 24,c4e6 f7e6 b3e6 f6e6,1975,75,100,98,advantage middlegame short,https://lichess.org/TIAmBRP9#47,,3474465
2534,4avPN,r4k1r/3q3p/pn1p4/1pp2pBQ/3b4/P1NP4/1PP3PP/5R1K b - - 7 19,d7f7 f1f5 f7f5 g5h6 f8e7 h5f5,1975,75,100,261,advantage discoveredAttack exposedKing long middlegame pin sacrifice,https://lichess.org/8I43KBjI/black#38,,402084
2535,29nFW,6k1/7p/4b1p1/4b3/8/7p/2R2P2/3B3K w - - 2 42,c2e2 e6d5 f2f3 d5f3 h1g1 h3h2,1975,75,100,103,advancedPawn crushing endgame exposedKing fork long,https://lichess.org/tGuZwrjf#83,,188979
2536,bA7gF,r1b5/1p2k2p/p5p1/2p5/P4R2/4Q3/1Pq3PP/7K b - - 1 30,e7d6 f4f6 d6d5 e3f3 c2e4 f6d6 d5d6 f3e4,1975,75,100,87,advantage deflection endgame pin veryLong,https://lichess.org/jbsryR2f/black#60,,3248908
2537,9xHSO,6k1/pq2rpp1/3Qb2p/2pR2b1/P7/1P5P/N1P2PP1/4R1K1 w - - 1 27,d5c5 e6h3 c5g5 e7e1 g1h2 h6g5 d6d8 g8h7,1976,74,100,220,advantage discoveredAttack kingsideAttack middlegame veryLong,https://lichess.org/1kV9Gfpd#53,,871439
2538,SB0DE,8/8/1p1pk3/2p5/1b2P1p1/4K1P1/3r4/5BR1 b - - 4 53,d2d1 f1c4 d6d5 e4d5,1976,75,100,67,advantage endgame short,https://lichess.org/USNSD95F/black#106,,2464442
2539,yUjys,8/pp5k/2p3pP/3p2K1/3P4/2P5/PP6/8 w - - 2 38,a2a4 a7a5 g5f4 h7h6,1976,75,100,91,crushing endgame pawnEndgame quietMove short zugzwang,https://lichess.org/lV8pIO2P#75,,5291892
2540,KwQE3,6k1/pp3p1p/1nb3pb/2p5/2P2n2/2NPrN2/PP2BKPP/R3R3 w - - 2 22,f2e3 f4h3 f3g5 h6g5,1976,75,100,105,discoveredAttack mate mateIn2 middlegame short,https://lichess.org/gqxPl81s#43,,1831223
2541,czGHL,2Q5/p1p3pk/1pn4r/8/4q1B1/2P1Pr1P/PP3P2/3R1RK1 w - - 2 27,g4f3 e4f3 c8g4 h6g6 g4g6 h7g6,1976,75,100,107,advantage long middlegame pin,https://lichess.org/jq5kIj8A#53,,3408453
2542,C8zs2,6k1/5p2/6p1/2K1Q2p/7P/2P2qP1/8/8 b - - 13 40,f7f6 e5d5 f3d5 c5d5 g8f7 d5d6,1976,74,100,182,crushing defensiveMove endgame long master queenEndgame,https://lichess.org/ZNrqktTW/black#80,,1062655
2543,FId3a,4r1k1/p5p1/6r1/1P3pP1/2Qp1Pq1/P1b1P3/5K2/2BR4 b - - 2 29,g8h7 d1h1 g6h6 h1h6 g7h6 c4f7 h7h8 f7e8,1976,75,100,102,advantage fork middlegame veryLong,https://lichess.org/DooJgC4G/black#58,,1338204
2544,5aaql,rn5R/p1pqk1p1/1p2p3/3p2PB/3Pr3/2P2b2/PPQ2P2/R4K2 b - - 5 21,d7b5 c3c4 d5c4 h5f3,1976,75,100,282,advantage defensiveMove middlegame short,https://lichess.org/dac0LraX/black#42,,488919
2545,UZTdh,r3k2r/pp1n3p/2pq4/3p2pb/3P1N1b/7B/PPPQP3/RNB2KR1 w kq - 2 16,f4h5 h8f8 h5f4 f8f4 d2f4 g5f4,1977,75,100,85,advantage long middlegame,https://lichess.org/f7HDEj7y#31,Grob_Opening Grob_Opening_Spike_Attack,2673420
2546,hmBYm,3r2k1/3q1p1p/p2R1Qp1/1p5P/5P2/1B6/6P1/6K1 b - - 0 31,d7d6 b3f7 g8f8 f7e6 f8e8 f6f7,1977,74,100,117,discoveredAttack endgame long mate mateIn3,https://lichess.org/mfIh9Xqq/black#62,,3827129
2547,myZxN,3r2k1/Qn2qpp1/5n1p/8/B3P3/3pBP2/6PP/2R3K1 w - - 4 30,e3c5 d3d2 c1d1 e7c5 a7c5 b7c5,1977,75,100,832,advancedPawn advantage long middlegame,https://lichess.org/bQRTmZKT#59,,4283219
2548,JTU98,r4r1k/pp3p1p/3q2pQ/3pp3/8/6R1/PPbN1PPP/3R2K1 b - - 1 22,c2d1 g3h3 d1h5 h3h5 g6h5 h6d6,1977,75,100,153,advantage long middlegame quietMove,https://lichess.org/cCpSxlf3/black#44,,1703573
2549,zkg4k,5r2/p2R2pp/2P1k3/r3pp2/1p6/7P/5PP1/1R4K1 b - - 0 29,f8f7 d7f7 e6f7 b1c1 b4b3 c6c7 b3b2 c7c8q b2c1r c8c1,1977,75,100,114,advancedPawn advantage endgame master promotion quietMove rookEndgame veryLong,https://lichess.org/ggGNcOXf/black#58,,5401953
2550,KFrhE,2b2rk1/7R/1p1b3p/1PpP2q1/2P1Qp2/3B3P/6P1/5NK1 w - - 6 40,f1h2 c8f5 e4f5 f8f5,1977,75,100,166,advantage fork middlegame short,https://lichess.org/M5LTaukL#79,,1771592
2551,0uHjs,3r2k1/2p3pp/Qb1r4/5N2/4pP2/3p3P/PP2R1P1/6K1 w - - 0 34,g1h2 b6g1 h2g1 d6a6,1977,74,100,94,crushing discoveredAttack endgame master short,https://lichess.org/FzmTvYb5#67,,79031
2552,y9iSL,6k1/7p/Q1P1Ppp1/2bp1p2/1q1N1P2/6P1/7P/6K1 w - - 1 37,a6c8 g8g7 c8d7 g7h6 d7d5 c5d4,1977,75,100,77,advantage endgame long pin,https://lichess.org/Qv1IqaaI#73,,5262023
2553,muCJ7,2r3k1/4bppp/2r1p3/pN1p2P1/P3bP1P/1P2B3/2P4R/2KR4 w - - 1 28,c2c3 c6c3 b5c3 c8c3 c1b2 c3e3,1978,75,100,347,crushing exposedKing fork long master middlegame,https://lichess.org/2h9uESdr#55,,4277085
2554,3QhFm,8/p6r/1p1b1pB1/3k1p1P/1P2p3/P5P1/5K2/2R5 b - - 1 36,h7h6 g6f7 d5d4 c1d1 d4c3 d1d6,1978,75,100,129,crushing endgame long skewer,https://lichess.org/YKZGs3MD/black#72,,300143
2555,KlayG,r7/p3q3/b1p1prpk/5pR1/3Q4/6R1/P5P1/7K b - - 1 33,a8h8 g5g6 f6g6 d4h8 e7h7 g3h3,1978,75,100,165,crushing long middlegame,https://lichess.org/N4mQoGcb/black#66,,1816044
2556,4fAgm,1k1r3r/p5p1/1q5p/3pN3/2pP4/2Pb2P1/1P1K1PP1/R2Q3R w - - 0 26,d1a4 b6b2 d2d1 d3c2 a4c2 b2a1,1978,74,100,150,advantage deflection fork long middlegame,https://lichess.org/KPMtiVs4#51,,408176
2557,JsLsX,3Q4/5ppk/p1pNp2p/4P3/1b3P2/7P/1P3BPK/5q2 w - - 9 35,f2g3 b4c5 h3h4 f1g1 h2h3 g1h1 g3h2 c5g1,1978,75,100,1144,clearance crushing endgame veryLong,https://lichess.org/iPG3DCa1#69,,1738293
2558,8vm8V,r4r1k/pbq3pp/3b2n1/2p1Np1N/2QP4/P7/1B1P1PPP/R3R1K1 w - - 0 24,d4c5 d6e5 b2e5 g6e5,1978,75,100,260,advantage master middlegame short,https://lichess.org/4aLkvwgZ#47,,781616
2559,YUgpb,3r3k/1Q4bp/p5p1/1p6/8/2P4P/PPB1NqPB/7K w - - 0 29,b7f3 f2f3 g2f3 d8d2 e2d4 g7d4,1978,75,100,97,advantage fork long middlegame,https://lichess.org/RCdYpjAY#57,,3015664
2560,lxTWS,RBr1k3/4bppp/p3p3/1P6/P4P2/8/6KP/8 b - - 0 34,e7d6 b8d6 c8a8 b5b6,1978,75,100,144,advantage endgame master sacrifice short,https://lichess.org/gZ3tMTnA/black#68,,4194450
2561,Feoe9,2kr4/1bpn4/pp2p3/3pb3/4PB1r/1P1B4/P1PPN1PP/1R3R1K w - - 2 24,g2g3 d5e4 d3a6 b7a6 g3h4 a6e2,1978,74,100,123,advantage long middlegame,https://lichess.org/Ob6IYQgJ#47,,1369351
2562,UMCEL,r2q1rk1/p2n1ppp/1p2p3/2p5/B1P1Q3/5N2/Pb3PPP/3R1RK1 b - - 1 16,d7f6 d1d8 f6e4 d8a8 f8a8 a4c6 a8d8 c6e4,1979,74,100,149,advantage fork middlegame veryLong,https://lichess.org/ASf2vugT/black#32,Zukertort_Opening Zukertort_Opening_Lemberger_Gambit,2654927
2563,dUiO2,6r1/8/4qBp1/4Pp2/1Qpk4/7P/P4PP1/6K1 b - - 0 39,g8c8 b4d6 e6d6 e5d6 d4c5 d6d7,1979,75,100,207,advancedPawn crushing discoveredAttack endgame long,https://lichess.org/GnLjTYY6/black#78,,3453171
2564,dTyhN,8/p5p1/1p1p1k2/1P3P1p/4K1P1/8/P6P/8 w - - 0 36,h2h3 h5g4 h3g4 f6g5 e4f3 d6d5 f3g3 d5d4,1979,74,100,192,crushing defensiveMove endgame pawnEndgame quietMove veryLong,https://lichess.org/LNgG5TxF#71,,3452134
2565,OSATw,2B5/8/1R2pk2/8/5n2/6pp/8/6K1 w - - 0 59,c8e6 f4e2 g1f1 g3g2 f1e2 g2g1q,1979,75,100,111,advancedPawn crushing deflection endgame exposedKing long promotion,https://lichess.org/30ChTgGU#117,,2138236
2566,zZQDW,3r1r2/1b3pk1/p3p1pp/1pq5/1P1N4/2P1QP2/P5PP/3R1RK1 b - - 0 25,c5b6 d4f5 g6f5 e3b6,1979,75,100,129,crushing discoveredAttack middlegame short,https://lichess.org/NE6IXYjH/black#50,,5386144
2567,3kyq5,2krr3/Bpp3p1/7p/2PNbp1q/8/4Q2n/PP3P1P/2RR3K b - - 2 24,h3g5 d5b6 c7b6 c5b6 e5c3 c1c3,1979,75,100,105,discoveredAttack long mate mateIn3 middlegame queensideAttack sacrifice,https://lichess.org/uqqn8jdr/black#48,,328901
2568,9nUHW,8/p3B3/2p5/3b1RP1/8/P2k4/r7/3K4 w - - 1 50,d1e1 a2e2 e1f1 e2e7,1980,75,100,249,crushing endgame fork short,https://lichess.org/OnwtFQUM#99,,857599
2569,Kq8tT,r1b1k1nr/1p1q1pp1/2p5/p2P2Pp/P2p4/6P1/1PPP1P2/R1BQKB1R w KQkq - 0 12,h1h5 d7e7 d1e2 h8h5,1980,75,100,82,advantage middlegame pin short,https://lichess.org/8ZbBhnUC#23,Nimzowitsch_Defense Nimzowitsch_Defense_Other_variations,1822344
2570,G0OOP,8/1N6/3pk3/2P1p1pp/p3P2P/Pp1pK1P1/1P2b3/8 b - - 0 49,d6c5 b7c5 e6d6 c5a4 g5h4 g3h4,1980,75,100,216,advantage endgame long,https://lichess.org/RUfsbZJ7/black#98,,1399860
2571,4HMNn,8/4n2k/2p2b2/2R1BPp1/p2pB1P1/r2P4/8/7K b - - 0 37,f6e5 f5f6 e7g6 c5e5,1980,75,100,144,crushing discoveredAttack endgame intermezzo pin short,https://lichess.org/LrKNRCVL/black#74,,374909
2572,Fv61v,2r1k2r/1p1nqp1p/p3p2p/2p4Q/3PN3/1P6/P1P3PP/R4RK1 b k - 2 15,c5d4 f1f7 e7f7 e4d6,1980,74,100,155,advantage attackingF2F7 middlegame sacrifice short,https://lichess.org/WZKt8s4h/black#30,Bird_Opening Bird_Opening_Other_variations,1392522
2573,XivEE,8/1p1k4/2p3pp/PpP1P3/1P2PK1P/8/8/8 w - - 5 42,h4h5 g6h5 f4g3 d7e6 g3h4 e6e5,1980,75,100,87,crushing endgame long pawnEndgame,https://lichess.org/UmqOWlGz#83,,2947993
2574,apudL,r2qkb1r/ppp2ppp/5n2/1b1Pp3/3n4/2N3P1/PP1PPPBP/R1BQK1NR w KQkq - 7 9,a2a4 b5c4 e2e3 c4b3 e3d4 b3d1,1980,74,100,224,advantage long opening trappedPiece,https://lichess.org/qHEx8kRt#17,Hungarian_Opening Hungarian_Opening_Other_variations,3220320
2575,Jl1GL,4Qnk1/1b6/5ppb/p2p3p/1p1N3P/1Pq2NP1/P1P2PB1/5K2 w - - 2 40,d4e6 c3a1 f3e1 b7a6,1980,75,100,499,crushing middlegame short,https://lichess.org/EHHvlQq5#79,,1728076
2576,EBoVY,4r3/p7/1p6/2p5/3b1pk1/1B1P1Np1/P1P3R1/5K2 w - - 2 39,f3d4 c5d4 g2e2 e8e2 f1e2 f4f3,1980,75,100,194,attraction crushing endgame long,https://lichess.org/CaomCtXf#77,,1241066
2577,h0ypR,6k1/R3ppbp/6p1/8/7P/5QNK/P4PP1/3r2q1 b - - 2 24,h7h5 a7e7 g1h1 g3h1 d1h1 h3g3 g7e5 e7e5,1981,75,100,167,crushing endgame master veryLong,https://lichess.org/Zic43M4Y/black#48,,3760727
2578,xkjrD,k2r1b1r/1pq2p2/p1n2Ppp/3pp1P1/7P/1Q2B3/PPP1BR2/1K3R2 b - - 1 27,c6a5 b3b6 c7b6 e3b6,1981,75,100,132,advantage master middlegame short,https://lichess.org/eKmQbdPS/black#54,,5226777
2579,Fvb7e,2k4r/pp1r1pp1/2p1p2p/8/Q3P3/P2q3P/5PP1/1R3RK1 b - - 3 22,a7a6 f1d1 d3c3 d1d7 c8d7 b1b7,1981,75,100,89,advantage attraction capturingDefender endgame long queensideAttack,https://lichess.org/JhEd97eV/black#44,,1393211
2580,MZaew,1rb2r2/1p3pk1/p1n1p2p/6pQ/P3R3/3B2q1/1PPN2P1/R6K b - - 7 20,c6e5 d2f1 g3f2 e4e5 f2h4 h5h4,1981,74,100,124,advantage long middlegame,https://lichess.org/3yIEsEZk/black#40,,1974146
2581,bcyYT,6k1/1p2P2p/2p3p1/2Pq1r2/5K2/6P1/P1Q1R2P/8 w - - 5 37,f4g4 d5f3 g4h4 f5h5,1981,74,100,599,endgame mate mateIn2 short,https://lichess.org/K0nQbrzE#73,,3289554
2582,PFI63,r7/2B3pk/q5rp/3Q1p2/pp3P2/1P1P4/2P3PP/1K1R3R w - - 8 29,d5f5 a4b3 c7a5 b3c2,1981,74,100,247,advancedPawn advantage middlegame queensideAttack short,https://lichess.org/R0ChJcCR#57,,2207916
2583,LofNa,6rk/6p1/1pq2pQp/r2R4/8/6P1/P2R1PKP/8 w - - 6 37,g6f7 g8d8 f7c7 c6c7 d5d8 h8h7,1981,74,100,590,crushing endgame long pin,https://lichess.org/RqHafaiw#73,,1907800
2584,0GpqH,3r1r2/ppp1qppk/7R/3bP3/2p1N3/4P1QP/PP4P1/5RK1 b - - 0 20,g7h6 e4f6 e7f6 f1f6,1981,75,100,82,advantage middlegame short,https://lichess.org/KvE9XQSO/black#40,,23716
2585,P7OSs,4r3/6pp/3N4/2k2pP1/p3rP1P/1P1RPK2/8/8 b - - 1 32,a4b3 d6e8 b3b2 d3b3,1981,75,100,123,advantage endgame short,https://lichess.org/4NeDbsuT/black#64,,2196923
2586,SG2Pr,5bk1/3R1p2/1p3Bp1/3B4/2r4P/5PK1/p5P1/7r b - - 1 42,f8g7 d5f7 g8f8 f6g7 f8g7 f7c4,1981,75,100,111,crushing discoveredAttack endgame fork long master,https://lichess.org/1n7sA6C3/black#84,,2471570
2587,kP5ql,r7/pp3kb1/2p3p1/3p1pP1/5PnK/2P1qB2/PP2P3/3RRQ2 w - - 1 28,d1d3 a8h8 h4g3 e3f4 g3f4 g7e5,1982,75,100,119,attraction long mate mateIn3 middlegame sacrifice,https://lichess.org/QJXTkfW7#55,,4057876
2588,ulLxd,8/2K1k3/3RP2p/6p1/6P1/1r6/1P6/8 w - - 5 51,d6d7 e7e6 d7d6 e6e5 d6h6 b3b2,1982,75,100,308,crushing endgame long rookEndgame,https://lichess.org/T220QNQf#101,,4965432
2589,gWr2f,1r3rk1/1b2Q2p/2q3p1/4pp2/8/2N1BP2/PPP3PP/R5K1 b - - 0 19,e5e4 e3d4 f8f7 e7e5,1982,75,100,141,crushing middlegame quietMove short,https://lichess.org/POtiY4GO/black#38,,3718047
2590,xdDBw,2rqk2r/1pp3pp/3b4/p2NpQ2/2P5/PP2P3/1B1P2P1/R5K1 b k - 3 17,h8f8 f5e6 d6e7 d5e7 d8d7 e6d7,1982,75,100,167,advantage long middlegame,https://lichess.org/csXympz5/black#34,Vant_Kruijs_Opening Vant_Kruijs_Opening_Other_variations,5216214
2591,zkXpY,6k1/1p2N1p1/1Q6/4q1Pp/p3P3/Pb3P2/1P1r4/1KR5 b - - 5 39,e5e7 c1c8 g8h7 g5g6 h7h6 c8h8,1982,75,100,114,advantage endgame long,https://lichess.org/FUtZV4yO/black#78,,5401748
2592,0k93k,8/8/8/p7/P1p5/2P1k3/2P5/3K4 w - - 8 57,d1c1 e3e2 c1b1 e2d1 b1b2 d1d2,1982,74,100,200,crushing endgame long pawnEndgame zugzwang,https://lichess.org/1YfEXIu5#113,,64744
2593,o8Yup,4rb1k/p1q3pp/5P1r/2pBP1N1/1pp5/4Q1P1/PP5P/3R3K b - - 0 30,e8e5 e3e5 c7e5 g5f7,1982,75,100,95,crushing kingsideAttack middlegame sacrifice short,https://lichess.org/Hi1EiRho/black#60,,4384924
2594,j3EnW,8/6R1/2kr4/1p2KP2/8/8/8/8 b - - 4 51,b5b4 g7g6 d6g6 f5g6 b4b3 g6g7 b3b2 g7g8q b2b1q g8c8,1982,74,100,395,advancedPawn crushing endgame promotion rookEndgame veryLong,https://lichess.org/bAuqgx38/black#102,,3939207
2595,s5nZX,r4bk1/5pnp/1q4p1/p2NP3/6P1/P4N2/1PP2P1P/2Q2K2 b - - 2 26,b6b5 c2c4 b5a6 d5f6 a6f6 e5f6,1982,75,100,94,advantage defensiveMove long middlegame,https://lichess.org/Q30NtAjK/black#52,,4731210
2596,oHtDF,1r4k1/6bp/Q5p1/2q2p2/4p3/8/PP3PPP/1B1R2K1 b - - 0 24,b8b2 a6e6 g8h8 d1d8 g7f8 e6f6,1982,75,100,66,crushing endgame long,https://lichess.org/NTK4U53o/black#48,,4397968
2597,mZpeQ,1rb2rk1/5ppp/p1Rbpq2/1p6/8/3N1B2/PPQ2PPP/3R2K1 b - - 5 24,f8d8 c6d6 d8d6 c2c7,1982,75,100,84,advantage clearance master middlegame sacrifice short,https://lichess.org/bVreRt3M/black#48,,4248458
2598,R7AGt,r2r3k/pppqnpp1/7p/3P4/2Q5/P1B5/1P3PPP/2KRR3 b - - 0 18,e7d5 d1d5 d7d5 e1e8 d8e8 c4d5,1982,75,100,392,advantage deflection long middlegame sacrifice,https://lichess.org/WFoRhJrW/black#36,Queens_Gambit_Declined Queens_Gambit_Declined_Ragozin_Defense,2371226
2599,sEk6d,8/8/6p1/p2pk1K1/P1r4P/2P1R3/8/8 b - - 8 57,c4e4 e3e4 d5e4 g5g4,1982,75,100,124,crushing defensiveMove endgame rookEndgame short zugzwang,https://lichess.org/y1dN9qKr/black#114,,4743814
2600,QR0p0,2k4r/ppp5/8/3q1p2/5Rp1/3P2Pr/PPPQ1R1P/6K1 w - - 10 26,f4f5 h3g3 f2g2 g3g2 d2g2 d5f5,1982,75,100,106,crushing endgame fork long,https://lichess.org/QlwPJzVL#51,,2311602
2601,sTARg,r3r1k1/5pbp/p2p1qp1/2p5/1p4PP/1Q2B3/PPPKn3/1N1R1R2 b - - 1 21,f6h4 b3f7 g8h8 f1h1 h4g4 h1h7 h8h7 d1h1 g4h5 h1h5,1983,75,100,81,advantage attraction kingsideAttack middlegame pin sacrifice veryLong,https://lichess.org/OPr5edyI/black#42,,4764236
2602,FQOAh,1r5k/1q4p1/7p/p3QPn1/2PB2Pb/2P4P/4R2N/3R2K1 w - - 9 34,e2b2 g5h3 g1f1 b7h1 f1e2 b8b2,1983,75,100,133,crushing discoveredAttack exposedKing long middlegame,https://lichess.org/sPmneDV5#67,,1349007
2603,PWD15,r5k1/1p2qpb1/4N1p1/p1P1P2p/1P4n1/PQ3R2/1B1r2PP/4R1K1 w - - 0 25,e6g7 e7h4 b3f7 g8h8 f7f4 h4e1,1983,75,100,87,advantage long middlegame,https://lichess.org/Mikq3sD6#49,,2231757
2604,PZTiD,5rk1/3rbppp/pqnp4/1ppQ1PP1/4N3/4B3/PPP2P1P/2KR3R w - - 1 17,e3c5 d6c5 d5d7 f8d8,1983,74,100,305,advantage middlegame sacrifice short,https://lichess.org/hUpiqQ8C#33,Philidor_Defense Philidor_Defense_Exchange_Variation,2236333
2605,JsMTz,8/pp1br1kp/3Q2p1/8/P2Pq3/5R2/8/3K1R2 b - - 8 36,d7g4 d6f6 g7h6 f1h1 g4h5 h1h5 h6h5 f3h3 h5g4 h3h4,1983,75,100,79,attraction crushing endgame pin sacrifice veryLong,https://lichess.org/b7dz8X5F/black#72,,1738314
2606,Lzghs,4B3/8/8/2ppk3/1p3pp1/1P6/2P1K3/8 w - - 0 62,e8d7 f4f3 e2f2 e5f4,1983,74,100,257,bishopEndgame crushing defensiveMove endgame short,https://lichess.org/409IaDPL#123,,1923390
2607,0Lbqj,2r3k1/7p/p3R1p1/1p1P1q2/3Q4/5K2/PP3P1P/8 w - - 1 30,f3g3 c8c4 d4c4 b5c4,1983,75,100,161,crushing endgame short,https://lichess.org/fdTsAH11#59,,30384
2608,NWSTW,3r4/ppR4p/6pk/5p2/1P6/PQ1prqP1/4bN1P/6KR b - - 3 31,d8e8 b3f7 e3e7 c7e7 e8e7 f7e7 d3d2 e7h4,1983,75,100,178,advantage middlegame veryLong,https://lichess.org/mhnZdM1B/black#62,,2057204
2609,DPtXk,r2qr1k1/1b3pbp/p2p1np1/1ppP2B1/8/5N2/PPBQRPPP/R5K1 b - - 3 19,b7d5 e2e8 d8e8 g5f6 d5f3 f6g7,1983,75,100,200,advantage kingsideAttack long middlegame,https://lichess.org/KNROVKUP/black#38,,1173559
2610,wpF0d,r3r1k1/p4ppp/b2p1b1B/3P1P2/2pqB1QP/8/P5P1/3RR2K b - - 5 27,d4b6 h6g7 h7h5 g4g3 b6f2 g3f2,1983,75,100,180,crushing long middlegame,https://lichess.org/1SuRYHI0/black#54,,5145653
2611,cke3v,1r6/3pkp2/2b1pQ2/pr2P3/8/K3P1P1/2B4P/8 b - - 4 44,e7f8 c2g6 b5b3 a3a2 b3b2 a2a1,1983,75,100,171,crushing endgame long pin,https://lichess.org/h6pzr2uf/black#88,,3387759
2612,Zv5ey,4r3/p4k2/1p5p/2p1Pp1P/2P2P2/3r4/PP1p1KR1/3R4 b - - 0 30,e8g8 e5e6 f7e6 g2g8,1983,75,100,166,crushing deflection endgame rookEndgame short,https://lichess.org/TkYXAWuM/black#60,,3140270
2613,wEtLt,4r1k1/ppp2pp1/5bbp/2qr4/4PP2/2N2BP1/PPQ3KP/R3R3 w - - 0 20,e4d5 e8e1 a1e1 g6c2,1983,75,100,126,advantage middlegame short,https://lichess.org/ZQzFzNOX#39,,5094233
2614,WiwoQ,6k1/5ppp/4p3/3qQ3/3P4/2r4P/5PP1/R5K1 b - - 0 30,d5c6 e5b8 c6c8 a1a8,1983,74,100,212,crushing defensiveMove endgame short,https://lichess.org/TvSGRSWQ/black#60,,2860974
2615,nGYoB,2r3k1/1p4pp/p2qp1b1/3p2P1/P7/1B3r1P/1PP1Q1K1/2R1R3 w - - 0 26,e2e6 d6e6 e1e6 f3b3 c2b3 c8c1,1984,75,100,127,advantage long middlegame,https://lichess.org/ZXlIdxaM#51,,4308800
2616,09OJf,8/8/6K1/3P4/4P3/6b1/6kp/1R6 b - - 0 50,h2h1q b1h1 g2h1 g6f5 h1g2 e4e5 g2f3 d5d6,1984,74,100,149,crushing endgame quietMove veryLong,https://lichess.org/p8lYeJcH/black#100,,13284
2617,EraWm,6k1/2p2pbp/n1q3p1/3p2B1/Np5P/1P2Q3/1P3PP1/6K1 b - - 0 27,c6c2 e3e8 g7f8 g5h6 c2c1 h6c1,1984,75,100,516,crushing endgame long pin,https://lichess.org/G2hzdNKx/black#54,,1299997
2618,xzIBI,2b3k1/1p3p1p/r3pbp1/p7/4B3/B7/P4PPP/2R3K1 b - - 5 25,c8d7 c1c7 d7e8 c7c8,1984,75,100,190,advantage endgame pin short,https://lichess.org/FHCPQOnA/black#50,,5247346
2619,09sfv,r4r1k/ppq4p/2p3p1/1P4N1/P1P3nn/N6Q/1b4B1/4RRK1 w - - 0 24,h3h4 b2d4 g1h1 g4f2 f1f2 d4f2,1984,75,100,139,advantage exposedKing kingsideAttack long middlegame,https://lichess.org/KJa3y5ms#47,,13987
2620,TMQ2v,5rk1/6b1/8/p1pRp1q1/4Pp2/PP5r/2P1QB1P/3R3K w - - 6 36,d1g1 h3h2 h1h2 g5h6 h2g2 f4f3 e2f3 f8f3,1985,75,100,99,advantage attraction fork middlegame sacrifice veryLong,https://lichess.org/dPs68hFh#71,,2567907
