,PuzzleId,FEN,Moves,Rating,RatingDeviation,Popularity,NbPlays,Themes,GameUrl,OpeningTags,ID
1579,wGLhe,4Rr2/1pp2Pkp/3q4/p1b3BQ/2P5/1P4P1/1n1p3P/5R1K w - - 1 34,e8f8 d6c6 h5f3 c6f3 f1f3 d2d1q,1892,74,100,146,advancedPawn crushing long middlegame promotion,https://lichess.org/O4lHY5kL#67,,5096292
1580,7ijwP,1r3rk1/R3Qp1p/4p1P1/1b1pP3/1P1q2P1/5PK1/8/R7 b - - 0 41,h7g6 e7f6 b5f1 a1f1,1892,75,100,188,crushing middlegame short,https://lichess.org/0zQswSOa/black#82,,675522
1581,mmLGa,r5k1/p4r1p/6p1/p3b1P1/3p2qP/1Q3Nn1/1P2P1P1/1NB2BK1 b - - 5 31,a8b8 b3f7 g8f7 f3e5 f7e6 e5g4,1893,75,100,203,advantage attraction fork long middlegame,https://lichess.org/3cUVPtCw/black#62,,4266096
1582,huZHD,8/5RP1/1kp3r1/8/5KP1/1p6/8/8 w - - 0 48,f4f5 g6g7 f7g7 b3b2 f5f4 b2b1q,1893,74,100,158,advancedPawn crushing endgame long promotion rookEndgame sacrifice,https://lichess.org/UA3aeAWV#95,,3839195
1583,BPodE,5k2/1q1r3p/pp1Rp1pN/2n1PpQ1/P1P5/1P4PP/7K/8 b - - 1 31,d7d6 g5f6 f8e8 e5d6,1893,75,100,99,crushing endgame intermezzo master short,https://lichess.org/0m4USmZ7/black#62,,999057
1584,3olEa,8/8/7p/1R4p1/p1r2p2/P3kP1K/1P4PP/8 w - - 2 48,b5b4 c4b4 a3b4 e3d4 b4b5 d4c5 b5b6 c5b6,1893,75,100,257,crushing endgame rookEndgame veryLong,https://lichess.org/0mHrnc0o#95,,334260
1585,BQRo5,8/p2kr3/8/3pr2p/4b3/4R3/PP5P/3BR1K1 w - - 0 30,d1c2 e5g5 e3g3 g5g3 h2g3 e4c2,1893,74,100,172,crushing endgame long,https://lichess.org/qdeZHkhR#59,,999928
1586,pFRgT,r4rk1/pppqnp1p/4pQp1/8/2PnN3/3B1P2/PP3P1P/3R1RK1 b - - 0 17,e7f5 f6f5 g6f5 e4f6 g8g7 f6d7,1893,75,100,106,advantage fork long middlegame sacrifice,https://lichess.org/tk4ofDsR/black#34,Queens_Gambit Queens_Gambit_Other_variations,4482214
1587,fVJIJ,r5k1/1R5p/1n1p1bp1/p1pn1pN1/P7/7P/BP1B1PP1/6K1 b - - 3 26,f6g5 b7b6 g5d2 a2d5 g8f8 d5a8,1893,75,100,220,capturingDefender crushing fork long middlegame pin,https://lichess.org/Fm8jQ9Vx/black#52,,3628308
1588,s15m1,r4r1k/1b1n1p2/p2p1b1P/1pqPp1NB/2p1P2P/4P3/PPP3Q1/2K2R1R w - - 2 22,f1f6 c5e3 c1b1 d7f6 g5f7 f8f7 h5f7 e3h6,1893,75,100,150,advantage intermezzo middlegame veryLong,https://lichess.org/jsvxf7O9#43,,4724583
1589,y8X1h,r2q4/1pp1nk2/1b1p1ppr/p2P4/3P3N/P3Q3/1P3PP1/4RK1R b - - 1 24,e7f5 e3e6 f7f8 h4g6 f8g7 h1h6,1893,75,100,301,advantage deflection discoveredAttack long master middlegame,https://lichess.org/5T4fSBNW/black#48,,5260407
1590,TDUos,8/6b1/1p3n1k/pP3Q1p/3P1K2/4P3/2R1NPq1/8 w - - 2 30,e2g3 f6d5 f5d5 g2d5 g3f5 h6h7,1893,75,100,148,advantage defensiveMove endgame long,https://lichess.org/CPaeZyeA#59,,2555386
1591,Qu2xt,8/p5kp/6n1/4pQ1P/3p4/3P2q1/P4R2/6K1 w - - 0 32,f2g2 g3g2 g1g2 g6h4 g2h3 h4f5,1893,75,100,495,attraction crushing endgame exposedKing fork long master sacrifice,https://lichess.org/uTXHAmxn#63,,2352579
1592,MYZcX,3q4/1p3pk1/2p4N/p5p1/P2bQ1P1/3B3n/5P2/5K2 b - - 2 39,h3f2 e4h7 g7f6 h7f7 f6e5 f7f5 e5d6 h6f7 d6e7 f7d8,1893,74,100,85,crushing endgame fork veryLong,https://lichess.org/IH3KOrRB/black#78,,1972745
1593,hLoih,8/p3b3/5k2/4p1p1/2p1P1n1/qb4B1/3Q1P2/3RKR2 w - - 0 43,d1c1 e7b4 c1c3 a3a1 e1e2 a1c3 d2c3 b4c3,1893,75,100,70,advantage middlegame pin veryLong,https://lichess.org/yqPgRoLu#85,,3789874
1594,SxsTe,r1b2rk1/1p2qpp1/pb2p2p/6NQ/2BnN3/3R4/PPP2PPP/R5K1 b - - 3 19,f7f5 h5g6 h6g5 e4g5 e7g5 g6g5,1893,75,100,383,advantage long middlegame sacrifice,https://lichess.org/mUBxgTLW/black#38,,2533343
1595,Q8zWM,3r1b1r/ppp2kp1/6qp/8/4R1b1/1P1P1N2/1PP2P2/RNBQ2K1 w - - 1 18,g1f1 g6e4 f3e5 e4e5,1893,74,100,216,advantage middlegame short,https://lichess.org/U84HtH9L#35,Italian_Game Italian_Game_Two_Knights_Defense,2286165
1596,zbOQk,4rrk1/6pp/p2p2q1/1pp2P2/2n1N3/2P4P/PP2Q1P1/3R1RK1 b - - 0 24,f8f5 f1f5 g6f5 e4f6 g7f6 e2e8,1893,74,100,176,advantage discoveredAttack kingsideAttack long middlegame,https://lichess.org/BbbOa72e/black#48,,5388970
1597,WMW60,2krb2r/ppp1qp1p/8/4p1bQ/4P3/1P1P1R1P/PBP3P1/RN4K1 w - - 3 17,b1c3 f7f5 h5g5 e7g5,1894,74,100,99,advantage middlegame short trappedPiece,https://lichess.org/181VVUFx#33,Nimzo-Larsen_Attack Nimzo-Larsen_Attack_Modern_Variation,2829460
1598,lgL36,8/8/2p1k1QP/6p1/1p2P3/1P6/2P2q2/1K1b4 b - - 5 37,e6d7 g6f5 f2f5 e4f5 d1g4 h6h7 g4f5 h7h8q,1894,75,100,63,advancedPawn crushing endgame master promotion veryLong,https://lichess.org/7gwCvkXu/black#74,,4170068
1599,NYLJs,8/pKP3pk/1p2R3/1P2P1b1/1P5p/8/8/2r5 b - - 4 49,h4h3 e6c6 h3h2 c7c8q,1894,75,100,118,advancedPawn advantage endgame master promotion short,https://lichess.org/MqF6qqEk/black#98,,2059847
1600,t3TVf,4r1k1/pp3p2/1bp2p1B/3b3R/3P4/2P5/PP1NrPPP/R4K2 w - - 5 19,h6e3 e8e3 f2e3 e2d2,1894,75,100,119,advantage capturingDefender middlegame short,https://lichess.org/dlWQ81nU#37,,4815642
1601,ee8D2,r1q5/ppn2B1k/4p3/4Bp2/2P1n3/P4N2/1P3P2/2KR4 b - - 4 31,c8f8 d1h1 f8h6 h1h6 h7h6 e5c7,1894,75,100,160,advantage exposedKing long middlegame,https://lichess.org/c9AVP12q/black#62,,3553502
1602,126Bs,r7/pppn2k1/1n1p2pp/3Pp1r1/2P2P1q/1P1BQ1N1/P4P1P/R4R1K b - - 0 22,e5f4 e3e7 g7h8 d3g6 g5g6 e7h4,1894,75,100,161,crushing deflection long middlegame,https://lichess.org/ZRSIwDBd/black#44,,90284
1603,i7Y1G,kr2R3/ppQ2pp1/2p4r/2N2q2/8/5n2/PP3PBP/2R3K1 w - - 9 30,g2f3 f5g5 g1h1 g5c1,1894,75,100,169,advantage fork middlegame short,https://lichess.org/egb4wV88#59,,3857729
1604,osYVM,3qkbQ1/1br1r3/p3B1P1/3p4/3P4/2p5/Pp6/1K3R2 b - - 4 36,e7e6 f1f8 e8d7 f8d8 d7c6 g8e6,1894,75,100,292,crushing exposedKing long middlegame skewer,https://lichess.org/IU5NQNBu/black#72,,4449746
1605,fa6K3,5rk1/4Rpb1/3P1qp1/ppp2b1p/PnB2Q1P/5N2/1P1R1PP1/2K5 w - - 0 24,c4b5 b4a2 c1d1 f5c2 d1c2 f6f4,1894,75,100,186,advantage discoveredAttack long middlegame,https://lichess.org/1ct6m4Jm#47,,3635059
1606,w6C1F,8/kp6/3Q4/1p1pP3/3q1ppP/8/1P3PP1/6K1 w - - 2 36,b2b4 g4g3 d6c5 d4c5 b4c5 b5b4,1894,74,100,76,crushing defensiveMove endgame long queenEndgame,https://lichess.org/CBGGuZQW#71,,5082125
1607,QwT6D,5rk1/ppqn2pp/2pb4/3p2Nn/3P4/2N1B2P/PPPQ2P1/R5K1 w - - 0 18,g5e6 d6h2 g1h1 h5g3 h1h2 g3f1 h2g1 c7h2,1894,75,100,150,doubleCheck fork mate mateIn4 middlegame sacrifice veryLong,https://lichess.org/4qtOlAh3#35,Latvian_Gambit Latvian_Gambit_Mason_Countergambit,2355979
1608,dDxk9,6k1/1b4pp/p4p2/8/1P3q2/6BP/P3Q1PK/2r5 b - - 1 31,f4b4 e2e6 g8f8 g3d6 b4d6 e6d6,1894,75,100,102,crushing endgame fork long,https://lichess.org/RnIHsEiz/black#62,,3429515
1609,DCLyL,r5k1/pp1q1p1p/6p1/3p2r1/4B3/1P2P2P/P4P2/R2Q1RK1 w - - 0 19,g1h2 d7c7 f2f4 d5e4,1894,74,100,177,advantage middlegame pin short,https://lichess.org/6mqkdgnj#37,,1154746
1610,Gf5A4,5rk1/2q2ppp/3p4/1Qb1pPP1/4P2P/2P5/rPKB4/3R3R w - - 2 24,b5c4 a2b2 c2b2 c5a3 b2b3 f8b8 c4b4 a3b4,1895,75,100,256,advantage attraction middlegame sacrifice veryLong,https://lichess.org/UUSiUTue#47,,1457565
1611,mz2RF,8/1p5k/p5p1/5q1p/4b3/1P1R3P/2P3p1/4Q1K1 w - - 6 43,d3d4 f5h3 d4e4 h3h1 g1f2 g2g1q e1g1 h1e4,1895,75,100,288,advancedPawn advantage deflection discoveredAttack endgame exposedKing promotion sacrifice veryLong,https://lichess.org/ZA8ewWF8#85,,4283901
1612,hEo7Q,6k1/P4p2/8/7p/1p1p1Pp1/3PrB1q/2P4P/5R1K b - - 2 47,g4f3 a7a8q g8h7 f1g1 h3g4 g1g4 h5g4 h1g1,1895,75,100,87,advancedPawn advantage defensiveMove endgame promotion quietMove veryLong,https://lichess.org/koIZ2HDW/black#94,,3780007
1613,EGmT4,r1b2rk1/pp4pp/2p5/3nN2q/3Pp2B/P3P3/2Q2PPP/R4RK1 w - - 2 18,c2e4 c8f5 e4f3 h5h4,1895,75,100,1425,advantage middlegame short,https://lichess.org/T3faFnw2#35,Dutch_Defense Dutch_Defense_Queens_Knight_Variation,1248109
1614,7dAbc,2r2rk1/1p3pb1/p1q5/8/1n2N1Q1/4B2R/PP2p1PP/R5K1 w - - 2 23,e3d4 c6c1 a1c1 c8c1 g1f2 e2e1q f2f3 e1d1,1895,74,100,222,advancedPawn crushing kingsideAttack middlegame promotion sacrifice veryLong,https://lichess.org/GNItJPQG#45,,667779
1615,A8nZO,4qb1r/1Q2n1pb/4R1k1/3p2p1/6N1/2P2P2/rP4PP/2KR4 b - - 0 23,g6h5 e6h6 g7h6 g4f6 h5g6 f6e8,1895,75,100,254,advantage fork long middlegame sacrifice,https://lichess.org/SCuuOFw5/black#46,,887647
1616,gLM0K,4Q3/8/1p2p2p/5k2/5PnP/p5q1/8/5R1K w - - 2 39,e8h5 f5f6 h5g4 g3g4,1895,74,100,99,crushing endgame master short,https://lichess.org/1PAxKAJA#77,,3701897
1617,H0xVJ,r1bk1r2/ppp2Bpp/2q5/3p1P2/2N1N3/6pK/P1P1Qb1P/4R2R w - - 0 20,c4e5 c8f5 h3g2 f5e4 e2e4 d5e4 e5c6 b7c6,1895,75,100,180,advantage exposedKing middlegame veryLong,https://lichess.org/XQKAgU02#39,,1488503
1618,cdhlz,5b2/8/2k5/P1P2pp1/1P1K3p/7P/6P1/8 b - - 2 46,f8g7 d4c4 c6b7 b4b5,1895,75,100,196,bishopEndgame crushing defensiveMove endgame short,https://lichess.org/En1w7J8Z/black#92,,3377904
1619,9GsSf,4rk2/pp5p/8/2pB2p1/2P2q2/P2P3P/1P3bQ1/5R1K w - - 2 27,f1f2 e8e1 g2g1 f4f2 g1e1 f2e1,1895,75,100,249,crushing endgame long pin,https://lichess.org/ZwSnZsF3#53,,811531
1620,WN3fw,3r2k1/2p2p1p/1p4p1/p1r5/Q1Pq4/6P1/P4P1P/2R1R1K1 b - - 4 29,d4d2 c1d1 d2d1 e1d1 d8d1 a4d1,1895,74,100,225,advantage endgame long,https://lichess.org/pm6x1s5A/black#58,,2830272
1621,w4OdD,1r1q1r2/3n1pkp/b3p1p1/p1pR4/1p3N2/3P1BP1/PPPQ1P1P/R5K1 w - - 0 19,d5d6 d7e5 d6d8 e5f3 g1g2 f3d2,1895,74,100,234,advantage fork long middlegame sacrifice,https://lichess.org/Lrx4bNfr#37,,5079613
1622,8M0t2,3r2k1/2p2pp1/p1Q5/4P3/3q4/P4R1P/6P1/6K1 w - - 0 42,g1h1 d4a1 h1h2 a1e5,1896,74,100,366,crushing endgame short,https://lichess.org/el4wIAVO#83,,730961
1623,Q22Ec,6k1/pp3p1p/1bb2pp1/5q2/5B2/2P2PP1/PP1QB1KP/8 b - - 6 27,g8g7 f4h6 g7g8 d2d6 f5c8 d6f6,1896,75,100,849,crushing endgame long,https://lichess.org/vXWr5gEp/black#54,,2276441
1624,cwxde,4r2k/7p/p5p1/1p1rP3/5P2/Q3P1Pp/PPR2R1K/3q4 w - - 0 32,h2h3 d1h5 h3g2 d5d1 f2f1 d1f1,1896,75,100,114,clearance crushing endgame long quietMove,https://lichess.org/vBGfbgTV#63,,3405271
1625,4R9Lq,2k3r1/pp1rb2p/2n5/5Q2/5B2/5qP1/P4P1P/R3R1K1 b - - 0 19,e7c5 f5c5 f3f4 e1e8 g8e8 g3f4,1896,74,100,183,advantage long middlegame,https://lichess.org/tUhWo0pS/black#38,,388672
1626,6SPA6,3r1rk1/pp4q1/2p1b2p/3pNp2/5Pn1/5BRQ/PP6/3R2K1 b - - 1 28,d5d4 e5g4 f5g4 f3g4 e6g4 g3g4,1896,75,100,75,advantage long middlegame pin,https://lichess.org/8HZBmMPc/black#56,,565301
1627,fbwwf,1r4k1/2p2p1p/5Pp1/p1p5/P1Q3P1/1PP1q2P/7K/5R2 w - - 0 28,h2g2 b8d8 f1f2 d8d3,1896,75,100,72,advantage endgame master quietMove short,https://lichess.org/TbjGLYcZ#55,,3637716
1628,uBgbn,6rk/p4Rp1/1pn4r/8/4B1Pq/2B2Q2/PP4K1/8 w - - 5 29,e4c6 h4h1 g2f2 h6h2 f2e3 h2h3 f7f5 h3f3,1896,75,100,172,advantage exposedKing middlegame pin veryLong,https://lichess.org/ldeu7baD#57,,4915251
1629,TBSB2,2r4k/6p1/7p/3q4/5PP1/4Q2P/7K/4R3 w - - 1 43,e3e5 c8c2 h2g3 d5g2 g3h4 g2f2 h4h5 c2c5,1896,75,100,628,crushing endgame pin veryLong,https://lichess.org/6O8YrgHF#85,,2552481
1630,1U55y,8/3P1R2/3r4/7p/6k1/4K3/8/8 b - - 1 66,h5h4 f7f4 g4g5 f4d4 d6d7 d4d7,1896,74,100,124,crushing endgame long rookEndgame,https://lichess.org/sZzoedRA/black#132,,129899
1631,ZBfs6,8/p6p/8/2B5/4P1q1/2P2r1k/2Q1KP1P/3R4 w - - 0 37,c5e3 f3f2 e2f2 g4g2 f2e1 g2c2,1896,74,100,288,advantage attraction doubleCheck endgame long sacrifice skewer,https://lichess.org/XFsmfdgx#73,,3076044
1632,t1CKa,8/8/3k2pp/2rP1p2/3R1K1P/6P1/5P2/8 b - - 1 45,c5d5 d4d5 d6d5 h4h5 g6h5 f4f5,1896,75,100,135,crushing deflection endgame long rookEndgame,https://lichess.org/taVviGEm/black#90,,4812361
1633,8YVfY,4Qr1k/5Ppp/8/1p1R4/5q2/2P5/1P1K2PP/r2R4 w - - 5 26,d2c2 f4a4 b2b3 a4a2 c2d3 a1d1 d3e3 d1e1,1896,74,100,133,crushing deflection endgame veryLong,https://lichess.org/Xxvludne#51,,748479
1634,Cftf2,8/8/1Ppk4/K7/8/6p1/8/3b2N1 b - - 4 52,c6c5 a5a6 d1b3 b6b7 d6c7 a6a7,1896,74,100,224,advancedPawn crushing defensiveMove endgame long,https://lichess.org/AsBVTmnc/black#104,,1109159
1635,tQR5k,2k4r/1p4p1/5p2/2q1n1p1/3R2P1/4Q2P/PPN2P2/2K5 w - - 0 31,d4d8 c8d8 e3c5 e5d3 c1d2 d3c5,1897,73,100,215,crushing endgame fork long sacrifice,https://lichess.org/kFCiAPyp#61,,4848258
1636,1DVHv,r5k1/4q1pp/2p1p3/2Pbb3/1P2pN2/4B3/2Q3PP/5RK1 b - - 0 25,a8a2 f4d5 e5h2 g1h1 e6d5 c2a2,1897,75,100,113,advantage long middlegame,https://lichess.org/7Ng8OAst/black#50,,106585
1637,xuQJ8,r2qr2k/1p3pb1/2p1p2p/3pN2n/p2P3P/2P1PN2/PPK2PQB/6R1 b - - 4 25,g7e5 h2e5 f7f6 g2g6,1897,75,100,149,crushing kingsideAttack middlegame short,https://lichess.org/SyoP90Z8/black#50,,5240637
1638,3Pwu3,4rqk1/1p3p2/p1np1Pp1/6Q1/8/7R/PPP3PP/4b1K1 b - - 2 24,e1b4 g5h4 b4c5 g1f1 f8g7 f6g7,1897,75,100,112,advancedPawn advantage defensiveMove endgame long,https://lichess.org/JbzULRuI/black#48,,299088
1639,SI6Ps,1r6/p3k2b/q1n1pp1P/2Pp3B/3P4/1QB3r1/P7/K3R2R w - - 11 31,b3d5 b8b1 e1b1 e6d5,1897,75,100,74,advantage middlegame short,https://lichess.org/KQqUZgVl#61,,2474567
1640,a7f3w,r4rk1/1p3pp1/p1bpp2p/8/1PP1P3/P4BP1/1b2NPP1/1R2K2R b K - 5 20,b2a3 b1b3 a6a5 b3a3,1897,75,100,89,advantage middlegame short trappedPiece,https://lichess.org/vnwpi16M/black#40,,3157877
1641,8d1QR,4r1k1/p1p2p2/1p4p1/3Pr2p/2P3q1/1P6/P2Q2PP/2R2RK1 w - - 0 24,c1e1 e5e2 e1e2 e8e2 f1f2 e2d2,1897,75,100,279,crushing endgame long,https://lichess.org/uTn7Qpmj#47,,754857
1642,SJq8r,2R5/8/8/1b3P1p/1k6/1pp3P1/8/2K5 w - - 2 60,f5f6 b3b2 c1c2 b5d3 c2d3 b2b1q,1897,75,100,72,advancedPawn attraction crushing deflection endgame exposedKing long master promotion,https://lichess.org/am7EaWqI#119,,2477036
1643,MhMJ9,8/1p3kp1/2pp3p/4p3/4P2q/1p1PQP1P/5P2/r1B1K2R w K - 0 23,e1e2 b3b2 c1b2 a1h1,1897,75,100,92,advancedPawn advantage endgame short,https://lichess.org/ek5opDuT#45,,1985298
1644,B0mnp,r4r1k/p5Rp/5P1P/3p2p1/4b1P1/5N2/PP3PK1/2R5 w - - 1 32,c1c7 f8f6 g7h7 e4h7,1897,75,100,181,advantage endgame pin short,https://lichess.org/3tAf088Y#63,,963682
1645,MF2qR,5r1k/pp2n1p1/7p/8/3qB3/1P4Q1/P2r1PPP/R4RK1 w - - 3 25,e4b7 d2f2 g3f2 f8f2 f1f2 d4a1,1897,75,100,176,advantage long middlegame,https://lichess.org/EtmQdLn4#49,,1945156
1646,u1MLx,8/5ppk/p3p1n1/2B1P3/5P2/1P4Pp/P2Q1KqP/8 w - - 4 36,f2e1 g2h1 e1e2 h1h2,1898,74,100,198,crushing endgame interference master short,https://lichess.org/QEzV3rfr#71,,4900694
1647,4p0aG,2r1k1r1/1q3p2/p1b1pP1p/1p3N2/5P2/8/PP1RQ1PP/3R3K b - - 0 29,c6g2 e2g2 g8g2 f5d6 e8d7 d6b7 g2d2 d1d2,1898,75,100,361,crushing discoveredAttack fork middlegame sacrifice veryLong,https://lichess.org/dI6aGHl5/black#58,,421972
1648,jiwuY,1b1Q1rk1/4npp1/2p1b2p/8/4B3/1P2B3/r1P2P2/2KR4 b - - 1 20,b8e5 d8f8 g8f8 d1d8,1898,75,100,110,attraction backRankMate mate mateIn2 middlegame sacrifice short,https://lichess.org/83dJNGq0/black#40,,3998333
1649,bkD4T,8/8/8/2pk1p2/1r6/RP2K1P1/8/8 w - - 0 48,e3d3 b4b3 a3b3 c5c4 d3c2 c4b3,1898,74,100,146,attraction crushing endgame exposedKing fork long master rookEndgame sacrifice,https://lichess.org/3eR1FB7T#95,,3299891
1650,l4mB1,8/pp6/2p5/2Pp3p/1P1Pp1k1/6P1/P4K2/8 b - - 0 44,b7b5 c5b6 a7b6 a2a4 h5h4 g3h4,1898,75,100,126,crushing enPassant endgame long pawnEndgame quietMove,https://lichess.org/Yssif7W9/black#88,,4116887
1651,LdOJ9,1r4kb/B2Q1p2/2p3p1/p6p/q3P3/5PPP/1P1R1K2/8 b - - 5 38,b8b2 d7e8 g8h7 e8f7 h8g7 d2b2,1898,75,100,72,crushing deflection endgame long pin,https://lichess.org/IukhBw1o/black#76,,1891693
1652,PP1rI,1r1q4/p1n2pkp/2ppr1p1/8/3pPQP1/2N5/PPP2P2/2KR3R b - - 0 19,g6g5 h1h7 g7h7 f4f7 h7h8 d1h1 e6h6 h1h6,1898,75,100,254,attraction deflection mate mateIn4 middlegame sacrifice veryLong,https://lichess.org/OGfRCzma/black#38,,2221540
1653,N7r7p,2r3r1/pR3p2/3B1kpp/4n3/3q2P1/Q6P/5P2/5B1K b - - 0 33,c8c2 d6e5 d4e5 a3f3,1898,75,100,73,advantage master middlegame short,https://lichess.org/QcMZiHuk/black#66,,2022476
1654,wq5HO,r1bq3k/ppp3pp/5r2/2B1b3/2B2p2/2N4P/PPP2KP1/R2Q1R2 w - - 4 16,d1f3 e5d4 c5d4 d8d4 f2e1 d4c4,1898,74,100,222,advantage fork long middlegame,https://lichess.org/fiOgOKcQ#31,Philidor_Defense Philidor_Defense_Nimzowitsch_Variation,5146896
1655,0YUVg,7r/1k1Nbp2/pBb1p1p1/4P1P1/5P2/1PQ5/P1P4r/3R1RK1 w - - 1 33,d7c5 e7c5 b6c5 h2g2,1898,74,100,160,mate mateIn2 middlegame short,https://lichess.org/gUSclBEg#65,,48569
1656,8ksEN,r7/pqpQ4/1r3P1B/4k3/4n3/8/PP3P1P/1K1RR3 w - - 4 38,f2f3 b6b2 b1c1 b2b1 c1c2 b7b2 c2d3 b1d1,1898,75,100,149,crushing deflection middlegame veryLong,https://lichess.org/vRKIhaX8#75,,766012
1657,9mFgK,3r4/Rpkr3p/4pp2/6p1/1qP4n/3P1P2/5P1P/3Q1BRK b - - 0 27,b4c4 a7b7 c7b7 d1b1 b7c7 d3c4,1898,75,100,361,advantage attraction long middlegame sacrifice,https://lichess.org/X0cYrlle/black#54,,855796
1658,ibtAu,r1b2r1k/pp4pp/2p2q2/3p4/3P2n1/PQ2PNP1/1PB2PP1/R4RK1 w - - 3 17,b3d3 f6h6 d3h7 h6h7 c2h7 h8h7,1898,75,100,73,advantage long middlegame,https://lichess.org/I9D0movt#33,Indian_Defense Indian_Defense_London_System,3900346
1659,lsP7Q,2r2r1k/1p2N1p1/p4p2/2p1p1q1/1PPpPn1n/P2P3p/3Q1P1N/3RRB1K w - - 4 29,e7c8 g5g2 f1g2 h3g2 h1g1 f4h3,1898,75,100,181,advancedPawn exposedKing kingsideAttack long mate mateIn3 middlegame sacrifice,https://lichess.org/wLzbimix#57,,4187217
1660,upMHi,8/Q6p/p3p3/1p1bP3/3kn3/PP5P/1q2B3/5K2 b - - 11 51,d4c3 a7e3 c3c2 e3d3 c2c1 d3d1,1899,75,100,94,endgame long mate mateIn3,https://lichess.org/ZB5115HT/black#102,,4970956
1661,E4iUN,4r1k1/p2Q1pp1/1q4b1/2pp4/2pnr3/6R1/PP3PPP/3R1BK1 b - - 7 31,e4e1 d1e1 e8e1 d7c8 g8h7 g3h3 g6h5 h3h5 h7g6 c8g4,1899,75,100,306,advantage kingsideAttack middlegame veryLong,https://lichess.org/534vtWIM/black#62,,1231206
1662,gbrt4,8/8/p6R/6b1/2P1bk2/3p1p2/P2K1B2/8 w - - 4 55,h6h8 f4g4 f2e3 f3f2,1899,74,100,110,advancedPawn crushing discoveredAttack endgame pin short,https://lichess.org/3xFWMS1g#109,,3725151
1663,62P8c,8/7p/8/pp6/3k4/1K1N2P1/PPP4P/1n6 w - - 14 37,c2c4 b5c4 b3c2 c4d3 c2b1 d4e3,1899,75,100,217,crushing defensiveMove endgame fork knightEndgame long,https://lichess.org/p6uiBFLZ#73,,528605
1664,hncUJ,8/p2P4/1b2R1kp/8/2P4P/1r6/8/7K b - - 4 53,g6g7 e6b6 b3d3 b6b7 g7f6 c4c5,1899,75,100,757,crushing defensiveMove endgame long,https://lichess.org/FSYfX55Z/black#106,,3829228
1665,4TJBX,2Q5/5rk1/Q2p3p/3Pp1q1/4P3/7P/5bPK/8 w - - 0 42,a6a8 f2g3 h2g1 g5e3 g1h1 f7f1,1899,75,100,102,endgame long mate mateIn3,https://lichess.org/gMYV6f6Y#83,,391607
1666,i36xE,1k1r2r1/1b1p4/p1nR4/1pQ1N2p/4qP2/4P1P1/PPP4P/R1B3K1 w - - 1 20,e5c6 b7c6 d6c6 d7c6 c5e5 e4e5,1900,75,100,180,advantage long middlegame,https://lichess.org/YpjSaUbJ#39,,3851516
1667,umDxs,2k4r/ppp5/2p2p2/2b1p3/3qP3/2NP3p/PPPQK3/R5R1 w - - 0 25,a1f1 d4g1 f1g1 c5g1 e2f1 h3h2,1900,75,100,236,advancedPawn crushing long middlegame,https://lichess.org/tHVEXIV8#49,,4966663
1668,3T5vS,R4b2/1R3k1p/4r1p1/2p5/2P1p3/3rBP1P/5KP1/8 b - - 1 37,e6e7 a8f8 f7f8 e3c5,1900,74,100,127,advantage endgame master pin short,https://lichess.org/RJqT8wOQ/black#74,,303576
1669,RDpYi,8/8/1p1p4/q1pPp1pk/2P1Pp2/P7/1Q3PPK/8 w - - 0 32,b2b5 a5b5 c4b5 c5c4 a3a4 c4c3 a4a5 c3c2 a5b6 c2c1q b6b7 c1c7 b7b8q c7b8,1900,74,100,228,advancedPawn crushing endgame promotion queenEndgame quietMove veryLong,https://lichess.org/yu4yrke8#63,,2380718
1670,LpcmC,1Q6/p4ppk/7p/1p6/8/1B2Bb1P/PP3P1K/5q2 w - - 7 36,h2g3 f1g2 g3f4 g2h2 f4f3 h2b8,1900,75,100,138,advantage endgame long skewer,https://lichess.org/VH8Plino#71,,1909210
1671,osSu8,r3k2r/pp2bppp/4pn2/qN1p1b2/1n1P1B2/P3PN2/5PPP/R2QKB1R w KQkq - 0 11,a3b4 e7b4 f3d2 b4d2 d1d2 a5a1,1900,75,100,154,advantage long middlegame,https://lichess.org/YtX3nQXe#21,English_Opening English_Opening_Caro-Kann_Defensive_System,4449621
1672,tFoTV,8/6pk/4p1n1/p3r1p1/1p1K4/1P6/P1Q5/8 b - - 1 47,h7h6 c2h2 g6h4 d4e5,1900,75,100,219,crushing deflection endgame short,https://lichess.org/q1zR2uQB/black#94,,4833190
1673,GnyPC,8/4kpp1/2P4p/2qPp3/7P/8/6P1/3Q3K b - - 0 42,c5d4 d1d4 e5d4 h1g1,1900,75,100,149,crushing defensiveMove endgame queenEndgame short,https://lichess.org/8tFBSnD0/black#84,,1470100
1674,9fyPw,3r2k1/3b3p/p1pPp3/2P1N1q1/P2BQ1P1/1P5P/2P3K1/8 w - - 0 37,e5c6 d7c6 e4c6 g5d2 g2g3 d2d4,1900,74,100,291,advantage endgame fork long pin,https://lichess.org/mFBx0c8D#73,,846985
1675,jY65G,6k1/5p1p/4p1p1/1P2qn2/2r5/1Q2PP1P/1P3KP1/3R4 w - - 0 29,b3c4 e5e3 f2f1 f5g3,1900,75,100,122,endgame mate mateIn2 short,https://lichess.org/wkeh9d1v#57,,3983068
1676,9aIle,rn3rk1/1pq2ppp/p2bpn2/4N3/3Q1B2/2N5/PPP2PPP/3RR1K1 b - - 1 13,b8c6 d4d6 c7d6 d1d6,1900,74,100,166,advantage middlegame short,https://lichess.org/cD2XRrgV/black#26,Sicilian_Defense Sicilian_Defense_Moscow_Variation,839026
1677,wLVrD,r7/2pb1p1k/p4p1p/N4q2/1PPP4/6QP/4rPP1/R2R2K1 w - - 1 32,g3d3 e2e1 g1h2 f5d3 d1d3 e1a1,1900,75,100,413,advantage long middlegame,https://lichess.org/gSqYXVib#63,,5103661
1678,t62bD,8/6pk/5pp1/7r/8/5qPP/3Q1P1K/4R3 w - - 7 42,e1e3 h5h3 h2h3 f3h1 h3g4 h1h5 g4f4 h5f5,1901,75,100,333,attraction endgame mate mateIn4 sacrifice veryLong,https://lichess.org/t6JKMcxz#83,,4819326
1679,WWEpr,8/2Rnr1k1/1q2p2p/p2p2pP/1p1P1r2/3Q4/PP1R1PP1/1B4K1 b - - 5 32,b6c7 d3h7 g7f8 h7h8 f8f7 b1g6,1901,75,100,135,long mate mateIn3 middlegame,https://lichess.org/9T66aLBB/black#64,,2843205
1680,JWv8n,r7/1p6/1p5p/P2kp3/1P6/3K2P1/7P/R7 b - - 0 32,b6a5 a1a5 a8a5 b4a5 e5e4 d3e3 h6h5 h2h3 d5e5 g3g4 h5g4 h3g4 e5d5 g4g5 d5e5 g5g6 e5f6 e3e4,1901,75,100,78,crushing endgame master quietMove rookEndgame veryLong zugzwang,https://lichess.org/FfBRWOXw/black#64,,1708340
1681,DBi8b,r4rk1/1pp1q1p1/pbn2n1p/3p4/PP2P3/2P2N1P/5PP1/R1BQRNK1 b - - 0 16,f6e4 d1d5 e7f7 d5f7 f8f7 e1e4,1901,74,100,475,advantage kingsideAttack long middlegame,https://lichess.org/ZThuIMFJ/black#32,Italian_Game Italian_Game_Classical_Variation,1153826
1682,NUqjF,8/1p6/5Pb1/1k1K4/1P1P4/8/8/8 b - - 0 42,b5b4 d5e6 b7b5 d4d5 b4c5 d5d6 b5b4 d6d7,1901,75,100,201,advancedPawn bishopEndgame crushing endgame quietMove veryLong,https://lichess.org/gyeO46kB/black#84,,2054929
1683,JuEgz,2k5/pp6/2pQ2K1/3pP3/8/7q/8/8 b - - 1 39,h3d7 d6d7 c8d7 g6f7 a7a5 e5e6,1901,75,100,211,crushing endgame long queenEndgame,https://lichess.org/tZac8FTH/black#78,,1740999
1684,MokBQ,3qn1k1/QR4bp/1p4p1/5p2/3p4/4p2P/PP1N1PP1/6K1 w - - 0 29,b7b8 e3d2 b8d8 d2d1q,1901,75,100,439,advancedPawn advantage endgame promotion short,https://lichess.org/nzYXyVZo#57,,1995473
1685,1Sj6k,2kr3r/pp2bppq/2n1p3/3n4/6QN/2N3P1/PP2BP2/R1B2RK1 w - - 1 17,g4e4 d5c3 e4h7 c3e2,1901,75,100,100,advantage middlegame sacrifice short,https://lichess.org/eFb0CXsl#33,Sicilian_Defense Sicilian_Defense_Alapin_Variation,128032
1686,MYk0V,5r1k/R6p/3P4/4p3/1pB1Pp2/1P6/4KPq1/1Q3n2 w - - 0 39,b1f1 g2e4 e2d2 e4d4 c4d3 d4a7,1901,74,100,320,advantage endgame fork long,https://lichess.org/AvFGcD8g#77,,1972973
1687,lzqJE,6k1/6p1/7p/p1p1r3/Pp1pP3/1P1P2RP/5KPq/2Q5 b - - 4 39,e5e6 c1c4 h2g3 f2g3,1901,75,100,387,crushing endgame master pin short,https://lichess.org/ifZodEv8/black#78,,4197854
1688,r20dl,3r4/pp4B1/1b2k2p/5p2/5P2/4p3/PP1rR1PP/2R2K2 w - - 0 29,g2g3 d2e2 f1e2 d8d2,1901,75,100,241,attraction crushing endgame short,https://lichess.org/U4DT9gGB#57,,4637877
1689,Ysh0q,1r3rk1/5p2/p2p1np1/1p2pP1P/2P1q3/1P2N3/P3K2Q/R6R b - - 1 27,f6h5 h2h5 g6h5 a1g1 e4g4 e3g4,1901,75,100,202,crushing long middlegame sacrifice,https://lichess.org/8k8jpaqF/black#54,,3049371
1690,SU2K2,6k1/3r1p1p/2qP2p1/p1pRQ3/8/6P1/P4PP1/6K1 b - - 5 32,c5c4 d5c5 c6d6 c5c8 d7d8 e5d6,1901,75,100,415,crushing endgame long pin,https://lichess.org/bGYjmU7a/black#64,,2491537
1691,SPHFx,r2r2k1/5qnp/pp1pb3/2p1n3/2P1P1P1/P1Q5/1BP1B2P/2KRR3 b - - 0 22,e5c4 e1f1 f7e7 e2c4 e6c4 c3c4,1901,74,100,271,advantage intermezzo long middlegame pin,https://lichess.org/u639nzbt/black#44,,2484768
1692,nAFZP,r3r1k1/pQ2bppp/5n2/2p2q2/5B2/2N5/PPP3PP/3R1RK1 w - - 1 19,f4b8 a8b8 b7b8 f5f1 g1f1 e8b8,1901,75,100,89,advantage long middlegame,https://lichess.org/bHt5jrRD#37,,4299891
1693,rbNHj,6k1/1p4pp/6n1/p2p4/B2qn3/2r5/P1P1QRPP/R5K1 b - - 1 23,e4f2 e2e6 g8h8 e6e8 g6f8 e8f8,1901,74,100,320,long mate mateIn3 middlegame,https://lichess.org/8r6vyriW/black#46,,4688120
1694,3fTFG,8/1p2krp1/3p4/p2Pp3/P2pP1P1/1P1P2K1/5p2/2B1bQ1R w - - 6 35,f1e2 f2f1q e2e1 f7f3 g3h4 f3h3 h1h3 f1e1,1902,75,100,78,advancedPawn crushing discoveredAttack endgame promotion veryLong,https://lichess.org/Gz2cLQoE#69,,321117
1695,vTCtv,r4q1k/6R1/p1p5/1p1bP1Q1/1b6/6R1/PP6/2K3Br b - - 5 33,h1g1 g3g1 b4d2 g5d2 f8g7 g1g7,1902,75,100,172,crushing hangingPiece long middlegame,https://lichess.org/P5tJpKS4/black#66,,5027438
1696,xpplo,r4r1k/6p1/b1p1p1p1/pn1pP1Q1/Nq6/1P4P1/6BP/3RR2K b - - 0 29,b5d4 g5h4 h8g8 h4d4,1902,75,100,216,advantage master middlegame short,https://lichess.org/dhvIXFmX/black#58,,5234129
1697,xmUl6,8/p5R1/4r3/2P2kpp/r2Bp3/2P1K2P/6P1/8 b - - 0 47,e6g6 g2g4 h5g4 h3g4 f5g4 g7g6,1902,74,100,267,crushing endgame long,https://lichess.org/KjuEFb9f/black#94,,5229354
1698,JDtzZ,4r2k/7p/3p2p1/p4P2/1pP5/2b2NP1/5q1P/1R1Q1B1K w - - 5 38,f5g6 e8e1 d1d3 e1b1 d3b1 f2f3,1902,75,100,210,advantage long middlegame,https://lichess.org/JsaFhYx1#75,,1681470
1699,lhBHr,4N3/8/2p1R3/7p/5P1P/8/5krK/8 w - - 2 46,h2h1 g2g4 e6e2 f2e2,1902,75,100,93,crushing endgame master short,https://lichess.org/7w51idT4#91,,4171268
1700,WCUyg,6k1/8/6p1/r2RK1P1/8/8/8/8 b - - 41 72,a5d5 e5d5 g8f7 d5d6,1902,74,100,432,crushing defensiveMove endgame master short,https://lichess.org/RBBJOlKa/black#144,,2815279
1701,2TZvz,8/8/4p1Pb/4PP2/4K3/Npk5/8/8 w - - 3 63,g6g7 e6f5 e4f5 h6g7,1902,75,100,86,crushing endgame master short,https://lichess.org/yb7WIURd#125,,216616
1702,2ghGe,kr4r1/p1p2p2/QpPbp3/4Np2/1P1P1q1p/4R2P/P4PP1/R5K1 b - - 6 25,f4d4 a6a7 a8a7 e3a3,1902,75,100,182,attraction mate mateIn2 middlegame queensideAttack sacrifice short,https://lichess.org/N3JSeg67/black#50,,235265
1703,QMSnE,5rk1/p3Rppp/1q6/1p6/2p3P1/P4Q1P/1b3PB1/6K1 b - - 1 31,a7a5 f3f7 f8f7 e7e8 f7f8 g2d5 b6e6 d5e6 g8h8 e8f8,1902,75,100,413,backRankMate endgame mate mateIn5 sacrifice veryLong,https://lichess.org/bGnXGGjE/black#62,,2305141
1704,32jjf,r4rk1/p1p2ppp/2p2n2/5N2/Q2p1q2/6N1/PP1K1PPP/2R1R3 w - - 5 20,d2e2 d4d3 e2f1 f4a4,1902,75,100,126,crushing discoveredAttack middlegame short,https://lichess.org/R4W2hbto#39,,266225
1705,uNW1c,r7/p1p2pk1/1bpp4/8/3PP1Nr/P1P2q2/1P3P1P/R3RQK1 w - - 0 23,g4e3 h4h2 f1g2 h2g2,1902,75,100,98,crushing kingsideAttack middlegame short,https://lichess.org/mRkCZue3#45,,4932018
1706,wQpvY,2kr4/1pp2p1p/p4p2/q2r4/1n6/3BBP2/1QP2PPP/2KR3R w - - 4 20,d3e4 b4a2 b2a2 a5a2,1903,75,100,359,advantage middlegame queensideAttack short,https://lichess.org/WIqJQHDn#39,,5111254
1707,2RDQe,8/7p/8/R5p1/1Brkpp2/P2p3P/3K1PP1/8 w - - 2 42,a5g5 e4e3 f2e3 f4e3 d2d1 e3e2 d1d2 c4c2 d2e1 c2c1 e1f2 c1f1,1903,75,100,103,advancedPawn advantage endgame exposedKing veryLong,https://lichess.org/E3WIElsh#83,,213384
