,PuzzleId,FEN,Moves,Rating,RatingDeviation,Popularity,NbPlays,Themes,GameUrl,OpeningTags,ID
792,9wvLD,1r4k1/4qpp1/P1Q5/2b2P2/2P4p/7P/6P1/5R1K b - - 2 35,e7d6 a6a7 d6c6 a7b8q,1840,75,100,500,advancedPawn advantage endgame master promotion short,https://lichess.org/KPuRmMEW/black#70,,870900
793,qvUZE,1k1r2nr/ppp2pp1/2n5/8/8/q3BQP1/P3P1B1/1R3RK1 w - - 0 17,f3c6 a3e3 f1f2 d8d1 b1d1 b7c6,1840,75,100,111,crushing exposedKing hangingPiece long middlegame pin,https://lichess.org/iBhDcFOe#33,Englund_Gambit Englund_Gambit_Hartlaub-Charlick_Gambit,4628704
794,2FTn3,6k1/1bq2pb1/1p2p2p/7P/2p1p1Q1/6R1/1r3PP1/3R2K1 b - - 1 24,c7e5 d1d8 g8h7 g4g6 f7g6 h5g6,1840,75,100,127,long mate mateIn3 middlegame sacrifice,https://lichess.org/poqwUsTt/black#48,,196959
795,6BKFJ,2kr3N/ppp4p/6p1/2b5/2Bn2bq/2N5/PPn2PPP/1RBQ1RK1 w - - 4 17,d1d2 d4f3 g2f3 d8d2,1841,75,100,172,crushing discoveredAttack middlegame short,https://lichess.org/7fOPp2Yc#33,Italian_Game Italian_Game_Rousseau_Gambit,541332
796,nvz9u,8/8/4kR2/6P1/5r2/4p3/8/6K1 b - - 0 50,e6e5 f6f4 e5f4 g5g6 f4f3 g1f1 e3e2 f1e1,1841,75,100,186,crushing endgame rookEndgame veryLong,https://lichess.org/o4HajpR5/black#100,,4367209
797,kejC5,r1b2r2/pp3kqB/1n6/3pp3/3N4/1QP5/PP3PP1/2KR3R w - - 0 25,d4f5 c8f5 h7f5 g7g5 c1b1 g5f5,1841,74,100,607,advantage fork long middlegame,https://lichess.org/Pc1KK5qN#49,,4080280
798,A4pCn,r3r1k1/1b3pbp/1q4p1/1Pn5/3pP3/3B1NNP/1P3PP1/R2QR1K1 w - - 3 23,b2b4 a8a1 d1a1 c5d3,1841,75,100,444,advantage middlegame short,https://lichess.org/yGswIvTd#45,,882086
799,YXWpk,Q6r/2p1kBpp/1b6/pP1nN3/P3b1Pq/2P4P/5P2/RN3RK1 w - - 1 24,f7d5 h4g3,1841,75,100,162,mate mateIn1 middlegame oneMove pin,https://lichess.org/iASLXJFr#47,,3019783
800,crL4N,r2q1rk1/pbpQn3/1p3ppb/7p/4P2P/2N5/PPP1BPP1/3R1RK1 b - - 0 15,e7c6 d7e6 g8h8 d1d8,1841,74,100,329,advantage discoveredAttack middlegame short,https://lichess.org/nY5IG9zM/black#30,Modern_Defense Modern_Defense_Other_variations,3397212
801,JjN9C,6k1/5pp1/R7/p3P2p/5r1P/P2r1N2/4n1K1/5R2 b - - 9 36,e2d4 a6a8 g8h7 f3g5 h7g6 f1f4,1841,75,100,74,crushing discoveredAttack endgame long,https://lichess.org/hXXRBrJ2/black#72,,1725726
802,TLutT,rn1q1rk1/4bp1p/bpp1p1pB/p3n3/P1PP4/3B2N1/1PQ2PPP/4RRK1 w - - 0 20,h6f8 e5d3 f8e7 d3e1 f1e1 d8e7,1841,75,100,109,advantage long middlegame,https://lichess.org/OaXdcdps#39,,2567185
803,uVKZz,4rrk1/pb1q3p/1p1p4/2pP4/2N5/3Q1N1P/Pb4PK/4RR2 b - - 1 25,b2g7 f3g5 g7e5 c4e5,1841,75,100,115,advantage middlegame short,https://lichess.org/WqebU9XR/black#50,,4942993
804,fEWPg,8/5p1k/4b1p1/8/2p2QP1/2Q2P1K/2p5/7q w - - 13 47,f4h2 c2c1q c3c1 h1c1,1841,74,100,226,advancedPawn crushing endgame master promotion short,https://lichess.org/R06EqXGp#93,,3604806
805,aZlk9,b2r2k1/6pp/1p2p3/pB2n2q/P3p3/2P2P2/4Q2P/1RB2R1K w - - 0 27,c1f4 e4f3 e2f2 e5g4,1841,74,100,487,crushing middlegame short,https://lichess.org/ySZ0Qan7#53,,3197577
806,Q4mdz,8/p7/K4p2/P7/2N5/1P1k4/3r4/8 b - - 1 46,d2d1 c4b2 d3c2 b2d1 c2d1 a6a7,1841,75,100,607,crushing endgame fork long,https://lichess.org/F0At5A06/black#92,,2280262
807,qASTL,1k1r3r/p5Q1/2N1p2p/3pP3/1n6/2q5/4KPPP/1R6 b - - 0 27,b8c8 c6a7 c8b8 b1b4 c3b4 a7c6,1841,74,100,268,crushing exposedKing long middlegame,https://lichess.org/GjBAnqEn/black#54,,4562266
808,8KDPu,8/8/6pp/1pk5/p2p1P2/P2K4/P5PP/8 b - - 0 33,c5d5 g2g4 g6g5 f4f5 d5e5 h2h3,1841,75,100,76,crushing defensiveMove endgame long pawnEndgame quietMove,https://lichess.org/IBOru3T0/black#66,,728508
809,dEN0Q,r2q1rk1/ppp3b1/3p2pp/4p3/3n2P1/P2P1N2/1PPBPRK1/RN1Q4 w - - 1 18,f3d4 f8f2 g2f2 d8h4,1842,75,100,64,advantage attraction middlegame short,https://lichess.org/LwHNfF9A#35,Hungarian_Opening Hungarian_Opening_Other_variations,3430072
810,o0hYF,8/2k3pp/8/2P1p3/B6p/8/2P5/2K5 w - - 1 32,c1d2 h4h3 a4b3 c7c6,1842,74,100,187,bishopEndgame crushing endgame master short,https://lichess.org/dfaFIPgH#63,,4373833
811,SZVd3,2r1r1k1/p4p2/2p1p1pp/2bqB3/5PQ1/6RP/PP4PK/R7 b - - 1 26,c5d6 a1d1 d6e5 d1d5 c6d5 f4e5,1842,75,100,191,advantage long middlegame,https://lichess.org/dGXPSL8D/black#52,,2499372
812,dgnxu,2B5/8/1p5p/p1kp1p2/P4P2/1P1bP2P/1K6/8 w - - 38 62,h3h4 d5d4 e3d4 c5d4,1842,74,100,181,advantage bishopEndgame endgame master short,https://lichess.org/kIpJ0Nyv#123,,3469968
813,RIiQ1,3kr2r/p1p1b1p1/2Q3p1/4R3/P7/3PB1P1/1PP1KP2/q7 b - - 0 22,e7d6 e3g5 d8c8 e5e8 h8e8 c6e8,1842,74,100,170,crushing deflection long middlegame,https://lichess.org/cwyBueMu/black#44,,2387607
814,HCJ7v,r1bN1r2/1p1kn1p1/7p/p7/P2P1B2/2P5/1P4PP/4RR1K b - - 0 22,d7d8 f4c7 d8e8 f1f8 e8f8 c7d6 a8a6 d6e7,1842,74,100,129,advantage discoveredAttack exposedKing middlegame veryLong,https://lichess.org/oWOt1UH8/black#44,,1504488
815,TmWAo,3r1k2/p1p2p1p/4pQ2/2p2n2/2B2q2/8/PPP2P1P/1K2R3 b - - 2 24,d8d2 c4e6 f5g7 f6f4,1842,75,100,279,crushing endgame master pin short,https://lichess.org/OWwcGKxc/black#48,,2604858
816,oyhfp,r1b1Qrk1/p5p1/4p2p/3p1p2/8/3n4/P4PPP/R4RK1 w - - 2 23,e8g6 d3f4 g6g3 f4e2 g1h1 e2g3,1842,74,100,621,crushing fork long middlegame,https://lichess.org/r8r2R12l#45,,4458504
817,I7MAR,8/4k3/8/5K1p/8/6P1/8/8 b - - 0 76,e7f7 f5g5 h5h4 g5h4 f7g6 h4g4,1842,74,100,545,crushing defensiveMove endgame long pawnEndgame zugzwang,https://lichess.org/44zobfiC/black#152,,1584512
818,Q4BLk,r1b2rk1/pp3ppp/2p2q2/2Pp4/1P2P1n1/8/P1P3PP/RNBQRBK1 w - - 1 14,c2c3 f6f2 g1h1 f2h4,1842,75,100,229,advantage opening short,https://lichess.org/JW3CzbwX#27,Ruy_Lopez Ruy_Lopez_Berlin_Defense,2279440
819,RcaYG,6r1/2Q2p1k/3pq3/p3P3/P2R4/2P3P1/1P6/6K1 w - - 1 46,c7d6 g8g3 g1f2 e6h3,1842,74,100,150,crushing defensiveMove endgame master short,https://lichess.org/uGtnDh1r#91,,2415896
820,Q2dEV,rn2k2r/pQ1b4/5n2/3pq2p/4p1p1/1N6/P1PN1PPP/R3R1K1 b kq - 0 20,d7c6 b7c8 e8f7 c8h8 b8d7 h8h6,1842,75,100,621,advantage long middlegame skewer,https://lichess.org/Ronhzm6q/black#40,,2277291
821,tBXLx,8/5p2/p3pkp1/2Q4p/1P5P/3qPKP1/5P2/8 b - - 3 30,d3d5 c5d5 e6d5 f3f4 g6g5 h4g5,1842,75,100,172,crushing endgame long queenEndgame,https://lichess.org/wjnPTFUu/black#60,,4827129
822,wW6uw,r1r5/4ppkp/2Np1np1/Q3q3/2p1P3/3B1P2/P1P3PP/1R3RK1 w - - 0 23,a5a8 e5c5 f1f2 c8a8,1842,75,100,91,advantage intermezzo middlegame short,https://lichess.org/84basEYw#45,,5118603
823,25PRc,3r1rk1/p4q1p/1pb1p1p1/8/2PB2P1/P2R3P/1Q3P2/3R2K1 b - - 4 26,f7f4 d4h8 e6e5 d3d8,1842,75,100,98,advantage discoveredAttack middlegame quietMove short,https://lichess.org/zmVjYEiq/black#52,,182828
824,0xP0X,6k1/1R3p1p/6p1/p1B5/P2pPP1P/4n1P1/7K/5r2 b - - 2 36,f1d1 b7b8 g8g7 c5f8 g7f6 b8b6,1842,74,100,141,endgame long mate mateIn3,https://lichess.org/fwcOy8tx/black#72,,83536
825,j04Ws,r3rb1k/ppqb2p1/3pP2p/2p5/P4Q2/1P5P/1BP2PP1/R3R1K1 b - - 2 20,e8e6 e1e6 d7e6 f4h6 h8g8 h6e6,1842,75,100,544,advantage kingsideAttack long middlegame pin,https://lichess.org/clsZDlz8/black#40,,3934760
826,aekbr,2kr4/Bpp3q1/7p/5b2/1QB1n1p1/5N1P/PP3PP1/5RK1 w - - 0 20,f3d4 g4h3 g2g3 e4g3 c4e6 f5e6,1842,75,100,85,crushing long middlegame,https://lichess.org/8635LfnW#39,,3204520
827,lrxQs,r4rk1/2p2ppp/p7/2pP4/4Qb2/7q/PPB2P2/RNB1R2K w - - 4 22,h1g1 f4h2 g1h1 h2g3 h1g1 h3h2 g1f1 h2f2,1842,74,100,133,discoveredAttack kingsideAttack mate mateIn4 middlegame veryLong,https://lichess.org/L5PIUiax#43,,4186523
828,1vrcA,1k2r3/1p2q3/pQ1R4/P4p2/2P2Pp1/1P4P1/5KBr/6R1 w - - 3 36,d6d2 h2g2 f2g2 e7e4 g2f1 e4e1,1842,74,100,298,attraction crushing long middlegame sacrifice,https://lichess.org/AWg09OvB#71,,169356
829,ltxOJ,5r1k/pp4pp/7n/2b1pr1q/4B3/2BP1P2/P4P1P/R2Q1R1K w - - 2 21,f3f4 h6g4 d1g4 h5g4,1842,75,100,332,advantage master middlegame short,https://lichess.org/DAtpoavX#41,,4189431
830,aE8va,2k3rr/2p5/1p1p4/pP2p2q/P1Pp1p2/5QP1/5R1P/5RK1 b - - 1 32,f4g3 f3a8 c8d7 f2f7 h5f7 f1f7 d7e6 a8d5,1842,75,100,160,endgame mate mateIn4 queensideAttack veryLong,https://lichess.org/2oyKLGWP/black#64,,3167095
831,3YMD7,8/r7/1k2N3/1p1Bp1R1/1P2P3/7r/4K3/8 w - - 1 53,g5g6 h3h2 e2f3 a7a3 f3g4 h2g2 g4f5 a3f3 f5e5 g2g6,1842,75,100,191,advantage deflection endgame exposedKing veryLong,https://lichess.org/SNLD6jlj#105,,311138
832,n08au,r3k3/1bP2p2/p2ppqr1/7p/3n2p1/1B4Q1/PP3PPP/RN3RK1 w q - 0 19,g3d6 d4e2 g1h1 b7g2 h1g2 f6f3,1842,75,100,136,attraction kingsideAttack long mate mateIn3 middlegame sacrifice,https://lichess.org/XGoUcLOB#37,,4285412
833,RFSd7,6k1/3n1p2/1PBp2p1/r1p4p/2P5/1p1P2P1/3R3P/6K1 b - - 1 35,a5a2 c6d7 a2d2 b6b7 b3b2 b7b8q,1843,74,100,151,advancedPawn advantage endgame long promotion sacrifice,https://lichess.org/OuTttPO3/black#70,,2383035
834,0S4mD,8/2P5/8/1P2p1p1/P5b1/8/8/2K4k b - - 0 47,g4c8 a4a5 h1h2 a5a6,1843,75,100,73,bishopEndgame crushing endgame quietMove short,https://lichess.org/URPl9sCu/black#94,,39530
835,4vA8X,8/3k4/p6B/1p2p3/3p4/N4b1p/PPPRN2r/5K2 w - - 0 33,e2g1 h2d2 h6d2 h3h2 g1f3 h2h1q,1843,74,100,214,advancedPawn advantage endgame long promotion,https://lichess.org/owaWNXiv#65,,430648
836,IQXH9,8/4k2p/1p2p1pP/pP1pP1P1/P1bP4/2b1K3/2B5/2B5 b - - 3 51,c3e1 c2g6 h7g6 h6h7,1843,75,100,91,advancedPawn bishopEndgame crushing endgame sacrifice short,https://lichess.org/1kdaUOlM/black#102,,1611619
837,zHVEW,8/1p6/p3p1p1/P1K3P1/3Pk3/8/8/8 b - - 0 52,e4f5 c5d6 f5e4 d6e6,1843,74,100,373,crushing endgame pawnEndgame short,https://lichess.org/vZjBxBNN/black#104,,5360935
838,A8qNE,r3r1k1/pp3ppp/2p1p3/3n4/P2PqP2/B3P1R1/1P2Q1PP/R5K1 b - - 0 22,d5f4 e2g4 f4e2 g4e2,1843,75,100,107,advantage middlegame short,https://lichess.org/ZP7pEWcr/black#44,,887727
839,SznIn,Q7/6k1/8/1N6/3PpP2/4K3/5P2/6bq w - - 0 47,a8e4 g1f2 e3d3 h1b1 d3c4 b1e4,1843,75,100,99,crushing deflection endgame fork long skewer,https://lichess.org/fv0HpCd2#93,,2535973
840,SzwvN,3r2k1/pQ3pp1/2p1b2p/4n3/2P2B2/1P4P1/4qPBP/5RK1 b - - 3 21,d8d1 b7b8 g8h7 b8e5 e2e5 f4e5,1843,75,100,210,advantage kingsideAttack long middlegame,https://lichess.org/uDSyunNf/black#42,,2536223
841,Z6Mgn,5Q2/8/3P2pk/5p1p/3b4/6P1/5PKP/4q3 b - - 6 46,h6h7 f8e7 e1e7 d6e7,1843,75,100,177,advancedPawn crushing endgame short,https://lichess.org/jooKHsSc/black#92,,3068663
842,hzsAm,8/4p3/5p2/4PP2/R7/1BK2b2/3Q1k2/1r4q1 b - - 4 63,f2g3 d2f4 g3g2 a4a2 g2h3 f4f3,1843,75,100,424,crushing deflection endgame long,https://lichess.org/1wZ4glm2/black#126,,3846896
843,OgJ3q,8/pp4pk/1q1p2Qp/3Pb3/1P6/P5PP/4R2K/1Br5 b - - 0 36,h7g8 g6e8,1843,75,100,164,endgame mate mateIn1 oneMove,https://lichess.org/E5BJln1O/black#72,,2158481
844,hzRFZ,4r3/8/1p1b1P1Q/2ppq1p1/4b1k1/1P6/P6P/4RRK1 b - - 0 31,c5c4 h2h3 g4g3 e1e3 e4f3 f1f3,1843,75,100,219,long mate mateIn3 middlegame,https://lichess.org/qrXiDysu/black#62,,3846258
845,AMq5b,8/R5Np/5k1P/1p3P2/8/7K/pr6/8 w - - 0 44,h3g4 b2b4 g4h5 b4a4,1843,75,100,715,crushing endgame short,https://lichess.org/OgTYK91p#87,,907511
846,ezEj5,3r1rk1/p1Q3pp/8/5N2/1PP1Pp1q/8/P5PP/R6K b - - 1 24,f8f7 c7f7 g8f7 f5h4,1843,75,100,430,crushing endgame short,https://lichess.org/ZBv7tcUh/black#48,,3583281
847,e2pZq,8/8/3p3b/5Q1k/2P1P3/7K/p7/1q6 b - - 5 49,h6g5 f5h7 g5h6 h7f7 h5g5 f7f5,1843,74,100,630,endgame long mate mateIn3,https://lichess.org/WpZb6LD2/black#98,,3501188
848,97Ra3,8/5p2/p5p1/5k1p/1P3P2/6PP/3K1P2/8 w - - 1 49,f2f3 h5h4 g3h4 f5f4 d2e2 f4g3 h4h5 g6h5,1843,75,100,157,crushing deflection endgame pawnEndgame veryLong,https://lichess.org/0yAxUyNh#97,,798162
849,IkjM4,1k6/1p3pp1/2pq4/p7/P2P1n2/1P4QR/2P1r2P/3R3K w - - 3 29,d1f1 d6d5 g3f3 f4h3 f3d5 c6d5,1843,74,100,92,advantage endgame long pin,https://lichess.org/r5loZEWd#57,,1640364
850,uOGcS,2k3rn/1pp5/p2p1b2/q2P4/2P1PB2/1P1N1PpR/P5Q1/1K6 w - - 1 30,f4d2 a5d2 g2d2 g3g2 d2g2 g8g2,1843,75,100,310,advancedPawn advantage long middlegame sacrifice,https://lichess.org/hEZ7HwrB#59,,4933122
851,sI51M,4r1k1/pp3p2/2p2qp1/8/8/1PP2P1Q/1KP2P2/3R4 b - - 3 25,e8e2 h3c8 g8g7 d1h1,1843,75,100,99,crushing defensiveMove endgame short,https://lichess.org/CjIigUIr/black#50,,4748513
852,szofN,3Q4/6k1/p3p3/5qPK/8/5P1P/8/8 w - - 3 43,d8e7 f5f7 e7f7 g7f7 h5h6 f7g8,1843,75,100,1451,crushing defensiveMove endgame long queenEndgame,https://lichess.org/x3XN5fIv#85,,4810457
853,fFemP,5r2/p3kpQ1/1rp3p1/1q1p2N1/N2P4/K1BnP2P/PPR5/8 w - - 3 32,a4b6 a7b6 g7f8 e7f8,1843,74,100,160,crushing middlegame short,https://lichess.org/vNcCCKCA#63,,3606323
854,ICRzF,5rk1/3p2pp/3P4/4q3/1P6/r5P1/3Q1PBP/1R4K1 b - - 1 29,a3a1 d2d5 g8h8 d5e5 a1b1 g2f1,1843,75,100,86,crushing endgame long,https://lichess.org/rBrN0o3L/black#58,,1591695
855,k3f3m,4r1k1/1p1n2p1/1p1Pr2p/3Q4/4R3/qPP4P/2P2PP1/1R4K1 b - - 0 25,d7f6 e4e6 f6d5 e6e8 g8f7 d6d7 d5f6 d7d8q,1844,75,100,291,advancedPawn crushing kingsideAttack middlegame promotion veryLong,https://lichess.org/fA7IFEky/black#50,,4027451
856,qJVuq,5rk1/p2p4/4p1p1/1p2Qp1p/2p2P1q/P1P1K3/1P1rB1R1/8 b - - 3 36,h4e1 g2g6 g8f7 g6g7 f7e8 e5b8,1844,74,100,325,endgame exposedKing kingsideAttack long mate mateIn3,https://lichess.org/LTHTSDU9/black#72,,4574989
857,HT0m9,5rk1/1bb2pp1/p4rn1/1p1q1N1Q/1P6/P1P1B1PP/3N1R1K/5R2 w - - 13 27,f5h6 g7h6 h5d5 f6f2 e3f2 b7d5,1844,75,100,122,advantage long middlegame,https://lichess.org/ZqXULSSe#53,,1527585
858,HTm3E,8/4q1kp/3R1pp1/6Pn/1p1Q1P2/1P3B1P/2P4K/2r5 w - - 0 38,f3h5 c1c2 h2g3 e7e1,1844,75,100,122,crushing endgame master short,https://lichess.org/UUsPnejS#75,,1528668
859,R06Fr,r4rk1/1p1nqp2/2p2npR/p2p2N1/3P2P1/2NQP3/PP6/2KR4 b - - 2 18,f6g4 h6g6 f7g6 d3g6 e7g7 g6e6,1844,75,100,132,advantage kingsideAttack long middlegame sacrifice,https://lichess.org/4gC7VXiO/black#36,Queens_Gambit_Declined Queens_Gambit_Declined_Baltic_Defense,2361238
860,G2Eg9,r5rk/pb3p1p/qp2pP2/6pQ/3R4/4P3/PP4PP/R5K1 b - - 1 24,a8d8 d4d8 g8d8 h5f7,1844,75,100,132,advantage middlegame short,https://lichess.org/sYl7Jtzk/black#48,,1402432
861,yOsi2,1r2r3/1R2ppkp/2pp1Pp1/p7/4P3/5Q2/q1P3PP/5RK1 b - - 0 25,e7f6 f3f6 g7g8 b7f7 a2f7 f6f7,1844,74,100,482,crushing endgame long,https://lichess.org/zGCll6Ng/black#50,,5283531
862,u79HX,1r6/2R3pp/3kp3/5p2/pp1P1P2/3K1P2/P5PP/8 w - - 2 38,c7g7 b4b3 a2b3 a4b3,1844,75,100,346,crushing endgame master rookEndgame short,https://lichess.org/Io2zvtTJ#75,,4908875
863,wXCPR,2k5/8/1Pp5/2K5/2P2pR1/6p1/8/2r5 b - - 3 47,f4f3 c5c6 c8d8 b6b7,1844,74,100,132,advancedPawn crushing endgame master rookEndgame short,https://lichess.org/z0sh5iVX/black#94,,5120177
864,umG1l,3r1b1Q/pppk1p1p/2n1b1r1/5N2/2pp4/8/PPP2PPP/R3R1K1 w - - 10 20,f5g3 f8g7 h8h7 d8h8 h7g6 f7g6,1844,75,100,102,advantage clearance long middlegame trappedPiece,https://lichess.org/LZxBD9W0#39,,4966692
865,FpG4d,1r4k1/4P1p1/Q6p/2P1Rpq1/3P4/4n1P1/Pr5P/5RK1 b - - 0 33,b8e8 a6e6 g8h7 e5e3 e8e7 e6e7,1844,74,100,225,crushing long middlegame,https://lichess.org/y4lQmqPx/black#66,,1384191
866,J3kFQ,r7/2RrPk2/3P3p/p4P2/2pR2P1/1b5P/5K2/8 b - - 1 47,d7c7 d6c7 f7e7 f5f6,1844,75,100,240,advancedPawn crushing endgame short,https://lichess.org/0dPaGCwm/black#94,,1667073
867,7OREM,7r/2N2k1p/1R1B1np1/2p2p2/2P5/3P1Q2/q4PPP/1b3K2 w - - 2 29,f3b7 b1d3 f1g1 a2a1 b6b1 a1b1 b7b1 d3b1,1844,75,100,105,advantage middlegame veryLong,https://lichess.org/Z0eeNalv#57,,647195
868,9Sbgw,2R5/6pk/2p2p1p/2P4P/2P2RK1/3n2P1/2r2P2/8 w - - 1 37,f4f3 d3e5 g4f4 c2c4 f4e3 c4c3,1844,75,100,87,advantage endgame fork long,https://lichess.org/I00UKfId#73,,827995
869,5pHwV,r1bqr2k/pp4pp/3p1p2/3Qn3/5B2/2N5/PPP2PPP/3RR1K1 w - - 4 17,d5d6 d8d6 d1d6 e5f3 g2f3 e8e1,1844,75,100,79,advantage discoveredAttack kingsideAttack long middlegame,https://lichess.org/J4nSAYKq#33,Italian_Game Italian_Game_Scotch_Gambit,510019
870,61OuR,2rqk2r/pp2ppbp/3p2p1/4n3/3NP1nP/2N1B3/PPPQ4/2KR1B1R w k - 0 13,e3g1 g7h6 d2h6 g4h6,1845,75,100,70,advantage opening pin short,https://lichess.org/nCVlvV57#25,Sicilian_Defense Sicilian_Defense_Dragon_Variation,527238
871,pcWDy,rn1qkb1r/pp3ppp/2p1p3/3nN2b/P1pP2P1/2N2P2/1P2P2P/R1BQKB1R w KQkq - 1 9,g4h5 d8h4 e1d2 h4d4,1845,75,100,136,advantage interference middlegame short,https://lichess.org/UdHdDd7R#17,Slav_Defense Slav_Defense_Steiner_Variation,4514979
872,k2gQA,Qnk4r/Rp1rq3/1P1p4/4p1p1/2p4p/2P2NP1/5PP1/5RK1 b - - 0 24,h4g3 a8b8 c8b8 f1a1 h8h1 g1h1 e7h7 h1g1 h7b1 a1b1,1845,75,100,79,crushing middlegame quietMove sacrifice veryLong,https://lichess.org/owl8ycbs/black#48,,4026088
873,UtrLC,4k3/5p2/1p5B/p2bq1KP/6Q1/P4P2/8/8 w - - 0 47,g4f5 f7f6 g5g4 d5e6 f5e6 e5e6,1845,75,100,86,crushing endgame long pin,https://lichess.org/tiJqzRxN#93,,2701887
874,vHORn,r5k1/5p1p/4p1p1/2NqB1P1/1P3P2/5r2/6QP/4R1K1 w - - 9 36,h2h3 a8a2 g2a2 d5a2,1845,75,100,142,advantage middlegame short,https://lichess.org/jFrLMfDo#71,,5010674
875,90kih,6r1/r4p1k/p3p2p/1p2n3/4Np1q/3P1B2/4Q1PP/1RR3K1 w - - 4 31,e2f2 h4f2 g1f2 e5d3 f2e2 d3c1,1845,75,100,407,advantage attraction fork long middlegame,https://lichess.org/sSYeZ7i5#61,,788549
876,4jSu8,r5k1/5p1p/5bp1/3B4/4P3/5P1P/1q4P1/3QK2R w K - 0 28,d5a8 f6h4 g2g3 h4g3 e1f1 b2f2,1845,74,100,397,endgame exposedKing long mate mateIn3,https://lichess.org/NDTogkzt#55,,414247
877,QWDTh,r2q1rk1/pppn1ppp/3b4/3B4/Q7/6P1/PP1PPP1P/R1B2RK1 w - - 1 12,d5b7 d7c5 a4c6 a8b8 d2d4 c5b7,1845,75,100,239,advantage fork long middlegame,https://lichess.org/vOAUoha8#23,English_Opening English_Opening_Anglo-Indian_Defense,2318926
878,tUpdc,4r3/p7/1p1k2b1/2pP1rpp/2P1p3/4R1PP/PPB3K1/5R2 w - - 18 39,e3e4 e8e4 c2e4 f5f1,1845,75,100,97,advantage endgame short,https://lichess.org/geyg1JmX#77,,4854531
879,390ys,8/8/2p2K2/2k5/2P1B3/1p1P4/8/8 w - - 0 52,f6e6 c5d4 e4c6 b3b2,1845,74,100,250,advancedPawn bishopEndgame crushing endgame short,https://lichess.org/lXKpQ6Qm#103,,275093
880,Gjmom,2kr3r/pp3ppp/1q2b3/2b1P3/2pN1P2/2P5/PP1QBPPP/R3K2R w KQ - 1 15,a1d1 d8d4 c3d4 c5b4 e1g1 b4d2,1845,74,100,93,advantage long middlegame pin sacrifice,https://lichess.org/sZkHe9Ko#29,Queens_Pawn_Game Queens_Pawn_Game_London_System,1464188
881,HjYe7,r6k/1p5p/2bNQpr1/4p3/p2q4/6P1/PPP2R1P/R5K1 b - - 0 26,h8g7 d6f5 g7h8 f5d4,1845,75,100,75,crushing fork master middlegame short,https://lichess.org/YBTdaAiA/black#52,,1550701
882,Ti2FG,2kr4/3b2p1/p1n1p1Np/qp1p2b1/2pPn1Q1/2P5/PPN1BPPP/R4RK1 w - - 3 20,e2f3 e6e5 g4h5 e4f6 g6e7 c6e7,1845,74,100,102,advantage long middlegame,https://lichess.org/o38b0OB5#39,,2598544
883,HcW8p,rnb5/ppp2kpp/5n2/2b5/8/1QNq1N2/PP1P1rPP/R1B3KR b - - 1 12,c8e6 f3e5 f7f8 e5d3 f2f5 d3c5,1845,74,100,170,advantage fork long middlegame,https://lichess.org/vhWrvBKM/black#24,French_Defense French_Defense_Other_variations,1541022
884,4zgGs,5r1k/pp2q1pp/8/8/3P1pQ1/2P2R1P/PP4P1/6K1 w - - 0 35,f3f4 e7e3 g1h2 e3f4 g4f4 f8f4,1845,75,100,116,crushing endgame long,https://lichess.org/0kk6x0hT#69,,436939
885,HO96Y,8/2K2kp1/R1P4p/8/8/8/8/3r4 b - - 2 44,h6h5 c7b7 d1b1 a6b6 b1c1 c6c7,1845,75,100,144,advancedPawn crushing defensiveMove endgame long master rookEndgame,https://lichess.org/EiJMGpxo/black#88,,1520771
886,uQ6mG,8/pR3r2/P2p1k2/3P4/2r3p1/4R3/KP6/8 b - - 0 47,f7b7 a6b7 c4b4 e3b3 b4b7 b3b7,1846,75,100,334,advancedPawn crushing endgame long master rookEndgame,https://lichess.org/l9gqnem4/black#94,,4935699
887,PIyZp,1q6/5pk1/2Qp1r2/1p2p2p/1P2P1pP/2PP2Pn/3N1PK1/5R2 w - - 1 30,d2b3 b8a7 b3d4 e5d4,1846,74,100,638,crushing endgame short,https://lichess.org/viCuwkLg#59,,2212975
888,g8EQT,r4rk1/p4ppp/2p2nb1/q7/3B2PP/b1N2P2/1PPQ4/2KR2NR w - - 0 16,c3e2 a3b4 d2b4 a5b4,1846,74,100,82,crushing middlegame short,https://lichess.org/iexd2gzP#31,Scandinavian_Defense Scandinavian_Defense_Modern_Variation,3683568
889,e2kWu,r3k3/p1pbn2r/1pn1qB2/1B1pPp1p/2PP3P/1Q2R3/PP4P1/2KR4 b q - 0 23,d5c4 b5c4 c6a5 c4e6 a5b3 e6b3,1846,75,100,124,advantage long middlegame trappedPiece,https://lichess.org/toTHXEaZ/black#46,,3501070
890,53dUN,8/bP6/5k2/5r2/B3p3/1Pp5/2P1K1Pr/R2R4 w - - 0 43,d1f1 h2g2 e2e1 f5f1 e1f1 g2g1,1846,75,100,64,attraction crushing endgame exposedKing long,https://lichess.org/uabjdyr4#85,,442372
891,aIAZ1,8/2p5/3b3R/1p2p3/4p3/2k5/4KPPP/8 w - - 0 37,h6h3 c3c2 h3h4 b5b4 h4e4 b4b3,1846,75,100,260,advantage defensiveMove endgame long quietMove,https://lichess.org/2enUjSza#73,,3172820
892,mcZ12,8/8/1k4PP/3pPK2/pp1Pn3/5R2/6r1/8 b - - 0 48,b4b3 h6h7 b3b2 h7h8q,1846,74,100,319,advancedPawn advantage endgame promotion short,https://lichess.org/5NyDbLw8/black#96,,4252357
893,gitQq,8/p5p1/Kp5p/2pk4/8/PP4P1/7P/8 b - - 1 36,b6b5 a6b5 d5d4 a3a4 h6h5 a4a5,1846,75,100,204,advantage defensiveMove endgame long pawnEndgame quietMove,https://lichess.org/ZQhk8aCO/black#72,,3735238
894,NS57z,4b3/8/1P6/P1k4p/5Kp1/8/4B3/8 b - - 0 51,c5c6 e2b5 c6b5 b6b7,1846,75,100,85,advancedPawn bishopEndgame crushing endgame master sacrifice short,https://lichess.org/YC9nJUIx/black#102,,2051044
895,57cgj,2k3nr/7p/p1p1rbp1/4p3/4N3/5P2/PPP1KP1P/3R3R b - - 3 17,g8e7 e4c5 e7f5 c5e6 h8e8 e6c5,1846,75,100,147,advantage long middlegame trappedPiece,https://lichess.org/S5n0BSTm/black#34,Modern_Defense Modern_Defense_Other_variations,447998
896,uZmG9,2r1k1r1/1b1p1p2/8/1p3P2/1B5p/1N1P3P/PP4P1/1K4R1 b - - 0 25,g8g2 g1e1 e8d8 b4a5,1846,74,100,238,advantage endgame master short,https://lichess.org/i2gOsZjd/black#50,,4949176
897,rtYaV,5r2/pppqk3/4pr2/4b3/6PQ/5R1P/PPP5/2K2R2 b - - 0 27,e7e8 f3f6 e5f6 f1f6,1846,75,100,85,advantage middlegame short,https://lichess.org/KezZVANB/black#54,,4713918
898,YHd3O,6k1/4pp1p/1pr3p1/8/pP6/7P/P3RQK1/q4B2 w - - 6 38,g2h2 c6f6 f2e1 f6f1 e1a1 f1a1,1846,75,100,298,advantage endgame long,https://lichess.org/hvX0UUVH#75,,2997088
899,xW6wi,rnb1k2r/6bp/1qPQ1np1/pB2p3/P3P3/2P2N2/1P3PPP/R3K2R b KQkq - 0 14,f6e4 c6c7 b6b5 d6d8,1847,74,100,125,advancedPawn advantage discoveredAttack master middlegame sacrifice short,https://lichess.org/qOVphlfM/black#28,Modern_Defense Modern_Defense_Gellers_System,5206279
900,gQFGp,r2r2k1/2q3p1/p3p1Q1/1p1b1p2/8/1P5R/1PP2PPP/3R2K1 b - - 3 26,c7f7 h3h8 g8h8 g6f7,1847,74,100,167,advantage deflection kingsideAttack middlegame short,https://lichess.org/dPdTKSjK/black#52,,3708858
901,Ofg4X,4rqn1/2Q3k1/pp2Rpr1/2pP4/8/P7/1PP2RPP/6K1 b - - 4 31,e8e7 e6e7 f8e7 d5d6 e7c7 d6c7,1847,74,100,176,advancedPawn crushing long middlegame,https://lichess.org/J0FetblA/black#62,,2157571
902,ArEqF,1k6/ppp3pp/8/8/3r3b/2Nq4/PP3QP1/R1K2R2 w - - 0 35,f2d4 h4g5 f1f4 d3d4,1847,75,100,243,crushing endgame intermezzo pin short,https://lichess.org/s2NyhkFl#69,,950165
903,1Wl6g,3r1qk1/1b4p1/pp1r3p/5p2/P1PN4/1P3P2/5QPP/3RR1K1 w - - 1 40,d4e6 d6e6 d1d8 e6e1 f2e1 f8d8,1847,75,100,106,advantage intermezzo long middlegame,https://lichess.org/lHYzOFGp#79,,133687
904,gLZVF,6k1/1p4pp/2p5/p1P2nN1/P2PqP2/2P3K1/3Q3P/8 w - - 5 33,g3g4 f5e3 g4g3 e3f1 g3h4 f1d2 g5e4 d2e4,1847,75,100,806,crushing endgame fork master pin veryLong,https://lichess.org/07vGvQR1#65,,3702214
905,T07vy,8/8/3q1pk1/1p1p2p1/p2P2Qp/P1P2P1P/1P3KP1/8 w - - 8 40,g2g3 f6f5 g3h4 f5g4,1847,74,100,168,crushing endgame queenEndgame short trappedPiece,https://lichess.org/mXK47f76#79,,2536449
906,6CjKq,4R1Q1/b1p4p/p1p2p2/2P2bpk/1P1q1B2/P5P1/5P1P/6K1 w - - 6 29,f4e3 d4d1 g1g2 f5h3 g2h3 d1f1,1847,74,100,211,attraction endgame kingsideAttack long mate mateIn3 sacrifice,https://lichess.org/fFVeAfyy#57,,543339
907,GIwcU,r2qkb1r/2p1pppp/p1n2n2/1p1P4/Q7/2N1B3/PPP2PPP/R3K1NR w KQkq - 0 12,c3b5 a6b5 a4b5 d8d5,1847,75,100,360,advantage opening short,https://lichess.org/r0FKbs1h#23,Nimzowitsch_Defense Nimzowitsch_Defense_Scandinavian_Variation,1426289
908,p9Dkf,8/2N3k1/p2Q1pp1/1pn2q1p/4rP2/P1P4P/6PK/3R4 b - - 0 33,f5f4 d6f4 e4f4 d1d5,1847,74,100,153,advantage endgame short,https://lichess.org/RBe1mANU/black#66,,4473300
909,EsGVG,rn1qr1k1/pp3ppp/3b4/2p3B1/3pB1b1/1P1P1N2/P1P2PPP/R2Q1RK1 b - - 2 13,g4f3 d1f3 d8g5 e4b7 b8d7 b7a8,1847,74,100,105,advantage long middlegame trappedPiece,https://lichess.org/j69O8SIe/black#26,French_Defense French_Defense_Queens_Knight,1300946
910,pTeYV,8/5Q2/1p2pppk/2q4p/P1P4P/2P3P1/2r2P2/5RK1 b - - 4 31,c2c3 f7f6 c3g3 g1h2,1847,74,100,282,crushing endgame short,https://lichess.org/P1MlmW4l/black#62,,4502358
911,4q89f,8/R7/P1p5/3n2p1/7p/3kp2P/6P1/5K2 w - - 1 57,a7d7 d3d2 f1g1 e3e2,1847,75,100,77,advancedPawn crushing endgame short,https://lichess.org/NTFEShnk#113,,423595
912,IO0or,2rq1rk1/1p1bppbp/p7/n3P2p/8/P1NQBN1P/1PP3P1/R4RK1 b - - 1 16,a5c4 f3g5 f7f5 e5f6,1847,74,100,446,crushing enPassant middlegame short,https://lichess.org/vArH7yFt/black#32,Sicilian_Defense Sicilian_Defense_Dragon_Variation,1607905
913,UF03V,8/8/p5p1/1p3kP1/1P1P3P/P3K3/8/8 w - - 1 47,h4h5 g6h5 d4d5 f5g5 d5d6 g5f6 d6d7 f6e7,1847,75,100,203,crushing endgame pawnEndgame veryLong,https://lichess.org/ZnYB3dK3#93,,2644897
914,FbNH0,1B2r1k1/1Q2b2p/p3P3/1bpp1p2/6p1/1Pq2N2/P1P2PPP/2RK3R w - - 0 20,h1e1 g4f3 b8e5 b5e2 e1e2 f3e2 d1e2 c3e5,1847,75,100,65,advancedPawn advantage attraction middlegame veryLong,https://lichess.org/YFVbsbAS#39,,1364493
915,j6GU0,2r1k2r/6p1/4p1p1/1p2qpP1/3nN3/2PQ3P/PP3P2/2R1K2R w Kk f6 0 24,d3d4 e5d4 c3d4 c8c1,1847,74,100,237,crushing middlegame short,https://lichess.org/FRybWH4u#47,,3943410
916,iO6DO,1r3rk1/5ppp/p7/q2Np1P1/2P1N3/1P5P/P1Q1K3/R5b1 b - - 0 23,g1d4 e4f6 g7f6 d5f6 g8g7 c2h7,1847,75,100,194,kingsideAttack long mate mateIn3 middlegame sacrifice,https://lichess.org/AdP7rKRu/black#46,,3880977
917,Jx4mo,8/1kp5/7r/2PKR3/8/8/8/8 w - - 13 64,e5e6 h6e6 d5e6 b7c6 e6e5 c6c5,1847,75,100,123,crushing endgame long rookEndgame,https://lichess.org/6UUtQA7X#127,,1744933
918,K5plN,5r1k/pp1q2pb/2p3np/2N3r1/2Q5/2BB4/PPP2PPP/2R3K1 b - - 5 23,d7h3 c3g7 h8g7 c5e6 h3e6 c4e6,1847,75,100,153,advantage attraction fork long master middlegame sacrifice,https://lichess.org/XRVuantK/black#46,,1757270
919,GXaJh,4r2k/p1p3pp/8/8/8/P6P/1P1rpPP1/2R1R1K1 w - - 3 29,b2b4 e8d8 f2f4 d2d1 c1c7 d1e1,1847,74,100,747,advantage endgame interference long pin quietMove rookEndgame,https://lichess.org/vrYOAukB#57,,1446883
920,yaIiS,5r1r/pk1n1Qpp/2q5/3N4/8/1R6/PPP2P2/5K2 b - - 7 28,b7a8 d5c7 c6c7 f7d5 c7c6 d5c6,1848,75,100,111,clearance long mate mateIn3 middlegame sacrifice,https://lichess.org/0BM0mLXx/black#56,,5299656
921,Cyx7B,r1rk1b2/p7/Pp2R3/3PN1pp/R7/2n4P/3N1PP1/6K1 w - - 3 33,e5c6 c8c6 e6c6 c3a4,1848,75,100,616,advantage master middlegame short,https://lichess.org/zZ8vluPU#65,,1135897
922,8C5oi,r4rk1/p5p1/8/2B2qNQ/2P2P2/3p2P1/P6P/4R1K1 b - - 0 27,f5c5 g1f1 c5g5 h5g5,1848,75,100,75,crushing defensiveMove endgame master short,https://lichess.org/EiTbvIK2/black#54,,717025
