,PuzzleId,FEN,Moves,Rating,RatingDeviation,Popularity,NbPlays,Themes,GameUrl,OpeningTags,ID
2347,jBONS,6n1/3R2pk/8/4N1Pp/5P2/1p5P/6K1/2r5 b - - 0 40,h5h4 g5g6 h7h6 d7d8,2242,76,100,194,crushing endgame short,https://lichess.org/UaGIiOw2/black#80,,3950765
2348,eY0Kz,1rr4k/p2N1pbp/6p1/2Q3P1/5q2/2P5/PP3PP1/1K1RR3 w - - 5 26,c5e3 b8b2 b1b2 f4b4 b2a1 g7c3 e3c3 b4c3,2242,76,100,133,attraction crushing deflection fork middlegame pin sacrifice veryLong,https://lichess.org/3booAZMc#51,,3544924
2349,qB6bx,2r2r1k/5p2/p4P1p/1p2P1p1/3R4/5Q1P/Pq3P1K/6R1 w - - 0 36,g1g5 b2d4 g5h5 d4d2 f3e3 d2e3,2242,76,98,167,crushing endgame hangingPiece long,https://lichess.org/IeMHfSQh#71,,4563217
2350,hbWoz,1brq1rk1/3b4/p3p1Bn/1p1pP1N1/3P4/PP6/2P4P/R1BQ2K1 b - - 0 22,g8g7 d1h5 b8e5 g5e6,2242,76,98,353,advantage middlegame short,https://lichess.org/HdPx7WTd/black#44,,3811936
2351,Q2FGu,2r2rk1/3n1pp1/1qn1p2p/pQ1pPP2/Pp1P4/1P6/1BRN2PP/R6K b - - 2 25,c6d4 b5b6 d7b6 c2c8 f8c8 b2d4,2243,75,98,273,advantage long middlegame,https://lichess.org/siBjZIrm/black#50,,2276763
2352,NgKr9,8/p5p1/6P1/1p3k1K/7P/1P6/P7/8 w - - 0 52,b3b4 f5f4 a2a4 b5a4,2243,76,98,207,crushing endgame pawnEndgame short,https://lichess.org/djIDaone#103,,2070992
2353,kr1rf,3r2k1/pp4p1/3Pq1b1/2P2r2/3B3Q/5p2/PP3P2/3R1RK1 w - - 0 32,h4d8 g6e8 d8h4 e6g6 h4g3 f5g5,2243,76,98,166,clearance crushing defensiveMove long middlegame pin,https://lichess.org/G1EQ7ypY#63,,4097631
2354,yHnof,8/1n1b1pk1/p2p4/1p1Pp1p1/1P2PqP1/2PK1P2/2B1Q2r/R3N3 w - - 5 37,e2e3 b7c5 b4c5 d6c5 c2b3 c5c4 b3c4 b5c4,2243,76,100,213,crushing fork middlegame sacrifice veryLong,https://lichess.org/CeRNRpOz#73,,5273599
2355,jjSbH,8/2n3k1/4P1P1/p1p1K3/1p2P3/P7/1P6/8 w - - 0 37,a3b4 c5b4 e5d6 c7e6,2243,75,99,193,crushing endgame knightEndgame short,https://lichess.org/muVqfpty#73,,3999093
2356,rnOtM,3r4/pp4kp/6p1/5p2/4bn2/1Q3PP1/PPr4P/R5K1 w - - 0 25,f3e4 f4h3 g1f1 d8d2 b3c2 d2c2,2243,76,100,70,crushing endgame long,https://lichess.org/gBB5Z7dD#49,,4705171
2357,JAABt,5knR/1p3pp1/p3p3/4P3/1K4P1/1P2QN2/P1r2P2/1q6 b - - 8 30,b1a2 e3d3 a6a5 b4b5 c2c5 b5c5,2243,76,99,189,crushing endgame long,https://lichess.org/Pwl97mi9/black#60,,1676245
2358,bnwoX,r4b1k/p1q2p2/7p/3p1Q2/1p2rP2/6N1/PPP5/2K3RR b - - 1 29,e4f4 f5g5 f7f6 h1h6 f8h6 g5h6 c7h7 h6f4,2243,76,98,232,crushing deflection exposedKing middlegame pin veryLong,https://lichess.org/G3NPTpm4/black#58,,3305168
2359,lBNDe,3r2k1/4q1p1/1pbp1nB1/2n5/p1P4Q/P3pPP1/1P2P1K1/3RR3 b - - 1 28,e7e5 e1h1 g8f8 h4h8 f6g8 h1h5,2243,75,99,155,advantage clearance long middlegame quietMove,https://lichess.org/Yppib4I7/black#56,,4126063
2360,n55H8,R7/1p4pk/8/3p2np/1P2p1q1/2P1Q1P1/1P3PK1/8 w - - 4 35,g2g1 g4d1 g1g2 g5f3 a8a1 d1a1,2243,76,98,248,crushing endgame long quietMove,https://lichess.org/fAeyhzSu#69,,4292451
2361,yydR0,2b5/2P5/2N5/2K5/k7/1p6/8/8 w - - 0 78,c6b4 b3b2 b4d5 a4b3 d5b6 b2b1q b6c8 b1f5 c5d6 f5c8,2243,76,98,68,advancedPawn crushing endgame fork master promotion veryLong,https://lichess.org/AwOE79EL#155,,5334320
2362,uBZ1v,2r3k1/1prbbppp/1q2p3/p2pP3/1P1P3P/P3PN2/N1RQ2P1/2R3K1 b - - 1 21,d7a4 b4a5 c7c2 a5b6 c2c1 a2c1,2243,74,98,203,advantage long middlegame,https://lichess.org/2FLmGS6I/black#42,,4915075
2363,dQTNg,4r1k1/5pp1/2pq3p/4rP2/4p3/1PP1R1Q1/P3R1PP/6K1 w - - 1 31,e3e4 d6c5 g3e3 c5e3 e2e3 e5e4,2243,75,98,275,advantage endgame long,https://lichess.org/AdnfkYPV#61,,3447233
2364,Mzu4E,8/7p/6p1/3p4/5P2/3K2P1/5kP1/8 b - - 3 46,f2g2 g3g4 h7h5 f4f5 g6f5 g4g5 h5h4 g5g6,2243,76,99,163,crushing endgame pawnEndgame quietMove veryLong,https://lichess.org/hefFBhdk/black#92,,2011355
2365,HROlG,6Q1/pp1kq3/2p1n1P1/2Pp1P2/1P6/5K2/P4P2/8 b - - 0 64,e7f6 g8e6 f6e6 f5e6 d7e6 f3g4 e6f6 g4h5,2244,75,99,212,crushing defensiveMove endgame veryLong,https://lichess.org/6OMiJ3Nu/black#128,,1525339
2366,PFsl3,8/Q3r1k1/p2p2pp/3P1p2/2P4q/1P6/P5PP/5RK1 w - - 2 36,a7a6 h4d4 g1h1 d4f2 f1g1 e7e1 a6a7 f2a7,2244,76,98,145,crushing endgame veryLong,https://lichess.org/vXzfIeVJ#71,,2208711
2367,Gj8Bo,5R2/1k6/6P1/3p1n2/1p6/r1p4P/2P5/4K3 b - - 1 58,f5e3 g6g7 a3a1 e1f2 a1f1 f2e3,2244,76,98,181,advancedPawn crushing endgame long,https://lichess.org/UP7qJgty/black#116,,1463242
2368,updxB,1r5k/p1q1r1pp/2pb1p2/4n2Q/3pP3/1P1B1R2/P1P3PP/2B2R1K b - - 7 32,e5f3 e4e5 g7g6 e5d6 c7d6 h5f3,2244,75,99,188,advantage long middlegame,https://lichess.org/HrT0il6e/black#64,,4971369
2369,FA0YU,3k4/1p6/p1p2p1p/2P1p1P1/1P5P/2P2P1K/8/8 b - - 0 32,f6g5 h4g5 h6g5 h3g4 d8e7 g4f5 e5e4 f3e4,2244,76,98,308,crushing endgame pawnEndgame veryLong,https://lichess.org/zJf8WySD/black#64,,1325836
2370,4lijy,8/6pp/3k4/1p2p1PP/p1p1K3/P1P2P2/1P6/8 w - - 0 36,f3f4 e5f4 e4f4 g7g6 h5g6 h7g6 f4e4 d6e6,2244,75,99,229,crushing defensiveMove endgame pawnEndgame veryLong zugzwang,https://lichess.org/HkBBN0Pu#71,,417401
2371,xZPSI,3r2k1/R5pp/2R1p3/3nN3/pp1P2PP/r4P2/6K1/8 b - - 0 32,b4b3 c6d6 a3a2 g2g3 d8c8 d6d7,2244,76,98,129,advantage defensiveMove endgame long,https://lichess.org/c68IFkKt/black#64,,5210897
2372,eo3dX,2r5/1p1b1k2/8/1P1N1p2/1QnPp1p1/4P1P1/5P1P/2q2BK1 b - - 0 34,c4d2 b4e7 f7g6 d5f4 g6h6 e7f6 h6h7 f6f7 h7h8 f4g6,2244,76,98,370,exposedKing fork mate mateIn5 middlegame veryLong,https://lichess.org/jy9yX0Kr/black#68,,3567492
2373,gzDy6,r2q1k1r/1b1pbpNp/2n1p3/pN6/1p2P3/3BBP2/PPPQ2P1/2K4R b - - 0 18,f8g7 e3h6 g7g8 d2f4 e7g5 h6g5,2244,76,98,291,clearance crushing long middlegame,https://lichess.org/MeIGIdfc/black#36,Sicilian_Defense Sicilian_Defense_Kan_Variation,3758199
2374,CVhqw,3r2kr/1pp1bp1n/p1nq2PQ/4p1P1/3pP3/2PP4/PPB2P2/R1B1K1R1 b Q - 0 23,h7g5 g6f7 g8f7 c2b3 f7e8 h6h8,2244,76,100,99,advancedPawn advantage attraction interference kingsideAttack long middlegame pin,https://lichess.org/C2IIaDzZ/black#46,,1094636
2375,mJDYx,8/8/6pp/8/p5PP/8/kPK5/8 b - - 10 63,a2a1 b2b4 a4b3 c2b3 g6g5 h4g5,2244,75,98,201,crushing endgame long pawnEndgame quietMove,https://lichess.org/qrY6NkrD/black#126,,4225070
2376,ND0We,1k6/1p1n4/p1q1rr2/6Q1/1PpP4/2P3P1/R4P2/R5K1 b - - 0 35,f6h6 d4d5 e6g6 d5c6 g6g5 c6d7,2245,75,98,126,advancedPawn advantage fork long middlegame,https://lichess.org/Phip1WT3/black#70,,2029752
2377,MhEot,r1q2rk1/ppp2pbp/3pbnp1/8/3QP3/1PN3P1/PBP2PBP/R3R1K1 b - - 0 12,f6d5 c3d5 g7d4 d5e7 g8g7 b2d4,2245,75,98,281,advantage fork intermezzo long middlegame sacrifice,https://lichess.org/K5WLPGia/black#24,Pirc_Defense Pirc_Defense_Other_variations,1985119
2378,K1I2i,r2q1r1k/1pp1n1p1/p6n/3p2NQ/3b4/1B6/PP3PPP/4RRK1 b - - 1 26,d8d6 e1e6 f8f2 f1f2,2245,76,100,94,advantage middlegame short,https://lichess.org/k33LMX1c/black#52,,1750895
2379,ixoVT,1B2k3/1p1r2p1/p3pp1p/PPP5/2P3P1/5P2/6P1/6K1 b - - 2 44,d7d2 c5c6 b7c6 b5a6 d2a2 b8c7 e8d7 a6a7 d7c7 a7a8q,2245,74,98,549,advancedPawn crushing deflection endgame promotion quietMove veryLong,https://lichess.org/RdslfxUl/black#88,,3931533
2380,XHwlH,6k1/5pbp/p2P2p1/6P1/1P2r3/P1p1q1B1/2Q3KP/3R4 b - - 0 32,e4e8 d1e1 e3e1 g3e1,2245,76,98,443,crushing endgame master short,https://lichess.org/yxD4e2Y9/black#64,,2910203
2381,ul7aj,8/2Q2pkp/2p3p1/4P3/P1bp1P2/7P/5BPK/3q4 b - - 1 28,c4d5 e5e6 d5e6 c7e5 f7f6 e5e6,2245,75,99,163,clearance crushing deflection endgame long pin,https://lichess.org/i0Xf751Z/black#56,,4965105
2382,8GqLe,4r2k/3p2pp/2rB1p2/pNP1pPqn/4Q3/P5P1/1R4KP/5R2 w - - 3 29,h2h4 g5g3 g2h1 g3h3 h1g1 h3f1 g1f1 h5g3 f1g1 g3e4,2245,75,98,188,advantage attraction fork middlegame sacrifice veryLong,https://lichess.org/RPG0vvZ9#57,,723730
2383,Jr7Pk,1r2krR1/3p4/p2Pp2p/n7/2p2P1q/2P2P2/PPKQ3P/6R1 b - - 3 30,b8b5 g8f8 e8f8 d2g2 b5g5 f4g5,2245,75,98,273,crushing long master middlegame quietMove,https://lichess.org/V1IypFar/black#60,,1736552
2384,n2c1S,3r2k1/5p1p/p4pnQ/1p2p3/7P/5qP1/P1B2P2/5RK1 b - - 1 29,d8d2 c2g6 h7g6 h6d2,2245,75,98,157,advantage endgame master short,https://lichess.org/E6swd816/black#58,,4288884
2385,5yCXT,8/6pk/6q1/pp5p/2p1Q2P/P3KP2/1P3P2/8 w - - 0 53,e3e2 g6e4 f3e4 g7g5,2246,75,98,105,crushing endgame queenEndgame short,https://lichess.org/tzmYxPto#105,,522644
2386,Aq4QI,rn1q1rk1/ppp1b1pp/3p4/5b2/3PNBn1/3Q1NPP/PPP5/3KRB1R b - - 0 13,f5e4 d3b3 d6d5 h3g4 e4f3 b3f3,2246,76,98,527,advantage long opening,https://lichess.org/4dFTB1Xp/black#26,Kings_Gambit_Accepted Kings_Gambit_Accepted_Cunningham_Defense,948565
2387,JCdNd,4R3/8/P7/8/4nk2/8/4p1PK/8 w - - 0 51,e8d8 e2e1q d8f8 f4g4,2246,74,99,154,advancedPawn crushing defensiveMove endgame master promotion short,https://lichess.org/HrAwO0fw#101,,1679743
2388,k4mqK,8/8/8/4p1R1/4k1pP/3p2P1/r4P2/4K3 w - - 0 54,g5g4 e4f3 g4g5 a2e2 e1d1 f3f2,2246,76,98,198,crushing defensiveMove deflection endgame long master rookEndgame,https://lichess.org/i52a5ZJM#107,,4029050
2389,tl4Ml,3r3r/p3k1p1/B1p3p1/3n1pP1/5q2/Q6P/PP1R4/1K1R4 b - - 1 29,f4b4 d2d5 b4a3 d5e5 e7f7 a6c4,2246,76,100,105,crushing exposedKing long middlegame sacrifice,https://lichess.org/OXjpX74R/black#58,,4877510
2390,UichG,8/Q4pkp/6p1/2p5/P7/2q5/3r1PPP/5RK1 w - - 0 27,f1b1 c3d3 h2h3 d3b1,2246,76,98,77,crushing endgame short,https://lichess.org/ucHhykJh#53,,2686096
2391,ij7Vr,8/8/8/R3bk2/4p3/4K2p/8/8 w - - 0 42,e3f2 e4e3 f2e3 h3h2,2246,75,99,134,advancedPawn crushing endgame short,https://lichess.org/ISrJDv0q#83,,3910618
2392,Zesmf,r1b2r1k/p3qpp1/1pR4p/3QN2B/3P4/8/PP3PPP/5K2 b - - 2 22,c8e6 c6e6 e7e6 e5f7 e6f7 h5f7,2247,75,100,146,advantage kingsideAttack long middlegame,https://lichess.org/dAifGe9I/black#44,,3117283
2393,mjkwr,8/8/8/p5K1/2k5/2p5/2N5/8 w - - 0 56,g5f4 c4d3 c2e1 d3d2,2247,76,100,102,crushing defensiveMove endgame knightEndgame short,https://lichess.org/g95paxJI#111,,4262521
2394,Gfzk2,8/8/p4k2/1pp1pP1p/4Kp1b/1PP4P/P4P2/4B3 w - - 0 33,c3c4 b5b4 e4d5 f6f5 d5c5 e5e4 c5d5 e4e3 f2e3 h4e1,2247,75,99,159,bishopEndgame crushing endgame quietMove veryLong,https://lichess.org/8nhgqsVK#65,,1458901
2395,AY65a,r2q4/pbpn1kbn/1p1p2p1/8/3P2Q1/2NBB3/PPP3PP/R5K1 b - - 1 15,h7f8 d3c4 d6d5 c3d5 b7d5 c4d5,2247,75,98,72,crushing long middlegame,https://lichess.org/xUDH0gnz/black#30,Rat_Defense Rat_Defense_Harmonist,923247
2396,9XckK,8/5p2/p2p1Ppp/2p1k1P1/4P2P/2P2K2/P7/8 w - - 0 43,f3e3 h6g5 h4g5 d6d5 e4d5 e5d5,2247,76,98,319,crushing endgame long pawnEndgame,https://lichess.org/9hZEJNDo#85,,835099
2397,BDVy8,r5k1/p1pnppbp/4q1p1/8/2PP4/N5Pb/P3PP1P/R1BQ1RK1 w - - 2 14,f1e1 e6e4 f2f3 e4d4 d1d4 g7d4 c1e3 d4e3,2247,75,98,255,advantage fork middlegame veryLong,https://lichess.org/NtObJm5p#27,Indian_Defense Indian_Defense_Przepiorka_Variation,981645
2398,zOw0l,8/p5P1/1pR5/8/3k3P/1Kp5/6r1/8 b - - 4 52,d4d5 c6c7 c3c2 b3b2,2247,75,98,89,advantage endgame rookEndgame short,https://lichess.org/WMFTGji1/black#104,,5371435
2399,htQpC,2r3k1/4bpp1/p2P3p/1p2p3/8/2P1qnP1/PP1R1P2/3R1Q1K b - - 3 38,f3d2 f2e3 d2f1 d6e7 c8e8 d1d8 f7f5 d8e8,2247,76,99,309,advancedPawn advantage endgame kingsideAttack pin veryLong,https://lichess.org/cBJinI79/black#76,,3837611
2400,H7eVQ,5r1k/p1N3pp/1n4r1/7q/3Pn3/1Q2B1P1/PP3PKP/2R2R2 w - - 1 25,b3d3 h5f3 g2g1 e4g5 e3g5 f3d3,2247,75,99,206,advantage long middlegame quietMove,https://lichess.org/tC3U3NtO#49,,1497917
2401,vnZFP,8/8/7p/3K3P/8/5k2/5P2/8 b - - 6 45,f3f2 d5e4 f2e2 e4f5 e2d3 f5g6,2247,75,99,219,crushing endgame long pawnEndgame,https://lichess.org/fF22H7K7/black#90,,5055789
2402,xo1yy,8/1p6/p3p1p1/5k1p/P6P/2P2KP1/1P6/8 b - - 3 36,e6e5 a4a5 e5e4 f3e3,2247,76,99,112,crushing defensiveMove endgame pawnEndgame quietMove short,https://lichess.org/9SK101su/black#72,,5231511
2403,FDQw4,2kr4/pppq2r1/4p2p/4Pp2/2Qb1P2/6PP/PP1R4/2KR4 b - - 1 23,d4b2 c1c2 d7d2 d1d2 d8d2 c2d2,2247,74,98,152,advantage defensiveMove long middlegame,https://lichess.org/Qhj42Ls0/black#46,,1330753
2404,BGFMf,r2q1rk1/p1p2p1p/2p4B/2bppR2/4n3/8/PPP3PP/RN1Q3K b - - 2 17,e4f2 f5f2 d8h4 h6f8 c5f2 f8a3,2247,75,98,86,advantage defensiveMove long middlegame,https://lichess.org/givLRo08/black#34,Italian_Game Italian_Game_Scotch_Gambit,985494
2405,ERGEr,3r1k2/1pQ2ppp/2b1p3/p1Rp4/8/P7/1q3PPP/2R3K1 b - - 5 27,d8d7 c7b8 f8e7 c5c6,2248,76,100,133,advantage endgame short,https://lichess.org/F4BmrqfD/black#54,,1262986
2406,DCBDU,3r2k1/p1Q2pp1/1p3n1p/8/1q6/1B6/PP1r1RPP/5R1K b - - 17 30,d2f2 c7d8 g8h7 d8d3 b4e4 f1f2 e4d3 b3c2,2248,76,99,676,advantage hangingPiece middlegame pin veryLong,https://lichess.org/YGI2URru/black#60,,1154499
2407,q2J5k,1N6/5kp1/7p/2bn3P/1p2n1P1/6q1/1PPBQ3/R4K1R w - - 1 25,b8d7 e4d2 e2d2 g3f3 f1e1 f3h1,2248,76,98,381,crushing exposedKing fork long middlegame,https://lichess.org/hBcbGgak#49,,4550960
2408,15O6X,2kr1r2/4R2Q/p1p1bq2/1p3p1p/8/8/PPP3PP/1K1R4 w - - 2 25,d1d8 c8d8 e7a7 e6f7,2248,76,99,156,advantage endgame short,https://lichess.org/fySjV6s2#49,,94957
2409,MxBqk,8/8/2pkbp2/1p1p4/3P1K2/pBP1N3/8/8 w - - 8 45,e3f5 e6f5 f4f5 c6c5 f5f6 c5c4,2248,75,98,91,crushing endgame long master,https://lichess.org/g3tMGA4z#89,,2007540
2410,7Yv31,1rbq1rk1/p3p1bp/6p1/2Pp4/2Q1nB2/4PN2/PPP2PP1/2KR1B1R w - - 0 17,d1d5 g7b2 c1d1 e4c3 d1e1 c3d5,2248,76,98,81,advantage fork long middlegame,https://lichess.org/WG8guF2b#33,Indian_Defense Indian_Defense_Other_variations,661836
2411,QPwpe,1k6/6Q1/1p5P/1Pb2p2/5P2/1B2P3/3q4/6K1 w - - 13 52,h6h7 c5e3 g1h1 d2e1 h1h2 e3f4 h2g2 e1e2,2248,76,98,155,crushing endgame exposedKing veryLong,https://lichess.org/BMlxEJCd#103,,2310114
2412,Us3JZ,4r2k/pp3Rpp/2p5/2q5/3pr3/1Q2P3/PP4PP/5RK1 b - - 1 25,d4e3 b3c3 e3e2 c3c5,2248,75,98,686,advantage endgame master short,https://lichess.org/9KsyMcqP/black#50,,2699398
2413,bTEEu,8/3B4/8/8/R7/1pk4P/6r1/2K5 w - - 1 50,c1d1 g2d2 d1e1 d2d7,2249,75,99,249,crushing endgame fork short,https://lichess.org/H9gUKBtw#99,,3275688
2414,KTwom,2br2k1/1p3ppp/p2rp3/4b3/3NP3/1PPR4/1P2B1PP/3R2K1 b - - 8 24,b7b5 d4c6 d6d3 e2d3,2249,76,100,74,advantage master middlegame short,https://lichess.org/8GobWqrR/black#48,,1791358
2415,dzn6U,2kr3r/ppp2ppp/8/4p1Q1/1n6/2NP1P2/bPP3PP/qNKR3R b - - 6 16,a2b1 g5g4 c8b8 g4b4 b1c2 c1c2,2249,74,98,362,advantage fork long middlegame,https://lichess.org/zihFzZ3V/black#32,Vienna_Game Vienna_Game_Frankenstein-Dracula_Variation,3496961
2416,esvMV,6k1/1p4pp/4n3/3p4/P1rP2PP/QPq1BP2/8/1K1R4 w - - 1 33,d1c1 c3e3 c1c4 d5c4,2249,76,100,259,crushing endgame hangingPiece short,https://lichess.org/KBOt7tIs#65,,3574367
2417,AS2Dg,r3q1k1/1pp1b1pp/p1np3B/6Nn/P3N1Q1/1P1P4/1P4PP/5RK1 b - - 0 18,g7h6 g4e6 g8h8 g5f7,2249,76,100,94,advantage kingsideAttack middlegame short,https://lichess.org/V0Zfm3Rx/black#36,Vienna_Game Vienna_Game_Max_Lange_Defense,914892
2418,RsNWL,2k4r/ppp3p1/2P1p3/7n/3P3q/1P1B2b1/PBPN2P1/R2Q1RK1 w - - 1 20,d2f3 g3f2 f1f2 h4h1 g1h1 h5g3 h1g1 h8h1,2249,76,98,887,attraction doubleCheck kingsideAttack mate mateIn4 middlegame sacrifice veryLong,https://lichess.org/YZ7LWomc#39,,2437950
2419,rKcpY,r3rk2/pp1q1p2/2p1bQ2/5B2/3P4/2P4P/PP4P1/4R1K1 b - - 10 29,d7d8 f6h6 f8e7 f5e6,2249,75,98,235,crushing middlegame short,https://lichess.org/gRyDSPXR/black#58,,4664569
2420,bQtgc,8/p7/1p4kP/4K1P1/8/8/8/8 b - - 0 53,a7a5 e5e6 a5a4 h6h7 g6h7 e6f7 b6b5 g5g6 h7h6 g6g7,2250,74,98,304,advancedPawn crushing endgame exposedKing pawnEndgame veryLong,https://lichess.org/2TWNHrZs/black#106,,3272404
2421,1cgsm,2bqk2r/5p1p/4p3/1pPn1p2/rP3N2/5Q2/5PPP/2RR2K1 b k - 2 23,a4b4 f4d5 e6d5 f3c3,2250,75,99,336,advantage middlegame short,https://lichess.org/VTKNJtj8/black#46,,142058
2422,zQLeK,2k5/5R2/1P1Np3/2b1P2p/5P2/p7/7r/1K6 b - - 1 50,c5d6 b6b7 c8b8 e5d6 h2h1 b1a2,2250,76,100,166,advancedPawn crushing endgame intermezzo long master,https://lichess.org/5kpnY7mP/black#100,,5373457
2423,r4ema,2krQ3/ppp2ppp/5q2/2Pn4/2B2p2/8/PP4PP/R1B1R1K1 b - - 0 18,d8e8 e1e8 c8d7 e8e4,2250,76,99,208,advantage middlegame short,https://lichess.org/xDHNIdGW/black#36,Kings_Gambit_Accepted Kings_Gambit_Accepted_Abbazia_Defense,4641589
2424,reBcN,r3k2r/1p4p1/p1n1p1Qp/q2pP3/3P4/8/5PPP/2R2RK1 b kq - 1 19,e8d7 c1c6 b7c6 g6g7,2250,75,98,276,advantage middlegame short,https://lichess.org/YQBv4AO5/black#38,,4692116
2425,UrW4L,8/1p2b3/2k5/P5pp/7P/3KB3/8/8 w - - 0 41,e3g5 e7g5 h4g5 c6d5 g5g6 d5e6,2250,75,99,540,bishopEndgame crushing defensiveMove endgame long,https://lichess.org/12kTPUZ0#81,,2698660
2426,LvBjy,3r2k1/p3q2p/1p4pP/2b2p2/8/1P2PQP1/PB1r1P2/1R3RK1 w - - 0 26,f1d1 e7e4 d1d2 e4b1 g1h2 d8d2,2250,75,100,127,advantage intermezzo long middlegame,https://lichess.org/v29kpNlf#51,,1917027
2427,fRm08,5rk1/5qbp/4p1p1/8/Q1BP4/5b2/PP4PP/RN1R2K1 w - - 0 23,d1f1 g7d4 g1h1 f3g2 h1g2 f7b7 g2g3 d4e5,2250,75,98,179,attraction crushing middlegame veryLong,https://lichess.org/x2pZvS1p#45,,3623282
2428,4Y450,5r1k/3q2pp/Bp1b1n2/2pP4/P4p1Q/2BP4/1PP3RP/6K1 b - - 2 30,d7a4 g2g7 h8g7 h4g5 g7h8 c3f6 f8f6 g5f6,2250,75,100,218,attraction crushing deflection kingsideAttack middlegame sacrifice veryLong,https://lichess.org/9rTj3Hya/black#60,,398164
2429,CDVZ4,r1b1r1k1/1pp1qp2/p4n1p/6pn/3P4/4PNB1/PPQ1BPPP/R4RK1 w - - 0 15,c2c7 h5g3 c7g3 f6e4 g3e5 e7d8,2250,75,98,134,advantage long middlegame,https://lichess.org/RPjnzsYN#29,Queens_Gambit_Declined Queens_Gambit_Declined_Modern_Variation,1069011
2430,WJ1tU,8/1p4q1/p1p1p1k1/3pPp1r/P2P1PpR/6P1/1PP3K1/7Q b - - 7 32,g7h6 h4h5 h6h5 h1h5 g6h5 a4a5,2250,75,98,103,advantage defensiveMove endgame long,https://lichess.org/qiiNcXKp/black#64,,2824539
2431,JWH6e,5B2/8/1b2k3/1p3p1p/pP1p2p1/P2K2P1/2P2P1P/8 w - - 0 32,f8c5 b6c5 b4c5 b5b4 a3b4 a4a3,2250,75,99,284,bishopEndgame crushing endgame long,https://lichess.org/NZbxTDgl#63,,1707424
2432,kC0E7,3rk2r/p2Rp3/2Q2p1b/3pNq2/3P4/4P1Pp/P3bP1B/1R4K1 b k - 0 29,f6e5 d7d8 e8f7 c6d5,2250,76,99,132,advantage doubleCheck middlegame short,https://lichess.org/A8fBOHxQ/black#58,,4039275
2433,7Ug7V,5r1k/3P2pp/8/8/3P4/b5PP/2R2PK1/8 b - - 0 46,f8d8 c2e2 h7h5 e2e8 h8h7 e8d8,2250,75,98,238,crushing endgame long quietMove,https://lichess.org/FQvWOUf7/black#92,,655888
2434,2c6vt,8/8/2k2pp1/4p3/p1p1P1PK/2P5/PP6/8 b - - 0 39,a4a3 b2a3 c6b5 g4g5 f6g5 h4g5 b5a4 g5f6 a4a3 f6e5,2250,74,98,258,crushing endgame pawnEndgame veryLong,https://lichess.org/2UqTeGVY/black#78,,228757
2435,LXEVQ,8/1p3k1p/p3r1p1/2BQP3/1P3q2/P1r5/7P/6RK b - - 0 32,f4e5 g1f1 f7g8 d5d8 e6e8 f1f8,2250,76,99,136,advantage endgame long,https://lichess.org/Ws4hRXMv/black#64,,1882934
2436,5qTuS,8/8/pp1k2pp/8/3K1PPP/8/P7/8 w - - 2 48,d4c4 h6h5 g4h5 g6h5 f4f5 d6e5,2250,74,98,512,crushing endgame long pawnEndgame,https://lichess.org/5wDMfPqr#95,,511681
2437,jDIxv,4Q3/p5pk/2p1pp1p/2Pp4/3P1P2/4PN1P/5nPK/q7 w - - 4 33,e8e6 a1h1 h2g3 f2e4 g3h4 h1g2,2251,75,98,283,crushing deflection endgame long,https://lichess.org/c6o4KL82#65,,3953449
2438,BBJ7a,8/8/8/5p2/7k/3K1P2/8/8 w - - 0 67,d3e2 f5f4 e2f2 h4h3,2251,76,98,169,crushing defensiveMove endgame pawnEndgame quietMove short,https://lichess.org/j6SS7dyO#133,,978443
2439,Eh69U,4R3/5ppk/2p3r1/p2p2P1/P2P1P1q/5Q2/5PK1/8 b - - 0 35,f7f6 e8e1 f6g5 e1h1 g5f4 g2f1,2251,76,98,666,advantage defensiveMove endgame long pin quietMove sacrifice,https://lichess.org/2hjH8C0V/black#70,,1285342
2440,6KFIN,r4rk1/p1p2pp1/8/nR4NQ/2b5/q3P3/5PPP/5RK1 b - - 3 19,f8d8 h5h7 g8f8 b5e5,2251,75,99,218,crushing master middlegame short,https://lichess.org/ESzTogcN/black#38,,553965
2441,eyrAP,8/8/R4n2/5qkp/5p2/5Q2/6PK/8 w - - 4 53,a6a8 f6g4 h2g1 f5c5 g1f1 g4h2,2251,76,98,313,crushing endgame long,https://lichess.org/YHl8x2RK#105,,3582786
2442,2GrPG,2r3k1/pp2b1pp/2n3b1/8/3PNrP1/2PB3P/PPKN4/R5R1 w - - 4 23,a1f1 c6b4 c2d1 b4d3 f1f4 d3f4,2251,76,98,456,advantage deflection long middlegame pin,https://lichess.org/8ttPyVXe#45,,198923
2443,HN56M,r3kb1r/pp1n1ppp/2pp1n2/q5B1/2PPN1b1/4PN2/PP2BPPP/R2QK2R w KQkq - 1 10,e4c3 g4f3 e2f3 a5g5,2251,76,98,100,advantage capturingDefender opening short,https://lichess.org/DReIiWLy#19,Old_Indian_Defense Old_Indian_Defense_Janowski_Variation,1519291
2444,zfFk8,2rr4/5p1k/7p/1B2qNp1/1Q2n3/8/6PP/R1R3K1 w - - 0 37,c1c8 e5a1 b5f1 a1a7,2252,75,98,239,advantage hangingPiece middlegame short,https://lichess.org/VXTsjGuH#73,,5394370
2445,Idpg6,2rq1rk1/1b3p1p/p2bpnp1/1p2B1N1/2nP4/P1N5/1P2QPPP/1BR1R1K1 b - - 3 18,f6d5 e2h5 d8g5 h5g5,2252,75,98,284,advantage master middlegame short,https://lichess.org/HcR8qmIh/black#36,Caro-Kann_Defense Caro-Kann_Defense_Panov_Attack,1630525
2446,3RIxA,2r3kb/3q1p1p/p1r1p1pB/1p1n4/1P1PN3/2P2Q1P/2R2PP1/2R3K1 b - - 8 26,h8d4 c3d4 c6c2 c1c2,2252,76,98,282,crushing hangingPiece middlegame short,https://lichess.org/C1RG2Wnj/black#52,,301024
2447,e2VHL,r5k1/6pp/2pNqn2/2P5/1P4b1/6P1/3QP1BP/1R2K3 w - - 1 26,g2c6 a8a2 c6d5 e6d5 d2d5 f6d5,2252,76,98,128,advantage long middlegame,https://lichess.org/LFf0wc9Q#51,,3500744
2448,lQgOy,3k4/8/8/4K1pp/5p2/7P/6P1/8 b - - 1 52,d8e7 e5f5 g5g4 h3g4 f4f3 g2f3 h5g4 f5g4,2252,75,100,186,crushing endgame master pawnEndgame veryLong,https://lichess.org/IWl8Rfy5/black#104,,4147775
2449,G1CJM,r7/pp2k3/3pp2Q/4p2b/3pP2P/P2P4/BPP2r2/2K5 w - - 0 27,h6h5 f2f1 c1d2 a8f8,2252,75,98,100,advantage defensiveMove endgame short,https://lichess.org/FfkkyZtq#53,,1401013
2450,FpQ5M,4kr2/8/1Q5p/3q2p1/3p2n1/P2P2P1/4P2P/2R3K1 b - - 0 35,g4e3 c1c8 e8e7 c8c7 d5d7 c7d7,2252,75,98,187,crushing endgame exposedKing long,https://lichess.org/VVW5n6aY/black#70,,1384421
2451,KYwl5,8/4b3/2k5/2P1pPp1/2K1P2p/4B2P/8/8 w - - 7 39,e3d2 g5g4 d2e3 g4h3 e3g1 e7c5 g1h2 c5f2,2252,76,98,208,bishopEndgame crushing defensiveMove endgame veryLong,https://lichess.org/P5rXWHZx#77,,1798299
2452,p7r4d,r2r2k1/3N1p2/4p1p1/1p1p3Q/pPnP1qRP/P1P5/5PP1/R5K1 w - - 5 29,g2g3 f4f5 g4g5 d8d7,2252,75,98,187,advantage middlegame short,https://lichess.org/S3rgYlkU#57,,4471353
2453,KNo0x,8/6p1/4kpP1/4N3/7P/8/1pK2P2/8 b - - 0 49,e6e5 h4h5 e5f5 f2f4 b2b1r c2b1,2252,76,98,103,crushing endgame long pawnEndgame quietMove,https://lichess.org/r7byDmQC/black#98,,1782679
2454,mNGvh,1r4k1/3pppbp/6p1/4q3/b3B1R1/2P1Q3/1B3P1P/1K1R4 w - - 0 26,e4c2 a4c2 b1c2 e5f5 g4e4 d7d5 e3f4 f5e4 f4e4 d5e4,2253,75,98,211,advantage attraction exposedKing fork middlegame pin veryLong,https://lichess.org/Cpu6uHjC#51,,4230800
2455,GW4Ne,2kr4/p4R2/3p4/3Nb3/q3n3/4Q1P1/1PP3PP/6K1 b - - 0 26,a4d4 d5e7 c8d7 e7f5,2253,75,98,390,crushing discoveredAttack middlegame short,https://lichess.org/BhPDZw2C/black#52,,1444771
2456,wuX53,2q4r/4bkp1/pPp2n2/4p1B1/1P2p3/P4Q1p/5P1P/R4RK1 w - - 0 28,f3g3 f6h5 g3b3 f7g6,2253,75,99,247,advantage defensiveMove master middlegame short,https://lichess.org/0aWpYVB6#55,,5153127
2457,0SZMy,8/1p6/4k3/P4pPp/5K2/P4P2/8/8 w - - 0 39,g5g6 h5h4 f4e3 e6f6 f3f4 f6g6 e3f2 g6h5 f2f3 h4h3 f3g3 h3h2,2253,75,100,164,advancedPawn crushing endgame master pawnEndgame quietMove veryLong,https://lichess.org/aXSNyqBZ#77,,40267
2458,2OLaZ,5r1k/p3n1bp/4B1p1/6q1/2Q5/N1P1P3/PP1r1PPP/R4RK1 w - - 1 24,a1d1 f8f2 f1f2 d2d1 f2f1 g5e3,2253,75,100,105,advantage deflection kingsideAttack long middlegame,https://lichess.org/FPxKjPlT#47,,209310
2459,qxH9H,1r6/p5k1/4p3/3pN1P1/b1pPp1R1/1PP1P3/P1K4R/5r2 w - - 1 29,g5g6 c4b3 a2b3 b8b3 h2h7 g7g8,2253,76,98,119,crushing endgame long,https://lichess.org/z5AacpEg#57,,4631297
2460,LGZFq,3r2k1/ppp3pp/4p3/8/2P5/P1B1q3/2Q3BP/3R2KR w - - 8 25,g1f1 d8f8 g2f3 e3f3 f1e1 f3h1 e1d2 f8f2 d2c1 f2c2,2253,74,100,163,advantage exposedKing fork middlegame skewer veryLong,https://lichess.org/GBUksst7#49,,1859424
2461,m5LJA,8/5p2/6p1/1p1kP3/2pB2PP/2P1K3/1P5b/8 b - - 0 37,h2e5 h4h5 g6h5 g4h5,2253,76,99,136,bishopEndgame crushing endgame short,https://lichess.org/sU8fxa38/black#74,,4205791
2462,UyUvx,r6k/pp3Bp1/6p1/8/3Qn3/7P/P1q1KPP1/3R4 w - - 0 24,d1d2 c2d2 d4d2 e4d2,2253,75,98,342,advantage endgame short,https://lichess.org/nAyDDfQW#47,,2708501
2463,e50Tn,2r3k1/p4ppp/1p6/4r3/3qP1n1/P1N3P1/1K5P/2QR1R2 b - - 3 30,e5b5 b2a1 c8c3 d1d4 c3c1 f1c1,2253,74,98,293,advantage defensiveMove long middlegame,https://lichess.org/GqVotZpV/black#60,,3504242
2464,bMr0v,1r2r1k1/p5pp/3R4/2p1P3/q1p1Q1Pb/P3P3/1BP4P/2K2R2 b - - 4 25,b8b2 e4d5 g8h8 c1b2,2253,76,100,154,advantage intermezzo middlegame short,https://lichess.org/7sKA3EuT/black#50,,3266799
2465,cMM9L,5rk1/p6p/2p2p2/3pbNp1/8/2q4P/P1P2QP1/1R5K b - - 3 30,h7h5 f2a7 f8f7 f5h6 g8h7 h6f7,2253,76,99,131,crushing endgame exposedKing fork long,https://lichess.org/2SvMJwI3/black#60,,3353711
2466,ztVfo,R7/P5k1/8/5P2/8/6p1/r7/3K4 w - - 0 46,f5f6 g7f7 a8c8 g3g2 c8c7 f7f6,2253,75,100,144,advancedPawn crushing defensiveMove endgame long master rookEndgame,https://lichess.org/ZUjC10eK#91,,5414397
2467,aViHq,8/3r4/2kP2R1/1p2K3/4p3/P2bP3/8/8 b - - 12 39,d7a7 d6d7 c6c7 g6g8 c7d7 g8g7 d7c6 g7a7,2254,75,100,240,advancedPawn crushing discoveredAttack endgame master quietMove skewer veryLong,https://lichess.org/RnD3ZcGM/black#78,,3191756
2468,j1tF9,3r3k/5pp1/2n5/p1qN1PP1/1pP1Q3/1Pb1R2P/8/7K b - - 0 31,c3d4 e4h4 h8g8 g5g6 f7g6 f5g6 c5d5 c4d5,2254,76,100,103,crushing middlegame veryLong,https://lichess.org/SM2uAwsx/black#62,,3937328
2469,L1RaN,6k1/1pp3bp/3p2p1/3P4/2PN3q/r6b/P2Q1P1P/R1BR2K1 w - - 5 22,f2f3 a3f3 d4f3 h4g4 g1f2 g4g2 f2e3 g7h6,2254,76,100,72,advantage fork middlegame sacrifice veryLong,https://lichess.org/92JkBIyj#43,,1838175
2470,pnIjr,5r1k/1p1Q2p1/1q1p1p1p/p4P2/2P5/P1B2R1P/1P4PK/4r3 b - - 7 30,e1e8 f3g3 f8g8 g3g7 g8g7 d7e8 h8h7 c3f6,2254,76,98,100,advantage deflection endgame kingsideAttack veryLong,https://lichess.org/awzkouVT/black#60,,4529997
2471,4Zmq6,8/pp4k1/1qp2ppp/3pN3/3P1n2/1PQB3P/P4KP1/8 w - - 0 31,e5d7 b6b4 c3b4 f4d3 f2f3 d3b4,2254,76,98,439,advantage attraction deflection endgame fork long sacrifice,https://lichess.org/z4J1n1hs#61,,400499
2472,F5BFU,1b6/8/P7/2B2kpp/2K1p3/4PpP1/5P2/8 b - - 1 48,h5h4 g3h4 g5g4 c5d6 g4g3 d6g3,2254,75,98,146,bishopEndgame crushing endgame long,https://lichess.org/qa7cjTII/black#96,,1319052
2473,ta0az,8/8/8/4pk2/1R6/7p/5Kb1/8 w - - 6 71,b4b5 g2c6 b5c5 h3h2 c5c6 h2h1q,2254,76,99,222,advancedPawn crushing endgame long promotion,https://lichess.org/vAJJmzZC#141,,4861891
2474,beXze,k4r2/1p6/3P2pp/4Q3/Pq2P3/2r4P/5nPK/1R4R1 b - - 2 35,b4a3 e5a5 a8b8 b1b7 b8b7 g1b1 c3b3 a5d5 b7a7 b1b3 a3b3 d5b3,2254,75,100,94,attraction crushing middlegame sacrifice veryLong,https://lichess.org/ZYvMw0Qo/black#70,,3291786
2475,LYfZx,r4rk1/p1q2p1p/1p1bp1p1/2p5/2P4Q/1P3N1P/PB3PP1/4R1K1 b - - 1 20,h7h5 h4f6 e6e5 e1e5 d6e5 b2e5,2255,76,98,134,advantage long middlegame,https://lichess.org/U05CdqsF/black#40,,1885026
