,PuzzleId,FEN,Moves,Rating,RatingDeviation,Popularity,NbPlays,Themes,GameUrl,OpeningTags,ID
2439,rdKQA,3r1rk1/1R5p/6p1/p1p1q3/P7/P2B1Q1P/6P1/3R2K1 b - - 0 34,f8f3 d3c4 f3f7 d1d8 g8g7 b7f7,1343,74,100,1212,crushing discoveredAttack endgame long pin,https://lichess.org/b64Q5OfZ/black#68,,4690869
2440,m9RV4,4r3/3R4/1pk1Pb1p/1p3P1P/1P2K3/P7/8/8 b - - 8 64,e8e7 d7e7 f6e7 e4e5 e7h4 f5f6,1343,74,100,422,crushing endgame long,https://lichess.org/ipKFZxtT/black#128,,4211505
2441,oHIm3,1rbR3R/2k5/2p5/p3p1p1/P6p/1P3P1P/5KP1/8 w - - 0 40,f2e2 c8a6 e2e3 b8d8,1343,74,100,1930,advantage discoveredAttack endgame master short,https://lichess.org/YLXb3nIU#79,,4397159
2442,5D0Lv,2k2r2/ppp5/8/5q1p/6n1/1P3N2/P3QPP1/4R1K1 b - - 1 25,f5c5 e2e6 c8d8 e1d1,1343,74,100,612,crushing endgame short,https://lichess.org/5jlN3FEd/black#50,,455684
2443,TP3ea,3rk2r/B4ppp/2p1pn2/8/1b6/2N5/PPP2PPP/R4RK1 w k - 1 15,c3a4 d8a8 a7d4 a8a4,1343,74,100,838,advantage middlegame short,https://lichess.org/vtr9qTNe#29,French_Defense French_Defense_Schlechter_Variation,2571619
2444,OfxZZ,7r/5p2/R1bkp1p1/1ppq4/5Q2/6P1/1PP2P1P/6K1 b - - 1 31,d5e5 a6c6 d6c6 f4e5,1343,74,100,792,crushing deflection endgame pin short,https://lichess.org/r5fncRtk/black#62,,2157955
2445,TanAO,kr6/p4p1p/R2p2p1/2pq3P/4r3/2P5/1PQNn3/1K1R4 w - - 0 39,c2e4 e2c3 b1c2 c3e4,1343,74,100,390,crushing master middlegame pin queensideAttack short,https://lichess.org/nsf9PfIl#77,,2588325
2446,499KN,8/3b4/5p1p/3PpPp1/1p2P1P1/1P3k1P/3K4/5B2 w - - 7 47,d2d3 d7b5 d3c2 b5f1 d5d6 f1b5,1343,74,100,529,bishopEndgame crushing defensiveMove endgame long skewer,https://lichess.org/uxFqIWTD#93,,363210
2447,TjAF0,8/1p2kpp1/1q1pp2p/1b6/5P2/r2BN1K1/2P1Q2P/5R2 b - - 9 29,b6d4 e3f5 e7f6 f5d4,1343,74,100,408,crushing middlegame pin short,https://lichess.org/9D6FDX4r/black#58,,2600095
2448,Tbw4N,1Q6/5ppk/7p/8/8/8/P1rq1PPP/R5K1 w - - 2 28,h2h3 d2f2 g1h2 f2g2,1343,74,100,1621,endgame mate mateIn2 short,https://lichess.org/QAhAR3Mz#55,,2589915
2449,kZ7py,1r6/qpk3pp/p1n2p2/3B4/5Q2/7P/PP3PP1/6K1 b - - 3 30,c7c8 d5e6 c8d8 f4d6 d8e8 d6d7 e8f8 d7f7,1343,74,100,1309,endgame mate mateIn4 veryLong,https://lichess.org/EoHU2t6N/black#60,,4072237
2450,PnsXN,3rr1k1/ppp2p2/2n3R1/8/2P2P1q/2Q1P3/PP2B2P/2K3R1 b - - 0 23,f7g6 g1g6 g8f7 c3g7,1344,74,100,366,mate mateIn2 middlegame short,https://lichess.org/Huyvder4/black#46,,2256551
2451,RsAVG,4r1k1/p1pp1p1p/1p6/5Q1R/2P2N2/1P2r1q1/P5K1/2R5 w - - 0 24,g2h1 e3e1 c1e1 e8e1,1344,74,100,357,mate mateIn2 middlegame short,https://lichess.org/DYAwgyT6#47,,2437640
2452,adjja,6k1/3n1pp1/3p4/1Q5p/1p2qn1N/7P/5PP1/2R3K1 w - - 2 32,b5d7 f4e2 g1h1 e2c1 d7c8 g8h7 c8c1 e4h4,1344,74,100,465,advantage endgame fork veryLong,https://lichess.org/iKc8rJiE#63,,3203038
2453,ZB8fN,b2r3k/p4r1p/1p2pq2/8/6R1/P4B1Q/5PPP/5RK1 w - - 2 29,f3a8 f6f2 f1f2 d8d1 f2f1 d1f1,1344,74,100,598,long mate mateIn3 middlegame sacrifice,https://lichess.org/0IOgY2Dl#57,,3075262
2454,77fWd,1n4k1/5ppp/4p3/1P1pP3/5P2/1BP1b1Q1/r1K1N1PP/q6R w - - 1 30,b3a2 a1a2 c2d3 a2d2,1344,74,100,1223,mate mateIn2 middlegame short,https://lichess.org/5rciIpUE#59,,623650
2455,ZxQ7L,8/3k4/4p1p1/p2pPp2/1p1P1P1p/1P3KPP/P7/8 b - - 0 40,h4g3 f3g3 d7e7 g3h4 e7f7 h4g5,1344,74,100,794,crushing endgame long pawnEndgame,https://lichess.org/WUquymZQ/black#80,,3143569
2456,9Twb3,2r4k/q3PPp1/7p/1pb5/2nr4/7P/5QP1/2BR1RK1 b - - 0 34,d4d1 f7f8q c8f8 e7f8q c5f8 f2a7 d1f1 g1f1,1344,74,100,1413,advancedPawn crushing middlegame promotion veryLong,https://lichess.org/IOvcKi6j/black#68,,829886
2457,WiI0y,2kr3r/ppp1b1pp/8/1Q1pR3/3Nn1q1/8/PPP3PP/RNB3K1 w - - 5 17,e5e7 g4d1 b5f1 d1d4,1344,74,100,812,advantage fork middlegame short,https://lichess.org/egzwABRj#33,Italian_Game Italian_Game_Scotch_Gambit,2860043
2458,pXARk,rn1q3r/ppp2kpp/8/3bQ3/8/8/PPPN1PPP/R3K1NR w KQ - 1 11,g1f3 h8e8 e1c1 e8e5,1344,74,100,737,advantage middlegame pin short,https://lichess.org/l36viKAN#21,Bishops_Opening Bishops_Opening_Ponziani_Gambit,4507376
2459,eQBRL,2r5/1p2k1p1/p3q3/3b2PP/1P3B2/3Q1PK1/Pb6/3R4 b - - 2 54,c8c3 d3d5 e6d5 d1d5,1344,74,100,241,advantage middlegame short,https://lichess.org/WjOnxjq0/black#108,,3533907
2460,z54d9,4kb1r/pp2q2p/2p1n3/4PQ2/5P2/2P3P1/PP2P2P/3R2K1 b k - 0 21,e6g7 f5c8 e8f7 d1d7 e7d7 c8d7,1344,74,100,2649,crushing endgame long pin,https://lichess.org/topnNFAO/black#42,,5343253
2461,5Y2OY,3R4/4q1pk/p5pp/4b3/8/1P6/PP6/K2Q4 w - - 2 45,a2a4 e7a3 a1b1 a3b2,1344,74,100,270,endgame mate mateIn2 pin short,https://lichess.org/zdQ8oCfW#89,,485377
2462,sUbGL,3N4/3n4/r2k4/P3p1p1/2RpP1Pp/5K1P/8/8 b - - 7 45,a6a5 d8b7 d6e7 b7a5,1344,74,100,413,crushing endgame fork short,https://lichess.org/vDuM5jum/black#90,,4766229
2463,YWx9m,8/pkpn3Q/1p1p4/2q5/P3n2P/1P6/2P5/2KR2R1 w - - 1 34,h7d7 c5a3 c1b1 e4c3,1344,74,100,860,endgame mate mateIn2 short,https://lichess.org/OgXqTRwL#67,,3018949
2464,sDtMk,rn1qk1nr/2p2ppp/p3p3/3bB3/Q2P4/4P3/PP3P1P/RN2K1R1 b Qkq - 2 13,d8d7 a4d7 b8d7 e5g7 g8e7 g7h8,1344,74,100,627,advantage long opening trappedPiece,https://lichess.org/Vx8Josne/black#26,Queens_Pawn_Game Queens_Pawn_Game_Other_variations,4742605
2465,4jzPC,8/p7/2pp3k/2n1p1p1/1R6/2P1N3/P2KNq2/8 b - - 6 41,d6d5 e3g4 h6g6 g4f2,1344,74,100,895,advantage endgame fork short,https://lichess.org/H65dZTb5/black#82,,415011
2466,7JH8x,8/1B5p/5k2/p4p2/K3n3/1P6/P4P2/8 w - - 4 37,f2f3 e4c5 a4a5 c5b7,1344,74,100,966,crushing endgame fork short,https://lichess.org/LbhRVEkl#73,,639986
2467,KWPRB,2q1k3/1p3pb1/p2Q2p1/4p3/8/1N6/PPPR1rP1/2K5 b - - 2 24,g7h6 d6e5 e8f8 e5h8,1344,74,100,3309,advantage endgame short,https://lichess.org/FT1TN2Pa/black#48,,1794805
2468,WzNXU,4rrk1/2p2pp1/2p2Nnp/p3P2Q/8/3P3R/Pq4PP/4R1K1 b - - 1 20,g8h8 h5h6 g7h6 h3h6 h8g7 h6h7,1344,74,100,3286,hookMate kingsideAttack long mate mateIn3 middlegame sacrifice,https://lichess.org/IeyRDT6V/black#40,,2883850
2469,3oJWS,8/1p1q2pk/p5Rn/2p3Q1/2Pp3N/3P4/PP2rrP1/R6K w - - 2 27,a1g1 d7h3 g2h3 f2h2,1344,74,100,1060,kingsideAttack mate mateIn2 middlegame sacrifice short,https://lichess.org/2ak3vblq#53,,333624
2470,hmEyI,8/8/2k5/2p2p1p/1pP2P1P/1K4P1/8/8 w - - 5 43,b3a4 c6b6 a4b3 b6a5 b3b2 a5a4,1344,74,100,499,crushing defensiveMove endgame long pawnEndgame zugzwang,https://lichess.org/2aff8lRl#85,,3827201
2471,ParP5,8/pq4pk/3p3p/8/2P1nr2/P2Q1B1P/5P2/5RK1 w - - 0 34,f1b1 f4f3 b1b7 f3d3,1345,74,100,1330,advantage endgame short,https://lichess.org/OASoM8wx#67,,2238275
2472,qmiNU,4r1k1/4qpp1/r6p/p1BQ4/4PNP1/P1P2n2/5KRP/8 b - - 1 23,e7e4 d5e4 e8e4 f2f3,1345,74,100,1012,advantage master middlegame short,https://lichess.org/gcg0Rqzb/black#46,,4616392
2473,bUTs7,2r2k1r/pp3pp1/4p1p1/3pP3/3q4/KP6/P6b/R3BQ1R b - - 1 24,d4c5 e1b4 c5b4 a3b4,1345,74,100,1144,advantage defensiveMove middlegame pin short,https://lichess.org/09Zsl7Bx/black#48,,3277491
2474,JrOvB,7R/8/1kp5/p7/r6P/5P2/4K3/8 b - - 1 45,a4b4 h8b8 b6c5 b8b4 a5b4 h4h5,1345,74,100,890,crushing defensiveMove endgame long master masterVsMaster rookEndgame,https://lichess.org/R9mrJg9l/black#90,,1736969
2475,ACEjd,2Q1n1k1/5pp1/4p2p/4b3/1P2q3/2K4P/r1B2P2/2RR4 w - - 5 32,c3b3 a2b2 b3a4 e4b4,1345,74,100,1146,mate mateIn2 middlegame short,https://lichess.org/vL5DIme4#63,,892556
2476,Its0O,8/2b5/7R/8/4K1k1/8/7p/8 w - - 4 60,h6g6 g4h5 g6g8 h2h1q,1345,74,100,279,advancedPawn crushing defensiveMove endgame promotion short,https://lichess.org/rXm3CXTY#119,,1653290
2477,gG80t,rnb2rk1/pp3ppp/8/3Q4/2BB4/8/P1q2PPP/R3R1K1 b - - 1 14,b8c6 d5f7 f8f7 e1e8,1345,74,100,500,kingsideAttack mate mateIn2 middlegame pin sacrifice short,https://lichess.org/WTaBWrNL/black#28,Vienna_Game Vienna_Game_Stanley_Variation,3694608
2478,pqo2M,8/RP2kp2/1r4p1/4p2p/8/6P1/5P1P/6K1 b - - 2 39,e7d6 a7a6 b6a6 b7b8q,1345,74,100,914,advancedPawn crushing deflection endgame pin promotion rookEndgame short,https://lichess.org/8Yq8n0N4/black#78,,4534866
2479,5cFAZ,8/8/5kp1/8/PKR5/1P2P3/2p4r/8 w - - 0 50,a4a5 h2h4 c4h4 c2c1q,1345,74,100,573,advancedPawn advantage deflection endgame master pin promotion rookEndgame short,https://lichess.org/ItCB4Hps#99,,491251
2480,57tVr,5rkr/p4ppp/2B5/8/nQPb4/8/qP1N3P/2K1R3 b - - 1 25,a4b2 b4f8 g8f8 e1e8,1345,74,100,501,attraction mate mateIn2 middlegame sacrifice short,https://lichess.org/5ThvsdfM/black#50,,448368
2481,gCRT5,8/8/8/pK3k2/P7/8/8/8 b - - 2 56,f5e5 b5a5 e5d6 a5b6 d6d7 b6b7,1345,74,100,315,crushing defensiveMove endgame long pawnEndgame,https://lichess.org/xhweOiQV/black#112,,3689371
2482,8lOvt,8/3kR1pp/r2P1p2/1rP5/8/6P1/5P1P/6K1 b - - 4 33,d7c6 e7c7 c6d5 d6d7 a6a8 c7c8,1345,74,100,507,advancedPawn crushing endgame long rookEndgame,https://lichess.org/7Tqgmevd/black#66,,766790
2483,HAnaD,r4rk1/pp3ppp/2p5/3p2BQ/3P2b1/2N3q1/PPP5/R3R2K w - - 2 18,h5h4 g4f3,1345,74,100,243,mate mateIn1 middlegame oneMove,https://lichess.org/MJdGr972#35,Scandinavian_Defense Scandinavian_Defense_Main_Line,1502265
2484,lsiJt,rnbr2k1/5ppp/p3p3/2q1P1P1/4pP1P/P6R/2PNQ3/R1B1K3 w Q - 0 21,d2e4 c5g1 e2f1 d8d1 e1d1 g1f1,1345,74,100,750,attraction crushing deflection exposedKing long middlegame,https://lichess.org/2HktSmZy#41,,4187681
2485,cKWry,8/5pp1/3r2kp/8/Rb1Bp3/4P2P/p4PP1/6K1 w - - 0 37,a4b4 d6d4 b4d4 a2a1q,1345,74,100,216,advancedPawn advantage endgame promotion short,https://lichess.org/lISoep8L#73,,3351173
2486,S6r6x,1k3r1r/ppp3pp/8/5Q2/3P4/2P5/PP3PqP/2KR3R w - - 3 17,d1g1 g2g1 h1g1 f8f5,1345,74,100,351,advantage endgame short,https://lichess.org/cndSTjEe#33,Scandinavian_Defense Scandinavian_Defense_Modern_Variation,2458424
2487,fA0nm,8/8/2p5/2kr1p2/p5p1/PpQ5/1P2r3/2K5 b - - 1 46,c5b5 c3b4 b5a6 b4c4 a6b6 c4e2,1346,74,100,779,advantage endgame fork long queenRookEndgame,https://lichess.org/dBbPZCge/black#92,,3598372
2488,HcT7y,r1b1r2k/pp5p/2R3pN/8/3p4/3N4/P4BPP/6K1 b - - 0 23,b7c6 f2d4 e8e5 d4e5,1346,74,100,431,endgame mate mateIn2 short,https://lichess.org/1GwyQnM4/black#46,,1540946
2489,Pblfz,2rr2k1/1p1q1ppp/p7/2bpP3/4bP2/1Q4BP/PP2B1P1/3R1RK1 w - - 1 21,g1h1 d7h3 g3h2 h3g2,1346,74,100,370,kingsideAttack mate mateIn2 middlegame pin short,https://lichess.org/jpPadnMc#41,,2239513
2490,oi6vL,r2qrb2/pb3p1k/7p/1p1pNQ1n/2pP4/2P4P/PP3PP1/R3R1K1 b - - 1 20,h7g8 f5f7 g8h8 e5g6,1346,74,100,454,fork mate mateIn2 middlegame short,https://lichess.org/NB5aNIs1/black#40,,4434862
2491,Yo2gz,rn1qr1k1/pb1pbp2/1p2pn1Q/6N1/8/2NBP3/PPP2PPP/2KR3R b - - 2 12,e7f8 d3h7 f6h7 h6h7,1346,74,100,2515,kingsideAttack mate mateIn2 middlegame short,https://lichess.org/6x8fhRKf/black#24,Indian_Defense Indian_Defense_Knights_Variation,3042819
2492,TCOmN,4r1kR/3p4/p1nq2P1/2p2pPQ/2P2p2/3n4/Pb1B4/1B1K4 b - - 4 32,b2h8 h5h7 g8f8 h7f7,1346,74,100,1529,mate mateIn2 middlegame short,https://lichess.org/IHy1lxSx/black#64,,2553799
2493,ITl1c,6rk/p7/1p1r3p/5n2/1P6/P1QB4/7P/7K b - - 5 39,g8g7 c3c8 g7g8 c8f5,1346,74,100,268,advantage endgame fork short,https://lichess.org/nnF5kc9e/black#78,,1616235
2494,OQf2b,8/5pk1/4p3/1pBr2p1/1Pr3P1/P5Q1/3b1PK1/8 b - - 5 40,c4c3 c5d4 d5d4 g3e5 g7g8 e5d4,1346,74,100,459,advantage attraction endgame fork long sacrifice,https://lichess.org/KeenTzrX/black#80,,2136147
2495,aDHj3,8/5p2/5Q2/pp4pp/4P2k/2P2PP1/r3q3/6RK b - - 0 44,h4h3 f6f5 g5g4 f5h5,1346,74,100,443,endgame mate mateIn2 short,https://lichess.org/Vptro7y2/black#88,,3165885
2496,zGnCL,6k1/1pqn2p1/p3bp1p/2pN4/1P1QPP2/P5P1/6BP/6K1 b - - 1 30,c7d6 d5f6 d7f6 d4d6,1346,74,100,555,crushing discoveredAttack endgame kingsideAttack master short,https://lichess.org/yzpFhARL/black#60,,5359898
2497,RVMoy,r1b2rk1/qp4pp/3Np3/p2nP3/6Q1/1B6/PP3PPP/2R1R1K1 w - - 3 20,c1c8 a7f2 g1h1 f2e1,1346,74,100,425,backRankMate fork mate mateIn2 middlegame short,https://lichess.org/TWTnb8fa#39,,2405487
2498,wJiHy,8/8/4kp2/6p1/4PKP1/8/8/8 w - - 0 48,f4e3 e6e5 e3f3 e5d4,1346,74,100,398,crushing endgame pawnEndgame short zugzwang,https://lichess.org/2AgM531B#95,,5101071
2499,MEASj,6k1/8/p2p3p/2PP1pp1/P2R4/5pKP/r4P2/8 b - - 0 36,d6c5 d5d6 c5d4 d6d7 g8f7 d7d8q,1346,74,100,710,advancedPawn advantage endgame long promotion rookEndgame sacrifice,https://lichess.org/qUOPhg3V/black#72,,1943911
2500,i3x2M,r4r1k/q6p/2bb1B2/2p2P2/1pB3QP/1P6/2P5/2K3RR b - - 0 30,f8f6 g4g8 a8g8 g1g8,1346,74,100,754,mate mateIn2 middlegame sacrifice short,https://lichess.org/joQMamDx/black#60,,3852691
2501,V6q9m,7k/2R5/4p2p/3p4/KP2p3/6Q1/Pq3r1P/8 b - - 5 41,b2a2 a4b5 a2c4 c7c4,1346,74,100,703,crushing endgame short,https://lichess.org/SkKQP3UR/black#82,,2720227
2502,WuIjp,6k1/p3b1pp/4pp2/2PnN3/b2P4/6P1/P4PBP/1N4K1 w - - 0 24,e5d3 a4c2 g2d5 e6d5 d3b4 c2b1,1346,74,100,607,advantage endgame fork long,https://lichess.org/fvWhUs8C#47,,2876848
2503,QsJsN,r5k1/1p1N1pp1/p3p3/3p3p/2nP4/bqP2N1P/1P2QPP1/2KR3R w - - 0 21,d7c5 a3b2 e2b2 b3b2,1346,74,100,894,mate mateIn2 middlegame queensideAttack short,https://lichess.org/XNO8XEdz#41,,2350118
2504,PNhwT,6k1/6p1/pN2P2p/5p1Q/P4P2/6PP/5rBK/5q2 w - - 2 35,h5f3 f2f3 g2f1 f3f1,1346,74,100,659,advantage endgame short,https://lichess.org/PW7y77LZ#69,,2219776
2505,mPK4E,8/6k1/4P1p1/6Pp/8/4K2B/8/2n5 b - - 0 59,c1b3 e6e7 g7f7 h3e6 f7e8 e6b3,1346,74,100,779,advancedPawn crushing endgame long master,https://lichess.org/XF830gkS/black#118,,4233622
2506,Tf8gB,rnb1Q1kr/pp3p1p/2pb1npB/7q/2BP4/2N2N2/PP3PPP/R3R1K1 b - - 5 13,f6e8 e1e8 d6f8 e8f8,1346,74,100,624,fork mate mateIn2 middlegame short,https://lichess.org/UBfbPzaA/black#26,French_Defense French_Defense_Steiner_Variation,2594383
2507,J8o3m,r3r2k/6p1/2pqp2p/3p4/p1pP4/P1P4P/1PQ1RPP1/4R1K1 w - - 0 25,c2f5 e6f5 e2e8 a8e8 e1e8 h8h7,1346,74,100,801,crushing endgame hangingPiece long,https://lichess.org/qHOtwyof#49,,1674330
2508,AIUk8,k2r1b1r/p1pq1pp1/B1n1p1p1/2N5/2PP2P1/PQ5P/1P6/2KR4 b - - 4 21,c6a5 a6b7 a5b7 b3b7,1347,74,100,1657,mate mateIn2 middlegame queensideAttack short,https://lichess.org/OgQZSiJ7/black#42,,901378
2509,Uc2iB,1r3k1b/r6p/6p1/1Bqp1p2/P1p5/4PPP1/Q1R2PK1/1R6 b - - 5 32,b8b5 b1b5 c5b5 a4b5 a7a2 c2a2,1347,74,100,302,advantage long middlegame,https://lichess.org/u7oViBp0/black#64,,2676887
2510,yuIZu,3r2k1/p5p1/2qPp1np/8/P2Npr2/3R3P/4QPP1/3R2K1 b - - 1 27,e4d3 e2e6 g8h7 d4c6,1347,74,100,174,crushing fork master middlegame short,https://lichess.org/9ILQcQdX/black#54,,5328191
2511,3U0O1,r5kr/2p4p/pb1pN1p1/1p1P2B1/3n3q/2N2Q2/PP3P2/R4RK1 w - - 0 22,e6d4 h4g5 f3g2 g5g2 g1g2 b6d4,1347,74,100,407,advantage hangingPiece kingsideAttack long middlegame,https://lichess.org/mIXS7MGe#43,,304867
2512,lcWmj,8/2PR4/8/7p/5p1k/2r5/5K2/8 b - - 1 55,h4h3 d7d3 c3d3 c7c8q,1347,74,100,226,advancedPawn crushing deflection endgame promotion rookEndgame short,https://lichess.org/eYbdxr7E/black#110,,4164639
2513,3Y3BB,3r1rk1/pp2n1p1/5q1p/3n4/2B2N2/P1P1bP1P/1P4P1/R1Q2R1K w - - 0 25,c1e3 f6f4 e3f4 f8f4,1347,74,100,505,advantage middlegame short,https://lichess.org/Vlv01Yhz#49,,310693
2514,upnyH,1k1r1q2/pr5p/2Q2R2/2ppn3/8/7P/PPP2P2/4RK2 w - - 0 29,f6f8 e5c6 f8d8 c6d8,1347,74,100,1093,advantage endgame hangingPiece short,https://lichess.org/V9jLhtf3#57,,4971605
2515,DgWeD,3R2k1/p7/5nq1/4b1N1/4p3/2P4P/Pr3PQ1/6K1 b - - 1 35,g8g7 g5e6 g7f7 d8f8 f7e6 g2g6,1347,74,100,2040,crushing deflection exposedKing long middlegame,https://lichess.org/59sJC9FQ/black#70,,1196882
2516,3v2jz,2kr4/1p3Q2/p1p1Pp2/4b3/4B1Pp/2P4P/PP4K1/3r4 w - - 3 40,e6e7 d8d2 g2f3 d1f1 f3e3 e5f4,1347,74,100,218,endgame long mate mateIn3,https://lichess.org/Wp1ynnIN#79,,343023
2517,ojX9u,q4rk1/r3bpp1/p2pn2p/1p2p3/1P5P/N1P3R1/P1B1QPRP/7K b - - 4 25,e6f4 g3g7 g8h8 g7h7,1347,74,100,221,kingsideAttack mate mateIn2 middlegame short,https://lichess.org/guurry05/black#50,,4436973
2518,Xvq4v,r4rk1/pp3pp1/2n3np/8/4P1q1/2PB2B1/P1PQ1P1P/3R1RK1 w - - 2 19,g1g2 g6h4 g2g1 h4f3 g1h1 f3d2,1347,74,100,734,advantage fork long middlegame,https://lichess.org/Q43RrEDI#37,,2966359
2519,lmcE0,7r/2k5/p1p2pnp/1pB1p1p1/4P3/P5P1/1PP2P1P/3R2K1 b - - 0 25,h8d8 c5b6 c7b6 d1d8,1347,74,100,1505,advantage deflection endgame short,https://lichess.org/Z9P18XBW/black#50,,4178972
2520,los3x,r4rk1/pppq1pp1/7p/3PnR2/4P3/2N3Q1/PP4PP/5R1K b - - 6 20,a8e8 f5e5 e8e5 g3e5,1347,74,100,1125,advantage middlegame short,https://lichess.org/vZTw6wUx/black#40,,4182150
2521,EEwkr,r4r2/pp3p1k/4n1Rp/3pPQ2/2p4P/q1P3R1/2P2PP1/6K1 b - - 0 25,f7g6 f5g6 h7h8 g6h6,1347,74,100,1791,deflection endgame fork mate mateIn2 short,https://lichess.org/6ZqAQEX6/black#50,,1245538
2522,fWqnJ,r6k/2Q5/2p2nRp/8/pp1P4/8/qP3KPP/3Nr3 b - - 4 31,a8g8 g6h6 f6h7 h6h7,1347,74,100,1155,fork mate mateIn2 middlegame short,https://lichess.org/mE3Lb8kq/black#62,,3630489
2523,wqU9j,8/pp3RK1/1r2k1p1/7p/8/1P5P/P7/8 b - - 0 42,b6a6 f7f6 e6e5 f6a6 b7a6 g7g6,1347,74,100,277,crushing endgame long rookEndgame,https://lichess.org/nYXZLBRl/black#84,,5147443
2524,g6RMo,k6r/b6r/R5p1/2BPp1P1/2P1P1qP/P1Q2p2/8/1R3K2 w - - 0 41,c5a7 g4g2 f1e1 g2e2,1347,74,100,325,mate mateIn2 middlegame short,https://lichess.org/7vIA2TrZ#81,,3681093
2525,pWJyH,8/2pK1P2/pk1b4/3R4/2P5/r7/8/8 b - - 3 57,d6c5 d5c5 b6c5 f7f8q,1347,74,100,446,advancedPawn attraction crushing endgame master promotion short,https://lichess.org/C3n6yyyC/black#114,,4506182
2526,5eJVO,8/1p5k/6p1/2pN2qp/2PbQr2/1P5P/P5PK/8 w - - 0 36,e4f4 d4e5 f4e5 g5e5,1347,74,100,5246,endgame master masterVsMaster,https://lichess.org/rDQtArPw#71,,494285
2527,GJbiB,r1b2Bk1/ppp2q2/5b1Q/3p4/3P4/2P2P2/P1P2KPP/4R3 b - - 0 24,f7f8 h6g6 f6g7 e1e8 c8f5 e8f8,1347,74,100,527,advantage endgame long pin,https://lichess.org/cYrlogkx/black#48,,1427238
2528,87IcS,r1nk4/1p3p2/1Pp1p2r/p2p2q1/P2P4/2PBPQP1/6P1/RR4K1 w - - 1 23,f3f7 g5e3 f7f2 h6h1 g1h1 e3f2,1347,74,100,960,advantage deflection fork long middlegame,https://lichess.org/r8oZDRa1#45,,710272
2529,uyIgk,2r3k1/pbq5/1p2prp1/3p4/4nB2/2P5/PP5Q/1BR1K2R b K - 5 27,c7f4 h2h8 g8f7 h1h7,1348,74,100,982,mate mateIn2 middlegame short,https://lichess.org/j74ELWVp/black#54,,4983359
2530,Fk4rX,r2qr1k1/pp1nnpbQ/2ppb3/6N1/B2PP3/2P3P1/PP6/RN3RK1 b - - 4 15,g8f8 g5e6,1348,74,100,1056,mate mateIn1 middlegame oneMove pin,https://lichess.org/Iz8J9M8T/black#30,Kings_Gambit_Accepted Kings_Gambit_Accepted_Fischer_Defense,1376793
2531,pQoj8,8/1p5k/p1b5/5r2/2P5/1P4R1/P2R2p1/6K1 w - - 0 40,d2d4 f5f1 g1h2 f1h1,1348,74,100,1382,endgame mate mateIn2 short,https://lichess.org/sYoOcyMF#79,,4498292
2532,tAS3v,8/p1pR1pkp/1pq2np1/4Q3/8/P1P5/1P3PPP/6K1 w - - 0 27,e5c7 c6d7 c7d7 f6d7,1348,74,100,428,advantage endgame short,https://lichess.org/aDbyBdy3#53,,4825583
2533,lE7vN,3k4/p1pr1p1Q/1n6/2q3p1/3b1p2/1BB4P/PP4P1/4R2K b - - 3 29,d4c3 h7g8 c5f8 g8f8,1348,74,100,348,mate mateIn2 middlegame short,https://lichess.org/zyREbUjV/black#58,,4129988
2534,z02O9,4kb2/5Np1/p3p3/1p1b3p/8/6qP/Pr1N1R2/R1Q2K2 b - - 7 28,b2d2 c1c8 e8e7 c8d8,1348,74,100,2107,mate mateIn2 middlegame short,https://lichess.org/kRYWlTbe/black#56,,5336249
2535,mrJH7,1k5r/p1p2p2/1b6/4P1p1/1P3q1p/P1NQ3K/7P/3R3R w - - 0 31,d3e4 g5g4 h3g2 h4h3,1348,74,100,416,mate mateIn2 middlegame short,https://lichess.org/ubbi3sX9#61,,4272987
2536,wFB38,rn1b1k1r/pbNp1ppp/1p1P1n2/2q5/2B5/5N2/PP2QPPP/R1B1K2R b KQ - 4 14,d8c7 e2e7 f8g8 e7f7,1348,74,100,1190,mate mateIn2 opening short,https://lichess.org/46bxyMLS/black#28,Owen_Defense Owen_Defense_Other_variations,5094654
2537,iltPr,5r2/p5p1/1p2k2p/1Pp1n3/3pP3/PP4PP/3R2K1/4R3 w - - 1 32,d2f2 f8f2 g2f2 e5d3 f2f1 d3e1,1348,74,100,762,attraction crushing endgame fork long,https://lichess.org/ABGyZQlz#63,,3914597
2538,Fo8M4,4r3/pp5p/2b3p1/6N1/4Pk2/2PB2R1/PP3rPP/2K5 b - - 3 25,h7h6 g5h3 f4e5 h3f2,1348,74,100,649,crushing endgame fork master short,https://lichess.org/3jtO6uMl/black#50,,1382544
2539,HCsXl,4r1k1/pp2rpp1/2p2q2/3p4/3P4/P2BB1QP/1PP1R1P1/6K1 w - - 1 25,e2f2 e7e3 g3e3 e8e3 f2f6 g7f6,1348,74,100,298,advantage long middlegame,https://lichess.org/AgSYhBD7#49,,1505259
2540,KvmGZ,B7/2Bk3p/1P4p1/5p2/r4P2/2K3P1/7P/8 w - - 5 48,b6b7 d7c7 b7b8r c7b8,1348,74,100,596,advantage endgame hangingPiece short,https://lichess.org/VrapKayE#95,,1830256
2541,uI0II,1rR1r1k1/5pp1/4p3/p2p4/3P2Q1/P5P1/2R2PPK/4q3 w - - 2 34,c8c7 b8b1 c2c1 b1c1,1348,74,100,568,crushing endgame quietMove short,https://lichess.org/NGXaWk7A#67,,4924284
2542,RDvjN,8/8/5b1p/P7/PBp1kP2/3p4/3K3P/8 w - - 1 40,b4c3 f6c3 d2c3 e4e3,1348,74,100,226,bishopEndgame crushing endgame short,https://lichess.org/uxV1Wbqt#79,,2380859
2543,E2Uba,b7/P5n1/6Bp/2N5/6kP/5p2/5K2/8 b - - 0 52,g4h4 g6e4 g7e6 e4a8,1348,74,100,970,crushing endgame short,https://lichess.org/CRanNwBo/black#104,,1228089
2544,VHjZL,1k5r/pp5p/2n5/2R1q1p1/N3p3/8/PP3PPP/3Q2K1 b - - 0 26,h8d8 d1d8 c6d8 c5e5,1348,74,100,467,crushing endgame queensideAttack short,https://lichess.org/aVB7NJ9R/black#52,,2735629
2545,czJf5,8/5pk1/3p2p1/6n1/p5P1/6K1/1PP1r3/1R3R2 w - - 2 38,f1f2 g5e4 g3f3 e2f2,1348,74,100,1154,advantage endgame fork short,https://lichess.org/U5KuJieF#75,,3408530
2546,ecjMz,1r4k1/4pp2/p2p1npB/2pPP3/q1r5/2R2R1P/1p4Q1/1B5K b - - 0 32,a4d1 f3f1 d1f1 g2f1 c4c3 e5f6,1348,74,100,1242,advantage defensiveMove long middlegame,https://lichess.org/vCyLbcgv/black#64,,3551615
2547,iG7Hb,2q2r1k/p2b2pp/1pnP4/2pB2B1/4Q2N/P5PP/1P5K/8 b - - 4 33,c6d4 h4g6 h7g6 e4h4,1348,74,100,721,clearance kingsideAttack master mate mateIn2 middlegame sacrifice short,https://lichess.org/1fcRep8h/black#66,,3869855
2548,pwCkn,r1b2rk1/pp4b1/4p1pR/8/3q4/2NB4/PP2QPP1/R4K2 w - - 1 18,h6g6 f8f2 e2f2 d4d3 f1g1 d3g6,1348,74,100,525,advantage deflection fork long master middlegame,https://lichess.org/BQralCsX#35,Sicilian_Defense Sicilian_Defense_Alapin_Variation,4542509
2549,x8YeO,5k2/2R2pp1/1p2p1p1/p2r4/P7/4PPP1/1P2K3/8 b - - 0 31,d5c5 c7c5 b6c5 e2d3 f8e7 d3c4,1348,74,100,360,advantage endgame long rookEndgame,https://lichess.org/26xiR7hw/black#62,,5172882
2550,6ccND,r7/5p2/6p1/1P1kn2p/1K6/p3BP2/R5PP/8 w - - 2 38,a2a3 a8a3 b4a3 e5c4 a3b4 c4e3,1348,74,100,412,attraction crushing endgame fork long,https://lichess.org/jt0ezLb4#75,,579812
2551,nUcNv,8/6k1/7p/2p1qPp1/4p3/r3P3/3Q1PKP/2R5 b - - 0 40,e5f5 d2b2 g7g6 b2a3,1348,74,100,1180,crushing endgame fork master short,https://lichess.org/m6N2QDpI/black#80,,4328492
2552,nmjlg,r4rk1/4qppp/p1p1p3/2Pp1b2/3PnB2/P3P2P/1P3PP1/R2QKB1R w KQ - 0 16,f2f3 e7h4 g2g3 e4g3 f4g3 h4g3,1348,74,100,1879,advantage long middlegame,https://lichess.org/56s73Cx5#31,Queens_Gambit_Declined Queens_Gambit_Declined_Baltic_Defense,4354241
2553,GSFr0,4k2r/1pp1nppp/1q6/3PQ3/2B3P1/1N1P3P/P1r2P2/R3K2R w KQk - 1 16,e5g7 b6f2 e1d1 f2e2,1348,74,100,1045,attackingF2F7 mate mateIn2 middlegame short,https://lichess.org/psVcN6Sv#31,Bishops_Opening Bishops_Opening_Other_variations,1439404
2554,7ItnB,5r2/2bqrpk1/4pRp1/pp2P1Pp/2pP3P/P1P2Q2/1P1B1R2/6K1 b - - 8 29,c7b8 f6g6 g7g6 f3f6,1348,74,100,820,advantage attraction middlegame sacrifice short,https://lichess.org/JAlcngsz/black#58,,639463
2555,R8CJq,r4r1k/pppq2pp/3p1p2/3N4/2n1P3/4QP2/PPP3PP/1K1R3R w - - 3 21,e3e2 d7b5 e2c4 b5c4,1348,74,100,563,advantage middlegame short,https://lichess.org/JW0vXwXm#41,,2372729
2556,HkQYC,rr4k1/p1p2ppp/8/K1qPQ3/5P2/1PB2B2/1PP3PP/R6R w - - 1 20,a5a4 c5b5 a4a3 b5a6 c3a5 a6a5,1349,74,100,1401,long master mate mateIn3 middlegame,https://lichess.org/7hSyoAkJ#39,,1551958
2557,2APn0,3r2k1/p4p1p/5qp1/2p5/3P2b1/5NP1/PP1Q1PP1/3R2K1 w - - 3 29,d2g5 f6g5 f3g5 g4d1,1349,74,100,754,advantage endgame master short,https://lichess.org/9eQPSFoQ#57,,189881
2558,oyDpU,r4rk1/p2N2pp/1nn5/5pq1/2b5/2Q3P1/1P2PPBP/R3K2R b KQ - 0 19,c4d5 g2d5 b6d5 c3c6,1349,74,100,267,advantage master middlegame short,https://lichess.org/dGNEpGe2/black#38,,4457834
2559,jusRQ,rn1qkbnr/ppp1p3/4b3/3pN1pp/3P4/4P3/PPP1BPPP/RN1QK2R b KQkq - 2 7,f8g7 e2h5 h8h5 d1h5,1349,74,100,1071,advantage opening short,https://lichess.org/HqtYwjXr/black#14,Queens_Pawn_Game Queens_Pawn_Game_Zukertort_Variation,4015102
2560,3fG0P,r1bqr1k1/2p3b1/1pn2p1p/p2n2p1/2NPB2N/PP4P1/1BP2P1P/R2QR1K1 b - - 0 16,g5h4 e4d5 d8d5 e1e8,1349,74,100,1913,advantage discoveredAttack kingsideAttack master middlegame short,https://lichess.org/F2eUNk5B/black#32,Kings_Indian_Attack Kings_Indian_Attack_Wahls_Defense,320805
2561,Ja5sE,rn2k2r/1bqp1pp1/pp2p3/2b5/2P1P1p1/2NB4/PPNB1PP1/R2Q1RK1 w kq - 0 13,g2g3 c7g3,1349,74,100,1130,kingsideAttack mate mateIn1 oneMove opening pin,https://lichess.org/rG6jqwCj#25,Horwitz_Defense Horwitz_Defense_Other_variations,1712746
2562,DoL4r,2r3k1/1p3ppp/3p4/3Pn3/5N2/4Q2P/PrqR2P1/3R1K2 b - - 3 33,c2c5 e3c5 c8c5 d2b2,1349,74,100,260,advantage master middlegame short,https://lichess.org/bwD6zOnA/black#66,,1207957
2563,62fqS,2rkr3/2q1b1pp/4Qp2/p7/P2P4/2P2B2/1P4PP/4RRK1 w - - 3 27,d4d5 e7c5 g1h1 e8e6,1349,74,100,998,advantage discoveredAttack middlegame short,https://lichess.org/KQx2IN46#53,,529011
2564,hzezd,2r5/5Qpk/6Rp/2q1p3/4P1P1/7P/P5PK/2q5 b - - 3 35,c8c7 g6g7 h7h8 f7g8,1349,74,100,284,endgame mate mateIn2 short,https://lichess.org/vEOYcLq2/black#70,,3846598
2565,hg9rd,6rr/Q2k4/2qp4/p3p3/Pn2P2p/5P1P/1P4P1/3RR1K1 b - - 1 27,c6c7 d1d6 d7d6 e1d1 d6e6 a7c7,1349,74,100,422,attraction crushing deflection long middlegame pin sacrifice,https://lichess.org/zysNmvZG/black#54,,3818445
2566,Am9Uo,r4r2/4bp1k/p2p4/2q1p3/P1ppP1R1/3P1NP1/1PP2PP1/2KR4 b - - 1 21,f8g8 d1h1 e7h4 h1h4,1349,74,100,2683,mate mateIn2 middlegame short,https://lichess.org/lz1MhakU/black#42,,942999
2567,fRBt7,5rk1/6pp/p3p3/7P/3R1r2/1B3b2/P2R4/1K6 w - - 0 34,d4f4 f8f4 d2d8 g8f7,1349,74,100,974,advantage endgame short,https://lichess.org/jgltWO76#67,,3622437
2568,IdnS0,4kb1r/5p2/p2p4/3Np1Pn/1P6/1q2B3/1PR5/1K1R4 b k - 0 27,b3a4 c2c8 e8d7 d5b6 d7e6 b6a4,1349,74,100,628,advantage fork long middlegame,https://lichess.org/rhgmCp7L/black#54,,1630478
2569,xU2rU,8/8/3Pk3/6P1/4b3/B7/2p2Kp1/8 b - - 1 63,e6f5 d6d7 c2c1q a3c1 g2g1q f2g1,1349,74,100,369,advancedPawn bishopEndgame crushing endgame long master,https://lichess.org/lVq5E52g/black#126,,5203437
2570,9CZiS,rnb1k2r/pp2q3/2p2nQ1/4p2p/4P3/2N5/PPP2PPP/2KR1B1R b kq - 5 15,e7f7 d1d8 e8e7 g6f7 e7f7 d8h8,1349,74,100,304,advantage exposedKing long opening,https://lichess.org/ZBQ9zNtT/black#30,Philidor_Defense Philidor_Defense_Other_variations,805337
2571,93X1L,3R3k/7p/p4br1/1p2nQ2/1P6/P1q4P/2P2PP1/3R2K1 b - - 6 33,f6d8 d1d8 g6g8 f5f6,1349,74,100,403,endgame mate mateIn2 short,https://lichess.org/MkKv4EVr/black#66,,792540
2572,EsecU,Q7/5ppk/4p2p/N3P3/PN3P2/4n1qP/1P4P1/7K w - - 3 41,a8f3 g3e1 h1h2 e3f1 f3f1 e1f1,1349,74,100,576,crushing endgame fork long,https://lichess.org/GnlNo6AE#81,,1301487
