,PuzzleId,FEN,Moves,Rating,RatingDeviation,Popularity,NbPlays,Themes,GameUrl,OpeningTags,ID
1564,Lb7jt,8/8/1pk4p/p7/P3P3/4K1P1/8/8 w - - 0 41,e3f4 b6b5 a4b5 c6b5 e4e5 b5c6,2187,75,100,85,crushing defensiveMove endgame long pawnEndgame,https://lichess.org/7jMNkNCl#81,,1888543
1565,HW8KE,4r3/3kb1Q1/p5Np/2qpP2P/1p1N2P1/1P6/P3K3/8 b - - 2 34,d7c8 g7f7 c5d4 f7e8 c8b7 e8e7,2187,76,100,77,crushing endgame exposedKing fork long,https://lichess.org/nI18UHSe/black#68,,1532090
1566,ZrcWc,8/p4p2/2qB2k1/2P3Pp/1p1b1P2/6Q1/6PK/8 b - - 0 44,d4c5 f4f5 g6g7 g3e5,2187,75,100,157,crushing endgame short,https://lichess.org/XiWwHtx4/black#88,,3135245
1567,eJVyn,4r1k1/1b2qp2/p5pQ/3p2N1/2p1r3/2P2Nb1/PP6/R4RK1 b - - 1 30,g3e5 f3e5 e7g5 h6g5,2187,76,100,162,advantage middlegame short,https://lichess.org/Xkf692tB/black#60,,3524579
1568,tDR74,8/8/4pp1p/4k1pP/3P4/2K2PP1/8/8 b - - 0 44,e5f5 c3d3 e6e5 d4d5 e5e4 f3e4,2187,76,98,504,crushing endgame long pawnEndgame quietMove,https://lichess.org/QrtNays2/black#88,,4829847
1569,0PUY3,r3k3/1p2q1p1/p2bP1p1/5p2/6nr/P5P1/1P3PB1/R1BQ1RK1 w q - 0 19,g2b7 e7b7 d1a4 e8f8,2187,75,98,333,crushing defensiveMove hangingPiece middlegame short,https://lichess.org/lNTzzcnb#37,,35934
1570,UAxei,4rbk1/3q1p1p/pn2p1p1/1p2P3/3N1PP1/3P4/PP2R1QP/2R4K w - - 5 28,g2c6 e8c8 c6d7 c8c1 h1g2 b6d7,2187,75,99,330,advantage intermezzo long middlegame sacrifice skewer,https://lichess.org/x5caAgSv#55,,2639235
1571,zn1p4,2b1qnrk/r5np/5R1B/pp1pP3/3P3N/6R1/PP1Q2PP/7K b - - 6 27,g7h5 g3g8 h8g8 f6f8 e8f8 h6f8,2187,76,98,582,attraction crushing fork long middlegame,https://lichess.org/3TLoxxRL/black#54,,5405261
1572,n0Ufw,7k/6p1/7p/pbQ2p2/7P/6R1/PqP2PPK/3r4 b - - 1 28,b5d7 c5f8 h8h7 c2c3 b2c3 g3c3,2187,75,98,171,crushing endgame long quietMove,https://lichess.org/EDmPQPLV/black#56,,4285890
1573,vxFcR,8/5pk1/P4p2/8/7r/1PR4p/1K6/8 b - - 0 39,h4h8 c3g3 g7f8 g3h3 h8h3 a6a7 f8g7 a7a8q,2187,76,100,418,advancedPawn advantage endgame promotion rookEndgame sacrifice veryLong,https://lichess.org/ES6ssyer/black#78,,5069534
1574,WnoYc,4r1k1/pR4p1/n1pPp2r/5p2/4p3/2N1P2P/P7/6RK b - - 1 36,e8d8 b7g7 g8f8 g7g8,2187,76,99,355,advantage endgame master short,https://lichess.org/bxRITwsU/black#72,,2867865
1575,HgOM6,7k/1p6/1q6/p3P2p/3R4/PP3PQ1/2r2P2/K7 w - - 1 42,d4d3 b6c7 g3f4 c2c1 f4c1 c7c1,2187,75,99,160,crushing endgame exposedKing long,https://lichess.org/HMDQD7lS#83,,1546334
1576,Asz5E,4B3/2Q2pp1/4p1kp/2p5/P1P1n3/1P5P/5qPK/8 b - - 0 40,e4d2 c7f7 f2f7 e8f7 g6f7 a4a5 d2b3 a5a6 b3a5 a6a7 a5c4 a7a8q,2187,76,100,91,advancedPawn crushing endgame promotion quietMove sacrifice veryLong,https://lichess.org/U19DhEjP/black#80,,952606
1577,nB9uu,5rk1/pQ4pp/4bq2/8/2p5/2P2n2/PP3PPP/R4RK1 w - - 0 28,g2f3 f6g5 g1h1 e6d5 f1g1 g5g1 h1g1 d5b7,2188,76,98,143,advantage endgame veryLong,https://lichess.org/uGCkwWhY#55,,4301147
1578,xVWiC,8/8/3p4/p3p1k1/PpP1Ppp1/1P1P2P1/5K2/8 b - - 0 40,g5h5 g3f4 e5f4 e4e5 h5g6 e5d6,2188,75,99,226,crushing endgame long pawnEndgame,https://lichess.org/c9otlL5B/black#80,,5205468
1579,D63Mj,8/1p5p/6p1/2PK4/1k4PP/8/8/8 b - - 0 36,b4b5 g4g5 b5b4 c5c6 b7c6 d5c6,2188,75,100,77,crushing endgame long pawnEndgame quietMove zugzwang,https://lichess.org/IyKYEWn9/black#72,,1145883
1580,Wycpi,8/8/1K5p/p1p4k/P7/1PP5/8/8 b - - 0 51,h5g5 b6c5 h6h5 c5d4 h5h4 d4e3,2188,75,100,163,crushing defensiveMove endgame long pawnEndgame,https://lichess.org/RyQEYzcM/black#102,,2882830
1581,28AYG,r1bq1rk1/6b1/p3p1QB/3p4/8/8/PPP3PP/R4R1K b - - 2 19,d8e7 h6g7 e7g7 f1f8 g8f8 a1f1 f8g8 g6e8,2188,76,98,308,attraction crushing exposedKing middlegame pin veryLong,https://lichess.org/PwGJfrhk/black#38,,186715
1582,dAQAl,8/pp3p2/7p/P2k4/1P1pnPPP/8/4K3/4R3 w - - 7 46,e1d1 e4c3 e2d2 c3d1 d2d1 d5e4 g4g5 h6h5,2188,76,99,154,crushing defensiveMove endgame fork veryLong,https://lichess.org/uwe12p27#91,,3424413
1583,0fX80,2r3r1/1p1q1Bpk/p2p3p/P3pP1Q/3pP3/3P4/1P1B2PP/7K b - - 0 26,c8c7 f7g6 h7h8 d2h6 g7h6 h5h6 d7h7 g6h7,2188,76,100,206,crushing deflection endgame veryLong,https://lichess.org/JdcsgLM2/black#52,,58199
1584,JaxUe,8/3n1k2/pp1p2pp/2pP4/2P2PK1/1P3B1P/P2B1b2/8 w - - 8 33,f4f5 d7f6 g4f4 g6g5,2188,75,98,190,endgame mate mateIn2 short,https://lichess.org/mHb6kudg#65,,1713967
1585,NaiqJ,8/5k2/p2P4/1P3PK1/P1p2P2/8/1b6/8 w - - 0 47,b5b6 b2a3 d6d7 f7e7 b6b7 a3d6 f5f6 e7d7,2188,76,100,111,bishopEndgame crushing endgame veryLong,https://lichess.org/3XHlWCVj#93,,2063253
1586,yH0d9,5rk1/2R2ppp/p3p3/1p6/4N3/2P2QP1/1b3PKP/q7 b - - 5 26,b5b4 e4g5 a1a5 c7f7,2188,76,98,117,advantage endgame short,https://lichess.org/TxjLX9l1/black#52,,5272481
1587,BjtTU,3r1k1r/p4p1p/1pQ3p1/3P4/3p1B2/6P1/PP5q/1R2KR2 w - - 1 27,c6f6 d8e8 f4e5 h2g3 e1d1 g3d3,2188,76,100,184,advantage exposedKing long middlegame pin,https://lichess.org/wBokplsN#53,,1027364
1588,jIDXj,6k1/6p1/7p/3PPb2/1qB5/4Q1P1/7P/6K1 w - - 1 41,c4e2 b4e1 g1g2 f5g4 d5d6 g4e2,2189,75,100,259,advantage endgame long,https://lichess.org/JVXMfHs5#81,,3960474
1589,VnC8r,r4r2/pppnR1kp/3P1q2/8/3Q4/6P1/PP4K1/R7 b - - 2 25,f8f7 e7f7 g7f7 a1f1 f6f1 g2f1,2189,76,100,133,advantage long middlegame pin,https://lichess.org/bTS4pMe9/black#50,,2779801
1590,Iwg4Z,r1b1k2N/p5pp/2p1pn2/3p4/1b1P4/2B5/Pq3PPP/RN1QK2R w KQq - 2 15,d1b3 b2c1 b3d1 b4c3 b1c3 c1c3,2189,75,98,750,advantage deflection fork long middlegame,https://lichess.org/uOmHUvY1#29,Sicilian_Defense Sicilian_Defense_Alapin_Variation,1657124
1591,eR370,3r2k1/3P2p1/2B4p/4P3/6P1/7r/7P/2R3K1 b - - 0 39,h3e3 c6d5 g8h7 e5e6,2189,75,99,97,crushing endgame short,https://lichess.org/fN4vaBXF/black#78,,3535175
1592,kAKVq,3r4/p1p2rpk/2Q4p/4P3/3B3q/2P2p2/PP3PPP/R5K1 w - - 0 27,a1e1 h4g4 c6e4 g4e4 e1e4 c7c5,2189,76,98,86,advantage endgame long,https://lichess.org/LblLBHmj#53,,4036922
1593,ku9XM,4r1k1/p4p2/8/2Rp3p/1P4p1/2P1qbP1/PKQ4P/2R5 w - - 0 33,c5c7 e3b6 c7d7 e8e2 c2e2 f3e2,2189,75,98,486,advantage clearance endgame long pin,https://lichess.org/8Bppid9A#65,,4101986
1594,DrVLL,8/Q5pk/7r/8/1Pq4P/P4pP1/5P1K/4R3 w - - 0 42,e1e7 h6h4 g3h4 c4h4 h2g1 h4g5 g1f1 g5c1,2189,76,98,384,crushing endgame sacrifice veryLong,https://lichess.org/cusz5FPX#83,,1212363
1595,T8LHI,8/2P5/7p/3N1b2/5K2/7k/8/8 b - - 1 52,f5d7 d5b6 d7g4 f4e5 h3g3 e5d6,2189,76,100,123,crushing defensiveMove endgame long,https://lichess.org/96KsjMIi/black#104,,2548093
1596,7d30o,3Nqr2/pb4kp/1p2P3/2ppb1p1/P3np2/2P5/3BQPPP/R1R3K1 w - - 0 27,d8b7 f4f3 g2f3 e8h5,2189,76,98,221,advantage master middlegame short,https://lichess.org/IHp7DflD#53,,667595
1597,5Pypr,8/7p/3r1k2/5p2/p4P2/PnR3PP/3pK3/3B4 w - - 7 48,d1b3 a4b3 e2d1 d6b6 d1d2 b3b2,2189,75,100,136,advancedPawn crushing endgame long master quietMove,https://lichess.org/hqKxMmTc#95,,474014
1598,sai6R,2b3rk/2p3bp/p1Pp3q/P4p1n/1P1NpP1n/4B2P/4N1P1/2RQ1RK1 w - - 0 32,d1e1 h4g2 g1g2 g7d4 g2h2 d4e3,2189,76,98,116,advantage discoveredAttack kingsideAttack long middlegame,https://lichess.org/YyVclaA7#63,,4774670
1599,rV6V1,3k4/R6p/4P3/5p2/2BK1b2/4r3/8/8 b - - 6 50,f4c7 a7a8 d8e7 d4e3,2189,76,98,151,crushing endgame master short,https://lichess.org/0PCfkwdp/black#100,,4679310
1600,OZNGJ,8/8/ppp5/8/5k2/PPPP1p2/5K2/8 w - - 0 42,a3a4 c6c5 d3d4 c5d4 c3d4 f4e4,2189,76,100,104,crushing endgame long pawnEndgame quietMove,https://lichess.org/WhWqSTuv#83,,2148543
1601,QxT6Y,r1b1n2r/1pkpQ2p/2p4q/p2PP3/8/B1P5/P1K1B3/6R1 b - - 0 33,h6e3 a3d6 e8d6 e5d6 c7b8 e7e3,2189,76,99,373,crushing long middlegame,https://lichess.org/RUdlmm9g/black#66,,2357404
1602,p22rO,r4r2/pp4kp/4Rpp1/6N1/2B5/1PB3Pq/P2P1P1P/6K1 b - - 2 26,h3f5 e6e7 g7h6 e7h7 h6g5 f2f4,2189,75,99,292,advantage long middlegame pin sacrifice,https://lichess.org/YICmdI0L/black#52,,4463171
1603,3wlfm,2kr4/ppp2p2/8/1B5Q/7p/6bb/PP1r4/2R2RK1 w - - 0 28,f1f3 g3h2 g1h1 h3g2 h1h2 g2f3,2189,75,99,455,crushing discoveredAttack exposedKing fork long middlegame,https://lichess.org/AX1rNwSZ#55,,345472
1604,R8tdw,2k1r3/1bb3p1/p7/4q1P1/1P1N4/P1P4R/3QN1P1/6K1 w - - 4 35,h3f3 b7f3 d4f3 e5e2 d2e2 e8e2,2190,74,99,246,advantage long middlegame,https://lichess.org/MW1D33Fz#69,,2373723
1605,rrtP3,k1r5/8/p7/1pqNp2p/n1N1P3/1P1Q2P1/2P4P/1K6 w - - 0 32,c4e5 c5g1 b1a2 g1c1 d5c7 c8c7 d3d8 a8b7,2190,74,98,285,crushing defensiveMove endgame veryLong,https://lichess.org/aPdJNhy4#63,,4711579
1606,UwoUm,8/6p1/4p3/1k6/p1pPP3/2K5/5PP1/8 w - - 0 47,d4d5 e6d5 e4d5 a4a3,2190,75,98,196,crushing endgame pawnEndgame short,https://lichess.org/ySVpCAV0#93,,2706116
1607,SURMe,8/8/2k5/pp1p1p1p/P2P1P2/1PK3P1/8/8 w - - 0 33,b3b4 b5a4 b4a5 c6b5 a5a6 b5a6 c3b4 a4a3 b4a3 a6a5 a3b3 a5b5,2190,75,99,263,crushing defensiveMove endgame pawnEndgame veryLong zugzwang,https://lichess.org/xfuCH9NT#65,,2492142
1608,yLjoz,1q3rk1/r4ppp/2p1p3/4P3/2P2P1P/b1B3P1/K1Q5/1R3B1R w - - 4 28,b1b8 f8b8 c2b3 a3c1 a2b1 b8b3,2190,75,100,395,advantage discoveredAttack exposedKing long middlegame,https://lichess.org/RvHHJ9iJ#55,,5279132
1609,n0yPi,2q1r1kb/2p2p1p/4n1pB/1p2P3/1P1P4/4N2b/2BQ1P1K/4R3 w - - 2 30,h2h3 e6g5 h3h4 g5f3 h4g3 f3d2,2190,76,99,158,advantage doubleCheck exposedKing fork long middlegame,https://lichess.org/l5B6Jo22#59,,4286564
1610,howOk,8/5ppk/2p5/3b3p/3Pp3/2Q1P1KP/1P1NqPP1/8 w - - 0 34,f2f3 h5h4 g3h2 e4f3,2190,75,99,163,crushing deflection endgame master short,https://lichess.org/1d3DPmkS#67,,3831064
1611,SeNk9,r2qr2k/ppp3pp/8/2b1nQN1/P3p3/2N5/B2BK1PP/R6R w - - 2 20,h1d1 d8d3 e2e1 e5f3 g2f3 e4f3,2190,75,98,217,crushing discoveredAttack exposedKing long middlegame sacrifice,https://lichess.org/pevgLfxb#39,,2506080
1612,RPBfP,r4rk1/1p1b1ppp/8/1p4PQ/4P3/1PB5/1qPK3P/1R4R1 b - - 0 26,b2a3 h5h6 a3d6 h6d6,2190,75,99,215,crushing master middlegame short,https://lichess.org/mfYTZCvA/black#52,,2396718
1613,UUAkH,8/PR5p/5k2/1Pb2p2/7P/3p1BP1/r4P2/5K2 w - - 1 50,b5b6 a2f2 f1g1 f2f3 g1h2 f3f2 h2h3 f2a2,2190,76,98,411,advantage discoveredAttack endgame fork master veryLong,https://lichess.org/GPxBZ03E#99,,2666000
1614,QVeaG,8/8/1R6/k1P2p2/2K2P2/b7/p7/8 w - - 6 61,b6b5 a5a6 b5b6 a6a7 b6e6 a2a1q,2190,75,98,227,advancedPawn crushing endgame long master promotion,https://lichess.org/wcrAVASu#121,,2318144
1615,qRmBM,5q2/2Qn3k/3Pb1pp/pp3P2/2pbN1P1/P6P/1P3RBK/4r3 b - - 0 38,e6d5 f5g6 h7g6 f2f8,2190,76,99,276,crushing discoveredAttack master masterVsMaster middlegame pin short,https://lichess.org/PyrT9klX/black#76,,4586793
1616,y6gZo,Q1b2rk1/2pq1p1p/2np1p2/1pb1p3/4P3/2PP1N2/PP1N1PPP/R3K2R w KQ - 2 12,b2b4 c5a7 a2a4 c8a6 a8a7 c6a7,2190,76,99,564,advantage long middlegame quietMove trappedPiece,https://lichess.org/4hTTUG4j#23,Italian_Game Italian_Game_Classical_Variation,5257760
1617,B7ISa,1r6/5Qpk/p2b4/2p1p1Pp/2P1P2q/3PB3/P7/5R1K w - - 0 30,h1g1 h4g3 g1h1 g3h3,2190,75,99,131,crushing endgame fork short,https://lichess.org/zumge6UP#59,,972872
1618,FUJ13,2k4r/ppp1qpbr/5n2/3p1Rp1/3Pp1Pn/2P1P1QP/PP1N2BB/5RK1 w - - 9 22,f5f6 g7f6 f1f6 h4g2 g1g2 h7h3,2190,76,98,92,advantage discoveredAttack long middlegame,https://lichess.org/cuMuTmmf#43,,1354573
1619,6u289,r5k1/1p3p1p/pnn2Qp1/5b2/1q2r3/1B2B3/PP3PPP/R3R1K1 b - - 3 22,b6d7 b3f7 g8f8 e3h6,2190,76,98,157,kingsideAttack master masterVsMaster mate mateIn2 middlegame short,https://lichess.org/F4MqDgby/black#44,,604583
1620,ds1Mw,6k1/4qpp1/p2b2p1/2p5/2N5/1Pn4Q/P1P2PP1/5K2 w - - 0 32,c4d6 e7e2 f1g1 e2d1 g1h2 d1d6,2190,75,99,208,advantage endgame fork long,https://lichess.org/QbiQZcQz#63,,3485964
1621,joa0G,8/8/1Pk2p2/4p2p/4P2P/4KP2/8/8 w - - 0 40,f3f4 c6b6 e3d3 b6b5 f4e5 f6e5 d3c3 b5c5,2190,76,99,110,crushing defensiveMove endgame pawnEndgame veryLong zugzwang,https://lichess.org/x2QNm2g2#79,,4006246
1622,NfSyf,2r3k1/p5pp/5p2/q3p3/3pP1Q1/P7/1R3PPP/1Nr2RK1 w - - 2 27,b2b7 c1f1 g1f1 a5a6 f1e1 a6b7,2191,76,100,85,attraction crushing fork long middlegame,https://lichess.org/yo8lRRNq#53,,2069814
1623,nSKP8,8/4bk1p/p7/1p1K1P1P/1P6/2B5/8/8 b - - 4 42,e7f6 c3f6 f7f6 d5e4 h7h6 e4f4,2191,75,99,169,bishopEndgame crushing defensiveMove endgame long,https://lichess.org/fwW0Uq6R/black#84,,4325317
1624,VFFDG,r6r/1b2qpk1/p3p3/1p1pR2B/3P4/2P5/PPQ2PP1/R5K1 w - - 1 22,c2d2 f7f6 d2f4 f6e5 f4g3 g7f8,2191,75,98,124,advantage defensiveMove long middlegame,https://lichess.org/DchPU8tD#43,,2732136
1625,rItT9,5rk1/QP5p/p3p1p1/2p1q3/6n1/6P1/1P3PP1/R4RK1 w - - 3 30,f2f3 e5e3 f1f2 e3f2 g1h1 g4e3,2191,76,98,205,crushing endgame long,https://lichess.org/tpKLrEaW#59,,4662028
1626,jkjL6,6k1/Rbr4p/5br1/1pBPp3/1Pp1Pp2/5P1q/2B1Q1PP/5RK1 w - - 6 32,d5d6 c7g7 f1f2 f6h4,2191,76,98,202,crushing middlegame pin quietMove short,https://lichess.org/BE32uOZZ#63,,4000814
1627,0aUfR,2k3rQ/1p3p2/p1b1p3/8/3P4/3B2q1/PP6/R2R1K2 w - - 4 29,h8e5 g3g1 f1e2 g8g2,2191,76,100,151,mate mateIn2 middlegame short,https://lichess.org/gvcZRRUI#57,,51417
1628,nco5u,5r2/1p4kp/p2P4/3Npq1p/2rn1p1Q/8/PP4PP/R4RK1 b - - 1 25,c4c2 d5e3 f5f6 h4f6 g7f6 e3c2,2191,75,98,240,advantage long middlegame,https://lichess.org/Qm68qh5w/black#50,,4340087
1629,ITrWR,3q1rk1/5p2/6B1/p1nb2P1/1b1Q1B2/4p1K1/8/2R4R b - - 4 28,d5h1 g6h7 g8h7 c1h1 h7g6 h1h6 g6f5 d4e5,2191,76,100,309,attraction intermezzo mate mateIn4 middlegame veryLong,https://lichess.org/PuIpMMCE/black#56,,1616387
1630,njQKt,r5k1/pp5p/6p1/4r3/3q4/1Q5P/P1P4K/1R3R2 b - - 1 26,g8g7 b3b7 g7h6 b7a8 e5e2 h2h1 d4d6 a8f8 d6f8 f1f8,2191,75,99,316,advantage endgame fork veryLong,https://lichess.org/BPhphDos/black#52,,4349534
1631,v15OO,8/6p1/p6p/1p3k1P/2P1p3/1P6/P4K2/8 b - - 1 40,f5e5 c4b5 a6b5 a2a4,2191,75,100,139,crushing endgame pawnEndgame short,https://lichess.org/lwAgNWwN/black#80,,4987365
1632,9fhGx,8/8/8/5kp1/2K2p1p/5P1P/6P1/8 b - - 10 48,f5e5 c4c5 e5e6 c5c6,2191,76,98,449,crushing defensiveMove endgame pawnEndgame short zugzwang,https://lichess.org/Lgbb92kk/black#96,,846590
1633,JRNcE,6k1/5pp1/1PQ1p3/8/8/Pn4P1/4q1BP/3r2RK w - - 1 37,b6b7 d1g1 h1g1 e2e3 g1h1 e3e1 g2f1 e1f1,2191,75,99,229,attraction endgame mate mateIn4 veryLong,https://lichess.org/QSvTyCQm#73,,1700610
1634,34kC6,k2q4/2r2bpp/1Q3p2/n2p4/3P2P1/P6P/KP3P2/2R2B2 b - - 0 31,a5c4 c1c4 d5c4 f1g2,2191,75,99,131,crushing middlegame sacrifice short,https://lichess.org/NiaqSNqp/black#62,,269075
1635,CphAq,8/p7/1ppk4/8/PPPK4/8/8/8 w - - 1 56,c4c5 b6c5 b4c5 d6e6 a4a5 e6f5,2191,76,99,181,crushing defensiveMove endgame long pawnEndgame,https://lichess.org/qpe0PluQ#111,,1122828
1636,IHEBP,2b5/4k3/2p5/ppN1p3/P3P3/2P1K3/2P5/8 w - - 1 37,c3c4 b5c4 e3d2 e7d6 c5d3 c4d3,2192,76,98,77,crushing endgame long trappedPiece,https://lichess.org/Mb5NTTp8#73,,1598460
1637,H73l1,8/8/P3R3/8/8/7K/r4pP1/5k2 w - - 10 56,e6f6 f1g1 g2g4 a2a6,2192,75,99,373,crushing endgame rookEndgame short,https://lichess.org/xhhuTyiJ#111,,1497061
1638,la7FL,5k2/pp1bp3/5nQ1/4q3/8/2N5/PPP1B3/2K5 w - - 1 27,e2c4 e5f4 c1b1 f4c4,2192,75,99,286,advantage endgame fork short,https://lichess.org/WihXqZaj#53,,4161231
1639,P9xIX,3k4/p3n3/1p1p3q/4Q3/8/4R3/r1r3PP/1K1R4 b - - 7 29,h6g6 d1d6 d8c8 d6g6,2192,76,100,218,crushing fork master middlegame short,https://lichess.org/78WIS9Ok/black#58,,2200456
1640,LzX2p,1k3b1r/p1r5/5q2/1Q1PNppp/4p3/Pb2P3/1B3PPP/1K5R b - - 0 28,b8a8 e5c6 c7b7 b5b7,2192,76,98,372,advantage middlegame queensideAttack short,https://lichess.org/boessfFB/black#56,,1923168
1641,OGiBG,5rk1/1Q3p1p/p5p1/3B4/3b4/1P6/q5PP/5R1K b - - 0 26,a2a5 f1f7 a5a1 f7f1 g8h8 f1a1,2192,75,98,478,crushing discoveredAttack endgame long,https://lichess.org/GvX8ypIE/black#52,,2122103
1642,nn2SJ,8/6R1/4Bp2/p1r2P1p/P4kp1/8/6P1/6K1 w - - 4 39,g7h7 g4g3 g1f1 f4e3 e6c4 c5c4,2192,75,98,176,crushing endgame long,https://lichess.org/knYTZDbm#77,,4354644
1643,2115o,r2r2k1/pp2pR1p/2p1q2b/3nP3/3P4/6P1/1B2Q1BP/5RK1 b - - 0 24,d5e3 e2d3 e6g6 g2e4 g6f7 f1f7,2192,75,99,143,advantage long middlegame,https://lichess.org/6vuIU4oA/black#48,,176733
1644,KSd7B,8/8/2b1P1K1/5P2/5k2/8/8/8 b - - 2 93,f4e5 f5f6 e5e6 f6f7 c6e4 g6g7,2192,75,98,488,advancedPawn bishopEndgame crushing defensiveMove endgame long,https://lichess.org/qhKneqs7/black#186,,1789488
1645,tHojs,8/8/1k5p/1P2p1p1/2K2p2/7P/5PP1/8 w - - 1 41,h3h4 g5h4 f2f3 e5e4 f3e4 f4f3 g2f3 h4h3,2192,76,98,438,crushing endgame pawnEndgame veryLong,https://lichess.org/fGU8SHNz#81,,4836079
1646,MXQwU,8/2RK2p1/3P1k1p/8/5pp1/8/6PP/4r3 b - - 0 41,f4f3 g2f3 g4f3 c7c3 e1e2 c3f3,2192,76,99,125,advantage endgame long rookEndgame,https://lichess.org/Rd9Twibn/black#82,,1971065
1647,oPJl1,4Q3/5p1k/4Bq1p/1p6/4Pp2/7P/1r4P1/5RK1 b - - 0 34,f7e6 f1d1 f6g7 d1d7 b2g2 g1f1,2192,75,98,137,advantage endgame long pin quietMove,https://lichess.org/QmGMWKCy/black#68,,4408421
1648,4w5Y6,3rq1k1/p4p1p/1p4p1/8/3n4/7P/PQ3PP1/B1R3K1 b - - 6 30,e8e4 c1d1 d4f3 g2f3 d8d1 g1g2 d1a1 f3e4,2192,75,99,278,advantage endgame sacrifice veryLong,https://lichess.org/jsuKWJUy/black#60,,431890
1649,bd8KL,4r1k1/p5p1/2pb3p/3p1p2/2P5/3Q4/PP3PPq/R1B1NK2 w - - 2 24,d3h3 h2g1 f1g1 e8e1,2192,76,98,725,attraction deflection mate mateIn2 middlegame sacrifice short,https://lichess.org/jlMvQSBx#47,,3289762
1650,xjAhk,6k1/6p1/b1q2p1p/p4N2/2p5/P4P1P/1P1Q2P1/6K1 b - - 0 35,c6b5 d2d8 g8h7 f5e7 b5c5 g1h1 c5e7 d8e7,2192,76,100,269,crushing endgame quietMove veryLong,https://lichess.org/jnBCWzYG/black#70,,5224519
1651,RD3mD,1k6/Rb6/1p2p3/4Pn1q/1P1P2p1/2P2pP1/5Q2/R5K1 w - - 1 38,f2a2 f3f2 g1f2 h5h2 f2e1 h2g1,2192,76,100,84,advancedPawn attraction crushing endgame exposedKing long,https://lichess.org/NGNKpYHe#75,,2379597
1652,ogdoy,2r3k1/1bq2ppB/pp2p3/4P1N1/3r1Q2/8/PP3PPP/2n1R1K1 b - - 0 23,g8f8 g5e6 f8e7 e6d4,2193,75,98,194,advantage middlegame pin short,https://lichess.org/gcX2ceaX/black#46,,4432775
1653,BKRME,1rb2rk1/p1q2p1p/4pp2/3p4/1b6/1PNBR3/P1PQ1PPP/R5K1 b - - 1 15,b4c3 d3h7 g8g7 e3c3,2193,74,100,93,advantage discoveredAttack middlegame short,https://lichess.org/bCAQ5k0z/black#30,Sicilian_Defense Sicilian_Defense_Open,991485
1654,ekJrG,2b4R/1pp2k2/p5p1/3p1p2/2n2P2/1NQ1q3/PPP5/2K5 w - - 0 32,c1b1 c4a3 b2a3 e3c3,2193,76,98,318,crushing deflection endgame master queensideAttack short,https://lichess.org/y8Ad3JtP#63,,3562215
1655,G5ru6,r7/2Nk4/5R2/p1p1B3/P2p4/1p6/2n3P1/5K2 w - - 4 47,c7a8 b3b2 a8b6 d7e8,2193,76,100,89,advancedPawn advantage defensiveMove endgame short,https://lichess.org/ymJLS8M4#93,,1407630
1656,6dcJM,r2r2k1/1b1nppb1/p7/1pp1P1PQ/5P2/2P1B1q1/PPBN2P1/R2K4 b - - 0 19,f7f6 c2h7 g8f8 e5e6 g3g4 h5g4,2193,76,100,89,crushing long middlegame,https://lichess.org/ypoXxp47/black#38,,581317
1657,I26TN,5r2/3kbQ1p/3pb3/8/1p6/1P2B3/P5PP/K7 w - - 0 31,f7h7 f8f1 a1b2 e6f5 h7e7 d7e7,2193,76,99,330,advantage endgame long master,https://lichess.org/cgJhYcpz#61,,1576961
1658,NrOi4,3r2k1/6p1/7p/q3Pp2/p1pn3P/P4QP1/2R2P1N/3R2K1 w - - 0 32,f3c3 d4e2 g1g2 e2c3 d1d8 a5d8,2193,76,99,204,advantage long middlegame,https://lichess.org/7h4UXTUT#63,,2086588
1659,frLyC,8/5p2/pp6/3kPK2/PP6/8/8/8 w - - 5 46,f5f6 b6b5 f6f7 d5e5 a4b5 a6b5,2193,76,99,187,crushing endgame long pawnEndgame,https://lichess.org/ISxmMUsZ#91,,3659832
1660,8Mz0n,8/8/3p2k1/2nPp3/1p2P1K1/1B6/P7/8 w - - 8 49,g4f3 c5b3 a2b3 g6h5 f3g3 h5g5,2193,75,100,356,crushing defensiveMove endgame long zugzwang,https://lichess.org/C0ffzMt3#97,,732327
1661,BzJZv,8/1p5N/8/P1P2k2/1P3ppp/6b1/4K1P1/8 w - - 0 59,b4b5 h4h3 g2h3 g4h3,2193,75,98,223,crushing endgame short,https://lichess.org/RhpdlimR#117,,1048999
1662,SC6IE,8/7p/3k2pP/2p3P1/2K2P2/8/8/8 w - - 0 50,c4d3 d6e6 d3e4 c5c4 f4f5 g6f5,2193,76,99,113,crushing endgame long pawnEndgame quietMove,https://lichess.org/9SY22LBA#99,,2465970
1663,DcAWb,6k1/p6p/2N3p1/3p4/P1n1p3/2N2rKP/1PP5/R7 w - - 1 27,g3g4 c4e3 g4g5 g8g7,2193,75,98,81,advantage defensiveMove endgame short,https://lichess.org/IaKOflG1#53,,1190844
1664,Zto2d,2kr4/pb1p1p2/1p2p2p/8/2Bb4/N6P/PPP1QPr1/4RK2 w - - 0 23,c4a6 g2f2 e2f2 b7a6 c2c4 d4f2,2193,75,98,285,advantage deflection fork intermezzo long middlegame,https://lichess.org/cNGRuql8#45,,3138368
1665,a4ABq,5r1r/ppQR3B/q1p1pkb1/2P3p1/P4n2/1P6/5PPP/5RK1 w - - 1 30,h7g6 f4e2 g1h1 e2g3 f2g3 a6f1,2193,76,100,178,discoveredAttack kingsideAttack long mate mateIn3 middlegame pin,https://lichess.org/P4FL2k3a#59,,3152899
1666,uxdJY,7k/pp3p2/5p2/3p4/8/4q2r/PPQ3B1/R5K1 w - - 3 31,g1f1 h3h4 c2e2 h4f4,2193,76,98,188,advantage endgame quietMove short,https://lichess.org/ni4F4i68#61,,4982446
1667,BB5RF,r5k1/1p1br1q1/p1p1p1p1/2N5/2Q5/8/PPP2P1P/3RR1K1 w - - 3 29,c5e6 g7f7 d1d7 e7d7,2193,76,98,257,advantage middlegame short,https://lichess.org/9scaANLK#57,,978136
1668,N1DqS,8/8/5k2/p7/1P5P/2pP4/4K3/8 b - - 0 36,a5b4 d3d4 b4b3 e2d3 c3c2 d3d2 f6e6 h4h5,2194,75,98,231,crushing defensiveMove endgame pawnEndgame quietMove veryLong,https://lichess.org/s4mecwFz/black#72,,2013198
1669,dpz8G,1r3r2/2k4p/2p3p1/3b4/Np2n3/1P1NP2P/1PK3P1/3R1R2 w - - 4 24,d3b4 b8b4 f1f8 d5b3,2194,76,98,3846,advantage master middlegame short,https://lichess.org/7gB28Mlw#47,,3483086
1670,cm2hM,6k1/4P3/5KP1/8/p7/1p2r3/6R1/8 b - - 0 68,e3e7 f6e7 g8g7 g2b2,2194,75,98,450,crushing endgame hangingPiece master masterVsMaster rookEndgame short,https://lichess.org/kRk6U10d/black#136,,3389699
1671,O89tN,2rr1k2/6b1/4p3/4Pp1K/1Q6/8/6P1/8 b - - 1 38,f8f7 b4b7 f7e8 h5g6 d8d3 b7c8,2194,76,99,211,crushing endgame long,https://lichess.org/N3YG4Sa4/black#76,,2110000
1672,vqcFa,4r1k1/p2r2pp/1pN2p2/2p5/3p1P2/5B2/PPP3PP/3R2K1 w - - 0 24,c2c3 d4c3 d1d7 c3c2 g1f2 c2c1q,2194,76,98,59,advancedPawn advantage endgame long promotion sacrifice,https://lichess.org/mpiqTjqW#47,,5060197
1673,otl2R,Q1b1k1nr/2qp2pp/p1nbpp2/1pp3B1/8/P1NP4/BPP2PPP/R3K1NR w KQk - 0 11,g5e3 e8e7 c3e4 c8b7 a8b7 c7b7,2194,75,98,1148,advantage long opening trappedPiece,https://lichess.org/Hb1jJIv2#21,Sicilian_Defense Sicilian_Defense_Bowdler_Attack,4451498
1674,5bGY3,6k1/2r2pp1/p3p1PP/1p2P3/2p5/4q3/PP5Q/K6R b - - 0 31,e3h6 h2g2 h6h1 g2h1,2194,75,98,93,advantage endgame quietMove short,https://lichess.org/TMSvwz4B/black#62,,489904
1675,7J2Dp,5rk1/p4p1p/1p4pB/8/4P3/1q1p1Q1P/5PP1/6K1 b - - 1 29,f8c8 f3f6 b3c3 e4e5 c3c1 h6c1,2194,74,99,261,advantage endgame long quietMove,https://lichess.org/vaDjjC9o/black#58,,639652
1676,mtrtB,8/3b1Pk1/8/p2Kp1N1/2P5/1P2p3/P7/8 w - - 0 47,d5e5 d7g4 e5f4 e3e2 f4g4 e2e1q,2194,76,99,481,advancedPawn advantage endgame long promotion quietMove,https://lichess.org/nwaRhzFL#93,,4276649
1677,EyrIT,5b2/1pqn4/p2p2kp/P1pP1p1P/4rB2/4NpP1/1PQ5/R5K1 b - - 0 27,g6h5 g3g4 h5g6 g4f5 g6h7 c2e4,2194,75,98,266,crushing long middlegame,https://lichess.org/8681dPzL/black#54,,1310221
1678,ftozF,2k5/6R1/7P/8/6P1/Kp6/2p5/2r5 w - - 0 51,h6h7 c1h1 a3b3 c2c1q,2194,76,100,146,advancedPawn clearance crushing endgame master promotion rookEndgame short,https://lichess.org/DBmXWr45#101,,3663401
1679,AiZvj,4k3/5p1P/p5p1/1p1p1p2/3P1q2/2P5/PP4K1/7Q b - - 0 28,f4g4 g2f2 g4f4 f2e2,2194,75,98,142,crushing defensiveMove endgame queenEndgame short,https://lichess.org/5p72uB3m/black#56,,937982
1680,bOV90,5r1k/1Qp2qp1/3p3p/p3p3/5r2/2PP1NNP/PP3KP1/R7 w - - 5 28,a1f1 e5e4 b7e4 f4e4,2194,75,98,169,advantage middlegame short,https://lichess.org/0qV50rl3#55,,3269088
1681,29JHB,r4k2/p4pp1/P2N3p/2pPnQ2/1qB1P3/5PP1/7P/6K1 b - - 4 39,f7f6 f5h7 b4e1 g1g2 e1d2 g2h3,2194,76,98,81,advantage defensiveMove endgame long,https://lichess.org/2WzSooG5/black#78,,188322
1682,B4a9b,r3k1r1/pppq1pPp/2n1b3/b5B1/2pp4/2P2N2/P2N1PPP/R2QR1K1 b q - 4 13,d4c3 d2e4 d7d1 e4f6 e8e7 f6g8,2195,76,98,360,advantage doubleCheck fork long middlegame sacrifice,https://lichess.org/v84vC2El/black#26,Italian_Game Italian_Game_Evans_Gambit,969000
1683,C5mhD,8/7B/3P2bp/1p3k2/1P2p3/4K1p1/8/8 b - - 0 53,g3g2 e3f2 g6h7 d6d7 e4e3 f2g2,2195,75,100,103,advancedPawn bishopEndgame crushing endgame long master sacrifice,https://lichess.org/bbRUMMyR/black#106,,1058066
1684,YOdzB,2r2rk1/p4p1p/1p2p1p1/1qnn4/4P3/3P4/BB1Q1P1P/K1R3R1 b - - 0 25,d5b4 d2h6 c5b3 a2b3 c8c1 g1c1,2195,76,100,338,advantage long middlegame,https://lichess.org/kqOjxUpq/black#50,,3007089
1685,q3qFi,6k1/QRr2ppp/2q1p3/3p4/8/P6P/5PP1/1Rr3K1 w - - 11 30,b1c1 c6c1 g1h2 c1f4 g2g3 c7b7 a7b7 f4f2,2195,76,99,181,advantage endgame veryLong,https://lichess.org/pGgXtYpm#59,,4553095
1686,Djs2X,r1bq1r2/pp2bp1k/4p1p1/2pn3Q/3P3P/2PB4/PP1B1PP1/R3K2R b KQ - 1 15,h7g7 h5h6 g7g8 h4h5,2195,76,100,64,crushing middlegame short,https://lichess.org/hJ6ciEeY/black#30,Queens_Pawn_Game Queens_Pawn_Game_Torre_Attack,1201552
1687,MLCbZ,8/6pp/3k4/5PPP/pK6/8/8/8 b - - 0 41,d6e5 f5f6 e5e6 f6g7 e6f7 h5h6,2195,75,99,633,advancedPawn crushing endgame long pawnEndgame,https://lichess.org/wNlz5Qzz/black#82,,1953795
1688,44pTH,1r3r1k/p1p2Rpp/1pq5/8/5n2/1Q4N1/PP3PPP/3R2K1 w - - 4 25,f2f3 f8f7 b3f7 c6c2 f7f4 c2d1,2195,75,98,111,advantage long master middlegame,https://lichess.org/blHoW7Et#49,,357052
1689,AldSv,8/2q2k2/pRP1p2p/3r1pp1/4p3/P6P/1Q3PP1/7K b - - 0 35,d5b5 b2b5 a6b5 b6b7 c7e7 c6c7 e7c7 b7c7,2195,76,100,188,advancedPawn crushing endgame pin sacrifice veryLong,https://lichess.org/7iNeYDxX/black#70,,942294
1690,QoOvd,8/8/p1Pk4/PP6/2K2P1p/8/8/8 w - - 0 57,c6c7 a6b5 c4b3 d6c7 f4f5 h4h3,2195,75,98,467,crushing endgame long pawnEndgame,https://lichess.org/idjEA3pr#113,,2344533
1691,LNon3,3r4/1P6/1K5k/8/6p1/7p/2R5/8 b - - 1 58,h6h5 c2c8 d8d2 c8c5 h5h4 b7b8q d2b2 c5b5 b2b5 b6b5,2195,76,98,1522,advancedPawn crushing endgame promotion rookEndgame veryLong,https://lichess.org/vutiD7pW/black#116,,1869659
1692,8TYQ2,r2qkb1r/1b3p1p/p4P2/1pn5/2p5/5N2/PP3PPP/R1BQR1K1 b kq - 0 16,c5e6 e1e6 f7e6 f6f7 e8f7 f3e5,2195,76,99,139,advancedPawn advantage attraction long opening sacrifice,https://lichess.org/EqKm4HvU/black#32,Queens_Gambit_Declined Queens_Gambit_Declined_Three_Knights_Variation,741442
1693,9hLeo,8/8/2p5/1p6/1P3K2/1kP5/1P6/8 w - - 5 66,f4e5 b3b2 e5d4 b2c2 c3c4 c2b3 c4b5 c6b5 d4c5 b3a4,2195,76,99,161,crushing endgame pawnEndgame veryLong zugzwang,https://lichess.org/hCM1tbMJ#131,,848929
1694,p0zdq,rk5r/p1b1R1p1/Qp3n1p/5q2/1PN2n1P/2P2N2/5PP1/R5K1 b - - 8 27,f6d5 c4d6 f4h3 g1f1 f5d3 a6d3,2195,74,98,380,crushing defensiveMove long middlegame,https://lichess.org/lczpBppk/black#54,,4461684
1695,KCY5Z,2kr4/pb2q1p1/1pn2p2/4pPPQ/3pP2P/2pP1N2/PPP5/2KR3R w - - 0 20,g5f6 e7b4 b2c3 d4c3,2195,75,99,326,advantage middlegame short,https://lichess.org/HHmwjVi2#39,,1766855
1696,AJ2gi,1k5r/ppp5/6r1/8/4P1N1/4B1K1/PPP2Q1n/R7 w - - 2 32,g3f4 h8f8 g4f6 f8f6 f4e5 h2g4,2195,76,98,303,advantage long middlegame,https://lichess.org/pAUvCr10#63,,902107
