,PuzzleId,FEN,Moves,Rating,RatingDeviation,Popularity,NbPlays,Themes,GameUrl,OpeningTags,ID
3644,JyL7h,r5k1/1p2pr1p/p1b1R1pB/2p3N1/3b4/3P4/P1P1Q1qP/5R1K w - - 0 21,e2g2 f7f1,1405,74,100,1538,kingsideAttack mate mateIn1 middlegame oneMove pin,https://lichess.org/tWZoxbif#41,,1746750
3645,3nZBu,r1bqk2r/pp3pp1/2n4p/1B1pp1N1/8/5N2/PPP2PPP/R2QK2R w KQkq - 0 11,g5h3 d8a5 c2c3 a5b5,1405,74,100,202,advantage fork opening short,https://lichess.org/QddkM3Ie#21,Indian_Defense Indian_Defense_Reversed_Chigorin_Defense,332575
3646,fThVS,6k1/p4ppp/4p1n1/3pP3/1P1NbP2/q6P/2rB2P1/3Q1R1K w - - 3 24,d4c2 a3h3 h1g1 h3g2,1405,74,100,1243,kingsideAttack mate mateIn2 middlegame pin short,https://lichess.org/Tq1swgrC#47,,3625954
3647,R8v8A,4r3/1b6/p1q5/8/Pkp4P/4B3/1Q3K2/5B2 b - - 1 52,b4a5 e3d2 c4c3 d2c3 c6c3 b2c3,1405,74,100,436,crushing endgame long,https://lichess.org/WHUj8LV6/black#104,,2373759
3648,gEs4z,r7/7p/6p1/3k1p2/p2Bp3/R6P/4KPP1/8 w - - 4 44,e2e3 f5f4 e3f4 d5d4,1405,74,100,488,advantage deflection endgame short,https://lichess.org/YHCp2bqU#87,,3692776
3649,eE79w,8/kp3p2/p4q1p/1np1N1p1/8/1PP1P1P1/P2Q1PP1/2K5 w - - 5 31,c3c4 f6e5 c4b5 e5a1 c1c2 a1a2,1405,74,100,423,advantage endgame exposedKing interference long queensideAttack,https://lichess.org/I4Yu6YtH#61,,3517163
3650,QoZpo,4kb2/1p4rp/pB3pp1/4pq2/2Q5/8/PP3PPP/3R2K1 b - - 1 27,g7e7 d1d8,1405,74,100,333,endgame mate mateIn1 oneMove,https://lichess.org/Dg6RPvPJ/black#54,,2344789
3651,bpT0E,8/1p3k1Q/4pp2/p2p4/P2P1Pr1/8/1P1qNK2/8 b - - 11 43,f7e8 h7h5 e8e7 h5g4,1405,74,100,249,advantage endgame fork short,https://lichess.org/hT8y55g2/black#86,,3307305
3652,5QwOE,r5k1/p1p1Rr1p/4RBpQ/3q4/8/8/1PP2PbP/6K1 b - - 0 25,g2h1 e7e8 a8e8 e6e8 f7f8 e8f8,1405,74,100,494,long mate mateIn3 middlegame,https://lichess.org/5vFoPW6i/black#50,,475308
3653,vgAGR,3r2k1/pp3p1p/6p1/4q3/8/1P2P2P/P1Q2PP1/2R3K1 w - - 0 23,c2c7 d8d1 c1d1 e5c7,1405,74,100,299,advantage deflection endgame short,https://lichess.org/WW2J27nJ#45,,5045492
3654,YwTuD,2k3r1/ppp3q1/8/2P2p2/1P1p1p1p/P2P1PrP/4QRPK/R7 w - - 7 25,a1g1 g3h3 g2h3 g7g1,1405,74,100,1440,discoveredAttack endgame mate mateIn2 short,https://lichess.org/LUL7IIJc#49,,3054790
3655,WoGHY,1r1r4/6kp/pq4p1/1p1p4/1QpNp3/P1P1P3/1P3PPP/5RK1 b - - 6 31,a6a5 b4e7 g7g8 d4e6 b6b7 e7b7 b8b7 e6d8,1405,74,100,1167,advantage endgame veryLong,https://lichess.org/GpRfXvHx/black#62,,2868478
3656,JfuTo,r1b2rk1/ppp4p/2np2p1/7n/3bpP2/2NP1K1P/PPPBN1B1/R6R w - - 0 15,d3e4 c6e5,1405,74,100,817,mate mateIn1 middlegame oneMove pin,https://lichess.org/unJb8NQp#29,Pirc_Defense Pirc_Defense_Other_variations,1720890
3657,JsgwX,8/1pb5/p1p4k/2P3qP/1P3p1R/6P1/P2Q1P2/6K1 w - - 2 35,g1g2 f4f3 g2f3 g5d2,1405,74,100,294,crushing discoveredAttack endgame short,https://lichess.org/DokLlZ4v#69,,1738746
3658,rz8aS,r1q1bkn1/4p1r1/6B1/p2p4/1p1n1Q2/5P2/PPP5/1NKR2NR b - - 2 28,g8f6 h1h8 g7g8 f4h6,1405,74,100,535,mate mateIn2 middlegame short,https://lichess.org/klWYotxb/black#56,,4721764
3659,mbsYx,5R2/k1p5/pp6/3Q4/3B4/1KPP2P1/1P6/3q4 w - - 17 47,b3c4 d1a4 b2b4 a4a2,1406,74,100,631,endgame mate mateIn2 short,https://lichess.org/tA0PP7Lm#93,,4251381
3660,8coyq,2r3k1/3p3p/p1q1pbp1/2P5/2Q5/8/P4PPP/1R2R1K1 w - - 4 27,b1b6 c6b6 c5b6 c8c4,1406,74,100,543,advantage discoveredAttack endgame short,https://lichess.org/6WcBtmoA#53,,754558
3661,mq83a,8/1p6/p2P2p1/1kP3p1/1P5p/2B2P1b/1Pr5/3R3K b - - 0 41,h3g2 h1g1 g2h3 d6d7 h3d7 d1d7,1406,74,100,267,advancedPawn advantage endgame long,https://lichess.org/VrQoMnum/black#82,,4271355
3662,wsKS9,8/8/6p1/7p/p1k2P1P/4K1P1/1P6/8 w - - 2 43,f4f5 g6f5 e3f4 c4b3 f4f5 b3b2 g3g4 a4a3 g4g5 a3a2,1406,74,100,384,advancedPawn crushing endgame pawnEndgame veryLong,https://lichess.org/rbPZcvGL#85,,5150044
3663,F2tya,5rk1/R5p1/3p3p/2rP1p2/2q1p3/6P1/P2Q1P2/5BK1 b - - 2 33,c4d5 d2d5 c5d5 f1c4,1406,74,100,2690,advantage endgame pin short,https://lichess.org/X9LdanAh/black#66,,1315873
3664,gui7Y,rn6/pp2rpkp/2p3p1/4b1N1/2B5/1P6/P5PP/4RR1K b - - 4 26,e5f6 e1e7 f6e7 f1f7,1406,74,100,1148,advantage middlegame short,https://lichess.org/kGPtmpMK/black#52,,3751867
3665,owWzH,8/8/1p5p/2p1k3/5pP1/5K2/PP5P/8 w - - 2 39,b2b3 b6b5 h2h4 c5c4,1406,74,100,441,crushing endgame pawnEndgame quietMove short,https://lichess.org/jeOHByF6#77,,4455454
3666,DoLge,4q2k/1p3rbp/3P4/1P4p1/2Q2P2/4p1P1/4N2P/3R2K1 w - - 2 32,c4f7 e8f7 d6d7 g7f6 d7d8r f6d8 d1d8 h8g7,1406,74,100,1099,advantage defensiveMove endgame hangingPiece quietMove veryLong,https://lichess.org/aE7d4Cdx#63,,1207978
3667,Vmkkl,8/8/6p1/1P2kp2/7r/2R2K2/5P2/8 w - - 0 41,b5b6 h4h3 f3g2 h3c3 b6b7 c3b3 b7b8q b3b8,1406,74,100,796,crushing endgame rookEndgame skewer veryLong,https://lichess.org/TsiF5Bmf#81,,2779197
3668,RjikX,3r4/p4p1k/4p2p/2p1qp2/2Q5/1P5P/P4PP1/2R3K1 w - - 0 31,c4c5 d8d1 c1d1 e5c5,1406,74,100,219,crushing deflection endgame master short,https://lichess.org/LOWqU0nW#61,,2425822
3669,ZW6ZA,1Q3bk1/7p/2N2r2/4p2q/8/2P2pP1/PP1r1P1P/5RRK w - - 5 33,b8e5 h5h2 h1h2 f6h6 e5h5 h6h5,1406,74,100,899,attraction fork long mate mateIn3 middlegame sacrifice,https://lichess.org/jq4zVhvk#65,,3104841
3670,ML7Wg,8/8/3k3p/6p1/1N2Rp2/3p1P1P/5KP1/2brB3 w - - 2 51,b4a2 c1e3 e4e3 f4e3 f2e3 d1e1,1406,74,100,742,attraction crushing endgame long,https://lichess.org/Ihbyoobd#101,,1953673
3671,Ej3wc,1r4k1/1q2b1R1/4p2p/3pN2r/3P4/8/1PQ2P2/1K1R4 b - - 0 30,g8g7 c2g6 g7h8 e5f7,1406,74,100,182,fork mate mateIn2 middlegame short,https://lichess.org/pD1fKzmZ/black#60,,1288063
3672,t6dWB,8/2p5/2P2k1p/pqp1b1pP/2p1Pp2/Pr3P2/1PRQ4/KR6 w - - 0 47,d2d7 b3a3,1406,74,100,2867,endgame mate mateIn1 oneMove pin,https://lichess.org/h0KmuXke#93,,4820185
3673,KqzEs,8/1r6/p6p/P1P1p3/kP1b4/3P1KP1/7P/1R6 b - - 6 40,b7b4 b1b4 a4b4 c5c6 b4a5 c6c7,1406,74,100,662,advancedPawn crushing endgame long,https://lichess.org/d3rr4D1C/black#80,,1823543
3674,iuQgg,4qr1k/6pp/1p2p2r/p2pNPR1/2pPnP2/2P1P2P/1P5K/4QR2 b - - 0 35,e4g5 f4g5 h6h3 h2h3,1407,74,100,1007,advantage middlegame short,https://lichess.org/tIHuTYrE/black#70,,3926775
3675,9JSyb,8/p7/3kp2p/3bQ1p1/3Pp3/2P1q1NK/P6P/8 b - - 9 43,d6c6 c3c4 d5c4 e5c5,1407,74,100,521,advantage endgame short,https://lichess.org/wbjrnkvO/black#86,,815228
3676,pjfyw,8/2P5/3K4/6k1/R4p2/8/8/4r3 b - - 0 60,e1c1 a4a5 g5h4 a5c5 c1c5 d6c5 f4f3 c7c8q,1407,74,100,466,advancedPawn crushing endgame promotion rookEndgame veryLong,https://lichess.org/Xx76yIOA/black#120,,4524993
3677,20HuZ,r4rk1/1bppb1pp/np2pn2/p4p1q/2PP4/PPN1PNP1/1B3PBP/R2Q1RK1 w - - 1 12,c3e2 b7f3 g2f3 h5f3,1407,74,100,593,advantage middlegame short,https://lichess.org/8foEPhbu#23,Horwitz_Defense Horwitz_Defense_Other_variations,175741
3678,1Os7w,r2k1b1N/pp3ppp/7n/2pP1b2/2P5/2N3P1/PP2Q2P/2KR1B1q b - - 4 15,f5g4 h8f7 h6f7 e2g4,1407,74,100,580,crushing deflection middlegame short,https://lichess.org/sXq7cGAh/black#30,Horwitz_Defense Horwitz_Defense_Other_variations,122650
3679,s36Ly,r2r2k1/4p3/6p1/p1pPPp2/1p3PpR/3P2P1/P5K1/1R6 b - - 2 27,g8g7 b1h1 d8d5 h4h7 g7g8 h7h8,1407,74,100,925,advantage endgame long quietMove rookEndgame,https://lichess.org/RSbzlpHF/black#54,,4727403
3680,eF9kf,k2r3r/pbQnqppp/1p6/1N1p4/3P4/4PN2/PP3PPP/2KR3R w - - 1 16,b5d6 d8c8 d6c8 h8c8 c7c8 b7c8,1407,74,100,915,advantage long middlegame pin sacrifice,https://lichess.org/DCT759T5#31,Queens_Gambit_Declined Queens_Gambit_Declined_Other_variations,3518583
3681,D0jqo,6rk/1pp4p/1p6/3Ppp2/2P1np1P/1P6/rB2R3/5KR1 b - - 5 26,e4g3 g1g3 g8g3 b2e5 h8g8 e2a2,1407,74,100,450,advantage discoveredAttack endgame long pin,https://lichess.org/u2V3BuX2/black#52,,1138355
3682,3laA3,2r1k2r/5pQn/p3p1n1/1ppB4/5q2/P2PR3/1PP2PPP/4R1K1 b k - 2 23,f4f6 e3e6 f7e6 e1e6 f6e6 d5e6,1407,74,100,823,crushing fork long middlegame sacrifice,https://lichess.org/2yniGhDB/black#46,,329760
3683,NqJe4,3r1r1k/ppp2p1P/5q2/4n3/4Q3/4P3/PP3PP1/R1B1K2R w KQ - 1 19,c1d2 e5d3 e4d3 d8d3 d2c3 d3c3,1407,74,100,698,crushing long middlegame,https://lichess.org/jAA7ZAOR#37,,2085094
3684,GW8mE,3k4/3b2R1/1p6/3B4/pP2P2P/8/P1r2pP1/5K2 w - - 7 44,g7f7 d7b5 d5c4 b5c4,1407,74,100,612,endgame mate mateIn2 short,https://lichess.org/KW9g0JAc#87,,1444888
3685,E9BfP,2r3k1/pp2nrpp/1n1p4/3P1p2/4p3/1PN1P1P1/P3P1BP/2R2R1K b - - 0 20,b6d5 c3d5 c8c1 d5e7 f7e7 f1c1,1407,74,100,627,advantage long middlegame,https://lichess.org/st33OiNm/black#40,,1237437
3686,GrsJ7,8/8/1p6/1k1p2pp/pP1P4/P2K1P2/6P1/8 w - - 0 47,d3e3 b5c4 f3f4 g5f4,1407,74,100,627,crushing endgame master pawnEndgame short,https://lichess.org/jzXCxziy#93,,1475610
3687,CKZKg,2b3k1/2P3rp/8/3p1p2/3qnB2/8/4Q2P/2R2R1K w - - 2 32,f1g1 e4f2 e2f2 d4f2 g1g7 g8g7,1407,74,100,265,crushing long middlegame,https://lichess.org/COhGTZU5#63,,1079030
3688,tM9dG,8/5ppk/4p2p/1p2R2P/8/4Q1B1/5PPK/1r1q4 w - - 5 42,e3e4 f7f5 e4b1 d1b1,1407,74,100,787,advantage defensiveMove endgame master short,https://lichess.org/bsIuqXDG#83,,4842287
3689,dOfeA,1k2r3/1p4R1/1P6/3K2p1/4pp2/7P/5PP1/8 w - - 0 52,g7g5 e4e3 f2e3 f4e3 g5e5 e8e5,1407,74,100,659,crushing endgame long rookEndgame,https://lichess.org/vWWmaje8#103,,3444584
3690,t732f,1n4r1/N1Q1k2p/4p3/4n3/2P5/1P2K3/P2R2PP/1q6 b - - 0 35,e7f6 d2f2 f6g6 c7e5 b1e1 f2e2,1407,74,100,364,advantage deflection long middlegame,https://lichess.org/SXMVW3eq/black#70,,4820753
3691,AP5AF,4R3/p5pk/1p1q3p/3pN3/5P2/6K1/P5P1/8 b - - 0 41,d5d4 e8h8 h7h8 e5f7 h8h7 f7d6,1407,74,100,208,advantage attraction endgame fork long sacrifice,https://lichess.org/EjK5pYoQ/black#82,,910635
3692,uDg4V,8/1ppk4/p4p2/P1Pp1Pp1/1P1P2P1/3K4/8/8 w - - 4 45,d3c3 d7c6 c3b2 c6b5,1408,74,100,215,crushing endgame pawnEndgame short,https://lichess.org/D2t2ybxW#89,,4918057
3693,xbzE7,5k2/5p2/6p1/3r4/4RPPK/8/8/8 w - - 1 41,e4e5 d5e5 f4e5 f8e7 h4g5 e7e6,1408,74,100,232,crushing endgame long rookEndgame,https://lichess.org/y8rTjuI8#81,,5214497
3694,ajXeA,5k2/7K/4p1P1/p2pPn2/Pp3B2/1P6/8/8 w - - 3 80,f4h6 f5h6 g6g7 f8f7 h7h6 f7g8,1408,74,100,350,crushing endgame long,https://lichess.org/qylemPYo#159,,3211278
3695,B8IQt,3r3k/p1Q2R2/1p1r3p/2p5/2Pq4/PP2p2P/6P1/1R5K b - - 6 37,e3e2 f7h7 h8g8 c7f7,1408,74,100,337,endgame mate mateIn2 short,https://lichess.org/sOm1Zqmt/black#74,,974244
3696,Oscjp,1r4k1/5ppp/p1R1p3/6P1/3P1q2/Q4p1P/Pr3P2/4R1K1 w - - 0 27,a3b2 f4g5 g1f1 g5g2,1408,74,100,4026,endgame mate mateIn2 short,https://lichess.org/JNSfZpDV#53,,2175833
3697,2Q8gB,6k1/1r3pp1/3Qp1q1/3b3p/1P1P4/2P2P1P/5KP1/2R5 b - - 0 33,b7a7 d6b8 g8h7 b8a7,1408,74,100,1169,advantage endgame fork short,https://lichess.org/tJavjAWt/black#66,,211839
3698,8YgTY,2r5/p3k2p/1p4p1/nPrBPp2/2P5/2R4P/6P1/2R4K w - - 1 38,c1a1 c5d5 c4d5 c8c3,1408,74,100,1233,advantage discoveredAttack endgame master short,https://lichess.org/25HneRqj#75,,748711
3699,v5CGF,r3k2r/pbpp2p1/1p2p2p/8/3N1P1q/P2p3P/BPPB2P1/R2Q3K w kq - 0 20,c2d3 h4h3 h1g1 h3g2,1408,74,100,255,kingsideAttack mate mateIn2 middlegame pin short,https://lichess.org/tzWqRzsS#39,,4993217
3700,apRMb,7r/ppp3k1/6P1/4P3/2P1Q1R1/PPq3KR/8/8 w - - 3 43,e4f3 h8h3 g3h3 c3f3,1408,74,100,295,advantage attraction endgame pin short,https://lichess.org/0VjrQGQS#85,,3219631
3701,l89or,r2qk2r/ppp3pp/8/3Pp3/1BB1p1nn/3P2K1/PPP1N2P/R2Q3R w kq - 0 14,g3g4 h7h5 g4g3 d8g5,1408,74,100,1032,crushing middlegame short,https://lichess.org/ftFglgfP#27,Bishops_Opening Bishops_Opening_Vienna_Hybrid,4121517
3702,LFQ1R,r4rk1/1p2bpp1/pBb4p/P7/2P3Q1/1PP4P/2q2NP1/1R3RK1 b - - 6 25,c2c3 b6d4 c3d4 g4d4,1408,74,100,894,advantage middlegame short,https://lichess.org/gXUYr4DU/black#50,,1857808
3703,KW5Dh,r3r3/ppp3k1/3p2p1/8/2QP3p/P1P2qNP/1P3P2/R4R1K w - - 2 24,h1h2 h4g3 f2g3 e8e2 c4e2 f3e2,1408,74,100,1163,crushing long middlegame,https://lichess.org/n5FHXCA3#47,,1794326
3704,z7ogA,3r1rk1/ppq1bppp/2b1pn2/3N4/2P4Q/1P1B4/PBK2PPP/3R3R b - - 14 18,c6d5 b2f6 h7h6 f6e7,1408,74,100,862,advantage middlegame short,https://lichess.org/ezwOwHV0/black#36,English_Opening English_Opening_Agincourt_Defense,5347167
3705,G0naI,rr4k1/2p2ppp/p3p3/8/1q5P/6P1/PPQ2P2/R2R2K1 b - - 4 20,b4b2 d1d8 b8d8 c2b2,1408,74,100,656,advantage deflection endgame short,https://lichess.org/FlAm1Ium/black#40,,1400461
3706,ez9fU,5rk1/p1b1R3/1p1q3p/2p3pQ/P7/2NP1p1P/1PPB1P2/6K1 w - - 2 32,d2g5 d6h2 g1f1 h2h1,1408,74,100,2273,kingsideAttack mate mateIn2 middlegame short,https://lichess.org/Oy9cEnqw#63,,3583141
3707,xMSLJ,1r4r1/1b1k1p2/pR1ppp1p/2p5/P3PP2/2PB4/2P3PP/R5K1 b - - 1 20,b7e4 b6b8 g8b8 d3e4,1408,74,100,536,advantage endgame intermezzo short,https://lichess.org/r5zG4IL0/black#40,,5192594
3708,i5C2W,8/1b4k1/3pq1rp/p3pR2/PpPbP1PB/1P4KP/6B1/5Q2 w - - 13 43,f5f6 g6f6 h4f6 e6f6 f1f6 g7f6,1408,74,100,236,crushing long middlegame,https://lichess.org/TxHVvxua#85,,3854453
3709,2Uxtg,2rqnrk1/1p2b1pp/p2Nb3/4Pp2/P1p2B2/2Pp4/BP1Q1PPP/1R2R1K1 b - - 1 20,e8d6 e5d6 e7d6 e1e6 d6f4 d2f4,1408,74,100,430,advantage discoveredAttack long middlegame,https://lichess.org/xkQwBOFp/black#40,,218591
3710,MMxym,3r4/8/pp2k1pp/2q1bB2/2P2Q2/7P/P5P1/3R3K b - - 0 32,g6f5 f4h6 e5f6 d1d8,1408,74,100,424,advantage endgame master pin short,https://lichess.org/PG2ydeFN/black#64,,1956293
3711,4E0wT,8/8/3p4/3B1b2/1P1P1k2/7p/5K2/8 b - - 0 47,f5e4 d5e4 f4e4 b4b5 h3h2 f2g2 h2h1r g2h1,1409,74,100,241,bishopEndgame crushing endgame quietMove veryLong,https://lichess.org/2S6Wane9/black#94,,370099
3712,yZxVR,r7/3Q1k2/5p2/8/5B2/6P1/6PK/qq6 b - - 5 48,f7f8 f4h6 f8g8 d7g7,1409,74,100,1247,endgame master mate mateIn2 short,https://lichess.org/PLEwhEFT/black#96,,5299185
3713,wlTl8,5rk1/1R3ppp/8/q2p4/P1b1n3/3nPQ1P/6PB/5RK1 b - - 5 31,e4d2 f3f7 f8f7 b7b8 a5d8 b8d8 f7f8 f1f8,1409,74,100,2720,mate mateIn4 middlegame sacrifice veryLong,https://lichess.org/jVMychw8/black#62,,5140370
3714,yDol1,r4r1k/1pp1R3/3p3p/3P4/1qP2p2/2NB1P1b/P1K4P/4R3 b - - 2 30,c7c6 e7h7 h8g8 e1g1 h3g2 g1g2,1409,74,100,1434,exposedKing long mate mateIn3 middlegame,https://lichess.org/Rt2lIfgV/black#60,,5267909
3715,4RRz2,r7/4k3/2R2p2/p3p1p1/4BnPp/P7/5K1P/8 b - - 8 39,f4e6 c6e6 e7e6 e4a8,1409,74,100,912,crushing discoveredAttack endgame short,https://lichess.org/aWapNgBC/black#78,,389098
3716,169o2,5rk1/pp3r1B/3pQ3/2pP2N1/2P5/1P6/P6P/3q1n1K b - - 0 31,g8g7 e6g6 g7h8 g5f7 f8f7 g6g8,1409,74,100,2745,exposedKing long mate mateIn3 middlegame,https://lichess.org/fwodNQ8W/black#62,,96093
3717,2HUIJ,5r1k/p1p3p1/6Qp/1p2P3/8/P1P4P/1PP1q1P1/3R3K w - - 5 32,d1d7 f8f1 h1h2 e2e5 g6g3 f1h1 h2h1 e5g3,1409,74,100,1057,crushing deflection endgame veryLong,https://lichess.org/3BrvAw4A#63,,199831
3718,AxXpu,5n2/5k2/1p2p1p1/1Q1pP1P1/1P2bP2/4P3/q7/2RK4 w - - 4 54,b5b6 e4f3 d1e1 a2e2,1409,74,100,1698,endgame mate mateIn2 short,https://lichess.org/3yaq3fU8#107,,959040
3719,1y9WF,3k4/p3p1b1/3p4/8/6QP/1P3N2/6P1/qKBR3R w - - 3 32,b1c2 a1c3 c2b1 c3b3 c1b2 b3b2,1409,74,100,1064,deflection long master mate mateIn3 middlegame,https://lichess.org/hTyrbiTZ#63,,172665
3720,mEB3G,5rk1/ppp2p1n/2n2qpQ/2bBp2b/4P2P/3P4/PPP2P2/R2NK1R1 b Q - 3 15,h5d1 g1g6 f6g6 h6g6,1409,74,100,656,advantage kingsideAttack middlegame pin short,https://lichess.org/nDgrNQOx/black#30,Italian_Game Italian_Game_Giuoco_Pianissimo,4218078
3721,5EIbj,6k1/5pp1/3rp3/7Q/p1pR3P/P1P5/1P3PPq/5K2 w - - 1 36,d4c4 h2h1 f1e2 h1d1,1409,74,100,1232,crushing endgame short,https://lichess.org/ggpEiqwl#71,,457500
3722,UWfIv,8/5pp1/1p2p1p1/2kpP3/P5PP/2K5/8/8 b - - 0 51,f7f6 e5f6 g7f6 h4h5 g6h5 g4h5,1409,74,100,345,crushing endgame long pawnEndgame,https://lichess.org/HbnaowyH/black#102,,2669498
3723,FXLHb,7k/4qp1P/4p1pQ/3pP3/3P1K2/r7/6P1/7R b - - 8 39,e7b4 h6g7 h8g7 h7h8q,1409,74,100,737,advancedPawn attraction endgame mate mateIn2 promotion short,https://lichess.org/2eFzxyaM/black#78,,1358895
3724,IvLMC,r4rk1/2pq1p2/p4bp1/1p1Np3/4P3/1P1P3R/1PP1NPP1/R3K3 b Q - 0 17,g8g7 h3h7 g7h7 d5f6 h7g7 f6d7,1409,74,100,1217,advantage attraction deflection fork long middlegame sacrifice,https://lichess.org/k8nJTMcP/black#34,Kings_Pawn_Game Kings_Pawn_Game_Wayward_Queen_Attack,1655329
3725,L3y0x,8/1r5k/2p4p/p2nBK1P/P2P4/8/8/2R5 w - - 7 48,c1c6 d5e7 f5e4 e7c6,1409,74,100,272,crushing endgame fork master short,https://lichess.org/3Gw3FRQp#95,,1841705
3726,EI2Xw,4k3/ppp2pp1/2n1r3/5Bq1/8/5K1Q/P4PPP/3R4 b - - 5 26,e6f6 h3h8 e8e7 d1d7,1409,74,100,303,endgame mate mateIn2 short,https://lichess.org/mFoRNoqQ/black#52,,1249929
3727,hUj32,8/5p2/3kb1p1/1p5p/4R2P/4PP2/1rB3P1/3K4 w - - 0 36,d1c1 b2c2 c1c2 e6f5 c2b3 f5e4,1409,74,100,1053,crushing endgame long pin sacrifice,https://lichess.org/9udv2Z8l#71,,3802403
3728,CiwBC,8/6p1/2nk4/4p1N1/1Ppp2PP/2P1K3/8/8 w - - 0 41,c3d4 e5d4 e3e4 c4c3,1409,74,100,217,crushing endgame knightEndgame short,https://lichess.org/RjTBtxUV#81,,1113404
3729,M5qYn,r6r/p2n3p/2pB1p2/kpN1p1p1/2B1P1b1/R7/PPP4P/2K5 b - - 1 24,a5b6 a3a6,1409,74,100,532,master mate mateIn1 middlegame oneMove,https://lichess.org/gzCy5BFK/black#48,,1932153
3730,jgNzb,4r3/p5pk/2QN3p/8/4rPn1/P5Pq/5P1P/2RR2K1 w - - 7 37,c6e4 e8e4 d6e4 h3h2 g1f1 h2h1 f1e2 h1e4,1409,74,100,578,crushing fork middlegame veryLong,https://lichess.org/uqBenWd8#73,,3994747
3731,gCFUt,3R4/4rkpp/p1r1pp2/Q7/8/8/P1q2PPP/4R1K1 b - - 1 31,c2c3 a5h5 g7g6 h5h7,1410,74,100,341,endgame mate mateIn2 short,https://lichess.org/qojxf6fH/black#62,,3689103
3732,9dCcg,2r2k1r/1p2P1p1/p5B1/6B1/1n2p2P/2q2P2/2P5/1K1RR3 b - - 0 27,f8g8 d1d8 c8d8 e7d8q,1410,74,100,287,advancedPawn mate mateIn2 middlegame promotion short,https://lichess.org/LzWvxFrQ/black#54,,843099
3733,nk1gA,5rk1/1p3r2/3p1qpb/3Pp3/1n2P1Qp/8/4RBPP/1B2K2R w K - 4 30,f2h4 f6f1 h1f1 f7f1,1410,74,100,300,mate mateIn2 middlegame sacrifice short,https://lichess.org/hi1wshFW#59,,4350390
3734,DACJn,rnb1k3/ppp3q1/5p2/2QN4/2B1P1pr/8/PPP2PKb/R1B2R2 b q - 5 17,g4g3 d5c7 g7c7 c5c7,1410,74,100,256,crushing fork middlegame short,https://lichess.org/DB17Bk29/black#34,Englund_Gambit Englund_Gambit_Hartlaub-Charlick_Gambit,1151686
3735,3Allr,6rk/p1R1Q1pp/1pP2r2/1P6/8/5PR1/P2q3P/5K2 b - - 12 34,d2h2 e7g7 g8g7 c7c8 f6f8 c8f8 g7g8 g3g8,1410,74,100,423,endgame mate mateIn4 sacrifice veryLong,https://lichess.org/1iHNG55B/black#68,,277608
3736,Q3Dud,8/1R6/1pK2pp1/p3p1kp/1rP5/1P3P2/P5PP/8 b - - 2 36,a5a4 b7b6 b4b6 c6b6 a4b3 a2b3,1410,74,100,770,crushing endgame long rookEndgame,https://lichess.org/zbNbnGj0/black#72,,2278095
3737,6clcs,r4rk1/1p3p1p/p2p1Pp1/4p1Q1/3q4/4R3/P6P/5RK1 b - - 1 23,f8c8 g5h6 d4e3 h6e3,1410,74,100,377,crushing endgame short,https://lichess.org/e2HQdPuR/black#46,,580052
3738,38gNe,8/8/6k1/R6p/p1r2PK1/8/7P/8 w - - 0 37,a5h5 c4f4 g4f4 g6h5 f4e5 a4a3,1410,74,100,2732,crushing deflection endgame long rookEndgame,https://lichess.org/P3BaCJER#73,,274604
3739,6HTAk,r1b1r1k1/pppp1ppp/3Q2n1/5qB1/8/PBP5/1PP2PPP/R3R1K1 b - - 0 14,c7d6 e1e8 g6f8 g5e7,1410,74,100,828,advantage hangingPiece kingsideAttack middlegame short,https://lichess.org/jmTkV6YU/black#28,Three_Knights_Opening Three_Knights_Opening_Other_variations,549979
3740,kHuJw,2R5/p4p1k/3Bn1pp/4P3/2Q2PK1/8/5qPP/8 w - - 1 43,c4e4 h6h5 g4h3 e6f4 e4f4 f2f4,1410,74,100,1097,crushing deflection endgame long,https://lichess.org/JPmD7vRE#85,,4047736
3741,QASoV,3r1rk1/p4qpp/1p2Np2/5p2/1P2n1PK/P3Q2R/7P/2R5 w - - 4 36,e6d8 g7g5 e3g5 f6g5,1410,74,100,481,mate mateIn2 middlegame short,https://lichess.org/vGzh9Svt#71,,2288262
3742,w0mSX,8/1np5/pk6/8/P1KN4/2P5/8/8 b - - 0 53,b7c5 a4a5 b6a5 c4c5,1410,74,100,775,crushing deflection endgame knightEndgame master short,https://lichess.org/VW8dJM6r/black#106,,5074549
3743,tY2ds,r7/4k3/4p2R/4Bp1p/1n5P/1Np5/1bP5/1K6 b - - 3 40,b4d5 h6h7 e7f8 h7h8 f8f7 h8a8,1410,74,100,3873,advantage endgame long skewer,https://lichess.org/wyUBuvoh/black#80,,4859136
3744,Gtlst,1r1q1rk1/pQ2bppp/2p1p3/8/3P1Bn1/4P3/PP3PPP/RN2K2R w KQ - 1 14,b7b8 d8a5 b1d2 f8b8,1410,74,100,443,advantage discoveredAttack middlegame short,https://lichess.org/GvGjmOzp#27,Queens_Pawn_Game Queens_Pawn_Game_Accelerated_London_System,1478359
3745,aDrzj,b2k1bnr/3p1pp1/R2q4/1P2n3/1P2P3/6P1/2P2PB1/3QR1K1 b - - 0 21,d6d1 a6a8 d8c7 e1d1,1410,74,100,1074,advantage hangingPiece intermezzo master middlegame short,https://lichess.org/vSZxsYHz/black#42,,3166717
3746,WtmP3,8/pp4R1/4k2p/2P3p1/4NbP1/5P2/r7/5K2 b - - 1 49,e6d5 e4c3 d5c5 c3a2,1410,74,100,428,advantage endgame fork master short,https://lichess.org/aCPX6mFb/black#98,,2876177
3747,ykMnD,6Q1/8/5k2/2K2P2/5P2/8/2B3n1/6q1 w - - 2 61,c5c4 g2e3 c4d3 g1g8,1410,74,100,339,crushing discoveredAttack endgame fork short,https://lichess.org/rdU0oal7#121,,5314091
3748,Z4R02,rnbqk2r/pp3ppp/4p3/8/1b1PB3/8/PP1B1PPP/R2QK1NR b KQkq - 0 9,d8d4 d1a4 c8d7 a4b4 d4b4 d2b4,1410,74,100,890,advantage long opening,https://lichess.org/C1q1YVuy/black#18,Slav_Defense Slav_Defense_Exchange_Variation,3065928
3749,E4b4m,5rk1/ppp3pp/3p4/3P4/4PP1n/2PQB3/Pq6/R3KR2 w - - 4 23,a1b1 h4g2 e1d1 g2e3 d3e3 b2b1,1410,74,100,752,advantage exposedKing long middlegame,https://lichess.org/nERrzKgd#45,,1231030
3750,HKagy,4r1k1/p3q1pp/2p5/2p3Pb/5p2/3P1N1P/PPPQ2K1/5R2 w - - 2 26,f1e1 h5f3 g2f3 e7e1 d2e1 e8e1,1410,74,100,256,crushing endgame long,https://lichess.org/xt15LiW0#51,,1515912
3751,wIbBt,r1bqr3/pp1p1pkp/2nP1np1/8/4N3/2Q5/P4PPP/R3RBK1 b - - 9 21,a7a6 e4f6 d8f6 c3f6 g7f6 e1e8,1410,74,100,282,advantage long opening,https://lichess.org/YKMEg8v3/black#42,,5099448
3752,NWdaI,4rr1k/p5p1/1p5p/4B3/3P4/2P1n2Q/3q2PP/2R1R2K b - - 3 26,f8f2 h3h6 h8g8 h6g7,1410,74,100,639,mate mateIn2 middlegame pin short,https://lichess.org/ipfPp2x3/black#52,,2057445
3753,B1M2M,1r4rk/2p2p1p/p2qpPpQ/3b4/1p1P1R2/4B3/PPP3PP/R5K1 b - - 6 25,d6f8 h6h7 h8h7 f4h4 f8h6 h4h6,1411,74,100,1006,attraction kingsideAttack long mate mateIn3 middlegame sacrifice,https://lichess.org/MGhhVkG8/black#50,,964428
3754,H8wXi,3r2k1/1bq2p2/p3pQp1/1pp1P2p/2Pr4/3P3R/PP2B1PP/4R1K1 b - - 1 26,b5c4 e2h5 d4f4 f6f4,1411,74,100,463,crushing master middlegame short,https://lichess.org/UswpaQjq/black#52,,1499723
3755,xxA21,r1b2r1k/ppp3pB/2n5/2b3Nq/2P2P2/2N3K1/PPQ3PP/R1B1R3 w - - 5 16,h7g6 h5g4,1411,74,100,289,mate mateIn1 middlegame oneMove,https://lichess.org/rZBjflgS#31,Indian_Defense Indian_Defense_Budapest_Defense,5244427
3756,rvHge,2rq1rk1/pp3ppp/2nb4/3Q4/3P4/P3B2P/1PPN1PP1/R3K2R w KQ - 1 14,d2e4 d6b4 a3b4 d8d5,1411,74,100,424,advantage discoveredAttack middlegame short,https://lichess.org/04F6BiE2#27,Caro-Kann_Defense Caro-Kann_Defense_Exchange_Variation,4716382
3757,AvcYM,1r5k/ppR3R1/5p1P/3p4/4b1p1/8/P2p2r1/3K4 b - - 1 36,f6f5 g7h7 h8g8 c7g7 g8f8 h7h8,1411,74,100,2091,endgame exposedKing long mate mateIn3,https://lichess.org/JFwz90xC/black#72,,956322
3758,n6ED5,2kr4/ppp2p2/3b4/7p/4q3/2B1P1rP/PPP2QP1/3R1R1K w - - 6 22,d1d4 g3h3 h1g1 d6h2,1411,74,100,425,crushing kingsideAttack middlegame pin short,https://lichess.org/QewLWCqN#43,,4294081
3759,8mvgu,Q5Q1/8/3p1p1p/6pk/4P3/7P/6R1/5q1K w - - 5 59,g2g1 f1h3,1411,74,100,269,endgame mate mateIn1 oneMove,https://lichess.org/BXrZFCuP#117,,769083
3760,mu160,r4rk1/1p3ppp/8/p4q2/3nn3/PQ4P1/1P2PPBP/R1B2RK1 w - - 2 20,b3b7 d4e2 g1h1 e4f2 f1f2 f5f2,1411,74,100,1132,advantage deflection kingsideAttack long middlegame,https://lichess.org/U8xEo5CD#39,,4276859
3761,tnjSr,8/8/pk1b2p1/Np2p2p/1PP1Pp2/1K3P2/6PP/8 b - - 0 33,b5c4 a5c4 b6c6 c4d6,1411,74,100,276,crushing endgame fork short,https://lichess.org/yZB5TF5X/black#66,,4881425
3762,GUt8Q,8/p5rk/2R2Qp1/2p3Pp/2P4q/1P6/P3r3/1K1R4 w - - 0 35,c6c5 h4e4 b1a1 e4c2,1411,74,100,256,crushing endgame master short,https://lichess.org/C3p7cRlJ#69,,1443112
3763,e1iiP,r5k1/pp3p1p/5np1/3pR3/8/2PQ1P2/PPB2PKP/2q5 b - - 2 21,f6h5 e5h5 g6h5 d3h7 g8f8 h7h8,1411,74,100,2158,advantage endgame kingsideAttack long,https://lichess.org/DRe57ODx/black#42,,3499617
3764,iBMXJ,2r1kbnr/p4ppp/4p3/3pP3/8/5P2/PPnBBP1P/RN1K3R b k - 3 13,g8e7 e2b5 e7c6 d1c2,1411,74,100,1200,advantage interference middlegame pin short,https://lichess.org/9OZcwBWZ/black#26,Caro-Kann_Defense Caro-Kann_Defense_Advance_Variation,3863130
3765,qvrTa,2kr1b1r/2pq1ppp/2n1p3/1N1p1bBn/QP1P4/P1P1PP2/6PP/R3K1NR b KQ - 2 13,f7f6 a4a8 c6b8 b5a7,1411,74,100,273,mate mateIn2 middlegame queensideAttack short,https://lichess.org/GhQqwRZ8/black#26,Richter-Veresov_Attack Richter-Veresov_Attack_Other_variations,4629227
3766,qqhis,2r1k2r/3p1p2/p2Np2p/qp1nP1bQ/3P4/P7/1Pp1KPPP/R6R b k - 1 21,e8e7 h5f7 e7d8 d6b7 d8c7 b7a5,1411,74,100,500,advantage fork long middlegame,https://lichess.org/LprufIkm/black#42,,4621883
3767,lO7Cf,r1bq1r1k/pp5R/2pp2p1/4b3/2P5/2N4P/PPB3P1/1R1Q2K1 b - - 0 21,h8h7 d1h5 h7g8 h5g6 e5g7 g6h7,1412,74,100,564,crushing deflection long middlegame pin,https://lichess.org/E3vRyvT8/black#42,,4144150
3768,jFWI3,r3r2k/1p2P1pp/p5b1/2p3Q1/q2pB2B/7P/6P1/4R1K1 b - - 1 31,a4b4 e4g6 h7g6 g5g6 b4e1 h4e1,1412,74,100,976,advantage long middlegame,https://lichess.org/pElQgRHB/black#62,,3956568
3769,MZlHF,4rr2/1pn3pk/p2b1q2/2pP1Pp1/P3R1P1/3B3P/1P1B2Q1/5RK1 w - - 1 31,e4e6 f6d4 d2e3 d4d3,1412,74,100,605,advantage fork middlegame short,https://lichess.org/U6huuyjy#61,,1974391
3770,Poe2j,8/8/5N2/6R1/6p1/5k2/3r4/5K2 w - - 3 55,g5g4 d2d1,1412,74,100,265,endgame master mate mateIn1 oneMove,https://lichess.org/k3auW2O0#109,,2257665
3771,cwzjD,6k1/1b3pp1/p4n1p/1pq2N2/2p1P3/1nN1QP2/1P2BKPP/8 b - - 6 27,b7c8 e3c5 b3c5 f5e7 g8f8 e7c8,1412,74,100,2252,advantage fork long middlegame,https://lichess.org/rqbpehoM/black#54,,3405333
3772,uQ7vB,r1b2rk1/1p2qppp/p7/P3n3/2p2P2/2N5/1PQ3PP/R1B1R1K1 b - - 0 20,e7c5 c1e3 e5f3 g2f3,1412,74,100,737,advantage defensiveMove middlegame short,https://lichess.org/26AnF1PV/black#40,,4935729
3773,g57qY,r3r1k1/5Rb1/p3p1Qp/3pq2N/8/8/P4PPP/5bK1 b - - 2 27,f1d3 f7g7 e5g7 g6g7,1412,74,100,764,mate mateIn2 middlegame short,https://lichess.org/D9egW75Y/black#54,,3679211
3774,qilRo,5k1r/pbNQb1p1/1p2P2p/2p5/6Pq/2P2P2/PP6/2KR4 b - - 1 31,g7g6 d7e8 f8g7 e8f7,1412,74,100,224,mate mateIn2 middlegame short,https://lichess.org/rRQ3n1Ic/black#62,,4610761
3775,GYRF6,r2qr1k1/1pp3bp/3p2p1/1PnP1pB1/4p2P/R1N3P1/P1Q2P2/5RK1 b - - 1 21,g7f6 a3a8 d8a8 g5f6,1412,74,100,1772,advantage middlegame short,https://lichess.org/Of9g8YsG/black#42,,1448111
3776,FnTPL,8/3R2pp/pk6/8/BKP1b2r/1P6/P7/8 b - - 5 40,h4g4 c4c5,1412,74,100,447,endgame mate mateIn1 oneMove,https://lichess.org/pzdnSVSd/black#80,,1381680
3777,gX0B2,5b2/2pk1p2/1p2pn2/4q3/1r4P1/2NQBB2/PP2KPP1/R6r b - - 2 25,b4d4 d3d4 e5d4 e3d4 h1a1 d4f6,1412,74,100,500,advantage long middlegame,https://lichess.org/Agi8q2Ed/black#50,,3718261
