,PuzzleId,FEN,Moves,Rating,RatingDeviation,Popularity,NbPlays,Themes,GameUrl,OpeningTags,ID
786,mgfX2,8/4k1pp/6p1/2P1p1P1/1p1pK2P/1P3P2/P7/8 b - - 1 38,e7e6 f3f4 e5f4 e4d4 f4f3 d4e3,2139,75,98,316,crushing deflection endgame long pawnEndgame,https://lichess.org/Ow6O8pCZ/black#76,,4258130
787,12KT2,1r2r1k1/p1p1qpnp/1pQ3pB/8/4P3/8/B1P3PP/5R1K b - - 2 28,a7a5 f1f7 e7f7 a2f7 g8f7 c6c7,2139,74,98,330,advantage attraction kingsideAttack long middlegame,https://lichess.org/toWZ9sRF/black#56,,90626
788,8b3L8,3rk3/8/3P1pp1/2pK4/1pN5/1P6/6PP/8 b - - 1 38,d8c8 d6d7 e8d7 c4b6 d7c7 b6c8,2139,76,99,101,advancedPawn attraction crushing endgame exposedKing fork long,https://lichess.org/XYh440Ds/black#76,,752072
789,QO6Sl,3r1rk1/pB2ppbp/1p4p1/2p1q3/8/P5P1/1PQ2P1P/R1BR2K1 w - - 1 17,a1b1 e5f5 b7e4 d8d1 c2d1 f5e4,2139,75,99,237,advantage kingsideAttack long middlegame,https://lichess.org/NCRztIJu#33,English_Opening English_Opening_Anglo-Indian_Defense,2307467
790,QqlDL,5rk1/pp3p1p/2p2pbQ/3p4/3P3N/2P4P/qPB2PP1/6K1 b - - 3 24,a2b2 h4f5 g6f5 c2f5 b2c1 h6c1,2139,76,98,969,crushing endgame long quietMove,https://lichess.org/CdmfvqZw/black#48,,2347893
791,T5wEG,3rr1k1/pp3ppp/2pq4/5n2/3P4/P2QB2P/1P3PP1/3RR1K1 b - - 4 22,f5d4 d3d4 d6d4 e3d4 e8e1 d1e1,2139,76,100,60,advantage long middlegame,https://lichess.org/miK3N4Ug/black#44,,2544666
792,4fEr6,8/6p1/6p1/pp6/3k2P1/3p1P1P/PP1K4/8 w - - 1 38,f3f4 d4e4 b2b3 b5b4 g4g5 e4f4 d2d3 f4g5,2139,76,100,65,crushing endgame pawnEndgame quietMove veryLong zugzwang,https://lichess.org/2wBZrYpq#75,,408287
793,WPd7w,4k3/8/8/3K4/1P1R4/1r6/3p4/8 b - - 1 44,b3b2 d5c4 e8e7 c4c3 d2d1q d4d1,2139,75,99,359,crushing endgame long master rookEndgame,https://lichess.org/NxMtj1Tp/black#88,,2833854
794,tQWBC,r2qk2r/pp3ppp/2n1bn2/1B2b3/3QP3/2N5/PPPB1PPP/R3K2R w KQkq - 7 11,d4e5 d8d2 e1d2 e8c8 d2e2 c6e5,2139,76,99,437,advantage castling discoveredAttack long middlegame sacrifice,https://lichess.org/3HqYtSZE#21,Sicilian_Defense Sicilian_Defense_Chekhover_Variation,4848372
795,9jm47,8/6kp/p2Bp1p1/2p5/2qb3P/5Q2/6P1/7K b - - 1 33,d4f6 f3b7 g7h6 d6f8 h6h5 b7h7 h5g4 h7g6,2139,74,99,184,crushing deflection endgame veryLong,https://lichess.org/Nw6O575z/black#66,,852333
796,HnREs,1r1q1rk1/p1p2pp1/b2b3p/8/2pPB1Q1/P7/1P3PPP/R1B2RK1 b - - 1 17,c4c3 c1h6 d8f6 h6g5 f6e6 e4f5 e6f5 g4f5,2139,74,98,525,advantage middlegame pin veryLong,https://lichess.org/DwHtPcwo/black#34,Queens_Gambit_Declined Queens_Gambit_Declined_Ragozin_Defense,1556252
797,pLKee,2r5/2q3bk/p1b3pp/1p3P2/3P3Q/2P4P/PP1B2P1/4R2K b - - 0 25,g6f5 d2h6 g7h6 e1e7 c7e7 h4e7,2139,76,100,59,advantage fork long middlegame sacrifice,https://lichess.org/1QhhkM7p/black#50,,4490587
798,Fg8i3,8/7p/4k1p1/p1P1r3/Pp1K4/6P1/7P/2R5 b - - 0 48,e5e2 c5c6 e2d2 d4c5,2139,76,99,391,crushing defensiveMove endgame rookEndgame short,https://lichess.org/DVoRT8J5/black#96,,1371203
799,FQJF4,5rk1/2p3p1/1p1p1p1p/r2Pq3/PQ2P3/3P2P1/7P/2R2RK1 b - - 6 28,a5c5 d3d4 e5e4 c1e1 e4d5 d4c5,2139,75,98,221,advantage endgame fork long,https://lichess.org/ZSCus7In/black#56,,1348893
800,5m6ve,rn5k/pb4p1/2q1pr2/1pb2p2/8/1P1BPN2/P1Q2PPP/R1B2RK1 w - - 1 16,c1b2 c6f3 e3e4 f6g6,2140,75,99,722,crushing middlegame pin short,https://lichess.org/cJTPndtG#31,Nimzo-Indian_Defense Nimzo-Indian_Defense_Three_Knights_Variation,505454
801,1Wg3S,8/8/2p5/pp1p1k2/8/1P4KP/P2P1P2/8 w - - 0 39,g3h4 c6c5 h4g3 c5c4 b3c4 d5c4,2140,75,98,289,crushing endgame long pawnEndgame quietMove,https://lichess.org/om7x6cAu#77,,133566
802,hYwkI,8/p3rp1k/8/R7/5P2/P2r4/3p1K2/3R4 b - - 9 42,d3d7 d1h1 h7g6 a5g5 g6f6 h1h6,2140,76,100,172,endgame exposedKing long mate mateIn3 rookEndgame,https://lichess.org/BtCeh44m/black#84,,3808284
803,YK0vM,8/1p6/p5pk/P1PpK3/2PPb3/8/8/8 b - - 1 51,d5c4 e5e4 h6g5 d4d5 g5f6 e4d4,2140,75,98,328,crushing endgame hangingPiece long quietMove,https://lichess.org/iKRE4gGG/black#102,,3000517
804,y7uc5,3r2k1/8/p5p1/P1p1p1P1/1nPrB3/5Q1P/8/6K1 w - - 2 40,e4g6 d4d1 g1f2 d8d2 f2g3 d2d3,2140,76,98,198,advantage endgame exposedKing long pin,https://lichess.org/VLmpiR4o#79,,5259545
805,kzSuR,7r/3bkp2/2pb1q2/4p2p/2B1PnpP/1QP3N1/1P3PP1/5RK1 b - - 0 26,f6h4 b3b7 h8b8 g3f5 e7d8 b7b8 d6b8 f5h4,2140,75,99,312,advantage fork middlegame veryLong,https://lichess.org/a5PQ4KGC/black#52,,4109399
806,Qk9IP,3r3k/pp3ppp/2n5/b4Q2/1q6/5N2/PP2NPP1/2R3K1 b - - 6 28,b4b2 f3g5 g7g6 f5f7,2140,75,100,119,advantage master middlegame short,https://lichess.org/6y0JxX9n/black#56,,2338626
807,6Yv5f,8/5p2/p2k1p2/Pp1P3p/1P2rP1P/2KR2P1/8/8 w - - 3 42,d3d4 e4d4 c3d4 f6f5 g3g4 f5g4,2140,75,100,129,crushing endgame long quietMove rookEndgame zugzwang,https://lichess.org/2CZVjLvf#83,,574474
808,Tw5U1,8/4Q1kr/4p1q1/p2p1pP1/2pP1P2/P5K1/7R/8 b - - 10 46,g7h8 e7f8 g6g8 h2h7 h8h7 f8h6,2140,76,100,220,attraction endgame exposedKing long mate mateIn3 pin,https://lichess.org/abMlgjI7/black#92,,2618434
809,hKVaS,1k4r1/1bq1n2p/4Q3/pP2P3/1pp4N/4pB2/1PP4P/3R3K w - - 1 30,d1d7 e3e2 e6g8 e7g8,2140,75,99,150,advancedPawn crushing middlegame pin short,https://lichess.org/x874NPuD#59,,3788117
810,nf70b,r1bq1rk1/pp2ppbp/2np1np1/8/2P5/1PN3P1/P1N1PPBP/R1BQK2R b KQ - 0 9,f6e4 c3e4 g7a1 c2a1,2140,76,99,239,advantage opening short,https://lichess.org/evkCMTAL/black#18,English_Opening English_Opening_Symmetrical_Variation,4343392
811,7pUzJ,2r2k1R/5p2/p3pNp1/3p2Q1/1p6/8/1Pr2qPK/8 b - - 3 38,f8g7 f6h5 g7h8 g5h6 h8g8 h6g7,2140,76,98,106,endgame long mate mateIn3 pin sacrifice,https://lichess.org/0mVxNxLK/black#76,,684948
812,rfx8n,5Q2/7p/2bp2pk/4b3/2B5/1P2qPP1/6KP/8 b - - 2 36,h6h5 g3g4 h5g5 h2h4 g5h4 f8e7 e3g5 e7h7,2140,75,98,89,attraction crushing endgame veryLong,https://lichess.org/vAGLhV0w/black#72,,4694609
813,WMWuv,1r4k1/5pp1/p4b1p/2pP1N2/8/2P2P2/qP1Q2PP/2KR3R w - - 0 24,d2c2 f6g5 d1d2 g5d2 c1d2 b8b2,2140,76,100,65,advantage long middlegame pin queensideAttack,https://lichess.org/5Ktf8bn6#47,,2829478
814,j9MDd,8/pp3Qpk/2p4p/3p2q1/3Pr3/1PP4P/1P4P1/5RK1 w - - 3 28,f7b7 e4e2 f1f2 g5c1 g1h2 e2f2,2140,75,99,137,crushing deflection endgame long,https://lichess.org/0TedXCPc#55,,3947921
815,4wyyz,8/q3nppk/3R2b1/2R3p1/1QP5/r5NP/5PP1/6K1 w - - 5 34,d6b6 a3a1 g1h2 a1b1 b4b1 g6b1,2140,76,98,724,advantage long middlegame,https://lichess.org/L1eNcbjV#67,,433102
816,TmM0D,2q2k1r/Rp3p2/2p5/3p2Q1/4P3/1P1PP2b/1PP1N1PK/8 w - - 2 24,g2h3 c8h3 h2g1 h3h1 g1f2 h8h2 f2g3 h2g2,2140,75,98,278,crushing endgame veryLong,https://lichess.org/79WRd1Mi#47,,2604617
817,duUtm,8/8/6p1/3k4/5PpP/4K3/8/8 w - - 0 67,e3f2 d5e4 f4f5 g6f5 h4h5 e4e5,2141,75,99,327,crushing defensiveMove endgame long pawnEndgame,https://lichess.org/Z4JzRjsj#133,,3489504
818,M52OL,7r/8/5p2/p1kR2p1/1pP3P1/5p1r/PPP2K2/2R5 b - - 2 38,c5c4 c1d1 h3h2 f2e3 h8e8 e3f3 h2h3 f3g2,2141,76,98,147,crushing defensiveMove endgame master quietMove rookEndgame veryLong,https://lichess.org/SfeG9L8u/black#76,,1930997
819,YDx6q,8/8/8/pR6/P3p3/5k2/7r/4K3 w - - 8 44,b5a5 h2h1 e1d2 e4e3,2141,76,98,382,crushing endgame rookEndgame short,https://lichess.org/TXVM85Zp#87,,2991969
820,xNo8d,2k2r2/1p2r1p1/p1P5/4Pp1p/Q2p3P/3P3q/P4P2/1R2RK2 w - - 3 27,f1g1 e7e6 c6b7 c8b8,2141,75,100,333,crushing defensiveMove endgame master masterVsMaster short,https://lichess.org/wwrO9THM#53,,5194463
821,UGsD0,8/8/1kp5/8/4K3/1n6/3Q4/8 w - - 2 74,e4d3 b3d2 d3d2 b6b5 d2c3 b5c5,2141,76,99,179,crushing defensiveMove endgame long zugzwang,https://lichess.org/c9vEakE7#147,,2647453
822,oIRcS,3r2k1/3r1ppp/2q1pb2/p2n4/8/QP4BP/P2RBPP1/3R2K1 w - - 3 29,e2c4 d5e3 f2e3 d7d2 d1d2 d8d2,2141,75,98,383,advantage discoveredAttack long middlegame,https://lichess.org/00cxe8Y1#57,,4398732
823,WbJ8z,6k1/5p2/2p2Pp1/1pP5/1P5R/4K3/2r5/8 b - - 5 43,c2c4 h4c4 b5c4 b4b5 c6b5 c5c6,2141,76,98,695,crushing endgame long rookEndgame,https://lichess.org/37J8SG0o/black#86,,2850294
824,2KH8t,6rr/2qpkp1p/p1n1p2Q/1p6/8/1BN4P/PPP2PP1/4RK2 b - - 0 20,g8g6 c3d5 e7d8 h6h4 d8c8 d5c7,2141,75,99,424,crushing long middlegame pin,https://lichess.org/VZm2GW6L/black#40,,203677
825,OSACq,8/8/8/3P1k1P/5P2/p3P3/2Kn4/8 b - - 0 47,f5e4 h5h6 a3a2 c2b2 a2a1q b2a1,2141,76,98,492,crushing endgame knightEndgame long,https://lichess.org/SWfkNway/black#94,,2138222
826,SPCaz,r4r1k/p3pp2/1pnq3b/3p2NQ/7P/2P1P3/PP6/2KR2R1 b - - 0 20,c6e5 d1d5 d6g6 g5f7 g6f7 h5h6 f7h7 h6h7 h8h7 d5e5,2141,76,99,278,advantage deflection exposedKing kingsideAttack middlegame pin veryLong,https://lichess.org/NNkBaGkx/black#40,,2484664
827,tSior,6k1/1rp3pp/b1p5/P2pPq2/1P5n/8/2NQ1PPP/R3R1K1 w - - 6 23,e5e6 f5g6 f2f4 h4f3 g1h1 f3d2,2141,75,98,86,advantage long middlegame pin,https://lichess.org/0ZPl7pmx#45,,4851519
828,7ulCH,3r4/1kp5/1p6/1P1pK1p1/8/6P1/7P/3R4 w - - 1 42,d1d5 d8d5 e5d5 g5g4 d5d4 c7c6,2141,75,99,142,crushing endgame long quietMove rookEndgame,https://lichess.org/DpKTMImW#83,,692266
829,qSHzm,8/8/4kpp1/7p/4K1PP/5P2/8/8 b - - 2 47,f6f5 g4f5 g6f5 e4d4 e6d6 f3f4,2141,75,99,140,crushing defensiveMove endgame long pawnEndgame zugzwang,https://lichess.org/ZCRf24LW/black#94,,4587527
830,GgUlp,r4rk1/5p2/1R4pp/2P1q3/2Q5/6RP/6P1/7K b - - 9 47,e5e1 h1h2 g8h7 g3g6 e1e5 g6g3,2141,76,100,162,advantage defensiveMove endgame long,https://lichess.org/94mFDVXA/black#94,,1459616
831,LEDxw,1r2k2r/3pn2p/1pnQp1p1/8/8/3B4/PPP2PqP/2KRR3 b k - 3 17,g2d5 d3g6 h7g6 d1d5 e7d5 d6d5,2141,74,100,128,advantage discoveredAttack long middlegame pin,https://lichess.org/3pnXyk6F/black#34,Dutch_Defense Dutch_Defense_Raphael_Variation,1856045
832,fK1ka,8/1p1R2pk/5p2/b1p2P1N/p6P/P3r1P1/1r6/5R1K b - - 0 33,e3a3 h5f6 h7h8 f1e1 a3a1 e1a1,2141,75,99,293,crushing endgame long pin quietMove,https://lichess.org/K3ieYWCZ/black#66,,3612425
833,BskIL,6k1/5p1p/6p1/8/3R1P2/1r4P1/2p4P/3R2K1 w - - 0 34,d1e1 b3b1 d4e4 b1d1 g1f2 c2c1q,2141,75,99,274,advancedPawn advantage endgame long promotion rookEndgame,https://lichess.org/agyNO5nm#67,,1039702
834,HVYP9,6k1/5pp1/1p3n1p/8/1QP1q3/P2p1NPP/5PK1/8 w - - 4 31,c4c5 b6c5 b4c5 d3d2 c5d6 f6d5 d6b8 g8h7,2141,75,99,263,advancedPawn crushing endgame master pin quietMove veryLong,https://lichess.org/R14gcZsG#61,,1531272
835,Z8rBJ,rn2k2r/pp3ppp/2pbp1b1/3p4/3Pn2q/3BP3/PPPN1PPP/R1BQRNK1 w kq - 6 10,f2f3 d6h2 f1h2 h4f2 g1h1 e4g3,2142,76,98,276,kingsideAttack long mate mateIn3 opening sacrifice,https://lichess.org/8mGSHRJU#19,Queens_Pawn_Game Queens_Pawn_Game_Symmetrical_Variation,3072131
836,lTaDJ,2R5/8/8/p2k3P/8/2pr1P2/5K2/8 b - - 0 45,d3d4 c8d8 d5e5 d8d4 e5d4 f2e2 c3c2 e2d2 c2c1q d2c1,2142,76,100,94,crushing endgame rookEndgame veryLong,https://lichess.org/zbwvDGAQ/black#90,,4151944
837,tOAgl,r4r2/p1n3pp/2Q1k1q1/3nP3/5P2/PB6/1PP3PP/R1B2b1K b - - 0 21,e6f7 c6c7 f7g8 b3d5,2142,75,98,1549,advantage middlegame pin short,https://lichess.org/rWB1VKSB/black#42,,4845105
838,xeKHD,r7/2p3R1/P1k5/6P1/7P/1pK1p3/8/8 w - - 0 55,c3b3 a8e8 a6a7 c6b7 a7a8r b7a8 g7c7 e3e2,2142,75,100,84,advancedPawn crushing endgame quietMove rookEndgame veryLong,https://lichess.org/29rMdqEF#109,,5217721
839,Z4Drd,2r3k1/p5pp/2pqp3/1p2Nn2/3P1Q1r/PP3P2/1BR5/2R3K1 w - - 2 27,c2c6 c8c6 c1c6 h4f4 c6d6 f5d6,2142,76,100,81,advantage long middlegame,https://lichess.org/b5OFOTFi#53,,3065639
840,Ma2KO,b4rk1/p4ppp/1p1Np1r1/3nP3/1P5q/P2Q1P2/3B2PP/2RR2K1 w - - 5 24,d2e1 g6g2 g1g2 d5f4 g2g1 h4g5 e1g3 f4d3,2142,75,99,1365,attraction crushing fork middlegame sacrifice veryLong,https://lichess.org/4vKCdtH0#47,,1974765
841,FGQL6,8/1r6/1P3k1p/1R4p1/3p4/3KpPPP/8/8 w - - 2 43,d3d4 e3e2 b5b1 b7d7 d4e3 d7d1 e3e2 d1b1,2142,75,99,134,advancedPawn crushing endgame rookEndgame veryLong,https://lichess.org/J3kGxf5T#85,,1335016
842,Cg2az,1k2rr2/1p4pp/3P4/8/8/2P1P1q1/P2NQn2/R1B1KR2 w Q - 1 25,d2b3 f2e4 e1d1 e4c3,2142,75,98,441,crushing discoveredAttack middlegame short,https://lichess.org/Db5YcZgD#49,,1109358
843,XTtGp,4r1qk/5R2/7p/p7/P2P4/1QP1b3/1P4PP/7K w - - 1 37,g2g3 e8e7 f7e7 g8b3,2142,75,100,141,advantage endgame short,https://lichess.org/7WhidBQH#73,,2926933
844,EhHLZ,1k1r1r2/pb1q3p/1pR4b/4pp2/3pN3/1Q3NB1/PP3PPP/4R1K1 b - - 0 20,b7c6 f3e5 d7d5 e5c6,2142,75,98,109,advantage doubleCheck middlegame queensideAttack short,https://lichess.org/i4fXOVRO/black#40,,1285584
845,6TiJ2,6k1/4bppp/2p1p3/2Pp1b2/3PnB2/5N2/2p1PPPP/4KB1R w K - 2 19,f4c1 e7d8 e2e3 d8a5 f3d2 e4d2,2142,75,99,414,advantage long middlegame quietMove,https://lichess.org/WACeUcsI#37,,567171
846,DI1gE,6k1/5p2/4p1p1/3bP2p/5P1P/3qP1P1/3B3K/4Q3 w - - 12 46,d2c3 d3e4 e1f1 e4c2 h2g1 c2c3,2142,74,99,424,crushing endgame fork long master,https://lichess.org/djlDGCiu#91,,1162569
847,mWFwg,7r/pp4r1/2b2p2/5k2/2BR2p1/P7/1P3KP1/4R3 b - - 0 32,h8h2 c4e6 f5g5 d4g4 g5h6 g4g7 h6g7 e6h3 c6g2 h3g2,2142,76,98,675,advantage clearance endgame quietMove veryLong,https://lichess.org/2dlEGAsy/black#64,,4243382
848,y947l,6k1/pp3ppp/2p1r3/3p4/1P1P1P2/4P1q1/P1Q1R3/R5K1 w - - 1 27,g1f1 e6h6 e2f2 h6h1,2142,76,99,149,crushing endgame quietMove short,https://lichess.org/BoVQAKPc#53,,5261134
849,MCg2H,5r1k/pb3Q1p/2pqp1p1/3p4/6Pn/2NB3K/PPPB4/4R3 w - - 3 22,f7e6 f8f3 h3h4 d6h2 h4g5 h2d2,2142,76,99,237,crushing fork long middlegame sacrifice,https://lichess.org/eVRCVaio#43,,1941877
850,r7BJ9,8/pQ1p1pk1/3Pp2p/6p1/8/q1rNK3/5PPP/3B3R w - - 7 32,d1e2 a3c5 e3d2 c3c2 d2d1 c5c3 b7b4 c2c1 d3c1 c3b4,2142,76,99,169,advantage clearance deflection endgame exposedKing pin veryLong,https://lichess.org/V2f1bwcM#63,,4645173
851,6SnWs,2qn2k1/4r2p/p3b2Q/1p3pN1/5P2/2P5/P5P1/3R3K b - - 4 35,e7g7 d1d8 c8d8 h6g7 g8g7 g5e6 g7g6 e6d8,2143,76,98,2027,advantage attraction fork middlegame sacrifice veryLong,https://lichess.org/8HWiF6zZ/black#70,,565829
852,HAAde,3q4/pp3kpr/1nn3b1/2R1p1P1/3pPpQ1/1P1P1N2/PB3PK1/5R1r b - - 5 29,h1f1 c5c6 f7g8 c6g6,2143,76,100,328,advantage middlegame short,https://lichess.org/QDLPvE8s/black#58,,1501382
853,2VaBW,8/1p3pkp/1p1q2b1/3pr1Pp/PP5P/2P2P2/2BQ2K1/4R3 b - - 1 31,g6c2 d2d4 f7f6 g5f6 g7f6 f3f4,2143,75,100,81,advantage endgame long pin,https://lichess.org/2bUWv2N2/black#62,,219447
854,gLzo5,8/5k2/2Q1p3/2P3p1/1PqP4/6PK/7P/8 w - - 0 36,b4b5 c4f1 c6g2 g5g4 h3g4 f1g2,2143,76,98,311,crushing deflection endgame long queenEndgame,https://lichess.org/DjQDxXyC#71,,3702827
855,xUEz1,1r3rk1/4bppp/2pp4/4P3/qp2P3/PNQ4P/5P2/1KBR2R1 w - - 0 25,a3b4 b8b4 g1g7 g8g7 d1g1 g7h8 e5d6 f7f6 d6e7 b4b3 c1b2 a4e4,2143,74,99,135,advantage exposedKing fork middlegame veryLong,https://lichess.org/DHglNhoi#49,,5203704
856,pznP1,r1r3k1/1p2qbpp/1B3p2/pB2p3/Pb1P4/1Q2PP2/1PR3PP/3R2K1 w - - 0 23,d4d5 e7d6 b6a5 b4a5,2143,75,98,374,advantage middlegame short,https://lichess.org/uDK6i6c0#45,,4547464
857,Y4Jib,r2qk2r/pp2nppp/2n1p3/2bpP3/6b1/2PB1N2/PP1N1PPP/R1BQ1RK1 b kq - 0 9,c6e5 d1a4 d8d7 d3b5,2143,75,100,275,advantage opening pin short,https://lichess.org/JjMp71kt/black#18,Caro-Kann_Defense Caro-Kann_Defense_Advance_Variation,2978370
858,MyRbW,8/8/2r2pkp/2q3p1/4Q3/5NPP/5P1K/8 b - - 5 43,f6f5 e4c6 c5c6 f3e5 g6f6 e5c6,2143,75,100,65,attraction crushing endgame fork long sacrifice,https://lichess.org/ovSoBViz/black#86,,2009285
859,PVd5K,1k1rqr2/pp2b3/2p5/2PPpRp1/4P2p/3BQ2P/P5P1/5RK1 w - - 1 28,f5e5 e7c5 e3c5 f8f1 d3f1 e8e5,2143,75,99,189,advantage long middlegame pin,https://lichess.org/GMs7nlvn#55,,2230931
860,R0Flf,4r1k1/pR3p1p/6pB/3R4/8/7P/PPr2bP1/5K2 w - - 1 23,d5d2 f2g3 b7e7 c2c1,2143,74,99,325,crushing endgame master quietMove short,https://lichess.org/Be2cIbrh#45,,2361443
861,y9yHZ,8/4kpp1/p1rRp2p/2P1P2P/r7/4K3/8/2R5 b - - 5 38,c6d6 e5d6 e7d7 c5c6 d7d6 c6c7,2143,75,98,121,advancedPawn crushing endgame long rookEndgame,https://lichess.org/rQBDuJNo/black#76,,5262371
862,YM195,6k1/7p/p6p/4pR2/1q1p4/5R2/4B1P1/3K4 b - - 6 38,e5e4 e2c4 g8h8 f5f8 b4f8 f3f8,2143,74,98,272,crushing endgame long,https://lichess.org/M2hin0Fs/black#76,,3003394
863,LpH9A,1qr5/5pk1/1p2bnp1/p2p2Qp/3P4/2N2B1P/PP3PP1/4R1K1 w - - 2 22,c3d5 f6d5 f3d5 f7f6 g5d2 e6d5,2143,75,98,696,crushing long middlegame,https://lichess.org/Cv7ySLEb#43,,1908702
864,bkp4u,8/2P5/6k1/p5p1/P3Q2p/5p1P/5qPK/8 b - - 1 54,g6h6 e4f3 f2c5 f3f6 h6h7 f6f7,2143,76,98,88,crushing endgame long queenEndgame,https://lichess.org/tyvZsUPV/black#108,,3300788
865,iD12L,rnb1kb1r/pp1p2pp/4p3/q3P3/3Q4/1Pp1BN2/PnP2PPP/RN2KB1R w KQkq - 0 12,b1c3 b8c6 d4d2 f8b4,2143,74,98,440,advantage opening short,https://lichess.org/cvOnNwsW#23,Alekhine_Defense Alekhine_Defense_Other_variations,3865482
866,AsVBi,1r4k1/1pQ2pbp/p2Rp1p1/4n3/PB2P3/1P3P2/4NKPP/1q6 b - - 3 29,b8e8 d6d8 e5d3 f2e3 g7h6 f3f4 d3b4 d8e8,2143,75,100,72,crushing defensiveMove master middlegame veryLong,https://lichess.org/oyuQRans/black#58,,951928
867,6vD84,2q2r2/7k/p6p/1r3bp1/3Q4/3NR1PP/PPP4K/5R2 w - - 7 29,d3e5 c8c2 h2g1 b5b2 d4b2 c2b2,2143,74,100,115,crushing long middlegame,https://lichess.org/q5TEv9G5#57,,606223
868,rvlp3,r6r/pp2k1p1/3qpbQ1/3p3p/3n1B2/2N4P/PPP3PK/5R2 b - - 2 23,f6e5 g6g5 e7d7 f4e5 d6e7 g5e7 d7e7 e5d4,2144,76,100,90,advantage fork middlegame veryLong,https://lichess.org/VdiCHorS/black#46,,4717046
869,5r3QC,8/6p1/1k3p2/1p3P1P/p3K1P1/r7/1R6/8 b - - 0 56,a3b3 b2b3 a4b3 e4d3 b6c5 g4g5 f6g5 f5f6 g7f6 h5h6 b3b2 d3c2 b2b1q c2b1 g5g4 h6h7,2144,75,100,83,advancedPawn crushing endgame rookEndgame veryLong,https://lichess.org/lpVyoCUL/black#112,,512469
870,8mYwE,6R1/p7/2n1kpp1/3p3p/4pP1P/1P2K1P1/P7/8 w - - 5 38,g8g6 c6e7 g3g4 e7g6,2144,76,100,72,advantage endgame master short,https://lichess.org/r2nNnZNB#75,,768506
871,6m9YX,4r1k1/p3rpp1/4qn1p/1p2N3/2pP1R1Q/2P4P/PP4P1/5RK1 b - - 1 26,g7g5 h4h6 g5f4 f1f4 f6e4 f4g4,2144,75,99,268,advantage kingsideAttack long middlegame sacrifice,https://lichess.org/ZzQbeIMs/black#52,,593450
872,qhcz3,5r2/P7/1P5p/6pk/P3p3/4Pq1P/2QR1Pp1/1N4K1 w - - 0 44,g1h2 f3h3 h2h3 g2g1q c2e4 g5g4,2144,74,98,316,advancedPawn crushing deflection endgame long promotion,https://lichess.org/sErIvZq8#87,,4609136
873,oKcxe,5rk1/6pp/4p1p1/3p1n2/P7/3QPPqP/6P1/RR4K1 w - - 7 33,d3d1 f5h4 b1b2 h4f3 d1f3 f8f3,2144,75,100,147,crushing endgame long pin,https://lichess.org/qLAGCLWx#65,,4401898
874,WPjQm,8/1Q2kppp/4pb2/3n4/5q2/1P6/P4PPP/3R2K1 b - - 4 26,e7d6 d1d5 e6d5 b7b8 d6e6 b8f4,2144,75,98,280,crushing endgame long sacrifice skewer,https://lichess.org/Rsm9s7h5/black#52,,2834001
875,gI7jJ,kr1q4/bpRB4/p2p2p1/Q2P4/P7/5P2/KP6/8 b - - 0 46,a7c5 d7c6 d8c7 a5c7,2144,75,98,132,crushing endgame master short,https://lichess.org/8fFtBTOD/black#92,,3697438
876,uQpzj,4r3/4k1p1/2p3Q1/p2q1r1P/3P4/P3B3/5P2/1R4K1 b - - 4 35,f5h5 b1b7 e7d8 b7b8 d8c7 e3f4,2144,75,99,169,crushing endgame exposedKing long,https://lichess.org/GALvoVzE/black#70,,4936755
877,N59h5,6k1/1p3p2/2p1q1p1/5NQP/4P3/1pP5/5PPK/1r6 b - - 3 32,e6e4 h5g6 b1h1 h2h1,2144,76,99,165,crushing endgame master short,https://lichess.org/6AKOWlda/black#64,,2018686
878,woL8f,3r2k1/ppq2pp1/2p1b2p/4P1nQ/2P5/1PNr1RBP/P5B1/5RK1 w - - 5 25,c3d5 g5f3 f1f3 d3d1 g1h2 c6d5,2144,76,98,418,advantage exposedKing kingsideAttack long middlegame,https://lichess.org/RhYdbLzR#49,,5144417
879,RbETx,6k1/p5p1/1p2q2p/2p4P/P7/2PB4/1PK1R3/8 b - - 3 34,e6d5 d3g6 d5a8 e2e8 a8e8 g6e8,2144,76,99,100,crushing endgame fork long master quietMove,https://lichess.org/u66s4256/black#68,,2413955
880,bDGtQ,8/1R6/4k3/3pB3/2nP3p/P1pK3P/1r6/8 w - - 6 47,b7b2 c3b2 d3c2 c4a3 c2b2 a3c4 b2b3 c4e5,2144,76,98,214,advancedPawn crushing endgame master veryLong,https://lichess.org/RZV37BD1#93,,3253301
881,bcHjm,r1b3k1/1p1p3p/p3p1p1/2p5/3q2P1/3PB1Q1/PP5P/R5K1 b - - 2 23,d4d3 a1f1 d7d6 f1f8 g8f8 e3h6,2144,76,98,66,attraction crushing endgame long quietMove sacrifice,https://lichess.org/gTESXYAy/black#46,,3288594
882,ZDjMi,8/8/8/3k1p2/1p4p1/4P1K1/1PR3P1/5r2 w - - 0 47,c2f2 f1f2 g3f2 d5c4,2145,76,98,81,crushing defensiveMove endgame rookEndgame short,https://lichess.org/8TCMmSCN#93,,3078994
883,Btpu2,r4rk1/pp1qn1pp/5p2/2bpn3/7B/2NB1P1P/PPPQ1PK1/R5R1 b - - 4 15,e5f3 g2f3 d7h3 h4g3 e7f5 d3f5,2145,74,99,219,advantage long middlegame,https://lichess.org/xSv2esjS/black#30,French_Defense French_Defense_Exchange_Variation,1041204
884,lcc4n,6R1/p7/1p2k3/8/4n3/2P1P1p1/PP6/2K5 w - - 0 40,c1d1 e6f7 g8g3 e4g3,2145,75,99,296,advantage endgame short,https://lichess.org/gGsrH7Ak#79,,4164766
885,b66BQ,r5k1/1bqn2pp/p2b1p2/1p1P4/3BR1Q1/PB5P/1PP2PP1/6K1 b - - 0 19,a6a5 e4e7 d6e7 d5d6 g8h8 d6c7,2145,76,98,74,advancedPawn crushing discoveredAttack long middlegame sacrifice,https://lichess.org/sMjhRojH/black#38,,3243263
886,0UVnY,r4q2/p3R3/1kp1Q2p/3p4/2pP3p/2Pb4/PP5P/RN2K3 w Q - 1 31,e7f7 f8g8 f7b7 b6b7 e6g8 a8g8,2145,76,98,254,advantage long middlegame,https://lichess.org/eXsPnMeo#61,,42938
887,zLxRZ,8/5k1p/2N3p1/5p2/3P2nK/6P1/6P1/8 w - - 2 41,c6e5 g4e5 d4e5 h7h6,2145,75,100,452,crushing defensiveMove endgame knightEndgame short,https://lichess.org/9YTiC7g6#81,,5367290
888,XzeiE,4r2k/3q1r1p/p4p1Q/Ppp2p1B/3p1Nn1/1PnP4/2P2PPP/R3R1K1 w - - 8 33,h5f7 e8e1 a1e1 g4h6 e1e8 h8g7,2145,74,98,566,advantage long middlegame,https://lichess.org/CXvuGvkV#65,,2971788
889,sjIq6,r3k2r/p4ppp/1pn2n2/5b2/4p3/2PN1N2/PP2PPPP/R3KB1R w KQkq - 0 13,d3e5 e4f3 e5c6 f5e4,2145,76,100,104,advantage clearance middlegame short,https://lichess.org/dzXG9gIg#25,Benoni_Defense Benoni_Defense_Benoni_Gambit_Accepted,4787093
890,JDrg4,1r3rk1/5Npp/4Q3/3Pp3/2P1q3/5RPB/1p4KP/8 b - - 3 38,f8f7 e6f7 g8h8 h3f5 e4e2 f3f2,2145,76,99,144,advantage endgame long,https://lichess.org/vTZmcf5i/black#76,,1681415
891,85Tkc,6r1/1k1q2r1/1p6/p6p/P3Rp2/1P2pP2/2R1Q1P1/3B2K1 w - - 2 35,c2c1 g7g2 e2g2 g8g2 g1g2 d7d2 g2h3 d2c1,2145,75,98,494,attraction crushing fork middlegame veryLong,https://lichess.org/dIlQ388j#69,,707624
892,bmOmg,8/4p3/3p1p2/p2P2k1/Pp2P1P1/1P3K2/8/8 b - - 1 35,g5h4 f3f4 h4h3 f4f5 h3g3 f5e6 g3f4 e6e7,2145,76,100,113,crushing endgame master pawnEndgame veryLong,https://lichess.org/ZKhRKb2t/black#70,,3302992
893,2yjIL,4rrk1/ppp3b1/3p1q1p/3P2p1/2n5/1Q3NPP/PP1N4/2K1R2R w - - 0 24,d2c4 f6f3 b3f3 e8e1 h1e1 f8f3,2145,75,100,99,advantage long middlegame,https://lichess.org/yOysOd20#47,,260509
894,8wgIE,2R5/5ppk/p2p1b1p/3BpP2/4P1Q1/q6P/1r4P1/7K b - - 3 29,f6g5 d5f7 a3a1 h1h2 b2g2 h2g2,2145,75,98,182,crushing endgame long,https://lichess.org/f0NZuYPn/black#58,,782806
895,NEidp,r1b1k2r/ppp1qpQp/8/8/1P6/2P2p2/P1P2PPP/R4K1R b kq - 1 16,c8h3 g7h8 e8d7 h8d4,2145,75,98,438,advantage hangingPiece middlegame short,https://lichess.org/kkANlrpB/black#32,Petrovs_Defense Petrovs_Defense_Nimzowitsch_Attack,2032223
896,2ciUK,4r1kb/1p3r1p/p6q/4B1p1/2PpR1P1/1P1Q4/P5K1/4R3 b - - 1 34,h6h4 e5g3 e8e4 g3h4 e4e1 h4e1,2145,76,98,378,crushing long middlegame,https://lichess.org/WPTJuxE0/black#68,,229650
897,Nfbcx,6k1/1p3p2/p1q2Pp1/P5QP/2p1bB2/8/1r4BK/6R1 b - - 0 38,b2g2 g1g2 e4g2 h5g6,2145,76,98,370,crushing endgame master short,https://lichess.org/KPWpwhFv/black#76,,2069994
898,r872F,2Q2k2/p2n1p2/2p1q3/3pP1p1/6P1/5PN1/PP6/6K1 b - - 2 33,f8g7 g3h5 g7h7 c8d7 e6d7 h5f6 h7g7 f6d7,2145,75,98,109,attraction crushing endgame fork sacrifice veryLong,https://lichess.org/AEQVGemb/black#66,,4646547
899,h3tJ2,6k1/1p1q1pp1/2p3p1/8/3P1P2/r1P4P/4R2K/4Q3 b - - 3 34,d7f5 e2e8 g8h7 e1h4 f5h5 h4d8 a3a2 h2g3,2145,75,100,99,crushing defensiveMove endgame quietMove veryLong,https://lichess.org/V9enkMe3/black#68,,3764793
900,brWR3,6k1/5p2/2pqp1p1/3n4/1PQ4p/P4BPP/5PK1/8 w - - 0 40,b4b5 d5e3 f2e3 d6g3 g2f1 g3f3,2146,75,99,280,crushing deflection endgame long sacrifice,https://lichess.org/b5HBoREp#79,,3310192
901,QHQeb,1r6/7p/p4p2/2ppk1p1/P7/1P3PPP/2PK4/4N3 b - - 1 35,e5d4 e1d3 b8b3 c2b3,2146,75,98,337,advantage endgame short,https://lichess.org/JvTls4SE/black#70,,2298001
902,66pRF,r2qr1k1/p1p2ppp/3b4/4N2n/2Q2B2/8/PPP2PPP/R2R2K1 b - - 4 17,h5f4 e5f7 d8f6 f7d6,2146,76,100,107,advantage discoveredAttack kingsideAttack middlegame short,https://lichess.org/FRX0JMM1/black#34,Ruy_Lopez Ruy_Lopez_Steinitz_Defense,534914
903,UpjRK,8/7k/P1p1q2p/5pb1/2P5/1P5P/5KP1/4Q3 b - - 0 39,e6e1 f2e1 g5e3 b3b4 e3a7 c4c5,2146,75,99,87,crushing defensiveMove endgame long quietMove,https://lichess.org/8tufDaFR/black#78,,2696090
904,L63nu,4r1k1/1R3Rb1/5Pp1/7p/p1n4P/P7/5P2/6K1 b - - 0 31,g7f8 f7g7 f8g7 f6f7,2146,75,98,239,advancedPawn crushing endgame master sacrifice short,https://lichess.org/InxDuaG2/black#62,,1844636
905,EQsLb,r4bk1/p4pp1/1pN4p/1PnP1B2/3B1Q1P/6P1/P3qP1K/8 b - - 6 32,c5d3 f5d3 e2d3 c6e5 d3d4 f4d4,2146,76,98,216,crushing long master middlegame,https://lichess.org/fdgKiE2D/black#64,,1262489
906,rkAzt,r5k1/pb1p1q1p/1p2p2B/4Qp2/1RP2P2/8/P5PP/6K1 b - - 0 24,f7e7 b4b3 e7c5 e5c5 b6c5 b3b7,2146,74,98,466,advantage endgame long,https://lichess.org/dirdzkLO/black#48,,4700653
907,GOgCd,r1b2rk1/p5pp/1pR2p2/1Q6/3B4/6P1/q4P1P/R5K1 b - - 1 25,a2d2 b5d5 g8h8 c6f6 g7f6 d4f6 f8f6 d5d2,2146,75,99,225,advantage middlegame sacrifice veryLong,https://lichess.org/7X7edv9n/black#50,,1434444
908,YXEaA,5rk1/3n1p2/3Q4/3p2Pp/4P2N/5PB1/rq4PK/8 b - - 2 33,g8g7 h4f5 g7h8 d6h6 h8g8 f5e7,2146,76,99,424,long master mate mateIn3 middlegame,https://lichess.org/m1UQT2aU/black#66,,3019318
909,eU4zv,8/2R2pp1/1p1kp3/1r5r/5RKN/8/8/8 w - - 10 49,c7f7 h5h4 g4h4 g7g5 h4g4 g5f4,2146,75,99,698,advantage attraction endgame fork long sacrifice,https://lichess.org/CrDDI6xZ#97,,3539456
910,jOBzg,8/pppb2pk/1b3q1p/8/2BnR3/3P2NP/PPPQ2PK/8 w - - 3 25,d2c3 f6f2 e4d4 b6d4 c3d4 f2d4,2146,75,98,765,crushing long middlegame,https://lichess.org/wpinBhUh#49,,3969022
911,hJr2B,8/8/p2k3p/N5p1/1p2K1P1/7P/8/8 w - - 2 51,e4f5 d6c5 f5e4 c5b5 a5b3 b5c4,2146,75,99,205,crushing endgame knightEndgame long,https://lichess.org/glhp43LE#101,,3787171
912,4Qlcb,r1b1kbnr/pp1p1ppp/2n5/8/4q3/6B1/PPP1B1PP/RN1QK1NR b KQkq - 1 8,e4g2 e2f3 f8b4 b1c3,2146,76,100,86,advantage defensiveMove opening short,https://lichess.org/EvugkQae/black#16,Sicilian_Defense Sicilian_Defense_Smith-Morra_Gambit,388139
913,4PeVQ,6r1/2pQ1p2/1kP5/2q5/8/1P3B1P/r1P2PP1/1K1R4 w - - 0 37,b1a2 c5c2 a2a3 g8a8 a3b4 c2c5,2146,76,98,447,endgame long mate mateIn3,https://lichess.org/GXEJXUGA#73,,386590
914,oeUKW,r4rk1/1ppq3p/p5p1/3NP3/5n2/P4Q1P/1PB2PP1/R5K1 b - - 0 24,d7d5 c2b3 f4e2 g1f1 f8f3 b3d5,2146,75,98,349,advantage defensiveMove long middlegame pin,https://lichess.org/efbNRnPk/black#48,,4429740
915,2VCDG,8/2p2Q2/7p/3P2p1/6k1/4P1P1/4q1KP/8 w - - 3 36,f7f2 e2f2 g2f2 g4f5 d5d6 c7d6 g3g4 f5g4,2146,76,99,188,crushing endgame queenEndgame veryLong,https://lichess.org/wk77hNjG#71,,218894
