,PuzzleId,FEN,Moves,Rating,RatingDeviation,Popularity,NbPlays,Themes,GameUrl,OpeningTags,ID
1218,Ew9Xw,8/6PR/1kp5/1p4r1/p7/K1P5/8/8 b - - 0 46,b6c5 h7h5 g5h5 g7g8q,1280,74,100,1143,advancedPawn advantage deflection endgame pin promotion rookEndgame short,https://lichess.org/wzpPkbYE/black#92,,1306469
1219,iCiMC,8/5kr1/6RK/5P2/8/8/8/8 b - - 82 85,g7g6 f5g6 f7f8 h6h7,1281,74,100,1789,crushing defensiveMove endgame short,https://lichess.org/7GflW0zl/black#170,,3865055
1220,3TZro,7r/1p6/4N1k1/pP1P2p1/8/P5R1/5KP1/3r4 b - - 6 34,d1d5 e6f4 g6f5 f4d5,1281,74,100,1647,advantage endgame master pin short,https://lichess.org/j7xc0YaR/black#68,,304280
1221,eCHxH,8/5k2/6p1/p1ppPq1p/3p3P/1P1P2Q1/P1P3P1/6K1 w - - 1 36,g3g5 f5g5 h4g5 f7e6,1281,74,100,446,crushing endgame queenEndgame short,https://lichess.org/jv51c61p#71,,3514520
1222,2DTJV,2r1k2r/1b1p1p1B/p3pp2/1p2q3/8/2P1P3/PP1Q1PPP/1K1RR3 b k - 0 19,h8h7 d2d7 e8f8 d7b7,1281,74,100,516,advantage fork middlegame short,https://lichess.org/BtQCqpEp/black#38,,194120
1223,Ie0Qv,5rk1/1p3q1p/p2p2p1/2p1b3/4P1Q1/2P1B2P/PP4P1/R5K1 w - - 1 26,e3h6 f7f2 g1h1 f2f1 a1f1 f8f1,1281,74,100,316,endgame kingsideAttack long mate mateIn3 sacrifice,https://lichess.org/XUIeRd7p#51,,1630798
1224,SGIU4,8/8/2K4p/8/pp2R2k/2Pn4/8/8 b - - 1 46,h4g5 c3b4 d3b4 e4b4,1281,74,100,574,crushing endgame short,https://lichess.org/oj1fL25v/black#92,,2471945
1225,9UkwB,8/8/5k2/7R/1p4Kp/1P3P2/r7/8 w - - 0 46,g4h4 a2h2 h4g4 h2h5 g4h5 f6f5,1281,74,100,577,crushing defensiveMove endgame long rookEndgame,https://lichess.org/SdHaNy45#91,,831062
1226,HRs2X,6k1/1p3pp1/1q2pn1p/pb6/1P6/P3P3/1Q3PPP/1R4K1 b - - 1 32,a5b4 b2b4 b6a6 b4b5,1281,74,100,375,advantage endgame short,https://lichess.org/ykt9TMoj/black#64,,1526007
1227,chmi9,2kr3r/1pb2B2/p4R2/8/3P2p1/2P2bP1/PP5P/5RK1 b - - 0 24,h8f8 f7e6 c8b8 f6f8 d8f8 e6g4,1281,74,100,672,advantage discoveredAttack long middlegame,https://lichess.org/Gh0ftj0v/black#48,,3383790
1228,YT9Ql,6R1/p7/1b2r2p/8/6kP/1P4P1/1PP1p1PK/8 b - - 5 44,g4h5 g3g4 h5h4 g2g3,1281,74,100,173,endgame mate mateIn2 short,https://lichess.org/O1zSCaUL/black#88,,3013504
1229,LJMRy,3rr1k1/2p2ppp/p2b2q1/8/8/4BB2/1P2QPPP/3R1RK1 w - - 8 26,e2a6 d6h2 g1h2 g6a6 d1d8 e8d8,1281,74,100,588,advantage discoveredAttack long middlegame,https://lichess.org/iQC9qT3d#51,,1863428
1230,fk7qE,6k1/5p2/R7/4PP2/1pP1NKP1/5B1P/p1r5/1r6 w - - 3 46,c4c5 a2a1q a6a1 b1a1,1281,74,100,1153,advancedPawn advantage endgame promotion short,https://lichess.org/Xp1wAL5F#91,,3649413
1231,wAH7r,r5k1/pp4p1/7p/2p1b3/2PpN3/P2P1r1P/1P3KPq/R2Q1R2 w - - 0 23,f2f3 h2f4 f3e2 f4e3,1281,74,100,279,mate mateIn2 middlegame short,https://lichess.org/nnOXOO7u#45,,5087690
1232,anP4w,8/p4pkp/2Q3p1/2P1p1b1/4P3/3q4/5PPP/3NK3 w - - 3 31,c6d5 g5d2,1281,74,100,1456,endgame mate mateIn1 oneMove,https://lichess.org/toAyITgs#61,,3216766
1233,YNOix,r3r1k1/1b3p2/p6p/1pb3p1/3N2N1/1PP1B1P1/1P1Q3P/2R1R1Kq w - - 1 33,g1f2 h1g2,1281,74,100,449,master mate mateIn1 middlegame oneMove,https://lichess.org/Mj3NXRz0#65,,3005346
1234,MtPIy,r2r4/p4R2/3pp1pk/2p5/2PqP3/1Pb2Q2/P5PP/7K b - - 1 32,g6g5 f3h3 h6g6 h3h7,1281,74,100,557,endgame mate mateIn2 short,https://lichess.org/SwxQg8HO/black#64,,2002195
1235,Jc2Ue,r3k1r1/2qp1p1p/4p2B/p1b5/P2nP3/1B1Q3P/1P3PP1/RN3RK1 w q - 3 19,h6e3 d4f3 g1h1 c7h2,1281,74,100,907,kingsideAttack mate mateIn2 middlegame pin short,https://lichess.org/CKLSsM4i#37,,1715558
1236,NDcGc,r3r1k1/pp3pq1/7R/2p3NQ/2P1bpp1/2P5/PP3PP1/R5K1 b - - 1 28,e8e5 h6h8 g7h8 h5f7,1281,74,100,2262,deflection kingsideAttack mate mateIn2 middlegame sacrifice short,https://lichess.org/dQfvvbWM/black#56,,2030656
1237,N1Xt3,8/4R2P/1pk2r2/p2p4/3Pb3/2P3K1/1P5P/8 b - - 0 51,f6h6 e7e6 h6e6 h7h8q,1281,74,100,419,advancedPawn advantage deflection endgame promotion short,https://lichess.org/PxS7SNvr/black#102,,2013671
1238,cScYl,r3k3/1p2q2p/2p3r1/2Pb1Q2/PB2p2P/4P1p1/6P1/5RK1 b q - 0 31,a8a4 f5c8 e7d8 f1f8 e8f8 c8d8,1282,74,100,507,advantage attraction clearance deflection exposedKing long middlegame pin,https://lichess.org/9gy270Jc/black#62,,3362521
1239,IUhSU,8/5ppk/4p1p1/4q3/7Q/8/1P3P2/5K2 b - - 1 50,e5h5 h4h5 g6h5 b2b4 h7g6 b4b5 g6f6 b5b6,1282,74,100,247,crushing endgame queenEndgame quietMove veryLong,https://lichess.org/zlvQXshf/black#100,,1617598
1240,xia0d,6R1/7p/P6k/1P3p1b/3pK1P1/4p2R/5r2/8 w - - 0 44,g4f5 e3e2 g8g1 f2f1 g1f1 e2f1q,1282,74,100,1009,advancedPawn crushing endgame long promotion,https://lichess.org/TOSMubVN#87,,5223701
1241,OGOoM,6k1/8/1p2rB2/p2p1RpP/3P4/2P4P/PP2r1K1/8 w - - 1 38,g2f3 e6e3 f3g4 e2g2,1282,74,100,1478,endgame mate mateIn2 short,https://lichess.org/3a2hipuq#75,,2121694
1242,ZXo94,8/6p1/5k1p/7P/2B3K1/5P2/8/3n4 w - - 1 49,c4d3 d1f2 g4g3 f2d3,1282,74,100,1002,crushing endgame fork master short,https://lichess.org/oqCWKKtN#97,,3107220
1243,rpMMx,2r5/ppp4R/3p2k1/3Pp1p1/4r3/P4K2/1PP5/7R b - - 9 32,e4d4 h1h6 g6f5 h7f7,1282,74,100,628,endgame mate mateIn2 rookEndgame short,https://lichess.org/BTgWoma8/black#64,,4707976
1244,mRDlh,1k3r2/1pp5/p2p4/3P2Q1/PP2P3/3PB1b1/4K1Pq/1R6 w - - 1 29,b1f1 h2g2 f1f2 f8f2 e3f2 g2f2,1282,74,100,692,crushing endgame long,https://lichess.org/AQBYXdwv#57,,4236268
1245,ZP03L,r3r3/1p1n4/1qp1pBk1/3n4/p2P4/7P/PPPQ1P2/1K1R2R1 b - - 0 22,g6f6 d2g5 f6f7 g5g7,1282,74,100,216,mate mateIn2 middlegame short,https://lichess.org/4u0GvkUI/black#44,,3094786
1246,s0ORx,4rrk1/ppp3pp/3q1p2/8/1P1n2n1/P3PN1P/4QPP1/R1B2RK1 w - - 0 17,e2d1 d4f3 g2f3 d6h2,1282,74,100,1571,kingsideAttack mate mateIn2 middlegame short,https://lichess.org/WPSuCg5D#33,Queens_Pawn_Game Queens_Pawn_Game_Zukertort_Variation,4723552
1247,b3I2z,6kr/2p3p1/8/4q3/6Q1/P4PK1/1P5P/7R w - - 3 39,g4f4 h8h3 g3h3 e5f4,1282,74,100,188,advantage deflection endgame short,https://lichess.org/Nbw6zyOC#77,,3239246
1248,ZtMgW,8/8/8/p7/k7/1r6/2K5/7R b - - 13 99,b3b8 h1a1 a4b4 a1b1 b4c4 b1b8,1282,74,100,772,crushing endgame long rookEndgame skewer,https://lichess.org/emjcL0dG/black#198,,3137772
1249,P2Puf,5r1k/6p1/p6p/P7/2PQp1q1/5p1r/5P1B/3R1R1K w - - 0 34,f1g1 h3h2 h1h2 g4h4,1282,74,100,1017,attraction mate mateIn2 middlegame sacrifice short,https://lichess.org/ud7PL12k#67,,2189994
1250,v7KpH,4kr2/7Q/1qp5/3pP3/8/4p3/P5PP/R5K1 w - - 1 31,h2h3 e3e2 g1h2 f8f1,1282,74,100,502,advancedPawn crushing discoveredAttack endgame short,https://lichess.org/WBLej1CC#61,,4996276
1251,hGOst,4r1k1/6p1/4p3/3pB2p/5P2/1P1PQBqP/r5P1/5RK1 w - - 2 35,f4f5 a2g2 f3g2 g3e3,1282,74,100,421,crushing middlegame short,https://lichess.org/dU8eeXMn#69,,3782295
1252,ExCrf,3r2k1/1P3ppp/8/q7/2P3Q1/7P/5PPK/8 b - - 0 28,d8b8 g4c8 a5d8 c8d8 b8d8 c4c5 g8f8 c5c6,1282,74,100,1684,crushing endgame quietMove veryLong,https://lichess.org/8SohFJL7/black#56,,1307943
1253,uiD6W,1r2r1k1/2p1qppp/p1b5/1p6/3N4/8/PPPQ1PPP/3R1RK1 b - - 0 19,b8d8 d4c6 d8d2 c6e7 e8e7 d1d2,1282,74,100,349,advantage fork hangingPiece long middlegame,https://lichess.org/APx4d0in/black#38,,4960962
1254,vvZWT,8/2r4p/2b3p1/R2k1p2/3PpP2/4B3/5KPP/8 b - - 1 34,d5c4 a5c5 c4d3 d4d5,1282,74,100,429,crushing endgame short,https://lichess.org/ly8r1f5Z/black#68,,5067183
1255,DRulp,2Rr3k/6pp/4Q3/p3P3/5p2/P2q2PK/7P/8 b - - 0 38,f4g3 e6e8 d8e8 c8e8,1283,74,100,648,backRankMate endgame mate mateIn2 sacrifice short xRayAttack,https://lichess.org/1oYradst/black#76,,1176388
1256,prEIy,8/2pk4/1p1p4/3Pp1P1/2P4p/7P/2r2RK1/8 b - - 0 38,c2f2 g2f2 d7e7 f2f3 e7f7 f3g4 f7g6 g4h4 g6f5 h4h5,1283,74,100,1373,crushing defensiveMove endgame veryLong,https://lichess.org/1YGoWE3N/black#76,,4535478
1257,fnMDP,8/q1p2k2/p2p2p1/Pp1Prp1p/4PR1P/1P3Q2/1P4P1/7K w - - 0 42,e4f5 e5e1 h1h2 a7g1 h2g3 e1e3,1283,74,100,568,advantage endgame long pin,https://lichess.org/BO3ofPLQ#83,,3653969
1258,qlN1U,r4r1k/7p/p3nP1Q/1p6/4q3/P7/1P4RP/7K b - - 2 35,f8f6 h6f6 e6g7 f6g7,1283,74,100,216,endgame hangingPiece mate mateIn2 short,https://lichess.org/jJsrscud/black#70,,4614497
1259,XvvuM,6k1/pp4p1/2p4p/8/P1PPQ3/1P5P/3q1r2/4R2K w - - 1 32,d4d5 f2h2 h1g1 d2f2,1283,74,100,1034,endgame mate mateIn2 short,https://lichess.org/k7LTfZEN#63,,2966497
1260,L5X3i,r7/pp2kp2/4p3/1P6/4R1P1/P5q1/2Q5/5R1K w - - 1 32,c2f2 a8h8 f2h2 h8h2,1283,74,100,1075,endgame mate mateIn2 short,https://lichess.org/81tJZItg#63,,1843890
1261,fpjUn,4R3/p4pk1/2nq2p1/1pp4p/3pNP2/P2P3P/1PPB2P1/6K1 b - - 1 25,d6d7 e8g8 g7g8 e4f6 g8f8 f6d7,1283,74,100,955,advantage attraction endgame fork long sacrifice,https://lichess.org/O8RatQp2/black#50,,3657447
1262,CKOEx,5rk1/Q4ppp/6r1/3P2P1/5q2/4RN1b/P3BP2/5RK1 w - - 0 26,f1d1 f4g4 g1h2 g4g2,1283,74,100,392,mate mateIn2 middlegame short,https://lichess.org/hC1ImONA#51,,1078765
1263,Uq5f9,3N4/r1R4p/kp1P1pp1/p1n1p3/P7/8/1P3PPP/6K1 w - - 3 29,d8c6 a7c7 d6c7 a6b7 c6a7 b7c7,1283,74,100,1072,advantage endgame long,https://lichess.org/KWb3avcp#57,,2696632
1264,aEPrC,r1bkr3/pppp1ppp/8/6q1/2B1Q3/8/PP2NKPP/RN5R w - - 1 15,e4f4 e8e2 f2e2 g5f4,1283,74,100,1179,crushing middlegame short,https://lichess.org/gTwlKuIY#29,Italian_Game Italian_Game_Classical_Variation,3167446
1265,AIjoD,r7/p3k1q1/2p3B1/1p1pPQ2/5p2/2P5/PP4P1/1K6 b - - 0 32,a8f8 f5g5 e7e6 g6f5 f8f5 g5g7,1283,74,100,1873,advantage discoveredAttack endgame exposedKing long,https://lichess.org/7zPBCFzD/black#64,,901721
1266,JRTsk,2r5/pp2k1R1/4p3/3p4/3PnB2/P6r/K7/3R4 b - - 1 29,e7f6 f4e5 f6f5 d1f1,1283,74,100,217,advantage endgame short,https://lichess.org/iWw5Lmdf/black#58,,1700765
1267,lLhrF,2k5/1pp2bbp/2n2pp1/P7/8/2P3qP/1P1QB1P1/3R3K b - - 3 27,f6f5 d2d7 c8b8 d7f7,1283,74,100,937,advantage fork middlegame short,https://lichess.org/609RpN2q/black#54,,4140754
1268,QCPAJ,r2qk2r/p2n2pp/3b1p2/3p4/3B2Q1/4P3/PPP2PPP/R4RK1 b kq - 3 14,e8g8 g4e6 f8f7 e6d6,1283,74,100,417,advantage fork middlegame short,https://lichess.org/mA5JG1yX/black#28,Benoni_Defense Benoni_Defense_Old_Benoni,2290986
1269,MfgCR,6k1/1R3pp1/4b3/8/5P1K/4PB1P/1P3r2/8 w - - 0 37,h4g3 f2f3 g3f3 e6d5 f3f2 d5b7,1283,74,100,451,advantage attraction endgame fork long sacrifice,https://lichess.org/K0Xw7abf#73,,1982952
1270,nDA5m,5k2/R7/3P4/4pbp1/3r1p1p/1B5P/2P3P1/6K1 b - - 2 44,d4d6 a7f7 f8e8 f7f5,1283,74,100,655,advantage endgame fork master short,https://lichess.org/ChwL9tIu/black#88,,4304008
1271,B50PK,8/8/8/pp6/6R1/3k1R2/rr6/6K1 b - - 1 61,d3c2 g4g2 c2b1 f3f1,1283,74,100,725,endgame mate mateIn2 rookEndgame short,https://lichess.org/ojZ2NxCb/black#122,,969661
1272,qdu2B,3Q4/p4Npk/1p2p2p/2q2n2/5P2/P6P/1P4PK/8 b - - 0 32,c5f2 d8h8 h7g6 f7e5 g6h5 h8e8,1283,74,100,664,crushing endgame long,https://lichess.org/mJDG6Fpx/black#64,,4603895
1273,mienE,6k1/1p3p2/6qP/p7/8/P5QP/6K1/8 w - - 2 42,g3g6 f7g6 a3a4 g8h7 g2f3 h7h6,1284,74,100,1317,crushing endgame long,https://lichess.org/Z1aOxpHb#83,,4260968
1274,1rfzS,r1bq2r1/3kn3/p1p1p2p/1pbpQ3/5B2/2NB4/PPP2PPP/4RR1K b - - 1 18,e7g6 e5e6,1284,74,100,369,mate mateIn1 middlegame oneMove,https://lichess.org/sWM07V9g/black#36,Mikenas_Defense Mikenas_Defense_Other_variations,163288
1275,ueJKk,8/5p1k/4p2p/3qP3/1B1b1pQ1/7P/1P4PK/8 w - - 2 36,g4f4 d4e5 g2g3 e5f4,1284,74,100,306,crushing endgame pin short,https://lichess.org/WJlT1kCH#71,,4955475
1276,gtlZK,3r1r1k/pb3p1p/1p1q2pP/2pP2Q1/1n2N3/8/1P3PP1/1K1R1B1R b - - 4 27,f7f6 e4d6 f6g5 d6b7,1284,74,100,590,advantage master middlegame short,https://lichess.org/N0Gb9VJM/black#54,,3750544
1277,H1SB9,4r2k/1pp1PQpp/p7/5p2/1P6/P3PBq1/4K1Nr/6R1 b - - 4 29,g3g6 f7f8 e8f8 e7f8q,1284,74,100,667,advancedPawn mate mateIn2 middlegame promotion short,https://lichess.org/wwJkFHh5/black#58,,1489160
1278,JkuXg,5Q2/6pk/r2p3p/8/2q5/6PP/3R1PK1/8 w - - 2 48,d2d6 c4e4 f8f3 e4f3 g2f3 a6d6,1284,74,100,350,crushing endgame long,https://lichess.org/AjZ6Tb1O#95,,1727923
1279,p6nnJ,8/8/3p1p2/4k1p1/2P1P1P1/r2RK2P/8/8 b - - 5 51,a3d3 e3d3 e5f4 d3d4 f4g3 d4d5,1284,74,100,165,crushing endgame long,https://lichess.org/HicHNeDh/black#102,,4469867
1280,bNuqm,1rbq1rk1/4bnpp/p2p4/1pp1p1P1/3P1P2/2P1B1N1/PPQ1P1B1/R3K2R b KQ - 0 18,e5f4 c2h7,1284,74,100,2145,kingsideAttack mate mateIn1 middlegame oneMove,https://lichess.org/9r1RQ8st/black#36,Saragossa_Opening Saragossa_Opening_Other_variations,3268304
1281,CCXfQ,3r3k/p4Qpp/1p3b2/8/2B3qn/2N3P1/PP3PKP/3R1R2 w - - 5 26,g2h1 g4f3 h1g1 f3g2,1284,74,100,269,kingsideAttack mate mateIn2 middlegame short,https://lichess.org/t968Mx4a#51,,1067650
1282,4ykFR,6rk/3p2p1/p1b1p1Rp/1p2Q3/8/P1N4q/KPP4P/5B2 b - - 19 40,h3f1 g6h6,1284,74,100,415,endgame mate mateIn1 oneMove pin,https://lichess.org/1ItcSRhQ/black#80,,435645
1283,5MJjA,r4r2/5pk1/2p4R/q2p3Q/3Pp3/pP2P3/P4PP1/N2K4 b - - 1 29,f8h8 h5g5 g7f8 h6h8,1284,74,100,635,deflection endgame mate mateIn2 short,https://lichess.org/Q1AMeYBP/black#58,,468774
1284,9KrqU,k7/p1B5/4r1p1/8/3n3P/2R5/P4PP1/6K1 w - - 1 38,c7g3 d4e2 g1h2 e2c3,1284,74,100,3236,advantage endgame fork master short,https://lichess.org/nI2lT10T#75,,817228
1285,o2a0z,8/6pp/k1r1pp2/2P5/1Pb2P2/2K3P1/5P1P/1R6 b - - 6 57,c4d5 b4b5 a6b7 b5c6,1284,74,100,558,crushing doubleCheck endgame fork short,https://lichess.org/V5Ah1RnL/black#114,,4376507
1286,PXs83,r1r3k1/5ppp/1Q1p4/3P4/1P6/1KPR4/P2R3P/4q3 w - - 3 28,b6d6 e1b1 d2b2 b1d3,1284,74,100,10261,crushing deflection endgame short,https://lichess.org/fGio32Lq#55,,2234109
1287,nnjJz,2k1R1r1/ppp2p2/2p5/3n1P1p/7B/3P1b2/PPP2Pp1/4R1K1 b - - 3 25,g8e8 e1e8 c8d7 e8d8,1284,74,100,550,endgame mate mateIn2 queensideAttack short,https://lichess.org/cyZQ3dn8/black#50,,4355623
1288,xCthy,r4rnk/1b2bp2/1pp1N1pp/p3P3/3P4/P3BqP1/1PQ2P1P/RB3RK1 w - - 1 27,e6f8 c6c5 c2e4 b7e4 b1e4 f3e4,1284,74,100,1056,advantage long middlegame,https://lichess.org/5g3Xl9Q9#53,,5178949
1289,OxZeH,r3kr2/ppp3pp/2np4/1B1Qp1q1/6b1/P1P4P/1P2K1P1/RN4NR w q - 2 14,g1f3 g4f3 g2f3 g5g2 e2e3 g2h1,1284,74,100,271,advantage clearance exposedKing fork long middlegame,https://lichess.org/iXmUcvwa#27,Bishops_Opening Bishops_Opening_Calabrese_Countergambit,2182962
1290,0tRHo,2kr3r/1ppqn1bp/p2n2p1/3Pp3/6P1/2P3B1/PPQ1N1B1/2KR3R b - - 1 18,d7g4 g2h3 g4h3 h1h3,1284,74,100,516,advantage middlegame pin short,https://lichess.org/joS3GWpR/black#36,Queens_Pawn_Game Queens_Pawn_Game_Chigorin_Variation,77846
1291,FQEFY,8/5pk1/4b1p1/2R5/5P2/6Kp/8/8 w - - 15 58,g3h4 h3h2 c5c1 e6d5,1285,74,100,232,advancedPawn crushing defensiveMove endgame short,https://lichess.org/NNjPulbS#115,,1348761
1292,f7Xbe,5r1k/pn4pp/1pB3n1/2pQ4/8/1P2q3/PB4PP/2R4K w - - 2 25,c6b7 e3c1 b2c1 f8f1,1285,74,100,1083,backRankMate mate mateIn2 middlegame sacrifice short,https://lichess.org/cSHqtrOJ#49,,3594870
1293,Et21S,r7/8/8/8/8/5k2/6RK/8 w - - 13 75,g2g1 a8h8,1285,74,100,787,endgame mate mateIn1 oneMove rookEndgame,https://lichess.org/eoF2Qs9N#149,,1302023
1294,w7Q5C,2r3k1/1p3p1p/1qb3p1/p1R5/P4P2/1PQ3P1/6BP/6K1 w - - 5 32,g2c6 c8c6 c3a5 b6c5 a5c5 c6c5,1285,74,100,567,crushing endgame long,https://lichess.org/4Ik6JPeY#63,,5083787
1295,GOzqQ,8/2R5/1k4p1/8/5PP1/4K3/r1p2N1P/8 w - - 2 41,c7c3 a2a3 c3a3 c2c1q,1285,74,100,174,advancedPawn advantage deflection endgame pin promotion short,https://lichess.org/XOfia5jZ#81,,1434910
1296,QTQ2m,r1b4N/pppp2kp/5np1/6K1/8/1B6/PPP3PP/4R3 b - - 3 18,d7d5 e1e7 g7h8 g5f6,1285,74,100,363,advantage deflection endgame short,https://lichess.org/JI8Bx9yq/black#36,Four_Knights_Game Four_Knights_Game_Scotch_Variation,2314953
1297,XJ1uv,8/1p6/1P1k1P2/8/3Br3/3KP3/8/8 b - - 2 53,e4h4 f6f7 d6e7 d4f6 e7f8 f6h4,1285,74,100,1050,advancedPawn crushing endgame exposedKing long,https://lichess.org/2RhM1qyS/black#106,,2911693
1298,3IImB,Qnk2br1/N4p2/2n1p3/7p/5p2/P2Bq3/1P5P/3R1K1R b - - 2 31,c6a7 d3a6 c8c7 a8b7,1285,74,100,345,mate mateIn2 middlegame pin queensideAttack short,https://lichess.org/cTITVOHp/black#62,,288256
1299,dy4Np,8/5pk1/6p1/2p1Q2p/2B4P/1P4P1/3q1r2/7K b - - 4 46,g7h6 e5h8,1285,74,100,592,endgame mate mateIn1 oneMove,https://lichess.org/o5xQSgz8/black#92,,3494553
1300,MXo9o,8/8/p1R3k1/6pp/pq6/5PP1/1B4K1/8 b - - 1 41,g6f5 c6f6,1285,74,100,127,endgame mate mateIn1 oneMove,https://lichess.org/WddorGNr/black#82,,1971662
1301,NCpAD,1k6/8/3p1p2/p1pPp1p1/2P1P1Br/6K1/7p/7R w - - 0 44,h1h2 h4h2 g3h2 a5a4 g4d1 a4a3,1285,74,100,998,crushing endgame long quietMove,https://lichess.org/8MFTh3TX#87,,2029490
1302,dmIAZ,4r1k1/2q2pP1/2p4p/pp1p1P2/3Pr3/P4Q1P/BPP1N1P1/R6K w - - 1 28,f3g3 c7g3 e2g3 e4e1 a1e1 e8e1,1286,74,100,204,advantage kingsideAttack long middlegame,https://lichess.org/IHbqUXRk#55,,3477812
1303,uzjG8,r5k1/pp3pp1/7p/8/1P6/P3Q2P/2P2PPq/3R1K2 w - - 0 26,e3g3 h2h1 f1e2 a8e8 e2d2 e8d8,1286,74,100,297,crushing endgame long,https://lichess.org/kP0wNhvd#51,,4985370
1304,FYDrK,2r5/4P3/7p/ppk2Kp1/2p3P1/8/8/3R4 b - - 1 45,c4c3 d1d8 c8d8 e7d8q,1286,74,100,225,advancedPawn crushing endgame promotion rookEndgame short,https://lichess.org/eyhYbNzS/black#90,,1360063
1305,ZnsKo,2r5/1p3k2/1P2p1p1/Q2p1pP1/P1pP4/2P3q1/8/1R3R1K w - - 4 36,b1b2 c8h8 b2h2 g3h2,1286,74,100,118,endgame mate mateIn2 short,https://lichess.org/Cd7lgPin#71,,3130080
1306,daxyb,r3r3/pQ5p/1p2kn2/q5p1/2p5/6PP/P1P3B1/4R1K1 b - - 1 28,e6d6 b7c6,1286,74,100,411,mate mateIn1 middlegame oneMove,https://lichess.org/CvZVx2ub/black#56,,3461917
1307,CQwaq,r1bq1rk1/1pp1ppbp/pnn3p1/3NP1B1/2B2P2/5N2/PPP3PP/R2QK2R w KQ - 4 11,d5e7 c6e7 d1d8 f8d8,1286,74,100,590,advantage opening short,https://lichess.org/CGTo40S9#21,Pirc_Defense Pirc_Defense_Byrne_Variation,1087832
1308,lGV86,2rqr1k1/1pn2p2/p2bpn1Q/6N1/2Pp3P/P2B2P1/1P3P2/R3K2R b KQ - 2 27,d6f8 d3h7 f6h7 h6h7,1286,74,100,666,kingsideAttack mate mateIn2 middlegame short,https://lichess.org/gBEndonk/black#54,,4133350
1309,Sz3oI,r1bq1r2/pp2p2k/2p3pn/4b2Q/2P5/2NB4/PP3PP1/R3K2R b KQ - 1 18,d8d3 h5h6 h7g8 h6h7,1286,74,100,328,fork mate mateIn2 middlegame short,https://lichess.org/MdKBze1w/black#36,Old_Indian_Defense Old_Indian_Defense_Czech_Variation,2534979
1310,wMupy,8/2p3r1/p2pP3/1p1P1K2/1P1P4/P5p1/7k/6R1 w - - 10 50,g1c1 g3g2 f5f6 g2g1q c1g1 g7g1,1286,74,100,1015,advancedPawn crushing endgame long promotion rookEndgame,https://lichess.org/CJIYqmEr#99,,5105664
1311,2gZoh,r2q2k1/1b1n1p2/3b1n1Q/p2p2NP/3Pr3/3B4/5PP1/R1N2RK1 b - - 2 27,e4g4 d3h7 f6h7 h6h7 g8f8 h7f7,1286,74,100,3172,kingsideAttack long mate mateIn3 middlegame,https://lichess.org/LsvyrHbc/black#54,,235101
1312,bjet5,2r1r1k1/pQ4Rp/4p1p1/4b1q1/8/7P/PP3PP1/R5K1 b - - 2 23,g8h8 g7h7 h8g8 b7f7,1286,74,100,537,mate mateIn2 middlegame short,https://lichess.org/uXTboLMp/black#46,,3299127
1313,lMWxJ,6R1/1b5p/p7/3p1R1k/2P4P/P7/B1Pqr1P1/6K1 b - - 4 35,h5h4 g2g3 h4h3 f5h5,1286,74,100,746,endgame mate mateIn2 short,https://lichess.org/FLmCKfVI/black#70,,4141921
1314,oUoxf,2r2r1k/6pp/5p2/1B1Rp3/3bP3/1Q3P2/P1P2qPP/3R3K w - - 1 32,a2a4 c8c2 b3c2 f2c2,1286,74,100,468,advantage middlegame short,https://lichess.org/o3rikTC4#63,,4416251
1315,mEZW4,2k5/pb5p/1p3Np1/2p5/5R2/2P4P/PP1r3K/R7 w - - 1 26,h2g3 d2g2 g3h4 g6g5 h4h5 g5f4,1286,74,100,545,advantage endgame fork long,https://lichess.org/qEurcNex#51,,4218632
1316,P4Nhy,6k1/6pp/pqp1pr2/3p1r2/3P2Q1/1P2B2P/P4P2/2R1R1K1 w - - 3 24,g4g3 f6g6 g3g6 h7g6,1286,74,100,405,advantage middlegame pin short,https://lichess.org/zHejZgXh#47,,2192728
1317,ACZdj,2r3k1/1b3pb1/p2p4/3P1P2/1p4Q1/1N6/PqP1R1PP/3K4 b - - 3 27,b7d5 f5f6 b2f6 g4c8,1286,74,100,755,advantage discoveredAttack master middlegame pin short,https://lichess.org/eCoQqHtp/black#54,,893041
1318,7RjGY,6nr/p1k5/2p1pbp1/2p5/2P1NPp1/P2r4/1P1B2P1/3R1RK1 b - - 3 21,f6b2 d2a5 c7c8 d1d3,1286,74,100,612,advantage discoveredAttack middlegame short,https://lichess.org/D2wy3jfj/black#42,,651846
1319,soWOt,5rk1/pp3pp1/2p3b1/6np/2BN2Pq/1N2R3/PP3PQ1/5K2 w - - 0 23,d4f5 g6f5 g4f5 h4c4,1286,74,100,1007,advantage middlegame short,https://lichess.org/xxunqfCz#45,,4794490
1320,RoB72,7k/p1q2prp/5Q2/4p3/3p2P1/P7/5PP1/4R1K1 b - - 3 34,d4d3 e1e5 c7c1 g1h2,1287,74,100,690,crushing endgame pin short,https://lichess.org/o2eOdOvu/black#68,,2432029
1321,oPNb3,8/8/6k1/4p3/p5Pp/1r5P/1P2R2K/8 w - - 0 49,e2e5 b3b2 h2g1 a4a3 e5a5 a3a2,1287,74,100,167,advancedPawn crushing endgame long rookEndgame,https://lichess.org/3rVIJAPz#97,,4408511
1322,zimdo,1r2qrk1/pbpN1p1p/1p3bp1/2nQ4/2N1P3/2P5/PP2BPPP/3R1RK1 b - - 2 15,b7d5 d7f6 g8h8 f6e8 d5c4 e2c4,1287,74,100,185,advantage fork hangingPiece long middlegame,https://lichess.org/hDek8eUv/black#30,Rat_Defense Rat_Defense_Antal_Defense,5399210
1323,1pjSE,4r3/p2N1R2/b1p2B1p/2p3pk/8/1P1P3K/P1r3P1/8 b - - 3 30,a6c8 g2g4 h5g6 f7g7,1287,74,100,936,endgame mate mateIn2 short,https://lichess.org/Bc8dxZtz/black#60,,160513
1324,KVQxz,r7/2R5/p6k/1p6/1rP3p1/3P2Kb/8/4R3 b - - 1 37,b5c4 e1e6 h6g5 c7c5,1287,74,100,424,endgame mate mateIn2 short,https://lichess.org/686XUhCE/black#74,,1793466
1325,kyGJC,r2qk2r/pp3ppp/2Nbp3/5b2/2QPn3/2N1P3/PP1B1PPP/R3K2R b KQkq - 0 12,b7c6 c4c6 e8f8 c3e4,1287,74,100,540,advantage middlegame short,https://lichess.org/MQGi5mpf/black#24,Queens_Gambit_Declined Queens_Gambit_Declined_Chigorin_Defense,4107718
1326,QEmkl,r1b3k1/pppp2pp/6n1/8/2NPq3/4B2P/PP3Q1K/5R2 b - - 5 24,d7d5 f2f7 g8h8 f7f8 g6f8 f1f8,1287,74,100,354,backRankMate long mate mateIn3 middlegame sacrifice,https://lichess.org/J272hRZq/black#48,,2294338
1327,VBtG0,2r2qr1/1b3p2/pn2pB1k/1p1pP1Qp/2nP1P1P/P1N2P2/1PB5/1R5K b - - 1 30,g8g5 f4g5,1287,74,100,260,mate mateIn1 middlegame oneMove,https://lichess.org/p125oSVm/black#60,,2727399
1328,OaRlQ,2r5/p2pRp2/1p1P2k1/1P3p2/P2B2p1/5bP1/2r4P/4R1K1 b - - 2 28,c2h2 g1h2 c8c2 h2g1 c2g2 g1f1,1287,74,100,746,advantage endgame hangingPiece long,https://lichess.org/d2PVztuI/black#56,,2150043
1329,9Harq,1r5k/1p2R1pn/p4pbp/3B4/2P2P2/PP4P1/1B4K1/8 w - - 1 31,d5b7 b8b7 e7b7 g6e4 g2f2 e4b7,1287,74,100,429,advantage attraction endgame fork long sacrifice,https://lichess.org/7xIY2ohp#61,,812568
1330,oetiI,r3r2k/4b1p1/p1Q4p/2p5/3q4/3P2P1/PP2RP1P/4R1K1 b - - 11 30,d4d6 c6d6 e7d6 e2e8 a8e8 e1e8,1287,74,100,811,crushing long middlegame,https://lichess.org/y35mt4GY/black#60,,4430329
1331,AWaQm,5rk1/p7/1p1B3p/2p3p1/4P3/P1q5/6QP/R6K w - - 0 28,d6f8 c3a1 g2g1 a1g1 h1g1 g8f8,1287,74,100,613,crushing endgame hangingPiece long,https://lichess.org/14yR9Obv#55,,921127
1332,uog0h,r2qkb1r/ppp2ppp/5n2/8/2BpP3/1QN2P2/PP3P1P/R3K2R b KQkq - 1 11,d4c3 c4f7 e8d7 b3e6,1287,74,100,273,attackingF2F7 mate mateIn2 middlegame short,https://lichess.org/nmYdkLta/black#22,English_Opening English_Opening_Anglo-Indian_Defense,4970040
1333,4hBN3,r5k1/p3R1p1/6Qp/6P1/3qp2P/5p2/P4P1K/7R w - - 2 35,h1d1 d4f2 h2h3 f2g2,1287,74,100,537,endgame master mate mateIn2 short,https://lichess.org/aYdQRjdq#69,,410959
1334,LFyXf,6k1/1b2p2p/3q1pp1/3rb1B1/B3Q3/r5P1/P4P1P/3RR1K1 w - - 0 26,a4b3 a3b3 d1d5 b7d5,1287,74,100,486,advantage master middlegame short,https://lichess.org/jc8MZvXv#51,,1858559
1335,LyGNn,5Q2/8/8/8/2q1K1P1/8/2k5/8 w - - 2 61,e4f3 c4f1 f3e4 f1f8,1287,74,100,295,crushing endgame queenEndgame short skewer,https://lichess.org/yqHBq1yU#121,,1921352
1336,jA9AJ,6k1/3r1p2/p2p1Qp1/1ppBn3/4P1q1/P4R2/6P1/3R3K w - - 6 38,f3h3 g4d1 h1h2 e5g4 h2g3 g4f6,1287,74,100,256,crushing fork hangingPiece long middlegame,https://lichess.org/PISyDmPm#75,,3949035
1337,j95H7,8/5p2/6p1/6k1/4K2p/1r4PP/4N3/6R1 w - - 4 42,e4e5 b3e3 e5d4 e3e2,1287,74,100,703,advantage endgame fork short,https://lichess.org/QLwVUr74#83,,3947513
1338,GXHz4,3r1r1k/1p4pp/pb2qp2/8/1Q6/5N2/PP3PPP/3RR1K1 b - - 1 24,d8d1 b4f8 e6g8 f8g8 h8g8 e1d1,1287,74,100,929,crushing hangingPiece long middlegame,https://lichess.org/ctLr3rEb/black#48,,1446500
1339,j6gyi,4r1k1/5pp1/5b1p/8/6Q1/3qB2P/1P1N1KP1/4R3 w - - 1 33,e3h6 f6d4 g4d4 d3d4,1287,74,100,358,advantage middlegame short,https://lichess.org/c5X6abby#65,,3944046
1340,YuR5m,r7/1p5p/3Bn1pk/8/PP2p1N1/7P/4r1P1/5R1K b - - 5 40,h6g7 d6e5 g7g8 g4h6,1288,74,100,1061,endgame mate mateIn2 short,https://lichess.org/PSp6aT6c/black#80,,3051914
1341,xe9bF,3Q4/4rk1p/6pP/p2p2q1/3P4/2P2p2/PP2bP2/1K1R3R w - - 1 29,d1e1 e2d3 b1a1 e7e1 h1e1 g5d8,1288,74,100,1300,crushing discoveredAttack endgame long,https://lichess.org/jwuSHkgq#57,,5217471
1342,kfyTb,rn3r2/1ppbqpp1/pn2N1k1/4P3/1b1P2Q1/2N5/PP3PPP/R1B2RK1 b - - 0 13,g6h7 g4g7,1288,74,100,427,mate mateIn1 middlegame oneMove,https://lichess.org/EBf2NYmn/black#26,Queens_Gambit_Declined Queens_Gambit_Declined_Marshall_Defense,4082084
1343,kaNSo,5rk1/B4p2/p3qn1p/1p2p3/4b2P/8/2PQ4/2K3R1 b - - 13 36,g8h8 d2h6 f6h7 h6g7,1288,74,100,326,fork mate mateIn2 middlegame short,https://lichess.org/ocmnInrG/black#72,,4074006
1344,EijdR,r4r2/p3qpk1/2p1p2p/3p2PQ/8/5N2/P1B1bPP1/1R4K1 b - - 0 24,h6g5 h5h7 g7f6 h7h6,1288,74,100,1798,mate mateIn2 middlegame short,https://lichess.org/1CV8C1yH/black#48,,1287578
1345,YzFu8,2r2rk1/ppq4p/2Pb4/5p2/3P4/7P/P1Q2PP1/2R2RK1 b - - 0 21,c7c6 c2b3 g8g7 c1c6,1288,74,100,1265,advantage discoveredAttack middlegame short,https://lichess.org/dTi7xR6c/black#42,,3058664
1346,LiVBV,3R4/7k/3n2pp/4K3/2r3P1/1P6/8/8 w - - 0 56,b3c4 d6f7 e5f6 f7d8,1288,74,100,430,crushing endgame fork short,https://lichess.org/IkzHt07p#111,,1899059
1347,sU31g,3rk2r/p2n1ppp/2Qb3q/2pN4/2B1P1b1/4K1N1/PP3P1P/R1B4R w k - 4 19,f2f4 d6f4 d5f4 h6c6,1288,74,100,352,advantage discoveredAttack middlegame short,https://lichess.org/VRDeyK1S#37,,4765457
1348,BWqS5,r1b3k1/1p2qppp/p1pr4/8/4PQ2/2N3p1/PPP1B1P1/R3R2K w - - 2 19,f4g3 d6h6 h1g1 e7c5 g3f2 h6h1 g1h1 c5f2,1288,74,100,282,advantage deflection kingsideAttack master middlegame veryLong,https://lichess.org/Y52xpCA0#37,,1009078
1349,rzANg,r6r/pR1kbQpp/4p3/3pP3/3n4/2q5/P4PPP/5RK1 b - - 0 17,d7d8 f7e7 d8c8 e7d7,1288,74,100,217,mate mateIn2 middlegame short,https://lichess.org/Xd79beWu/black#34,Sicilian_Defense Sicilian_Defense_Alapin_Variation,4721795
1350,U5TVf,2krr3/ppp2ppp/4q2b/8/3P2b1/3BP1B1/PPQ2PPP/2KR3R b - - 0 16,g4d1 c2c7,1288,74,100,256,mate mateIn1 middlegame oneMove queensideAttack,https://lichess.org/03o5L3OY/black#32,Englund_Gambit Englund_Gambit_Hartlaub-Charlick_Gambit,2631534
1351,WzEC1,8/pp1kpp2/3p2p1/3p4/3Pb1P1/P2qPPQ1/4K2P/6R1 w - - 1 27,e2f2 d3d2 f2f1 e4d3,1288,74,100,392,endgame mate mateIn2 short,https://lichess.org/DcGa49D2#53,,2883641
1352,CBAqt,8/5n2/p3kP2/1p2P2p/1P2K3/P2R2BP/1b6/8 w - - 10 46,d3d5 f7g5 e4e3 e6d5,1288,74,100,1400,advantage deflection endgame short,https://lichess.org/NaZTOcQK#91,,1065742
1353,hntUc,8/p1R3kp/6p1/1P6/3p2P1/8/7P/1q3rQK b - - 6 37,g7h6 g4g5 h6h5 c7h7,1288,74,100,2328,deflection endgame mate mateIn2 short,https://lichess.org/JEws9pR1/black#74,,3829597
